Sheet: Balances
A1: QHCC Balances 2006
A2: Date | B2: QHCC Account | C2: General | D2: Parsonage | E2: Deacon | F2: Restore | G2: Pastor Retirement | H2: DSL | I2: Temporary | J2: Total | K2: Diff | L2: Total Other | M2: General by Diff | N2: Diff | O2: QHCC Acct Rpt | P2: Diff | Q2: General from Rpt | R2: General by Diff | S2: Diff
A3: 2005-12-31 | B3: 24505.31 | C3: oooc:=15580-925 -> 14655 | D3: 7203 | E3: 429.34 | F3: 741.92 | G3: 2853 | H3: -744.37 | I3: -633 | J3: oooc:=SUM([.C3:.I3]) -> 24504.89 | K3: oooc:=[.J3]-[.B3] -> -0.420000000001892 | L3: oooc:=SUM([.D3:.I3]) -> 9849.89 | M3: oooc:=IF([.$B3]<>"";[.B3]-[.L3];"") -> 14655.42 | N3: oooc:=IF([.$B4]<>"";[.M3]-[.C3];"") -> 0.420000000001892 | O3: 24505.31 | P3: oooc:=[.O3]-[.B3] -> 0 | Q3: 15718.23 | R3: oooc:=[.B3]-SUM([.D3:.I3]) -> 14655.42 | S3: oooc:=[.R3]-[.C3] -> 0.420000000001892
A4: 2006-01-31 | B4: oooc:=IF([$Income.$B4]>0;[.B3]+[$Income.B4]-[$Expense.B4];"") -> 23006.31 | C4: oooc:=IF([$Income.$B4]>0;[.C3]+[$Income.C4]-[$Expense.C4];"") -> 14515 | D4: oooc:=IF([$Income.$B4]>0;[.D3]+[$Income.D4]-[$Expense.D4];"") -> 7203 | E4: oooc:=IF([$Income.$B4]>0;[.E3]+[$Income.E4]-[$Expense.E4];"") -> 389.34 | F4: oooc:=IF([$Income.$B4]>0;[.F3]+[$Income.F4]-[$Expense.F4];"") -> 741.92 | G4: oooc:=IF([$Income.$B4]>0;[.G3]+[$Income.G4]-[$Expense.G4];"") -> 1258 | H4: oooc:=IF([$Income.$B4]>0;[.H3]+[$Income.H4]-[$Expense.H4];"") -> -807.07 | I4: oooc:=IF([$Income.$B4]>0;[.I3]+[$Income.I4]-[$Expense.I4];"") -> -294 | J4: oooc:=IF([$Income.$B4]>0;SUM([.C4:.I4]);"") -> 23006.19 | K4: oooc:=IF([$Income.$B4]>0;[.J4]-[.B4];"") -> -0.119999999995343 | L4: oooc:=IF([$Income.$B4]>0;SUM([.D4:.I4]);"") -> 8491.19 | M4: oooc:=IF([.$B4]<>"";[.B4]-[.L4];"") -> 14515.12 | N4: oooc:=IF([.$B5]<>"";[.M4]-[.C4];"") -> 0.119999999997162 | O4: 23007.06 | P4: oooc:=IF([$Income.$B4]>0;[.O4]-[.B4];"") -> 0.750000000003638 | Q4: 15578.68 | R4: oooc:=IF([$Income.$B4]>0;[.B4]-SUM([.D4:.I4]);"") -> 14515.12 | S4: oooc:=IF([$Income.$B4]>0;[.R4]-[.C4];"") -> 0.119999999997162
A5: 2006-02-28 | B5: oooc:=IF([$Income.$B5]>0;[.B4]+[$Income.B5]-[$Expense.B5];"") -> 21549.31 | C5: oooc:=IF([$Income.$B5]>0;[.C4]+[$Income.C5]-[$Expense.C5];"") -> 13329 | D5: oooc:=IF([$Income.$B5]>0;[.D4]+[$Income.D5]-[$Expense.D5];"") -> 7203 | E5: oooc:=IF([$Income.$B5]>0;[.E4]+[$Income.E5]-[$Expense.E5];"") -> 389.34 | F5: oooc:=IF([$Income.$B5]>0;[.F4]+[$Income.F5]-[$Expense.F5];"") -> 741.92 | G5: oooc:=IF([$Income.$B5]>0;[.G4]+[$Income.G5]-[$Expense.G5];"") -> 1150 | H5: oooc:=IF([$Income.$B5]>0;[.H4]+[$Income.H5]-[$Expense.H5];"") -> -869.77 | I5: oooc:=IF([$Income.$B5]>0;[.I4]+[$Income.I5]-[$Expense.I5];"") -> -395 | J5: oooc:=IF([$Income.$B5]>0;SUM([.C5:.I5]);"") -> 21548.49 | K5: oooc:=IF([$Income.$B5]>0;[.J5]-[.B5];"") -> -0.819999999999709 | L5: oooc:=IF([$Income.$B5]>0;SUM([.D5:.I5]);"") -> 8219.49 | M5: oooc:=IF([.$B5]<>"";[.B5]-[.L5];"") -> 13329.82 | N5: oooc:=IF([.$B6]<>"";[.M5]-[.C5];"") -> 0.81999999999789 | O5: 21549.69 | P5: oooc:=IF([$Income.$B5]>0;[.O5]-[.B5];"") -> 0.380000000001019 | Q5: 14285.01 | R5: oooc:=IF([$Income.$B5]>0;[.B5]-SUM([.D5:.I5]);"") -> 13329.82 | S5: oooc:=IF([$Income.$B5]>0;[.R5]-[.C5];"") -> 0.81999999999789
A6: 2006-03-31 | B6: oooc:=IF([$Income.$B6]>0;[.B5]+[$Income.B6]-[$Expense.B6];"") -> 19497.31 | C6: oooc:=IF([$Income.$B6]>0;[.C5]+[$Income.C6]-[$Expense.C6];"") -> 11303 | D6: oooc:=IF([$Income.$B6]>0;[.D5]+[$Income.D6]-[$Expense.D6];"") -> 7203 | E6: oooc:=IF([$Income.$B6]>0;[.E5]+[$Income.E6]-[$Expense.E6];"") -> 426.42 | F6: oooc:=IF([$Income.$B6]>0;[.F5]+[$Income.F6]-[$Expense.F6];"") -> 741.92 | G6: oooc:=IF([$Income.$B6]>0;[.G5]+[$Income.G6]-[$Expense.G6];"") -> 1150 | H6: oooc:=IF([$Income.$B6]>0;[.H5]+[$Income.H6]-[$Expense.H6];"") -> -932.47 | I6: oooc:=IF([$Income.$B6]>0;[.I5]+[$Income.I6]-[$Expense.I6];"") -> -395 | J6: oooc:=IF([$Income.$B6]>0;SUM([.C6:.I6]);"") -> 19496.87 | K6: oooc:=IF([$Income.$B6]>0;[.J6]-[.B6];"") -> -0.439999999995052 | L6: oooc:=IF([$Income.$B6]>0;SUM([.D6:.I6]);"") -> 8193.87 | M6: oooc:=IF([.$B6]<>"";[.B6]-[.L6];"") -> 11303.44 | N6: oooc:=IF([.$B7]<>"";[.M6]-[.C6];"") -> 0.43999999999869 | O6: 19498.1 | P6: oooc:=IF([$Income.$B6]>0;[.O6]-[.B6];"") -> 0.790000000000873 | Q6: 12259.04 | R6: oooc:=IF([$Income.$B6]>0;[.B6]-SUM([.D6:.I6]);"") -> 11303.44 | S6: oooc:=IF([$Income.$B6]>0;[.R6]-[.C6];"") -> 0.43999999999869
A7: 2006-04-30 | B7: oooc:=IF([$Income.$B7]>0;[.B6]+[$Income.B7]-[$Expense.B7];"") -> 21753.31 | C7: oooc:=IF([$Income.$B7]>0;[.C6]+[$Income.C7]-[$Expense.C7];"") -> 13152 | D7: oooc:=IF([$Income.$B7]>0;[.D6]+[$Income.D7]-[$Expense.D7];"") -> 7203 | E7: oooc:=IF([$Income.$B7]>0;[.E6]+[$Income.E7]-[$Expense.E7];"") -> 426.42 | F7: oooc:=IF([$Income.$B7]>0;[.F6]+[$Income.F7]-[$Expense.F7];"") -> 741.92 | G7: oooc:=IF([$Income.$B7]>0;[.G6]+[$Income.G7]-[$Expense.G7];"") -> 1225 | H7: oooc:=IF([$Income.$B7]>0;[.H6]+[$Income.H7]-[$Expense.H7];"") -> -995.17 | I7: oooc:=IF([$Income.$B7]>0;[.I6]+[$Income.I7]-[$Expense.I7];"") -> 0 | J7: oooc:=IF([$Income.$B7]>0;SUM([.C7:.I7]);"") -> 21753.17 | K7: oooc:=IF([$Income.$B7]>0;[.J7]-[.B7];"") -> -0.139999999999418 | L7: oooc:=IF([$Income.$B7]>0;SUM([.D7:.I7]);"") -> 8601.17 | M7: oooc:=IF([.$B7]<>"";[.B7]-[.L7];"") -> 13152.14 | N7: oooc:=IF([.$B8]<>"";[.M7]-[.C7];"") -> 0.139999999997599 | O7: 21753.98 | P7: oooc:=IF([$Income.$B7]>0;[.O7]-[.B7];"") -> 0.670000000001892 | Q7: 14107.62 | R7: oooc:=IF([$Income.$B7]>0;[.B7]-SUM([.D7:.I7]);"") -> 13152.14 | S7: oooc:=IF([$Income.$B7]>0;[.R7]-[.C7];"") -> 0.139999999997599
A8: 2006-05-31 | B8: oooc:=IF([$Income.$B8]>0;[.B7]+[$Income.B8]-[$Expense.B8];"") -> 22059.31 | C8: oooc:=IF([$Income.$B8]>0;[.C7]+[$Income.C8]-[$Expense.C8];"") -> 13720 | D8: oooc:=IF([$Income.$B8]>0;[.D7]+[$Income.D8]-[$Expense.D8];"") -> 7203 | E8: oooc:=IF([$Income.$B8]>0;[.E7]+[$Income.E8]-[$Expense.E8];"") -> 226.42 | F8: oooc:=IF([$Income.$B8]>0;[.F7]+[$Income.F8]-[$Expense.F8];"") -> 741.92 | G8: oooc:=IF([$Income.$B8]>0;[.G7]+[$Income.G8]-[$Expense.G8];"") -> 1225 | H8: oooc:=IF([$Income.$B8]>0;[.H7]+[$Income.H8]-[$Expense.H8];"") -> -1058.06 | I8: oooc:=IF([$Income.$B8]>0;[.I7]+[$Income.I8]-[$Expense.I8];"") -> 0 | J8: oooc:=IF([$Income.$B8]>0;SUM([.C8:.I8]);"") -> 22058.28 | K8: oooc:=IF([$Income.$B8]>0;[.J8]-[.B8];"") -> -1.02999999999884 | L8: oooc:=IF([$Income.$B8]>0;SUM([.D8:.I8]);"") -> 8338.28 | M8: oooc:=IF([.$B8]<>"";[.B8]-[.L8];"") -> 13721.03 | N8: oooc:=IF([.$B9]<>"";[.M8]-[.C8];"") -> 1.02999999999702 | O8: 22059.37 | P8: oooc:=IF([$Income.$B8]>0;[.O8]-[.B8];"") -> 0.0600000000013097 | Q8: 14675.9 | R8: oooc:=IF([$Income.$B8]>0;[.B8]-SUM([.D8:.I8]);"") -> 13721.03 | S8: oooc:=IF([$Income.$B8]>0;[.R8]-[.C8];"") -> 1.02999999999702
A9: 2006-06-30 | B9: oooc:=IF([$Income.$B9]>0;[.B8]+[$Income.B9]-[$Expense.B9];"") -> 23392.31 | C9: oooc:=IF([$Income.$B9]>0;[.C8]+[$Income.C9]-[$Expense.C9];"") -> 15216 | D9: oooc:=IF([$Income.$B9]>0;[.D8]+[$Income.D9]-[$Expense.D9];"") -> 7203 | E9: oooc:=IF([$Income.$B9]>0;[.E8]+[$Income.E9]-[$Expense.E9];"") -> 126.42 | F9: oooc:=IF([$Income.$B9]>0;[.F8]+[$Income.F9]-[$Expense.F9];"") -> 741.92 | G9: oooc:=IF([$Income.$B9]>0;[.G8]+[$Income.G9]-[$Expense.G9];"") -> 1225 | H9: oooc:=IF([$Income.$B9]>0;[.H8]+[$Income.H9]-[$Expense.H9];"") -> -1120.95 | I9: oooc:=IF([$Income.$B9]>0;[.I8]+[$Income.I9]-[$Expense.I9];"") -> 0 | J9: oooc:=IF([$Income.$B9]>0;SUM([.C9:.I9]);"") -> 23391.39 | K9: oooc:=IF([$Income.$B9]>0;[.J9]-[.B9];"") -> -0.919999999998254 | L9: oooc:=IF([$Income.$B9]>0;SUM([.D9:.I9]);"") -> 8175.39 | M9: oooc:=IF([.$B9]<>"";[.B9]-[.L9];"") -> 15216.92 | N9: oooc:=IF([.$B10]<>"";[.M9]-[.C9];"") -> 0.919999999998254 | O9: 23392.33 | P9: oooc:=IF([$Income.$B9]>0;[.O9]-[.B9];"") -> 0.0200000000040745 | Q9: 16171.75 | R9: oooc:=IF([$Income.$B9]>0;[.B9]-SUM([.D9:.I9]);"") -> 15216.92 | S9: oooc:=IF([$Income.$B9]>0;[.R9]-[.C9];"") -> 0.919999999998254
A10: 2006-07-31 | B10: oooc:=IF([$Income.$B10]>0;[.B9]+[$Income.B10]-[$Expense.B10];"") -> 15865.31 | C10: oooc:=IF([$Income.$B10]>0;[.C9]+[$Income.C10]-[$Expense.C10];"") -> 7729 | D10: oooc:=IF([$Income.$B10]>0;[.D9]+[$Income.D10]-[$Expense.D10];"") -> 7203 | E10: oooc:=IF([$Income.$B10]>0;[.E9]+[$Income.E10]-[$Expense.E10];"") -> 126.42 | F10: oooc:=IF([$Income.$B10]>0;[.F9]+[$Income.F10]-[$Expense.F10];"") -> 741.92 | G10: oooc:=IF([$Income.$B10]>0;[.G9]+[$Income.G10]-[$Expense.G10];"") -> 1000 | H10: oooc:=IF([$Income.$B10]>0;[.H9]+[$Income.H10]-[$Expense.H10];"") -> -1183.84 | I10: oooc:=IF([$Income.$B10]>0;[.I9]+[$Income.I10]-[$Expense.I10];"") -> 247.65 | J10: oooc:=IF([$Income.$B10]>0;SUM([.C10:.I10]);"") -> 15864.15 | K10: oooc:=IF([$Income.$B10]>0;[.J10]-[.B10];"") -> -1.15999999999804 | L10: oooc:=IF([$Income.$B10]>0;SUM([.D10:.I10]);"") -> 8135.15 | M10: oooc:=IF([.$B10]<>"";[.B10]-[.L10];"") -> 7730.16 | N10: oooc:=IF([.$B11]<>"";[.M10]-[.C10];"") -> 1.15999999999804 | O10: 15865.01 | P10: oooc:=IF([$Income.$B10]>0;[.O10]-[.B10];"") -> -0.299999999997453 | Q10: 8684.67 | R10: oooc:=IF([$Income.$B10]>0;[.B10]-SUM([.D10:.I10]);"") -> 7730.16 | S10: oooc:=IF([$Income.$B10]>0;[.R10]-[.C10];"") -> 1.15999999999804
A11: 2006-08-31 | B11: oooc:=IF([$Income.$B11]>0;[.B10]+[$Income.B11]-[$Expense.B11];"") -> 13484.31 | C11: oooc:=IF([$Income.$B11]>0;[.C10]+[$Income.C11]-[$Expense.C11];"") -> 5782 | D11: oooc:=IF([$Income.$B11]>0;[.D10]+[$Income.D11]-[$Expense.D11];"") -> 7203 | E11: oooc:=IF([$Income.$B11]>0;[.E10]+[$Income.E11]-[$Expense.E11];"") -> 76.42 | F11: oooc:=IF([$Income.$B11]>0;[.F10]+[$Income.F11]-[$Expense.F11];"") -> 741.92 | G11: oooc:=IF([$Income.$B11]>0;[.G10]+[$Income.G11]-[$Expense.G11];"") -> 925 | H11: oooc:=IF([$Income.$B11]>0;[.H10]+[$Income.H11]-[$Expense.H11];"") -> -1245.62 | I11: oooc:=IF([$Income.$B11]>0;[.I10]+[$Income.I11]-[$Expense.I11];"") -> 0 | J11: oooc:=IF([$Income.$B11]>0;SUM([.C11:.I11]);"") -> 13482.72 | K11: oooc:=IF([$Income.$B11]>0;[.J11]-[.B11];"") -> -1.58999999999833 | L11: oooc:=IF([$Income.$B11]>0;SUM([.D11:.I11]);"") -> 7700.72 | M11: oooc:=IF([.$B11]<>"";[.B11]-[.L11];"") -> 5783.59 | N11: oooc:=IF([.$B12]<>"";[.M11]-[.C11];"") -> 1.58999999999833 | O11: 13483.96 | P11: oooc:=IF([$Income.$B11]>0;[.O11]-[.B11];"") -> -0.349999999998545 | Q11: 6738.05 | R11: oooc:=IF([$Income.$B11]>0;[.B11]-SUM([.D11:.I11]);"") -> 5783.59 | S11: oooc:=IF([$Income.$B11]>0;[.R11]-[.C11];"") -> 1.58999999999833
A12: 2006-09-30 | B12: oooc:=IF([$Income.$B12]>0;[.B11]+[$Income.B12]-[$Expense.B12];"") -> 11496.31 | C12: oooc:=IF([$Income.$B12]>0;[.C11]+[$Income.C12]-[$Expense.C12];"") -> 3854 | D12: oooc:=IF([$Income.$B12]>0;[.D11]+[$Income.D12]-[$Expense.D12];"") -> 7203 | E12: oooc:=IF([$Income.$B12]>0;[.E11]+[$Income.E12]-[$Expense.E12];"") -> 76.42 | F12: oooc:=IF([$Income.$B12]>0;[.F11]+[$Income.F12]-[$Expense.F12];"") -> 741.92 | G12: oooc:=IF([$Income.$B12]>0;[.G11]+[$Income.G12]-[$Expense.G12];"") -> 925 | H12: oooc:=IF([$Income.$B12]>0;[.H11]+[$Income.H12]-[$Expense.H12];"") -> -1305.57 | I12: oooc:=IF([$Income.$B12]>0;[.I11]+[$Income.I12]-[$Expense.I12];"") -> 0 | J12: oooc:=IF([$Income.$B12]>0;SUM([.C12:.I12]);"") -> 11494.77 | K12: oooc:=IF([$Income.$B12]>0;[.J12]-[.B12];"") -> -1.53999999999724 | L12: oooc:=IF([$Income.$B12]>0;SUM([.D12:.I12]);"") -> 7640.77 | M12: oooc:=IF([.$B12]<>"";[.B12]-[.L12];"") -> 3855.54 | N12: oooc:=IF([.$B13]<>"";[.M12]-[.C12];"") -> 1.53999999999814 | O12: 11495.56 | P12: oooc:=IF([$Income.$B12]>0;[.O12]-[.B12];"") -> -0.749999999998181 | Q12: 4809.6 | R12: oooc:=IF([$Income.$B12]>0;[.B12]-SUM([.D12:.I12]);"") -> 3855.54 | S12: oooc:=IF([$Income.$B12]>0;[.R12]-[.C12];"") -> 1.53999999999814
A13: 2006-10-31 | B13: oooc:=IF([$Income.$B13]>0;[.B12]+[$Income.B13]-[$Expense.B13];"") -> 8061.31 | C13: oooc:=IF([$Income.$B13]>0;[.C12]+[$Income.C13]-[$Expense.C13];"") -> 478 | D13: oooc:=IF([$Income.$B13]>0;[.D12]+[$Income.D13]-[$Expense.D13];"") -> 7203 | E13: oooc:=IF([$Income.$B13]>0;[.E12]+[$Income.E13]-[$Expense.E13];"") -> 76.42 | F13: oooc:=IF([$Income.$B13]>0;[.F12]+[$Income.F13]-[$Expense.F13];"") -> 741.92 | G13: oooc:=IF([$Income.$B13]>0;[.G12]+[$Income.G13]-[$Expense.G13];"") -> 925 | H13: oooc:=IF([$Income.$B13]>0;[.H12]+[$Income.H13]-[$Expense.H13];"") -> -1365.52 | I13: oooc:=IF([$Income.$B13]>0;[.I12]+[$Income.I13]-[$Expense.I13];"") -> 0 | J13: oooc:=IF([$Income.$B13]>0;SUM([.C13:.I13]);"") -> 8058.82 | K13: oooc:=IF([$Income.$B13]>0;[.J13]-[.B13];"") -> -2.48999999999796 | L13: oooc:=IF([$Income.$B13]>0;SUM([.D13:.I13]);"") -> 7580.82 | M13: oooc:=IF([.$B13]<>"";[.B13]-[.L13];"") -> 480.489999999998 | N13: oooc:=IF([.$B14]<>"";[.M13]-[.C13];"") -> 2.48999999999796 | O13: 7066.3 | P13: oooc:=IF([$Income.$B13]>0;[.O13]-[.B13];"") -> -995.009999999997 | Q13: 140.29 | R13: oooc:=IF([$Income.$B13]>0;[.B13]-SUM([.D13:.I13]);"") -> 480.489999999998 | S13: oooc:=IF([$Income.$B13]>0;[.R13]-[.C13];"") -> 2.48999999999796
A14: 2006-11-30 | B14: oooc:=IF([$Income.$B14]>0;[.B13]+[$Income.B14]-[$Expense.B14];"") -> 9892.31 | C14: oooc:=IF([$Income.$B14]>0;[.C13]+[$Income.C14]-[$Expense.C14];"") -> 1709 | D14: oooc:=IF([$Income.$B14]>0;[.D13]+[$Income.D14]-[$Expense.D14];"") -> 7203 | E14: oooc:=IF([$Income.$B14]>0;[.E13]+[$Income.E14]-[$Expense.E14];"") -> 136.42 | F14: oooc:=IF([$Income.$B14]>0;[.F13]+[$Income.F14]-[$Expense.F14];"") -> 741.92 | G14: oooc:=IF([$Income.$B14]>0;[.G13]+[$Income.G14]-[$Expense.G14];"") -> 925 | H14: oooc:=IF([$Income.$B14]>0;[.H13]+[$Income.H14]-[$Expense.H14];"") -> -825.470000000001 | I14: oooc:=IF([$Income.$B14]>0;[.I13]+[$Income.I14]-[$Expense.I14];"") -> 0 | J14: oooc:=IF([$Income.$B14]>0;SUM([.C14:.I14]);"") -> 9889.87 | K14: oooc:=IF([$Income.$B14]>0;[.J14]-[.B14];"") -> -2.43999999999869 | L14: oooc:=IF([$Income.$B14]>0;SUM([.D14:.I14]);"") -> 8180.87 | M14: oooc:=IF([.$B14]<>"";[.B14]-[.L14];"") -> 1711.44 | N14: oooc:=IF([.$B15]<>"";[.M14]-[.C14];"") -> 2.43999999999869 | P14: oooc:=IF([$Income.$B14]>0;[.O14]-[.B14];"") -> -9892.31 | R14: oooc:=IF([$Income.$B14]>0;[.B14]-SUM([.D14:.I14]);"") -> 1711.44 | S14: oooc:=IF([$Income.$B14]>0;[.R14]-[.C14];"") -> 2.43999999999869
A15: 2006-12-31 | B15: oooc:=IF([$Income.$B15]>0;[.B14]+[$Income.B15]-[$Expense.B15];"") -> 8686.31 | C15: oooc:=IF([$Income.$B15]>0;[.C14]+[$Income.C15]-[$Expense.C15];"") -> 3401 | D15: oooc:=IF([$Income.$B15]>0;[.D14]+[$Income.D15]-[$Expense.D15];"") -> 4226 | E15: oooc:=IF([$Income.$B15]>0;[.E14]+[$Income.E15]-[$Expense.E15];"") -> 136.42 | F15: oooc:=IF([$Income.$B15]>0;[.F14]+[$Income.F15]-[$Expense.F15];"") -> 741.92 | G15: oooc:=IF([$Income.$B15]>0;[.G14]+[$Income.G15]-[$Expense.G15];"") -> 925 | H15: oooc:=IF([$Income.$B15]>0;[.H14]+[$Income.H15]-[$Expense.H15];"") -> -885.470000000001 | I15: oooc:=IF([$Income.$B15]>0;[.I14]+[$Income.I15]-[$Expense.I15];"") -> 139 | J15: oooc:=IF([$Income.$B15]>0;SUM([.C15:.I15]);"") -> 8683.87 | K15: oooc:=IF([$Income.$B15]>0;[.J15]-[.B15];"") -> -2.43999999999869 | L15: oooc:=IF([$Income.$B15]>0;SUM([.D15:.I15]);"") -> 5282.87 | M15: oooc:=IF([.$B15]<>"";[.B15]-[.L15];"") -> 3403.44 | N15: oooc:=IF([.$B16]<>"";[.M15]-[.C15];"") ->  | P15: oooc:=IF([$Income.$B15]>0;[.O15]-[.B15];"") -> -8686.31 | R15: oooc:=IF([$Income.$B15]>0;[.B15]-SUM([.D15:.I15]);"") -> 3403.44 | S15: oooc:=IF([$Income.$B15]>0;[.R15]-[.C15];"") -> 2.43999999999869
O28: 4779 | P28: 105
O29: 7203 | P29: 7203
O30: 76 | P30: 76
O31: 742 | P31: 742
O32: 0 | P32: 300
O33: -1306 | P33: -1366
N34: Total | O34: oooc:=SUM([.O28:.O33]) -> 11494 | P34: oooc:=SUM([.P28:.P33]) -> 7060
N35: QHCC | O35: 11496 | P35: 7067
N36: Diff | O36: oooc:=[.O34]-[.O35] -> -2 | P36: oooc:=[.P34]-[.P35] -> -7
B38: Month | C38: General | D38: Income | E38: Expense
B39: oooc:=[Income.A4] -> 2006-01-31 | C39: oooc:=[.C4] -> 14515 | D39: oooc:=[Income.C4] -> 7824 | E39: oooc:=[Expense.C4] -> 7964
B40: oooc:=[Income.A5] -> 2006-02-28 | C40: oooc:=[.C5] -> 13329 | D40: oooc:=[Income.C5] -> 3283 | E40: oooc:=[Expense.C5] -> 4469
B41: oooc:=[Income.A6] -> 2006-03-31 | C41: oooc:=[.C6] -> 11303 | D41: oooc:=[Income.C6] -> 5210 | E41: oooc:=[Expense.C6] -> 7236
B42: oooc:=[Income.A7] -> 2006-04-30 | C42: oooc:=[.C7] -> 13152 | D42: oooc:=[Income.C7] -> 9327 | E42: oooc:=[Expense.C7] -> 7478
B43: oooc:=[Income.A8] -> 2006-05-31 | C43: oooc:=[.C8] -> 13720 | D43: oooc:=[Income.C8] -> 5891 | E43: oooc:=[Expense.C8] -> 5323
B44: oooc:=[Income.A9] -> 2006-06-30 | C44: oooc:=[.C9] -> 15216 | D44: oooc:=[Income.C9] -> 7536 | E44: oooc:=[Expense.C9] -> 6040
B45: oooc:=[Income.A10] -> 2006-07-31 | C45: oooc:=[.C10] -> 7729 | D45: oooc:=[Income.C10] -> 2790 | E45: oooc:=[Expense.C10] -> 10277
B46: oooc:=[Income.A11] -> 2006-08-31 | C46: oooc:=[.C11] -> 5782 | D46: oooc:=[Income.C11] -> 5969 | E46: oooc:=[Expense.C11] -> 7916
B47: oooc:=[Income.A12] -> 2006-09-30 | C47: oooc:=[.C12] -> 3854 | D47: oooc:=[Income.C12] -> 4457 | E47: oooc:=[Expense.C12] -> 6385
B48: oooc:=[Income.A13] -> 2006-10-31 | C48: oooc:=[.C13] -> 478 | D48: oooc:=[Income.C13] -> 5891 | E48: oooc:=[Expense.C13] -> 9267
B49: oooc:=[Income.A14] -> 2006-11-30 | C49: oooc:=[.C14] -> 1709 | D49: oooc:=[Income.C14] -> 6625 | E49: oooc:=[Expense.C14] -> 5394
B50: oooc:=[Income.A15] -> 2006-12-31 | C50: oooc:=[.C15] -> 3401 | D50: oooc:=[Income.C15] -> 6783 | E50: oooc:=[Expense.C15] -> 5091

Sheet: Income
A1: QHCC Income 2006
A2: Date | B2: QHCC Account | C2: General | D2: Parsonage | E2: Deacon | F2: Restore | G2: Pastor Retirement | H2: DSL | I2: Temporary | J2: Total | K2: Diff
A4: 2006-01-31 | B4: 8710 | C4: 7824 | D4: 0 | E4: 60 | F4: 0 | G4: 275 | H4: 0 | I4: 511 | J4: oooc:=SUM([.C4:.I4]) -> 8670 | K4: oooc:=[.J4]-[.B4] -> -40
A5: 2006-02-28 | B5: oooc:=6060 -> 6060 | C5: 3283 | D5: 0 | E5: 0 | F5: 0 | G5: 300 | H5: 0 | I5: 95 | J5: oooc:=SUM([.C5:.I5]) -> 3678 | K5: oooc:=[.J5]-[.B5] -> -2382
A6: 2006-03-31 | B6: 5649 | C6: 5210 | D6: 0 | E6: 37.08 | F6: 0 | G6: 300 | H6: 0 | I6: 0 | J6: oooc:=SUM([.C6:.I6]) -> 5547.08 | K6: oooc:=[.J6]-[.B6] -> -101.92
A7: 2006-04-30 | B7: 10149 | C7: 9327 | D7: 0 | E7: 0 | F7: 0 | G7: 375 | H7: 0 | I7: 395 | J7: oooc:=SUM([.C7:.I7]) -> 10097 | K7: oooc:=[.J7]-[.B7] -> -52
A8: 2006-05-31 | B8: 6938 | C8: 5891 | D8: 0 | E8: 0 | F8: 0 | G8: 300 | H8: 0 | I8: 0 | J8: oooc:=SUM([.C8:.I8]) -> 6191 | K8: oooc:=[.J8]-[.B8] -> -747
A9: 2006-06-30 | B9: 7841 | C9: 7536 | D9: 0 | E9: 0 | F9: 0 | G9: 300 | H9: 0 | I9: 0 | J9: oooc:=SUM([.C9:.I9]) -> 7836 | K9: oooc:=[.J9]-[.B9] -> -5
A10: 2006-07-31 | B10: 4628 | C10: 2790 | D10: 0 | E10: 0 | F10: 0 | G10: 450 | H10: 0 | I10: 247.65 | J10: oooc:=SUM([.C10:.I10]) -> 3487.65 | K10: oooc:=[.J10]-[.B10] -> -1140.35
A11: 2006-08-31 | B11: 6438 | C11: 5969 | D11: 0 | E11: 0 | F11: 0 | G11: 225 | H11: 0 | I11: 0 | J11: oooc:=SUM([.C11:.I11]) -> 6194 | K11: oooc:=[.J11]-[.B11] -> -244
A12: 2006-09-30 | B12: 4757 | C12: 4457 | D12: 0 | E12: 0 | F12: 0 | G12: 300 | H12: 0 | I12: 0 | J12: oooc:=SUM([.C12:.I12]) -> 4757 | K12: oooc:=[.J12]-[.B12] -> 0
A13: 2006-10-31 | B13: 6448 | C13: 5891 | D13: 0 | E13: 0 | F13: 0 | G13: 375 | H13: 0 | I13: 175 | J13: oooc:=SUM([.C13:.I13]) -> 6441 | K13: oooc:=[.J13]-[.B13] -> -7
A14: 2006-11-30 | B14: 7585 | C14: 6625 | D14: 0 | E14: 60 | F14: 0 | G14: 300 | H14: 600 | I14: 0 | J14: oooc:=SUM([.C14:.I14]) -> 7585 | K14: oooc:=[.J14]-[.B14] -> 0
A15: 2006-12-31 | B15: 7384 | C15: 6783 | D15: 0 | E15: 0 | F15: 0 | G15: 375 | H15: 0 | I15: 224 | J15: oooc:=SUM([.C15:.I15]) -> 7382 | K15: oooc:=[.J15]-[.B15] -> -2
A16: Total for Year | B16: oooc:=SUM([.B4:.B15]) -> 82587 | C16: oooc:=SUM([.C4:.C15]) -> 71586 | D16: oooc:=SUM([.D4:.D15]) -> 0 | E16: oooc:=SUM([.E4:.E15]) -> 157.08 | F16: oooc:=SUM([.F4:.F15]) -> 0 | G16: oooc:=SUM([.G4:.G15]) -> 3875 | H16: oooc:=SUM([.H4:.H15]) -> 600 | I16: oooc:=SUM([.I4:.I15]) -> 1647.65 | J16: oooc:=SUM([.J4:.J15]) -> 77865.73 | K16: oooc:=SUM([.K4:.K15]) -> -4721.27
A17: Monthly Average | B17: oooc:=[.B16]/[.$B$23] -> 5344.12446550413 | C17: oooc:=[.C16]/[.$B$23] -> 4632.26045246321 | D17: oooc:=[.D16]/[.$B$23] -> 0 | E17: oooc:=[.E16]/[.$B$23] -> 10.1644940613098 | F17: oooc:=[.F16]/[.$B$23] -> 0 | G17: oooc:=[.G16]/[.$B$23] -> 250.74748209559 | H17: oooc:=[.H16]/[.$B$23] -> 38.825416582543 | I17: oooc:=[.I16]/[.$B$23] -> 106.617829387045 | J17: oooc:=[.J16]/[.$B$23] -> 5038.61567458969 | K17: oooc:=[.K16]/[.$B$23] -> -305.508790914438
A18: Weekly Average | B18: oooc:=[.B16]/[.$B$22] -> 1229.03889145064 | C18: oooc:=[.C16]/[.$B$22] -> 1065.32478578209 | D18: oooc:=[.D16]/[.$B$22] -> 0 | E18: oooc:=[.E16]/[.$B$22] -> 2.33762491759074 | F18: oooc:=[.F16]/[.$B$22] -> 0 | G18: oooc:=[.G16]/[.$B$22] -> 57.6667720630516 | H18: oooc:=[.H16]/[.$B$22] -> 8.92904857750476 | I18: oooc:=[.I16]/[.$B$22] -> 24.5199114812095 | J18: oooc:=[.J16]/[.$B$22] -> 1158.77814282145 | K18: oooc:=[.K16]/[.$B$22] -> -70.2607486291931
A20: Today | B20: oooc:=NOW() -> 2007-04-15T08:59:48.15
A21: Day | B21: oooc:=[.B20]-DATE(2005;12;31) -> 470.374862847224
A22: Week | B22: oooc:=[.B21]/7 -> 67.1964089781749
A23: Month | B23: oooc:=[.B21]/365.25*12 -> 15.4537942619211

Sheet: Expense
A1: QHCC Expenses 2006
A2: Date | B2: QHCC Account | C2: General | D2: Parsonage | E2: Deacon | F2: Restore | G2: Pastor Retirement | H2: DSL | I2: Temporary | J2: Total | K2: Diff
A4: 2006-01-31 | B4: 10209 | C4: 7964 | D4: 0 | E4: 100 | F4: 0 | G4: 1870 | H4: 62.7 | I4: 172 | J4: oooc:=SUM([.C4:.I4]) -> 10168.7 | K4: oooc:=[.J4]-[.B4] -> -40.2999999999993
A5: 2006-02-28 | B5: 7517 | C5: 4469 | D5: 0 | E5: 0 | F5: 0 | G5: 408 | H5: 62.7 | I5: 196 | J5: oooc:=SUM([.C5:.I5]) -> 5135.7 | K5: oooc:=[.J5]-[.B5] -> -2381.3
A6: 2006-03-31 | B6: 7701 | C6: 7236 | D6: 0 | E6: 0 | F6: 0 | G6: 300 | H6: 62.7 | I6: 0 | J6: oooc:=SUM([.C6:.I6]) -> 7598.7 | K6: oooc:=[.J6]-[.B6] -> -102.3
A7: 2006-04-30 | B7: 7893 | C7: 7478 | D7: 0 | E7: 0 | F7: 0 | G7: 300 | H7: 62.7 | I7: 0 | J7: oooc:=SUM([.C7:.I7]) -> 7840.7 | K7: oooc:=[.J7]-[.B7] -> -52.3000000000002
A8: 2006-05-31 | B8: 6632 | C8: 5323 | D8: 0 | E8: 200 | F8: 0 | G8: 300 | H8: 62.89 | I8: 0 | J8: oooc:=SUM([.C8:.I8]) -> 5885.89 | K8: oooc:=[.J8]-[.B8] -> -746.11
A9: 2006-06-30 | B9: 6508 | C9: 6040 | D9: 0 | E9: 100 | F9: 0 | G9: 300 | H9: 62.89 | I9: 0 | J9: oooc:=SUM([.C9:.I9]) -> 6502.89 | K9: oooc:=[.J9]-[.B9] -> -5.10999999999967
A10: 2006-07-31 | B10: 12155 | C10: 10277 | D10: 0 | E10: 0 | F10: 0 | G10: 675 | H10: 62.89 | I10: 0 | J10: oooc:=SUM([.C10:.I10]) -> 11014.89 | K10: oooc:=[.J10]-[.B10] -> -1140.11
A11: 2006-08-31 | B11: 8819 | C11: 7916 | D11: 0 | E11: 50 | F11: 0 | G11: 300 | H11: 61.78 | I11: 247.65 | J11: oooc:=SUM([.C11:.I11]) -> 8575.43 | K11: oooc:=[.J11]-[.B11] -> -243.57
A12: 2006-09-30 | B12: 6745 | C12: 6385 | D12: 0 | E12: 0 | F12: 0 | G12: 300 | H12: 59.95 | I12: 0 | J12: oooc:=SUM([.C12:.I12]) -> 6744.95 | K12: oooc:=[.J12]-[.B12] -> -0.0500000000001819
A13: 2006-10-31 | B13: 9883 | C13: 9267 | D13: 0 | E13: 0 | F13: 0 | G13: 375 | H13: 59.95 | I13: 175 | J13: oooc:=SUM([.C13:.I13]) -> 9876.95 | K13: oooc:=[.J13]-[.B13] -> -6.04999999999927
A14: 2006-11-30 | B14: 5754 | C14: 5394 | D14: 0 | E14: 0 | F14: 0 | G14: 300 | H14: 59.95 | I14: 0 | J14: oooc:=SUM([.C14:.I14]) -> 5753.95 | K14: oooc:=[.J14]-[.B14] -> -0.0500000000001819
A15: 2006-12-31 | B15: 8590 | C15: 5091 | D15: 2977 | E15: 0 | F15: 0 | G15: 375 | H15: 60 | I15: 85 | J15: oooc:=SUM([.C15:.I15]) -> 8588 | K15: oooc:=[.J15]-[.B15] -> -2
A16: Total for Year | B16: oooc:=SUM([.B4:.B15]) -> 98406 | C16: oooc:=SUM([.C4:.C15]) -> 82840 | D16: oooc:=SUM([.D4:.D15]) -> 2977 | E16: oooc:=SUM([.E4:.E15]) -> 450 | F16: oooc:=SUM([.F4:.F15]) -> 0 | G16: oooc:=SUM([.G4:.G15]) -> 5803 | H16: oooc:=SUM([.H4:.H15]) -> 741.1 | I16: oooc:=SUM([.I4:.I15]) -> 875.65 | J16: oooc:=SUM([.J4:.J15]) -> 93686.75 | K16: oooc:=SUM([.K4:.K15]) -> -4719.25
A17: Monthly Average | B17: oooc:=[.B16]/[$Income.$B$23] -> 6367.75657370288 | C17: oooc:=[.C16]/[$Income.$B$23] -> 5360.49584949644 | D17: oooc:=[.D16]/[$Income.$B$23] -> 192.638775277051 | E17: oooc:=[.E16]/[$Income.$B$23] -> 29.1190624369072 | F17: oooc:=[.F16]/[$Income.$B$23] -> 0 | G17: oooc:=[.G16]/[$Income.$B$23] -> 375.506487380828 | H17: oooc:=[.H16]/[$Income.$B$23] -> 47.9558603822044 | I17: oooc:=[.I16]/[$Income.$B$23] -> 56.6624600508396 | J17: oooc:=[.J16]/[$Income.$B$23] -> 6062.37849502427 | K17: oooc:=[.K16]/[$Income.$B$23] -> -305.37807867861
A18: Weekly Average | B18: oooc:=[.B16]/[$Income.$B$22] -> 1464.45325719656 | C18: oooc:=[.C16]/[$Income.$B$22] -> 1232.80397360082 | D18: oooc:=[.D16]/[$Income.$B$22] -> 44.3029626920528 | E18: oooc:=[.E16]/[$Income.$B$22] -> 6.69678643312857 | F18: oooc:=[.F16]/[$Income.$B$22] -> 0 | G18: oooc:=[.G16]/[$Income.$B$22] -> 86.3587814921002 | H18: oooc:=[.H16]/[$Income.$B$22] -> 11.0288631679813 | I18: oooc:=[.I16]/[$Income.$B$22] -> 13.0312023114867 | J18: oooc:=[.J16]/[$Income.$B$22] -> 1394.22256969757 | K18: oooc:=[.K16]/[$Income.$B$22] -> -70.2306874989822