Sheet: Budget
A1: Budget 2006 | P1: #Months YTD
P2: oooc:=COUNT([.C6:.N6]) -> 12
C3: Month
A4: CategoryÂ Description | B4: Budget | C4: 2006-01-01 | D4: 2006-02-01 | E4: 2006-03-01 | F4: 2006-04-01 | G4: 2006-05-01 | H4: 2006-06-01 | I4: 2006-07-01 | J4: 2006-08-01 | K4: 2006-09-01 | L4: 2006-10-01 | M4: 2006-11-01 | N4: 2006-12-31 | O4: Total YTD | P4: Budget YTD | Q4: Difference | R4: Annual Budget
A6: General income | B6: oooc:=[.R6]/12 -> 7500 | C6: 9327 | D6: 5891 | E6: 7536 | F6: 2790 | G6: 5969 | H6: 4457 | I6: 5891 | J6: 6625 | K6: 6783 | L6: 5892 | M6: 6625 | N6: 6783 | O6: oooc:=SUM([.C6:.N6]) -> 74569 | P6: oooc:=[.$P$2]/12*[.R6] -> 90000 | Q6: oooc:=[.O6]-[.P6] -> -15431 | R6: 90000
A8: Building
A9: Hazard Insurance | B9: oooc:=([.R9]/12) -> 166.666666666667 | C9: 0 | D9: 0 | E9: 0 | F9: 0 | G9: 0 | H9: 0 | I9: 1997 | J9: 0 | K9: 0 | L9: 0 | M9: 0 | N9: 0 | O9: oooc:=SUM([.C9:.N9]) -> 1997 | P9: oooc:=[.$P$2]/12*[.R9] -> 2000 | Q9: oooc:=[.O9]-[.P9] -> -3 | R9: 2000
A10: Maintenance | B10: oooc:=([.R10]/12) -> 80 | C10: 0 | D10: 0 | E10: 0 | F10: 820 | G10: -747 | H10: 0 | I10: 0 | J10: 2040 | K10: 0 | L10: 0 | M10: 0 | N10: 0 | O10: oooc:=SUM([.C10:.N10]) -> 2113 | P10: oooc:=[.$P$2]/12*[.R10] -> 960 | Q10: oooc:=[.O10]-[.P10] -> 1153 | R10: 960
A11: Mortgage | B11: oooc:=([.R11]/12) -> 1160 | C11: 1137 | D11: 1137 | E11: 1137 | F11: 1137 | G11: 1137 | H11: 1137 | I11: 1137 | J11: 1137 | K11: 1137 | L11: 1137 | M11: 1137 | N11: 0 | O11: oooc:=SUM([.C11:.N11]) -> 12507 | P11: oooc:=[.$P$2]/12*[.R11] -> 13920 | Q11: oooc:=[.O11]-[.P11] -> -1413 | R11: 13920
A12: Property Tax | B12: oooc:=([.R12]/12) -> 50 | C12: 0 | D12: -2379 | E12: 0 | F12: 0 | G12: 0 | H12: 0 | I12: 0 | J12: 0 | K12: 0 | L12: 336 | M12: 0 | N12: 0 | O12: oooc:=SUM([.C12:.N12]) -> -2043 | P12: oooc:=[.$P$2]/12*[.R12] -> 600 | Q12: oooc:=[.O12]-[.P12] -> -2643 | R12: 600
A13: Supplies | B13: oooc:=([.R13]/12) -> 30 | C13: 0 | D13: 0 | E13: 0 | F13: 0 | G13: 0 | H13: 0 | I13: 0 | J13: 90 | K13: 0 | L13: 0 | M13: 0 | N13: 0 | O13: oooc:=SUM([.C13:.N13]) -> 90 | P13: oooc:=[.$P$2]/12*[.R13] -> 360 | Q13: oooc:=[.O13]-[.P13] -> -270 | R13: 360
A14: Utilities | B14: oooc:=([.R14]/12) -> 650 | C14: 795 | D14: 393 | E14: 528 | F14: 587 | G14: 566 | H14: 452 | I14: 644 | J14: 1127 | K14: 605 | L14: 1135 | M14: 549 | N14: 129 | O14: oooc:=SUM([.C14:.N14]) -> 7510 | P14: oooc:=[.$P$2]/12*[.R14] -> 7800 | Q14: oooc:=[.O14]-[.P14] -> -290 | R14: 7800
A15: TOTAL Building | B15: oooc:=(SUM([.B9:.B14])) -> 2136.66666666667 | C15: oooc:=(SUM([.C9:.C14])) -> 1932 | D15: oooc:=(SUM([.D9:.D14])) -> -849 | E15: oooc:=(SUM([.E9:.E14])) -> 1665 | F15: oooc:=(SUM([.F9:.F14])) -> 2544 | G15: oooc:=(SUM([.G9:.G14])) -> 956 | H15: oooc:=(SUM([.H9:.H14])) -> 1589 | I15: oooc:=(SUM([.I9:.I14])) -> 3778 | J15: oooc:=(SUM([.J9:.J14])) -> 4394 | K15: oooc:=(SUM([.K9:.K14])) -> 1742 | L15: oooc:=SUM([.L9:.L14]) -> 2608 | M15: oooc:=SUM([.M9:.M14]) -> 1686 | N15: oooc:=SUM([.N9:.N14]) -> 129 | O15: oooc:=SUM([.C15:.N15]) -> 22174 | P15: oooc:=[.$P$2]/12*[.R15] -> 25640 | Q15: oooc:=[.O15]-[.P15] -> -3466 | R15: oooc:=(SUM([.R8:.R14])) -> 25640
A17: Business Expenses
A18: Workers' Comp | B18: oooc:=([.R18]/12) -> 166.666666666667 | D18: 598 | F18: -52 | O18: oooc:=SUM([.C18:.N18]) -> 546 | P18: oooc:=[.$P$2]/12*[.R18] -> 2000 | Q18: oooc:=[.O18]-[.P18] -> -1454 | R18: 2000
A19: Office | B19: oooc:=([.R19]/12) -> 50 | C19: 987 | D19: 0 | E19: 5 | F19: 6 | G19: 42 | H19: 5 | I19: 6 | J19: 6 | K19: 0 | L19: 40 | M19: 0 | N19: 0 | O19: oooc:=SUM([.C19:.N19]) -> 1097 | P19: oooc:=[.$P$2]/12*[.R19] -> 600 | Q19: oooc:=[.O19]-[.P19] -> 497 | R19: 600
A20: Telephone | B20: oooc:=([.R20]/12) -> 100 | C20: 74 | D20: 95 | E20: 87 | F20: 86 | G20: 90 | H20: 85 | I20: 88 | J20: 84 | K20: 83 | L20: 85 | M20: 87 | N20: 77 | O20: oooc:=SUM([.C20:.N20]) -> 1021 | P20: oooc:=[.$P$2]/12*[.R20] -> 1200 | Q20: oooc:=[.O20]-[.P20] -> -179 | R20: 1200
A21: TOTAL Business Expenses | B21: oooc:=(SUM([.B18:.B20])) -> 316.666666666667 | C21: oooc:=(SUM([.C18:.C20])) -> 1061 | D21: oooc:=(SUM([.D18:.D20])) -> 693 | E21: oooc:=(SUM([.E18:.E20])) -> 92 | F21: oooc:=(SUM([.F18:.F20])) -> 40 | G21: oooc:=(SUM([.G18:.G20])) -> 132 | H21: oooc:=(SUM([.H18:.H20])) -> 90 | I21: oooc:=(SUM([.I18:.I20])) -> 94 | J21: oooc:=(SUM([.J18:.J20])) -> 90 | K21: oooc:=(SUM([.K18:.K20])) -> 83 | L21: oooc:=SUM([.L18:.L20]) -> 125 | M21: oooc:=SUM([.M18:.M20]) -> 87 | N21: oooc:=SUM([.N18:.N20]) -> 77 | O21: oooc:=SUM([.C21:.N21]) -> 2664 | P21: oooc:=[.$P$2]/12*[.R21] -> 3800 | Q21: oooc:=[.O21]-[.P21] -> -1136 | R21: oooc:=(SUM([.R17:.R20])) -> 3800
A23: Ministry
A24: Adult | B24: oooc:=([.R24]/12) -> 10 | C24: 0 | D24: 0 | E24: 0 | F24: 0 | G24: 0 | H24: 0 | I24: 0 | O24: oooc:=SUM([.C24:.N24]) -> 0 | P24: oooc:=[.$P$2]/12*[.R24] -> 120 | Q24: oooc:=[.O24]-[.P24] -> -120 | R24: 120
A25: Children | B25: oooc:=([.R25]/12) -> 10 | C25: 0 | D25: 0 | E25: 0 | F25: 0 | G25: 0 | H25: 0 | I25: 0 | J25: 0 | K25: 0 | O25: oooc:=SUM([.C25:.N25]) -> 0 | P25: oooc:=[.$P$2]/12*[.R25] -> 120 | Q25: oooc:=[.O25]-[.P25] -> -120 | R25: 120
A26: Fellowship | B26: oooc:=([.R26]/12) -> 30 | C26: 0 | D26: 0 | E26: 0 | F26: 0 | G26: 0 | H26: 0 | I26: 0 | J26: 0 | K26: 0 | O26: oooc:=SUM([.C26:.N26]) -> 0 | P26: oooc:=[.$P$2]/12*[.R26] -> 360 | Q26: oooc:=[.O26]-[.P26] -> -360 | R26: 360
A27: Missions | B27: oooc:=([.R27]/12) -> 80 | C27: 75 | D27: 80 | E27: 50 | F27: 52 | G27: 100 | H27: 90 | I27: 80 | J27: 54 | K27: 60 | L27: 50 | M27: 60 | N27: 70 | O27: oooc:=SUM([.C27:.N27]) -> 821 | P27: oooc:=[.$P$2]/12*[.R27] -> 960 | Q27: oooc:=[.O27]-[.P27] -> -139 | R27: 960
A28: Outreach | B28: oooc:=([.R28]/12) -> 50 | C28: 18 | D28: 18 | E28: 18 | F28: 18 | G28: 18 | H28: 18 | I28: 18 | J28: 18 | K28: 18 | L28: 18 | M28: 18 | N28: 18 | O28: oooc:=SUM([.C28:.N28]) -> 216 | P28: oooc:=[.$P$2]/12*[.R28] -> 600 | Q28: oooc:=[.O28]-[.P28] -> -384 | R28: 600
A29: Christian Education | B29: oooc:=([.R29]/12) -> 20 | C29: 0 | D29: 0 | E29: 137 | F29: 35 | G29: 0 | H29: 137 | I29: 0 | J29: 0 | K29: 137 | O29: oooc:=SUM([.C29:.N29]) -> 446 | P29: oooc:=[.$P$2]/12*[.R29] -> 240 | Q29: oooc:=[.O29]-[.P29] -> 206 | R29: 240
A30: Worship | B30: oooc:=([.R30]/12) -> 30 | C30: 0 | D30: 0 | E30: 101 | F30: 0 | G30: 0 | H30: 0 | I30: 0 | J30: 0 | K30: 0 | O30: oooc:=SUM([.C30:.N30]) -> 101 | P30: oooc:=[.$P$2]/12*[.R30] -> 360 | Q30: oooc:=[.O30]-[.P30] -> -259 | R30: 360
A31: Youth | B31: oooc:=([.R31]/12) -> 10 | C31: 0 | D31: 0 | E31: 0 | F31: 0 | G31: 0 | H31: 0 | I31: 0 | J31: 0 | K31: 0 | O31: oooc:=SUM([.C31:.N31]) -> 0 | P31: oooc:=[.$P$2]/12*[.R31] -> 120 | Q31: oooc:=[.O31]-[.P31] -> -120 | R31: 120
A32: TOTAL Ministry | B32: oooc:=(SUM([.B24:.B31])) -> 240 | C32: oooc:=(SUM([.C24:.C31])) -> 93 | D32: oooc:=(SUM([.D24:.D31])) -> 98 | E32: oooc:=(SUM([.E24:.E31])) -> 306 | F32: oooc:=(SUM([.F24:.F31])) -> 105 | G32: oooc:=(SUM([.G24:.G31])) -> 118 | H32: oooc:=(SUM([.H24:.H31])) -> 245 | I32: oooc:=(SUM([.I24:.I31])) -> 98 | J32: oooc:=(SUM([.J24:.J31])) -> 72 | K32: oooc:=(SUM([.K24:.K31])) -> 215 | L32: oooc:=SUM([.L24:.L31]) -> 68 | M32: oooc:=SUM([.M24:.M31]) -> 78 | N32: oooc:=SUM([.N24:.N31]) -> 88 | O32: oooc:=SUM([.C32:.N32]) -> 1584 | P32: oooc:=[.$P$2]/12*[.R32] -> 2880 | Q32: oooc:=[.O32]-[.P32] -> -1296 | R32: oooc:=(SUM([.R23:.R31])) -> 2880
A34: Parsonage
A35: Maintenance | B35: oooc:=([.R35]/12) -> 100 | C35: 0 | D35: 0 | E35: 0 | F35: 0 | G35: 0 | H35: 0 | I35: 0 | J35: 0 | K35: 0 | O35: oooc:=SUM([.C35:.N35]) -> 0 | P35: oooc:=[.$P$2]/12*[.R35] -> 1200 | Q35: oooc:=[.O35]-[.P35] -> -1200 | R35: 1200
A36: Mortgage | B36: oooc:=([.R36]/12) -> 570 | C36: 565 | D36: 565 | E36: 565 | F36: 565 | G36: 565 | H36: 565 | I36: 565 | J36: 565 | K36: 599 | L36: 1130 | M36: 0 | N36: 565 | O36: oooc:=SUM([.C36:.N36]) -> 6814 | P36: oooc:=[.$P$2]/12*[.R36] -> 6840 | Q36: oooc:=[.O36]-[.P36] -> -26 | R36: 6840
A37: Property Tax | B37: oooc:=([.R37]/12) -> 250 | C37: 0 | D37: 0 | E37: 1040 | F37: 0 | G37: 0 | H37: 0 | I37: 0 | J37: 0 | K37: 0 | L37: 1078 | M37: 0 | N37: 0 | O37: oooc:=SUM([.C37:.N37]) -> 2118 | P37: oooc:=[.$P$2]/12*[.R37] -> 3000 | Q37: oooc:=[.O37]-[.P37] -> -882 | R37: 3000
A38: Utilities | B38: oooc:=([.R38]/12) -> 300 | C38: 312 | D38: 354 | E38: 268 | F38: 225 | G38: 252 | H38: 250 | I38: 543 | J38: 695 | K38: 446 | L38: 257 | M38: 243 | N38: 232 | O38: oooc:=SUM([.C38:.N38]) -> 4077 | P38: oooc:=[.$P$2]/12*[.R38] -> 3600 | Q38: oooc:=[.O38]-[.P38] -> 477 | R38: 3600
A39: TOTAL Parsonage | B39: oooc:=(SUM([.B35:.B38])) -> 1220 | C39: oooc:=(SUM([.C35:.C38])) -> 877 | D39: oooc:=(SUM([.D35:.D38])) -> 919 | E39: oooc:=(SUM([.E35:.E38])) -> 1873 | F39: oooc:=(SUM([.F35:.F38])) -> 790 | G39: oooc:=(SUM([.G35:.G38])) -> 817 | H39: oooc:=(SUM([.H35:.H38])) -> 815 | I39: oooc:=(SUM([.I35:.I38])) -> 1108 | J39: oooc:=(SUM([.J35:.J38])) -> 1260 | K39: oooc:=(SUM([.K35:.K38])) -> 1045 | L39: oooc:=SUM([.L35:.L38]) -> 2465 | M39: oooc:=SUM([.M35:.M38]) -> 243 | N39: oooc:=SUM([.N35:.N38]) -> 797 | O39: oooc:=SUM([.C39:.N39]) -> 13009 | P39: oooc:=[.$P$2]/12*[.R39] -> 14640 | Q39: oooc:=[.O39]-[.P39] -> -1631 | R39: oooc:=(SUM([.R34:.R38])) -> 14640
A41: Pastor
A42: Business Expenses | B42: oooc:=([.R42]/12) -> 500 | C42: 500 | D42: 500 | E42: 500 | F42: 500 | G42: 500 | H42: 500 | I42: 1000 | J42: 0 | K42: 500 | L42: 500 | M42: 500 | N42: 500 | O42: oooc:=SUM([.C42:.N42]) -> 6000 | P42: oooc:=[.$P$2]/12*[.R42] -> 6000 | Q42: oooc:=[.O42]-[.P42] -> 0 | R42: 6000
A43: Honorarium | B43: oooc:=([.R43]/12) -> 2950 | C43: 3500 | D43: 2800 | E43: 2800 | F43: 3500 | G43: 2800 | H43: 2800 | I43: 4200 | J43: 2100 | K43: 2800 | L43: 3500 | M43: 2800 | N43: 3500 | O43: oooc:=SUM([.C43:.N43]) -> 37100 | P43: oooc:=[.$P$2]/12*[.R43] -> 35400 | Q43: oooc:=[.O43]-[.P43] -> 1700 | R43: 35400
A44: TOTAL Pastor | B44: oooc:=(SUM([.B42:.B43])) -> 3450 | C44: oooc:=(SUM([.C42:.C43])) -> 4000 | D44: oooc:=(SUM([.D42:.D43])) -> 3300 | E44: oooc:=(SUM([.E42:.E43])) -> 3300 | F44: oooc:=(SUM([.F42:.F43])) -> 4000 | G44: oooc:=(SUM([.G42:.G43])) -> 3300 | H44: oooc:=(SUM([.H42:.H43])) -> 3300 | I44: oooc:=(SUM([.I42:.I43])) -> 5200 | J44: oooc:=(SUM([.J42:.J43])) -> 2100 | K44: oooc:=(SUM([.K42:.K43])) -> 3300 | L44: oooc:=SUM([.L42:.L43]) -> 4000 | M44: oooc:=SUM([.M42:.M43]) -> 3300 | N44: oooc:=SUM([.N42:.N43]) -> 4000 | O44: oooc:=SUM([.C44:.N44]) -> 43100 | P44: oooc:=[.$P$2]/12*[.R44] -> 41400 | Q44: oooc:=[.O44]-[.P44] -> 1700 | R44: oooc:=(SUM([.R41:.R43])) -> 41400
A46: TOTAL EXPENSES | B46: oooc:=[.B15]+[.B21]+[.B32]+[.B39]+[.B44] -> 7363.33333333333 | C46: oooc:=[.C15]+[.C21]+[.C32]+[.C39]+[.C44] -> 7963 | D46: oooc:=[.D15]+[.D21]+[.D32]+[.D39]+[.D44] -> 4161 | E46: oooc:=[.E15]+[.E21]+[.E32]+[.E39]+[.E44] -> 7236 | F46: oooc:=[.F15]+[.F21]+[.F32]+[.F39]+[.F44] -> 7479 | G46: oooc:=[.G15]+[.G21]+[.G32]+[.G39]+[.G44] -> 5323 | H46: oooc:=[.H15]+[.H21]+[.H32]+[.H39]+[.H44] -> 6039 | I46: oooc:=[.I15]+[.I21]+[.I32]+[.I39]+[.I44] -> 10278 | J46: oooc:=[.J15]+[.J21]+[.J32]+[.J39]+[.J44] -> 7916 | K46: oooc:=[.K15]+[.K21]+[.K32]+[.K39]+[.K44] -> 6385 | L46: oooc:=[.L15]+[.L21]+[.L32]+[.L39]+[.L44] -> 9266 | M46: oooc:=[.M15]+[.M21]+[.M32]+[.M39]+[.M44] -> 5394 | N46: oooc:=[.N15]+[.N21]+[.N32]+[.N39]+[.N44] -> 5091 | O46: oooc:=[.O15]+[.O21]+[.O32]+[.O39]+[.O44] -> 82531 | P46: oooc:=[.$P$2]/12*[.R46] -> 88360 | Q46: oooc:=[.O46]-[.P46] -> -5829 | R46: oooc:=[.R15]+[.R21]+[.R32]+[.R39]+[.R44] -> 88360
A48: OVERALL TOTAL | B48: oooc:=[.B6]-[.B46] -> 136.666666666667 | C48: oooc:=[.C6]-[.C46] -> 1364 | D48: oooc:=[.D6]-[.D46] -> 1730 | E48: oooc:=[.E6]-[.E46] -> 300 | F48: oooc:=[.F6]-[.F46] -> -4689 | G48: oooc:=[.G6]-[.G46] -> 646 | H48: oooc:=[.H6]-[.H46] -> -1582 | I48: oooc:=[.I6]-[.I46] -> -4387 | J48: oooc:=[.J6]-[.J46] -> -1291 | K48: oooc:=[.K6]-[.K46] -> 398 | L48: oooc:=[.L6]-[.L46] -> -3374 | M48: oooc:=[.M6]-[.M46] -> 1231 | N48: oooc:=[.N6]-[.N46] -> 1692 | O48: oooc:=[.O6]-[.O46] -> -7962 | P48: oooc:=[.$P$2]/12*[.R48] -> 1640 | Q48: oooc:=[.O48]-[.P48] -> -9602 | R48: oooc:=[.R6]-[.R46] -> 1640
B82: oooc:=[.O4] -> Total YTD | C82: oooc:=[.P4] -> Budget YTD
A83: oooc:=[.$A6] -> General income | B83: oooc:=[.O6] -> 74569 | C83: oooc:=[.P6] -> 90000
A84: oooc:=[.$A8] -> Building | B84: oooc:=[.O15] -> 22174 | C84: oooc:=[.P15] -> 25640
A85: oooc:=[.$A17] -> Business Expenses | B85: oooc:=[.O21] -> 2664 | C85: oooc:=[.P21] -> 3800
A86: oooc:=[.$A23] -> Ministry | B86: oooc:=[.O32] -> 1584 | C86: oooc:=[.P32] -> 2880
A87: oooc:=[.$A34] -> Parsonage | B87: oooc:=[.O39] -> 13009 | C87: oooc:=[.P39] -> 14640
A88: oooc:=[.$A41] -> Pastor | B88: oooc:=[.O44] -> 43100 | C88: oooc:=[.P44] -> 41400