Sheet: Balances
A1: QHCC Balances 2007
A2: Date | B2: QHCC Account | C2: General | D2: Parsonage | E2: Deacon | F2: Restore | G2: Pastor Retirement | H2: DSL | I2: Temporary | J2: Total | K2: Diff | L2: Total Other | M2: General by Diff | N2: Diff | O2: QHCC Acct Rpt | P2: Diff | Q2: General from Rpt | R2: General by Diff | S2: Diff
A3: 2006-12-31 | B3: 8686.31 | C3: 3401 | D3: 4226 | E3: 136.42 | F3: 741.92 | G3: 925 | H3: -885.470000000001 | I3: 139 | J3: oooc:=SUM([.C3:.I3]) -> 8683.87 | K3: oooc:=[.J3]-[.B3] -> -2.44000000000051 | L3: oooc:=SUM([.D3:.I3]) -> 5282.87 | M3: oooc:=IF([.$B3]<>"";[.B3]-[.L3];"") -> 3403.44 | N3: oooc:=IF([.$B4]<>"";[.M3]-[.C3];"") -> 2.44000000000051 | O3: 24505.31 | P3: oooc:=[.O3]-[.B3] -> 15819 | Q3: 15718.23 | R3: oooc:=[.B3]-SUM([.D3:.I3]) -> 3403.44 | S3: oooc:=[.R3]-[.C3] -> 2.44000000000051
A4: 2007-01-31 | B4: oooc:=IF([$Income.$B4]>0;[.B3]+[$Income.B4]-[$Expense.B4];"") -> 7868.31 | C4: oooc:=IF([$Income.$B4]>0;[.C3]+[$Income.C4]-[$Expense.C4];"") -> 2838 | D4: oooc:=IF([$Income.$B4]>0;[.D3]+[$Income.D4]-[$Expense.D4];"") -> 4226 | E4: oooc:=IF([$Income.$B4]>0;[.E3]+[$Income.E4]-[$Expense.E4];"") -> 165.42 | F4: oooc:=IF([$Income.$B4]>0;[.F3]+[$Income.F4]-[$Expense.F4];"") -> 741.92 | G4: oooc:=IF([$Income.$B4]>0;[.G3]+[$Income.G4]-[$Expense.G4];"") -> 925 | H4: oooc:=IF([$Income.$B4]>0;[.H3]+[$Income.H4]-[$Expense.H4];"") -> -945.470000000001 | I4: oooc:=IF([$Income.$B4]>0;[.I3]+[$Income.I4]-[$Expense.I4];"") -> -85 | J4: oooc:=IF([$Income.$B4]>0;SUM([.C4:.I4]);"") -> 7865.87 | K4: oooc:=IF([$Income.$B4]>0;[.J4]-[.B4];"") -> -2.44000000000051 | L4: oooc:=IF([$Income.$B4]>0;SUM([.D4:.I4]);"") -> 5027.87 | M4: oooc:=IF([.$B4]<>"";[.B4]-[.L4];"") -> 2840.44 | N4: oooc:=IF([.$B5]<>"";[.M4]-[.C4];"") -> 2.44000000000051 | O4: 23007.06 | P4: oooc:=IF([$Income.$B4]>0;[.O4]-[.B4];"") -> 15138.75 | Q4: 15578.68 | R4: oooc:=IF([$Income.$B4]>0;[.B4]-SUM([.D4:.I4]);"") -> 2840.44 | S4: oooc:=IF([$Income.$B4]>0;[.R4]-[.C4];"") -> 2.44000000000051
A5: 2007-02-28 | B5: oooc:=IF([$Income.$B5]>0;[.B4]+[$Income.B5]-[$Expense.B5];"") -> 6616.31 | C5: oooc:=IF([$Income.$B5]>0;[.C4]+[$Income.C5]-[$Expense.C5];"") -> 1339 | D5: oooc:=IF([$Income.$B5]>0;[.D4]+[$Income.D5]-[$Expense.D5];"") -> 4226 | E5: oooc:=IF([$Income.$B5]>0;[.E4]+[$Income.E5]-[$Expense.E5];"") -> 165.42 | F5: oooc:=IF([$Income.$B5]>0;[.F4]+[$Income.F5]-[$Expense.F5];"") -> 741.92 | G5: oooc:=IF([$Income.$B5]>0;[.G4]+[$Income.G5]-[$Expense.G5];"") -> 1225 | H5: oooc:=IF([$Income.$B5]>0;[.H4]+[$Income.H5]-[$Expense.H5];"") -> -1005.47 | I5: oooc:=IF([$Income.$B5]>0;[.I4]+[$Income.I5]-[$Expense.I5];"") -> -77 | J5: oooc:=IF([$Income.$B5]>0;SUM([.C5:.I5]);"") -> 6614.87 | K5: oooc:=IF([$Income.$B5]>0;[.J5]-[.B5];"") -> -1.44000000000051 | L5: oooc:=IF([$Income.$B5]>0;SUM([.D5:.I5]);"") -> 5275.87 | M5: oooc:=IF([.$B5]<>"";[.B5]-[.L5];"") -> 1340.44 | N5: oooc:=IF([.$B6]<>"";[.M5]-[.C5];"") -> 1.44000000000051 | O5: 21549.69 | P5: oooc:=IF([$Income.$B5]>0;[.O5]-[.B5];"") -> 14933.38 | Q5: 14285.01 | R5: oooc:=IF([$Income.$B5]>0;[.B5]-SUM([.D5:.I5]);"") -> 1340.44 | S5: oooc:=IF([$Income.$B5]>0;[.R5]-[.C5];"") -> 1.44000000000051
A6: 2007-03-31 | B6: oooc:=IF([$Income.$B6]>0;[.B5]+[$Income.B6]-[$Expense.B6];"") -> 6672.31 | C6: oooc:=IF([$Income.$B6]>0;[.C5]+[$Income.C6]-[$Expense.C6];"") -> 1300 | D6: oooc:=IF([$Income.$B6]>0;[.D5]+[$Income.D6]-[$Expense.D6];"") -> 4031 | E6: oooc:=IF([$Income.$B6]>0;[.E5]+[$Income.E6]-[$Expense.E6];"") -> 165.42 | F6: oooc:=IF([$Income.$B6]>0;[.F5]+[$Income.F6]-[$Expense.F6];"") -> 741.92 | G6: oooc:=IF([$Income.$B6]>0;[.G5]+[$Income.G6]-[$Expense.G6];"") -> 925 | H6: oooc:=IF([$Income.$B6]>0;[.H5]+[$Income.H6]-[$Expense.H6];"") -> -415.470000000001 | I6: oooc:=IF([$Income.$B6]>0;[.I5]+[$Income.I6]-[$Expense.I6];"") -> -77 | J6: oooc:=IF([$Income.$B6]>0;SUM([.C6:.I6]);"") -> 6670.87 | K6: oooc:=IF([$Income.$B6]>0;[.J6]-[.B6];"") -> -1.44000000000051 | L6: oooc:=IF([$Income.$B6]>0;SUM([.D6:.I6]);"") -> 5370.87 | M6: oooc:=IF([.$B6]<>"";[.B6]-[.L6];"") -> 1301.44 | N6: oooc:=IF([.$B7]<>"";[.M6]-[.C6];"") -> 1.44000000000051 | O6: 19498.1 | P6: oooc:=IF([$Income.$B6]>0;[.O6]-[.B6];"") -> 12825.79 | Q6: 12259.04 | R6: oooc:=IF([$Income.$B6]>0;[.B6]-SUM([.D6:.I6]);"") -> 1301.44 | S6: oooc:=IF([$Income.$B6]>0;[.R6]-[.C6];"") -> 1.44000000000051
A7: 2007-04-30 | B7: oooc:=IF([$Income.$B7]>0;[.B6]+[$Income.B7]-[$Expense.B7];"") -> 6815.31 | C7: oooc:=IF([$Income.$B7]>0;[.C6]+[$Income.C7]-[$Expense.C7];"") -> 2150 | D7: oooc:=IF([$Income.$B7]>0;[.D6]+[$Income.D7]-[$Expense.D7];"") -> 4031 | E7: oooc:=IF([$Income.$B7]>0;[.E6]+[$Income.E7]-[$Expense.E7];"") -> 292.42 | F7: oooc:=IF([$Income.$B7]>0;[.F6]+[$Income.F7]-[$Expense.F7];"") -> 741.92 | G7: oooc:=IF([$Income.$B7]>0;[.G6]+[$Income.G7]-[$Expense.G7];"") -> 0 | H7: oooc:=IF([$Income.$B7]>0;[.H6]+[$Income.H7]-[$Expense.H7];"") -> -475.470000000001 | I7: oooc:=IF([$Income.$B7]>0;[.I6]+[$Income.I7]-[$Expense.I7];"") -> 75 | J7: oooc:=IF([$Income.$B7]>0;SUM([.C7:.I7]);"") -> 6814.87 | K7: oooc:=IF([$Income.$B7]>0;[.J7]-[.B7];"") -> -0.440000000000509 | L7: oooc:=IF([$Income.$B7]>0;SUM([.D7:.I7]);"") -> 4664.87 | M7: oooc:=IF([.$B7]<>"";[.B7]-[.L7];"") -> 2150.44 | N7: oooc:=IF([.$B8]<>"";[.M7]-[.C7];"") -> 0.440000000000509 | O7: 21753.98 | P7: oooc:=IF([$Income.$B7]>0;[.O7]-[.B7];"") -> 14938.67 | Q7: 14107.62 | R7: oooc:=IF([$Income.$B7]>0;[.B7]-SUM([.D7:.I7]);"") -> 2150.44 | S7: oooc:=IF([$Income.$B7]>0;[.R7]-[.C7];"") -> 0.440000000000509
A8: 2007-05-31 | B8: oooc:=IF([$Income.$B8]>0;[.B7]+[$Income.B8]-[$Expense.B8];"") -> 13043.31 | C8: oooc:=IF([$Income.$B8]>0;[.C7]+[$Income.C8]-[$Expense.C8];"") -> 5861 | D8: oooc:=IF([$Income.$B8]>0;[.D7]+[$Income.D8]-[$Expense.D8];"") -> 4031 | E8: oooc:=IF([$Income.$B8]>0;[.E7]+[$Income.E8]-[$Expense.E8];"") -> 369.42 | F8: oooc:=IF([$Income.$B8]>0;[.F7]+[$Income.F8]-[$Expense.F8];"") -> 741.92 | G8: oooc:=IF([$Income.$B8]>0;[.G7]+[$Income.G8]-[$Expense.G8];"") -> 0 | H8: oooc:=IF([$Income.$B8]>0;[.H7]+[$Income.H8]-[$Expense.H8];"") -> -535.470000000001 | I8: oooc:=IF([$Income.$B8]>0;[.I7]+[$Income.I8]-[$Expense.I8];"") -> 2575 | J8: oooc:=IF([$Income.$B8]>0;SUM([.C8:.I8]);"") -> 13042.87 | K8: oooc:=IF([$Income.$B8]>0;[.J8]-[.B8];"") -> -0.43999999999869 | L8: oooc:=IF([$Income.$B8]>0;SUM([.D8:.I8]);"") -> 7181.87 | M8: oooc:=IF([.$B8]<>"";[.B8]-[.L8];"") -> 5861.44 | N8: oooc:=IF([.$B9]<>"";[.M8]-[.C8];"") -> 0.43999999999869 | O8: 22059.37 | P8: oooc:=IF([$Income.$B8]>0;[.O8]-[.B8];"") -> 9016.06 | Q8: 14675.9 | R8: oooc:=IF([$Income.$B8]>0;[.B8]-SUM([.D8:.I8]);"") -> 5861.44 | S8: oooc:=IF([$Income.$B8]>0;[.R8]-[.C8];"") -> 0.43999999999869
A9: 2007-06-30 | B9: oooc:=IF([$Income.$B9]>0;[.B8]+[$Income.B9]-[$Expense.B9];"") -> 15960.31 | C9: oooc:=IF([$Income.$B9]>0;[.C8]+[$Income.C9]-[$Expense.C9];"") -> 5128 | D9: oooc:=IF([$Income.$B9]>0;[.D8]+[$Income.D9]-[$Expense.D9];"") -> 4031 | E9: oooc:=IF([$Income.$B9]>0;[.E8]+[$Income.E9]-[$Expense.E9];"") -> 369.42 | F9: oooc:=IF([$Income.$B9]>0;[.F8]+[$Income.F9]-[$Expense.F9];"") -> 741.92 | G9: oooc:=IF([$Income.$B9]>0;[.G8]+[$Income.G9]-[$Expense.G9];"") -> 0 | H9: oooc:=IF([$Income.$B9]>0;[.H8]+[$Income.H9]-[$Expense.H9];"") -> -595.470000000001 | I9: oooc:=IF([$Income.$B9]>0;[.I8]+[$Income.I9]-[$Expense.I9];"") -> 6285 | J9: oooc:=IF([$Income.$B9]>0;SUM([.C9:.I9]);"") -> 15959.87 | K9: oooc:=IF([$Income.$B9]>0;[.J9]-[.B9];"") -> -0.43999999999869 | L9: oooc:=IF([$Income.$B9]>0;SUM([.D9:.I9]);"") -> 10831.87 | M9: oooc:=IF([.$B9]<>"";[.B9]-[.L9];"") -> 5128.44 | N9: oooc:=IF([.$B10]<>"";[.M9]-[.C9];"") -> 0.43999999999869 | O9: 23392.33 | P9: oooc:=IF([$Income.$B9]>0;[.O9]-[.B9];"") -> 7432.02 | Q9: 16171.75 | R9: oooc:=IF([$Income.$B9]>0;[.B9]-SUM([.D9:.I9]);"") -> 5128.44 | S9: oooc:=IF([$Income.$B9]>0;[.R9]-[.C9];"") -> 0.43999999999869
A10: 2007-07-31 | B10: oooc:=IF([$Income.$B10]>0;[.B9]+[$Income.B10]-[$Expense.B10];"") -> 12741.31 | C10: oooc:=IF([$Income.$B10]>0;[.C9]+[$Income.C10]-[$Expense.C10];"") -> 1656 | D10: oooc:=IF([$Income.$B10]>0;[.D9]+[$Income.D10]-[$Expense.D10];"") -> 4031 | E10: oooc:=IF([$Income.$B10]>0;[.E9]+[$Income.E10]-[$Expense.E10];"") -> 447.42 | F10: oooc:=IF([$Income.$B10]>0;[.F9]+[$Income.F10]-[$Expense.F10];"") -> 741.92 | G10: oooc:=IF([$Income.$B10]>0;[.G9]+[$Income.G10]-[$Expense.G10];"") -> 0 | H10: oooc:=IF([$Income.$B10]>0;[.H9]+[$Income.H10]-[$Expense.H10];"") -> -655.470000000001 | I10: oooc:=IF([$Income.$B10]>0;[.I9]+[$Income.I10]-[$Expense.I10];"") -> 6520 | J10: oooc:=IF([$Income.$B10]>0;SUM([.C10:.I10]);"") -> 12740.87 | K10: oooc:=IF([$Income.$B10]>0;[.J10]-[.B10];"") -> -0.43999999999869 | L10: oooc:=IF([$Income.$B10]>0;SUM([.D10:.I10]);"") -> 11084.87 | M10: oooc:=IF([.$B10]<>"";[.B10]-[.L10];"") -> 1656.44 | N10: oooc:=IF([.$B11]<>"";[.M10]-[.C10];"") -> 0.43999999999869 | O10: 15865.01 | P10: oooc:=IF([$Income.$B10]>0;[.O10]-[.B10];"") -> 3123.7 | Q10: 8684.67 | R10: oooc:=IF([$Income.$B10]>0;[.B10]-SUM([.D10:.I10]);"") -> 1656.44 | S10: oooc:=IF([$Income.$B10]>0;[.R10]-[.C10];"") -> 0.43999999999869
A11: 2007-08-31 | B11: oooc:=IF([$Income.$B11]>0;[.B10]+[$Income.B11]-[$Expense.B11];"") -> 11130.31 | C11: oooc:=IF([$Income.$B11]>0;[.C10]+[$Income.C11]-[$Expense.C11];"") -> 205 | D11: oooc:=IF([$Income.$B11]>0;[.D10]+[$Income.D11]-[$Expense.D11];"") -> 2861 | E11: oooc:=IF([$Income.$B11]>0;[.E10]+[$Income.E11]-[$Expense.E11];"") -> 447.42 | F11: oooc:=IF([$Income.$B11]>0;[.F10]+[$Income.F11]-[$Expense.F11];"") -> 741.92 | G11: oooc:=IF([$Income.$B11]>0;[.G10]+[$Income.G11]-[$Expense.G11];"") -> 0 | H11: oooc:=IF([$Income.$B11]>0;[.H10]+[$Income.H11]-[$Expense.H11];"") -> -715.470000000001 | I11: oooc:=IF([$Income.$B11]>0;[.I10]+[$Income.I11]-[$Expense.I11];"") -> 7590 | J11: oooc:=IF([$Income.$B11]>0;SUM([.C11:.I11]);"") -> 11129.87 | K11: oooc:=IF([$Income.$B11]>0;[.J11]-[.B11];"") -> -0.43999999999869 | L11: oooc:=IF([$Income.$B11]>0;SUM([.D11:.I11]);"") -> 10924.87 | M11: oooc:=IF([.$B11]<>"";[.B11]-[.L11];"") -> 205.439999999999 | N11: oooc:=IF([.$B12]<>"";[.M11]-[.C11];"") -> 0.43999999999869 | O11: 13483.96 | P11: oooc:=IF([$Income.$B11]>0;[.O11]-[.B11];"") -> 2353.65 | Q11: 6738.05 | R11: oooc:=IF([$Income.$B11]>0;[.B11]-SUM([.D11:.I11]);"") -> 205.439999999999 | S11: oooc:=IF([$Income.$B11]>0;[.R11]-[.C11];"") -> 0.43999999999869
A12: 2007-09-30 | B12: oooc:=IF([$Income.$B12]>0;[.B11]+[$Income.B12]-[$Expense.B12];"") -> 14007.31 | C12: oooc:=IF([$Income.$B12]>0;[.C11]+[$Income.C12]-[$Expense.C12];"") -> 939 | D12: oooc:=IF([$Income.$B12]>0;[.D11]+[$Income.D12]-[$Expense.D12];"") -> 2861 | E12: oooc:=IF([$Income.$B12]>0;[.E11]+[$Income.E12]-[$Expense.E12];"") -> 520.42 | F12: oooc:=IF([$Income.$B12]>0;[.F11]+[$Income.F12]-[$Expense.F12];"") -> -0.0800000000000409 | G12: oooc:=IF([$Income.$B12]>0;[.G11]+[$Income.G12]-[$Expense.G12];"") -> 0 | H12: oooc:=IF([$Income.$B12]>0;[.H11]+[$Income.H12]-[$Expense.H12];"") -> -775.470000000001 | I12: oooc:=IF([$Income.$B12]>0;[.I11]+[$Income.I12]-[$Expense.I12];"") -> 10462 | J12: oooc:=IF([$Income.$B12]>0;SUM([.C12:.I12]);"") -> 14006.87 | K12: oooc:=IF([$Income.$B12]>0;[.J12]-[.B12];"") -> -0.43999999999869 | L12: oooc:=IF([$Income.$B12]>0;SUM([.D12:.I12]);"") -> 13067.87 | M12: 0 | N12: oooc:=IF([.$B13]<>"";[.M12]-[.C12];"") -> -939 | O12: 11495.56 | P12: oooc:=IF([$Income.$B12]>0;[.O12]-[.B12];"") -> -2511.75 | Q12: 4809.6 | R12: oooc:=IF([$Income.$B12]>0;[.B12]-SUM([.D12:.I12]);"") -> 939.439999999999 | S12: oooc:=IF([$Income.$B12]>0;[.R12]-[.C12];"") -> 0.43999999999869
A13: 2007-10-31 | B13: oooc:=IF([$Income.$B13]>0;[.B12]+[$Income.B13]-[$Expense.B13];"") -> 3901.31 | C13: oooc:=IF([$Income.$B13]>0;[.C12]+[$Income.C13]-[$Expense.C13];"") -> 1234 | D13: oooc:=IF([$Income.$B13]>0;[.D12]+[$Income.D13]-[$Expense.D13];"") -> 2861 | E13: oooc:=IF([$Income.$B13]>0;[.E12]+[$Income.E13]-[$Expense.E13];"") -> 566.42 | F13: oooc:=IF([$Income.$B13]>0;[.F12]+[$Income.F13]-[$Expense.F13];"") -> -0.0800000000000409 | G13: oooc:=IF([$Income.$B13]>0;[.G12]+[$Income.G13]-[$Expense.G13];"") -> 0 | H13: oooc:=IF([$Income.$B13]>0;[.H12]+[$Income.H13]-[$Expense.H13];"") -> -835.470000000001 | I13: oooc:=IF([$Income.$B13]>0;[.I12]+[$Income.I13]-[$Expense.I13];"") -> 75 | J13: oooc:=IF([$Income.$B13]>0;SUM([.C13:.I13]);"") -> 3900.87 | K13: oooc:=IF([$Income.$B13]>0;[.J13]-[.B13];"") -> -0.43999999999869 | L13: oooc:=IF([$Income.$B13]>0;SUM([.D13:.I13]);"") -> 2666.87 | M13: oooc:=IF([.$B13]<>"";[.B13]-[.L13];"") -> 1234.44 | N13: oooc:=IF([.$B14]<>"";[.M13]-[.C13];"") ->  | O13: 7066.3 | P13: oooc:=IF([$Income.$B13]>0;[.O13]-[.B13];"") -> 3164.99 | Q13: 140.29 | R13: oooc:=IF([$Income.$B13]>0;[.B13]-SUM([.D13:.I13]);"") -> 1234.44 | S13: oooc:=IF([$Income.$B13]>0;[.R13]-[.C13];"") -> 0.43999999999869
A14: 2007-11-30 | B14: oooc:=IF([$Income.$B14]>0;[.B13]+[$Income.B14]-[$Expense.B14];"") ->  | C14: oooc:=IF([$Income.$B14]>0;[.C13]+[$Income.C14]-[$Expense.C14];"") ->  | D14: oooc:=IF([$Income.$B14]>0;[.D13]+[$Income.D14]-[$Expense.D14];"") ->  | E14: oooc:=IF([$Income.$B14]>0;[.E13]+[$Income.E14]-[$Expense.E14];"") ->  | F14: oooc:=IF([$Income.$B14]>0;[.F13]+[$Income.F14]-[$Expense.F14];"") ->  | G14: oooc:=IF([$Income.$B14]>0;[.G13]+[$Income.G14]-[$Expense.G14];"") ->  | H14: oooc:=IF([$Income.$B14]>0;[.H13]+[$Income.H14]-[$Expense.H14];"") ->  | I14: oooc:=IF([$Income.$B14]>0;[.I13]+[$Income.I14]-[$Expense.I14];"") ->  | J14: oooc:=IF([$Income.$B14]>0;SUM([.C14:.I14]);"") ->  | K14: oooc:=IF([$Income.$B14]>0;[.J14]-[.B14];"") ->  | L14: oooc:=IF([$Income.$B14]>0;SUM([.D14:.I14]);"") ->  | M14: oooc:=IF([.$B14]<>"";[.B14]-[.L14];"") ->  | N14: oooc:=IF([.$B15]<>"";[.M14]-[.C14];"") ->  | P14: oooc:=IF([$Income.$B14]>0;[.O14]-[.B14];"") ->  | R14: oooc:=IF([$Income.$B14]>0;[.B14]-SUM([.D14:.I14]);"") ->  | S14: oooc:=IF([$Income.$B14]>0;[.R14]-[.C14];"") -> 
A15: 2007-12-31 | B15: oooc:=IF([$Income.$B15]>0;[.B14]+[$Income.B15]-[$Expense.B15];"") ->  | C15: oooc:=IF([$Income.$B15]>0;[.C14]+[$Income.C15]-[$Expense.C15];"") ->  | D15: oooc:=IF([$Income.$B15]>0;[.D14]+[$Income.D15]-[$Expense.D15];"") ->  | E15: oooc:=IF([$Income.$B15]>0;[.E14]+[$Income.E15]-[$Expense.E15];"") ->  | F15: oooc:=IF([$Income.$B15]>0;[.F14]+[$Income.F15]-[$Expense.F15];"") ->  | G15: oooc:=IF([$Income.$B15]>0;[.G14]+[$Income.G15]-[$Expense.G15];"") ->  | H15: oooc:=IF([$Income.$B15]>0;[.H14]+[$Income.H15]-[$Expense.H15];"") ->  | I15: oooc:=IF([$Income.$B15]>0;[.I14]+[$Income.I15]-[$Expense.I15];"") ->  | J15: oooc:=IF([$Income.$B15]>0;SUM([.C15:.I15]);"") ->  | K15: oooc:=IF([$Income.$B15]>0;[.J15]-[.B15];"") ->  | L15: oooc:=IF([$Income.$B15]>0;SUM([.D15:.I15]);"") ->  | M15: oooc:=IF([.$B15]<>"";[.B15]-[.L15];"") ->  | N15: oooc:=IF([.$B16]<>"";[.M15]-[.C15];"") ->  | P15: oooc:=IF([$Income.$B15]>0;[.O15]-[.B15];"") ->  | R15: oooc:=IF([$Income.$B15]>0;[.B15]-SUM([.D15:.I15]);"") ->  | S15: oooc:=IF([$Income.$B15]>0;[.R15]-[.C15];"") -> 
O28: 4779 | P28: 105
O29: 7203 | P29: 7203
O30: 76 | P30: 76
O31: 742 | P31: 742
O32: 0 | P32: 300
O33: -1306 | P33: -1366
N34: Total | O34: oooc:=SUM([.O28:.O33]) -> 11494 | P34: oooc:=SUM([.P28:.P33]) -> 7060
N35: QHCC | O35: 11496 | P35: 7067
N36: Diff | O36: oooc:=[.O34]-[.O35] -> -2 | P36: oooc:=[.P34]-[.P35] -> -7
B38: Month | C38: General | D38: Income | E38: Expense
B39: oooc:=[Income.A4] -> 2007-01-31 | C39: oooc:=[.C4] -> 2838 | D39: oooc:=IF([$Income.C4] > 0;[$Income.C4];"") -> 7161 | E39: oooc:=IF([$Expense.C4] > 0;[$Expense.C4];"") -> 7724
B40: oooc:=[Income.A5] -> 2007-02-28 | C40: oooc:=[.C5] -> 1339 | D40: oooc:=IF([$Income.C5] > 0;[$Income.C5];"") -> 5396 | E40: oooc:=IF([$Expense.C5] > 0;[$Expense.C5];"") -> 6895
B41: oooc:=[Income.A6] -> 2007-03-31 | C41: oooc:=[.C6] -> 1300 | D41: oooc:=IF([$Income.C6] > 0;[$Income.C6];"") -> 7769 | E41: oooc:=IF([$Expense.C6] > 0;[$Expense.C6];"") -> 7808
B42: oooc:=[Income.A7] -> 2007-04-30 | C42: oooc:=[.C7] -> 2150 | D42: oooc:=IF([$Income.C7] > 0;[$Income.C7];"") -> 7419 | E42: oooc:=IF([$Expense.C7] > 0;[$Expense.C7];"") -> 6569
B43: oooc:=[Income.A8] -> 2007-05-31 | C43: oooc:=[.C8] -> 5861 | D43: oooc:=IF([$Income.C8] > 0;[$Income.C8];"") -> 9858 | E43: oooc:=IF([$Expense.C8] > 0;[$Expense.C8];"") -> 6147
B44: oooc:=[Income.A9] -> 2007-06-30 | C44: oooc:=[.C9] -> 5128 | D44: oooc:=IF([$Income.C9] > 0;[$Income.C9];"") -> 5266 | E44: oooc:=IF([$Expense.C9] > 0;[$Expense.C9];"") -> 5999
B45: oooc:=[Income.A10] -> 2007-07-31 | C45: oooc:=[.C10] -> 1656 | D45: oooc:=IF([$Income.C10] > 0;[$Income.C10];"") -> 4755 | E45: oooc:=IF([$Expense.C10] > 0;[$Expense.C10];"") -> 8227
B46: oooc:=[Income.A11] -> 2007-08-31 | C46: oooc:=[.C11] -> 205 | D46: oooc:=IF([$Income.C11] > 0;[$Income.C11];"") -> 4925 | E46: oooc:=IF([$Expense.C11] > 0;[$Expense.C11];"") -> 6376
B47: oooc:=[Income.A12] -> 2007-09-30 | C47: oooc:=[.C12] -> 939 | D47: oooc:=IF([$Income.C12] > 0;[$Income.C12];"") -> 8000 | E47: oooc:=IF([$Expense.C12] > 0;[$Expense.C12];"") -> 7266
B48: oooc:=[Income.A13] -> 2007-10-31 | C48: oooc:=[.C13] -> 1234 | D48: oooc:=IF([$Income.C13] > 0;[$Income.C13];"") -> 7526 | E48: oooc:=IF([$Expense.C13] > 0;[$Expense.C13];"") -> 7231
B49: oooc:=[Income.A14] -> 2007-11-30 | C49: oooc:=[.C14] ->  | D49: oooc:=IF([$Income.C14] > 0;[$Income.C14];"") ->  | E49: oooc:=IF([$Expense.C14] > 0;[$Expense.C14];"") -> 
B50: oooc:=[Income.A15] -> 2007-12-31 | C50: oooc:=[.C15] ->  | D50: oooc:=IF([$Income.C15] > 0;[$Income.C15];"") ->  | E50: oooc:=IF([$Expense.C15] > 0;[$Expense.C15];"") -> 

Sheet: Income
A1: QHCC Income 2007
A2: Date | B2: QHCC Account | C2: General | D2: Parsonage | E2: Deacon | F2: Restore | G2: Pastor Retirement | H2: DSL | I2: Temporary | J2: Total | K2: Diff
A4: 2007-01-31 | B4: 7498 | C4: 7161 | D4: 0 | E4: 29 | F4: 0 | G4: 300 | H4: 0 | I4: 0 | J4: oooc:=SUM([.C4:.I4]) -> 7490 | K4: oooc:=[.J4]-[.B4] -> -8
A5: 2007-02-28 | B5: 5903 | C5: 5396 | D5: 0 | E5: 200 | F5: 0 | G5: 300 | H5: 0 | I5: 8 | J5: oooc:=SUM([.C5:.I5]) -> 5904 | K5: oooc:=[.J5]-[.B5] -> 1
A6: 2007-03-31 | B6: 8723 | C6: 7769 | G6: 300 | H6: 650 | J6: oooc:=SUM([.C6:.I6]) -> 8719 | K6: oooc:=[.J6]-[.B6] -> -4
A7: 2007-04-30 | B7: 8244 | C7: 7419 | E7: 127 | G7: 375 | I7: 306 | J7: oooc:=SUM([.C7:.I7]) -> 8227 | K7: oooc:=[.J7]-[.B7] -> -17
A8: 2007-05-31 | B8: 12762 | C8: 9858 | E8: 77 | G8: 320 | I8: 2500 | J8: oooc:=SUM([.C8:.I8]) -> 12755 | K8: oooc:=[.J8]-[.B8] -> -7
A9: 2007-06-30 | B9: 9297 | C9: 5266 | G9: 320 | I9: 3710 | J9: oooc:=SUM([.C9:.I9]) -> 9296 | K9: oooc:=[.J9]-[.B9] -> -1
A10: 2007-07-31 | B10: 5469 | C10: 4755 | E10: 78 | G10: 400 | I10: 235 | J10: oooc:=SUM([.C10:.I10]) -> 5468 | K10: oooc:=[.J10]-[.B10] -> -1
A11: 2007-08-31 | B11: 6315 | C11: 4925 | G11: 320 | I11: 1070 | J11: oooc:=SUM([.C11:.I11]) -> 6315 | K11: oooc:=[.J11]-[.B11] -> 0
A12: 2007-09-30 | B12: 11349 | C12: 8000 | E12: 73 | G12: 400 | I12: 2872 | J12: oooc:=SUM([.C12:.I12]) -> 11345 | K12: oooc:=[.J12]-[.B12] -> -4
A13: 2007-10-31 | B13: 8211 | C13: 7526 | E13: 46 | G13: 320 | I13: 137 | J13: oooc:=SUM([.C13:.I13]) -> 8029 | K13: oooc:=[.J13]-[.B13] -> -182
A14: 2007-11-30 | J14: oooc:=SUM([.C14:.I14]) -> 0 | K14: oooc:=[.J14]-[.B14] -> 0
A15: 2007-12-31 | J15: oooc:=SUM([.C15:.I15]) -> 0 | K15: oooc:=[.J15]-[.B15] -> 0
A16: Total for Year | B16: oooc:=SUM([.B4:.B15]) -> 83771 | C16: oooc:=SUM([.C4:.C15]) -> 68075 | D16: oooc:=SUM([.D4:.D15]) -> 0 | E16: oooc:=SUM([.E4:.E15]) -> 630 | F16: oooc:=SUM([.F4:.F15]) -> 0 | G16: oooc:=SUM([.G4:.G15]) -> 3355 | H16: oooc:=SUM([.H4:.H15]) -> 650 | I16: oooc:=SUM([.I4:.I15]) -> 10838 | J16: oooc:=SUM([.J4:.J15]) -> 83548 | K16: oooc:=SUM([.K4:.K15]) -> -223
A17: Monthly Average | B17: oooc:=[.B16]/[.$B$23] -> 3810.07753850478 | C17: oooc:=[.C16]/[.$B$23] -> 3096.19114530939 | D17: oooc:=[.D16]/[.$B$23] -> 0 | E17: oooc:=[.E16]/[.$B$23] -> 28.6536969745856 | F17: oooc:=[.F16]/[.$B$23] -> 0 | G17: oooc:=[.G16]/[.$B$23] -> 152.592306904341 | H17: oooc:=[.H16]/[.$B$23] -> 29.563338148382 | I17: oooc:=[.I16]/[.$B$23] -> 492.934552080252 | J17: oooc:=[.J16]/[.$B$23] -> 3799.93503941695 | K17: oooc:=[.K16]/[.$B$23] -> -10.1424990878295
A18: Weekly Average | B18: oooc:=[.B16]/[.$B$22] -> 876.23959817769 | C18: oooc:=[.C16]/[.$B$22] -> 712.060386600927 | D18: oooc:=[.D16]/[.$B$22] -> 0 | E18: oooc:=[.E16]/[.$B$22] -> 6.58976193255357 | F18: oooc:=[.F16]/[.$B$22] -> 0 | G18: oooc:=[.G16]/[.$B$22] -> 35.0930972757416 | H18: oooc:=[.H16]/[.$B$22] -> 6.7989607240632 | I18: oooc:=[.I16]/[.$B$22] -> 113.364825119072 | J18: oooc:=[.J16]/[.$B$22] -> 873.907031652358 | K18: oooc:=[.K16]/[.$B$22] -> -2.33256652533245 | M18: 1608
M19: 774.71
A20: Today | B20: oooc:=NOW() -> 2007-10-31T05:16:41.7 | M20: 1834.54
A21: Day | B21: oooc:=[.B20]-DATE(2005;12;31) -> 669.21992708333 | M21: 2903
A22: Week | B22: oooc:=[.B21]/7 -> 95.60284672619 | M22: oooc:=SUM([.M18:.M21]) -> 7120.25
A23: Month | B23: oooc:=[.B21]/365.25*12 -> 21.986691649555 | M23: 375
M24: oooc:=SUM([.M22:.M23]) -> 7495.25
L25: 7513
L26: oooc:=[.L25]-[.M24] -> 17.75

Sheet: Expense
A1: QHCC Expenses FY 2007
A2: Date | B2: QHCC Account | C2: General | D2: Parsonage | E2: Deacon | F2: Restore | G2: Pastor Retirement | H2: DSL | I2: Temporary | J2: Total | K2: Diff
A4: 2007-01-31 | B4: 8316 | C4: 7724 | D4: 0 | E4: 0 | F4: 0 | G4: 300 | H4: 60 | I4: 224 | J4: oooc:=SUM([.C4:.I4]) -> 8308 | K4: oooc:=[.J4]-[.B4] -> -8
A5: 2007-02-28 | B5: 7155 | C5: 6895 | D5: 0 | E5: 200 | F5: 0 | G5: 0 | H5: 60 | I5: 0 | J5: oooc:=SUM([.C5:.I5]) -> 7155 | K5: oooc:=[.J5]-[.B5] -> 0
A6: 2007-03-31 | B6: 8667 | C6: 7808 | D6: 195 | G6: 600 | H6: 60 | J6: oooc:=SUM([.C6:.I6]) -> 8663 | K6: oooc:=[.J6]-[.B6] -> -4
A7: 2007-04-30 | B7: 8101 | C7: 6569 | G7: 1300 | H7: 60 | I7: 154 | J7: oooc:=SUM([.C7:.I7]) -> 8083 | K7: oooc:=[.J7]-[.B7] -> -18
A8: 2007-05-31 | B8: 6534 | C8: 6147 | G8: 320 | H8: 60 | J8: oooc:=SUM([.C8:.I8]) -> 6527 | K8: oooc:=[.J8]-[.B8] -> -7
A9: 2007-06-30 | B9: 6380 | C9: 5999 | G9: 320 | H9: 60 | J9: oooc:=SUM([.C9:.I9]) -> 6379 | K9: oooc:=[.J9]-[.B9] -> -1
A10: 2007-07-31 | B10: 8688 | C10: 8227 | G10: 400 | H10: 60 | J10: oooc:=SUM([.C10:.I10]) -> 8687 | K10: oooc:=[.J10]-[.B10] -> -1
A11: 2007-08-31 | B11: 7926 | C11: 6376 | D11: 1170 | G11: 320 | H11: 60 | J11: oooc:=SUM([.C11:.I11]) -> 7926 | K11: oooc:=[.J11]-[.B11] -> 0
A12: 2007-09-30 | B12: 8472 | C12: 7266 | F12: 742 | G12: 400 | H12: 60 | J12: oooc:=SUM([.C12:.I12]) -> 8468 | K12: oooc:=[.J12]-[.B12] -> -4
A13: 2007-10-31 | B13: 18317 | C13: 7231 | G13: 320 | H13: 60 | I13: 10524 | J13: oooc:=SUM([.C13:.I13]) -> 18135 | K13: oooc:=[.J13]-[.B13] -> -182
A14: 2007-11-30 | J14: oooc:=SUM([.C14:.I14]) -> 0 | K14: oooc:=[.J14]-[.B14] -> 0
A15: 2007-12-31 | J15: oooc:=SUM([.C15:.I15]) -> 0 | K15: oooc:=[.J15]-[.B15] -> 0
A16: Total for Year | B16: oooc:=SUM([.B4:.B15]) -> 88556 | C16: oooc:=SUM([.C4:.C15]) -> 70242 | D16: oooc:=SUM([.D4:.D15]) -> 1365 | E16: oooc:=SUM([.E4:.E15]) -> 200 | F16: oooc:=SUM([.F4:.F15]) -> 742 | G16: oooc:=SUM([.G4:.G15]) -> 4280 | H16: oooc:=SUM([.H4:.H15]) -> 600 | I16: oooc:=SUM([.I4:.I15]) -> 10902 | J16: oooc:=SUM([.J4:.J15]) -> 88331 | K16: oooc:=SUM([.K4:.K15]) -> -225
A17: Monthly Average | B17: oooc:=[.B16]/[$Income.$B$23] -> 4027.70918933556 | C17: oooc:=[.C16]/[$Income.$B$23] -> 3194.75076649022 | D17: oooc:=[.D16]/[$Income.$B$23] -> 62.0830101116021 | E17: oooc:=[.E16]/[$Income.$B$23] -> 9.09641173796368 | F17: oooc:=[.F16]/[$Income.$B$23] -> 33.7476875478452 | G17: oooc:=[.G16]/[$Income.$B$23] -> 194.663211192423 | H17: oooc:=[.H16]/[$Income.$B$23] -> 27.289235213891 | I17: oooc:=[.I16]/[$Income.$B$23] -> 495.8454038364 | J17: oooc:=[.J16]/[$Income.$B$23] -> 4017.47572613035 | K17: oooc:=[.K16]/[$Income.$B$23] -> -10.2334632052091
A18: Weekly Average | B18: oooc:=[.B16]/[$Income.$B$22] -> 926.290409046371 | C18: oooc:=[.C16]/[$Income.$B$22] -> 734.727075660996 | D18: oooc:=[.D16]/[$Income.$B$22] -> 14.2778175205327 | E18: oooc:=[.E16]/[$Income.$B$22] -> 2.09198791509637 | F18: oooc:=[.F16]/[$Income.$B$22] -> 7.76127516500753 | G18: oooc:=[.G16]/[$Income.$B$22] -> 44.7685413830623 | H18: oooc:=[.H16]/[$Income.$B$22] -> 6.27596374528911 | I18: oooc:=[.I16]/[$Income.$B$22] -> 114.034261251903 | J18: oooc:=[.J16]/[$Income.$B$22] -> 923.936922641887 | K18: oooc:=[.K16]/[$Income.$B$22] -> -2.35348640448342