Sheet: Budget
A1: Budget | B1: 2007 | P1: #Months YTD
P2: oooc:=COUNT([.C6:.N6]) -> 12
C3: Month
A4: CategoryÂ Description | B4: Budget | C4: 2007-01-01 | D4: 2007-02-01 | E4: 2007-03-01 | F4: 2007-04-01 | G4: 2007-05-01 | H4: 2007-06-01 | I4: 2007-07-01 | J4: 2007-08-01 | K4: 2007-09-01 | L4: 2007-10-01 | M4: 2007-11-01 | N4: 2007-12-01 | O4: Total YTD | P4: Budget YTD | Q4: Difference | R4: Annual Budget
A6: General income | B6: oooc:=[.R6]/12 -> 7500 | C6: 7161 | D6: 5396 | E6: 7769 | F6: 7419 | G6: 12358 | H6: 5266 | I6: 4755 | J6: 4925 | K6: 8000 | L6: 7226 | M6: 5890 | N6: 7236 | O6: oooc:=SUM([.C6:.N6]) -> 83401 | P6: oooc:=[.$P$2]/12*[.R6] -> 90000 | Q6: oooc:=[.O6]-[.P6] -> -6599 | R6: 90000
A8: Building
A9: Hazard Insurance | B9: oooc:=[.R9]/12 -> 166.666666666667 | C9: 0 | D9: 0 | I9: 512 | L9: 512 | O9: oooc:=SUM([.C9:.N9]) -> 1024 | P9: oooc:=[.$P$2]/12*[.R9] -> 2000 | Q9: oooc:=[.O9]-[.P9] -> -976 | R9: 2000
A10: Maintenance | B10: oooc:=[.R10]/12 -> 80 | C10: 0 | D10: 0 | I10: 260 | O10: oooc:=SUM([.C10:.N10]) -> 260 | P10: oooc:=[.$P$2]/12*[.R10] -> 960 | Q10: oooc:=[.O10]-[.P10] -> -700 | R10: 960
A11: Mortgage | B11: oooc:=[.R11]/12 -> 1160 | C11: 2275 | D11: 1137 | E11: 1137 | F11: 1137 | G11: 1137 | H11: 1137 | I11: 1137 | J11: 1137 | K11: 1137 | L11: 1137 | N11: 2275 | O11: oooc:=SUM([.C11:.N11]) -> 14783 | P11: oooc:=[.$P$2]/12*[.R11] -> 13920 | Q11: oooc:=[.O11]-[.P11] -> 863 | R11: 13920
A12: Property Tax | B12: oooc:=[.R12]/12 -> 50 | C12: 0 | D12: 0 | E12: 335 | L12: 205 | O12: oooc:=SUM([.C12:.N12]) -> 540 | P12: oooc:=[.$P$2]/12*[.R12] -> 600 | Q12: oooc:=[.O12]-[.P12] -> -60 | R12: 600
A13: Supplies | B13: oooc:=[.R13]/12 -> 30 | C13: 0 | D13: 0 | J13: 90 | O13: oooc:=SUM([.C13:.N13]) -> 90 | P13: oooc:=[.$P$2]/12*[.R13] -> 360 | Q13: oooc:=[.O13]-[.P13] -> -270 | R13: 360
A14: Utilities | B14: oooc:=[.R14]/12 -> 650 | C14: 817 | D14: 569 | E14: 825 | F14: 443 | G14: 611 | H14: 435 | I14: 902 | J14: 444 | K14: 677 | L14: 853 | M14: 672 | N14: 345 | O14: oooc:=SUM([.C14:.N14]) -> 7593 | P14: oooc:=[.$P$2]/12*[.R14] -> 7800 | Q14: oooc:=[.O14]-[.P14] -> -207 | R14: 7800
A15: TOTAL Building | B15: oooc:=SUM([.B9:.B14]) -> 2136.66666666667 | C15: oooc:=SUM([.C9:.C14]) -> 3092 | D15: oooc:=SUM([.D9:.D14]) -> 1706 | E15: oooc:=SUM([.E9:.E14]) -> 2297 | F15: oooc:=SUM([.F9:.F14]) -> 1580 | G15: oooc:=SUM([.G9:.G14]) -> 1748 | H15: oooc:=SUM([.H9:.H14]) -> 1572 | I15: oooc:=SUM([.I9:.I14]) -> 2811 | J15: oooc:=SUM([.J9:.J14]) -> 1671 | K15: oooc:=SUM([.K9:.K14]) -> 1814 | L15: oooc:=SUM([.L9:.L14]) -> 2707 | M15: oooc:=SUM([.M9:.M14]) -> 672 | N15: oooc:=SUM([.N9:.N14]) -> 2620 | O15: oooc:=SUM([.C15:.N15]) -> 24290 | P15: oooc:=[.$P$2]/12*[.R15] -> 25640 | Q15: oooc:=[.O15]-[.P15] -> -1350 | R15: oooc:=SUM([.R8:.R14]) -> 25640
A17: Business Expenses
A18: Worker's Comp | B18: oooc:=[.R18]/12 -> 50 | D18: 564 | O18: oooc:=SUM([.C18:.N18]) -> 564 | P18: oooc:=[.$P$2]/12*[.R18] -> 600 | Q18: oooc:=[.O18]-[.P18] -> -36 | R18: 600
A19: Office | C19: 30 | D19: 0 | F19: 8 | G19: 4 | I19: 7 | L19: 80 | O19: oooc:=SUM([.C19:.N19]) -> 129 | P19: oooc:=[.$P$2]/12*[.R19] -> 600 | Q19: oooc:=[.O19]-[.P19] -> -471 | R19: 600
A20: Telephone | B20: oooc:=[.R20]/12 -> 100 | C20: 117 | D20: 89 | E20: 101 | F20: 95 | G20: 99 | H20: 96 | I20: 97 | J20: 95 | K20: 99 | L20: 98 | M20: 97 | N20: 95 | O20: oooc:=SUM([.C20:.N20]) -> 1178 | P20: oooc:=[.$P$2]/12*[.R20] -> 1200 | Q20: oooc:=[.O20]-[.P20] -> -22 | R20: 1200
A21: TOTAL Business Expenses | B21: oooc:=SUM([.B18:.B20]) -> 150 | C21: oooc:=SUM([.C18:.C20]) -> 147 | D21: oooc:=SUM([.D18:.D20]) -> 653 | E21: oooc:=SUM([.E18:.E20]) -> 101 | F21: oooc:=SUM([.F18:.F20]) -> 103 | G21: oooc:=SUM([.G18:.G20]) -> 103 | H21: oooc:=SUM([.H18:.H20]) -> 96 | I21: oooc:=SUM([.I18:.I20]) -> 104 | J21: oooc:=SUM([.J18:.J20]) -> 95 | K21: oooc:=SUM([.K18:.K20]) -> 99 | L21: oooc:=SUM([.L18:.L20]) -> 178 | M21: oooc:=SUM([.M18:.M20]) -> 97 | N21: oooc:=SUM([.N18:.N20]) -> 95 | O21: oooc:=SUM([.C21:.N21]) -> 1871 | P21: oooc:=[.$P$2]/12*[.R21] -> 2400 | Q21: oooc:=[.O21]-[.P21] -> -529 | R21: oooc:=SUM([.R17:.R20]) -> 2400
A23: Ministry
A24: Adult | B24: oooc:=[.R24]/12 -> 10 | O24: oooc:=SUM([.C24:.N24]) -> 0 | P24: oooc:=[.$P$2]/12*[.R24] -> 120 | Q24: oooc:=[.O24]-[.P24] -> -120 | R24: 120
A25: Children | B25: oooc:=[.R25]/12 -> 10 | O25: oooc:=SUM([.C25:.N25]) -> 0 | P25: oooc:=[.$P$2]/12*[.R25] -> 120 | Q25: oooc:=[.O25]-[.P25] -> -120 | R25: 120
A26: Fellowship | B26: oooc:=[.R26]/12 -> 30 | O26: oooc:=SUM([.C26:.N26]) -> 0 | P26: oooc:=[.$P$2]/12*[.R26] -> 360 | Q26: oooc:=[.O26]-[.P26] -> -360 | R26: 360
A27: Missions | B27: oooc:=[.R27]/12 -> 80 | C27: 100 | D27: 72 | E27: 60 | F27: 80 | G27: 80 | H27: 124 | I27: 54 | J27: 48 | K27: 50 | L27: 80 | M27: 76 | N27: 60 | O27: oooc:=SUM([.C27:.N27]) -> 884 | P27: oooc:=[.$P$2]/12*[.R27] -> 960 | Q27: oooc:=[.O27]-[.P27] -> -76 | R27: 960
A28: Outreach | B28: oooc:=[.R28]/12 -> 50 | C28: 18 | D28: 18 | E28: 18 | F28: 18 | G28: 18 | H28: 18 | I28: 18 | J28: 18 | K28: 18 | L28: 18 | M28: 18 | N28: 18 | O28: oooc:=SUM([.C28:.N28]) -> 216 | P28: oooc:=[.$P$2]/12*[.R28] -> 600 | Q28: oooc:=[.O28]-[.P28] -> -384 | R28: 600
A29: Christian Education | B29: oooc:=[.R29]/12 -> 20 | D29: 142 | I29: 69 | J29: 69 | O29: oooc:=SUM([.C29:.N29]) -> 280 | P29: oooc:=[.$P$2]/12*[.R29] -> 240 | Q29: oooc:=[.O29]-[.P29] -> 40 | R29: 240
A30: Worship | B30: oooc:=[.R30]/12 -> 30 | E30: 101 | O30: oooc:=SUM([.C30:.N30]) -> 101 | P30: oooc:=[.$P$2]/12*[.R30] -> 360 | Q30: oooc:=[.O30]-[.P30] -> -259 | R30: 360
A31: Youth | B31: oooc:=[.R31]/12 -> 10 | O31: oooc:=SUM([.C31:.N31]) -> 0 | P31: oooc:=[.$P$2]/12*[.R31] -> 120 | Q31: oooc:=[.O31]-[.P31] -> -120 | R31: 120
A32: TOTAL Ministry | B32: oooc:=SUM([.B24:.B31]) -> 240 | C32: oooc:=SUM([.C24:.C31]) -> 118 | D32: oooc:=SUM([.D24:.D31]) -> 232 | E32: oooc:=SUM([.E24:.E31]) -> 179 | F32: oooc:=SUM([.F24:.F31]) -> 98 | G32: oooc:=SUM([.G24:.G31]) -> 98 | H32: oooc:=SUM([.H24:.H31]) -> 142 | I32: oooc:=SUM([.I24:.I31]) -> 141 | J32: oooc:=SUM([.J24:.J31]) -> 135 | K32: oooc:=SUM([.K24:.K31]) -> 68 | L32: oooc:=SUM([.L24:.L31]) -> 98 | M32: oooc:=SUM([.M24:.M31]) -> 94 | N32: oooc:=SUM([.N24:.N31]) -> 78 | O32: oooc:=SUM([.C32:.N32]) -> 1481 | P32: oooc:=[.$P$2]/12*[.R32] -> 2880 | Q32: oooc:=[.O32]-[.P32] -> -1399 | R32: oooc:=SUM([.R23:.R31]) -> 2880
A34: Parsonage
A35: Maintenance | B35: oooc:=[.R35]/12 -> 100 | O35: oooc:=SUM([.C35:.N35]) -> 0 | P35: oooc:=[.$P$2]/12*[.R35] -> 1200 | Q35: oooc:=[.O35]-[.P35] -> -1200 | R35: 1200
A36: Mortgage | B36: oooc:=[.R36]/12 -> 570 | C36: 565 | D36: 565 | E36: 565 | F36: 565 | G36: 565 | H36: 565 | I36: 565 | J36: 565 | K36: 565 | L36: 599 | M36: 531 | N36: 565 | O36: oooc:=SUM([.C36:.N36]) -> 6780 | P36: oooc:=[.$P$2]/12*[.R36] -> 6840 | Q36: oooc:=[.O36]-[.P36] -> -60 | R36: 6840
A37: Property Tax | B37: oooc:=[.R37]/12 -> 250 | C37: 0 | E37: 1078 | M37: 1106 | O37: oooc:=SUM([.C37:.N37]) -> 2184 | P37: oooc:=[.$P$2]/12*[.R37] -> 3000 | Q37: oooc:=[.O37]-[.P37] -> -816 | R37: 3000
A38: Utilities | B38: oooc:=[.R38]/12 -> 300 | C38: 375 | D38: 438 | E38: 287 | F38: 287 | G38: 333 | H38: 324 | I38: 606 | J38: 609 | K38: 720 | L38: 348 | M38: 196 | N38: 267 | O38: oooc:=SUM([.C38:.N38]) -> 4790 | P38: oooc:=[.$P$2]/12*[.R38] -> 3600 | Q38: oooc:=[.O38]-[.P38] -> 1190 | R38: 3600
A39: TOTAL Parsonage | B39: oooc:=SUM([.B35:.B38]) -> 1220 | C39: oooc:=SUM([.C35:.C38]) -> 940 | D39: oooc:=SUM([.D35:.D38]) -> 1003 | E39: oooc:=SUM([.E35:.E38]) -> 1930 | F39: oooc:=SUM([.F35:.F38]) -> 852 | G39: oooc:=SUM([.G35:.G38]) -> 898 | H39: oooc:=SUM([.H35:.H38]) -> 889 | I39: oooc:=SUM([.I35:.I38]) -> 1171 | J39: oooc:=SUM([.J35:.J38]) -> 1174 | K39: oooc:=SUM([.K35:.K38]) -> 1285 | L39: oooc:=SUM([.L35:.L38]) -> 947 | M39: oooc:=SUM([.M35:.M38]) -> 1833 | N39: oooc:=SUM([.N35:.N38]) -> 832 | O39: oooc:=SUM([.C39:.N39]) -> 13754 | P39: oooc:=[.$P$2]/12*[.R39] -> 14640 | Q39: oooc:=[.O39]-[.P39] -> -886 | R39: oooc:=SUM([.R34:.R38]) -> 14640
A41: Pastor
A42: Business Expenses | B42: oooc:=[.R42]/12 -> 500 | C42: 500 | D42: 500 | E42: 500 | F42: 500 | G42: 500 | H42: 500 | I42: 500 | J42: 500 | K42: 500 | L42: 500 | M42: 500 | N42: 500 | O42: oooc:=SUM([.C42:.N42]) -> 6000 | P42: oooc:=[.$P$2]/12*[.R42] -> 6000 | Q42: oooc:=[.O42]-[.P42] -> 0 | R42: 6000
A43: Honorarium | B43: oooc:=[.R43]/12 -> 2950 | C43: 2800 | D43: 2800 | E43: 2800 | F43: 3500 | G43: 2800 | H43: 2800 | I43: 3500 | J43: 2800 | K43: 3500 | L43: 2800 | M43: 2800 | N43: 3500 | O43: oooc:=SUM([.C43:.N43]) -> 36400 | P43: oooc:=[.$P$2]/12*[.R43] -> 35400 | Q43: oooc:=[.O43]-[.P43] -> 1000 | R43: 35400
A44: TOTAL Pastor | B44: oooc:=SUM([.B42:.B43]) -> 3450 | C44: oooc:=SUM([.C42:.C43]) -> 3300 | D44: oooc:=SUM([.D42:.D43]) -> 3300 | E44: oooc:=SUM([.E42:.E43]) -> 3300 | F44: oooc:=SUM([.F42:.F43]) -> 4000 | G44: oooc:=SUM([.G42:.G43]) -> 3300 | H44: oooc:=SUM([.H42:.H43]) -> 3300 | I44: oooc:=SUM([.I42:.I43]) -> 4000 | J44: oooc:=SUM([.J42:.J43]) -> 3300 | K44: oooc:=SUM([.K42:.K43]) -> 4000 | L44: oooc:=SUM([.L42:.L43]) -> 3300 | M44: oooc:=SUM([.M42:.M43]) -> 3300 | N44: oooc:=SUM([.N42:.N43]) -> 4000 | O44: oooc:=SUM([.C44:.N44]) -> 42400 | P44: oooc:=[.$P$2]/12*[.R44] -> 41400 | Q44: oooc:=[.O44]-[.P44] -> 1000 | R44: oooc:=SUM([.R41:.R43]) -> 41400
A46: TOTAL EXPENSES | B46: oooc:=[.B15]+[.B21]+[.B32]+[.B39]+[.B44] -> 7196.66666666667 | C46: oooc:=[.C15]+[.C21]+[.C32]+[.C39]+[.C44] -> 7597 | D46: oooc:=[.D15]+[.D21]+[.D32]+[.D39]+[.D44] -> 6894 | E46: oooc:=[.E15]+[.E21]+[.E32]+[.E39]+[.E44] -> 7807 | F46: oooc:=[.F15]+[.F21]+[.F32]+[.F39]+[.F44] -> 6633 | G46: oooc:=[.G15]+[.G21]+[.G32]+[.G39]+[.G44] -> 6147 | H46: oooc:=[.H15]+[.H21]+[.H32]+[.H39]+[.H44] -> 5999 | I46: oooc:=[.I15]+[.I21]+[.I32]+[.I39]+[.I44] -> 8227 | J46: oooc:=[.J15]+[.J21]+[.J32]+[.J39]+[.J44] -> 6375 | K46: oooc:=[.K15]+[.K21]+[.K32]+[.K39]+[.K44] -> 7266 | L46: oooc:=[.L15]+[.L21]+[.L32]+[.L39]+[.L44] -> 7230 | M46: oooc:=[.M15]+[.M21]+[.M32]+[.M39]+[.M44] -> 5996 | N46: oooc:=[.N15]+[.N21]+[.N32]+[.N39]+[.N44] -> 7625 | O46: oooc:=[.O15]+[.O21]+[.O32]+[.O39]+[.O44] -> 83796 | P46: oooc:=[.$P$2]/12*[.R46] -> 86960 | Q46: oooc:=[.O46]-[.P46] -> -3164 | R46: oooc:=[.R15]+[.R21]+[.R32]+[.R39]+[.R44] -> 86960
A48: OVERALL TOTAL | B48: oooc:=[.B6]+[.B46] -> 14696.6666666667 | C48: oooc:=[.C6]-[.C46] -> -436 | D48: oooc:=[.D6]-[.D46] -> -1498 | E48: oooc:=[.E6]-[.E46] -> -38 | F48: oooc:=[.F6]-[.F46] -> 786 | G48: oooc:=[.G6]-[.G46] -> 6211 | H48: oooc:=[.H6]-[.H46] -> -733 | I48: oooc:=[.I6]-[.I46] -> -3472 | J48: oooc:=[.J6]-[.J46] -> -1450 | K48: oooc:=[.K6]-[.K46] -> 734 | L48: oooc:=[.L6]-[.L46] -> -4 | M48: oooc:=[.M6]-[.M46] -> -106 | N48: oooc:=[.N6]-[.N46] -> -389 | O48: oooc:=[.O6]-[.O46] -> -395 | P48: oooc:=[.$P$2]/12*[.R48] -> 3040 | Q48: oooc:=[.O48]-[.P48] -> -3435 | R48: oooc:=[.R6]-[.R46] -> 3040
B82: oooc:=[.$O$4] -> Total YTD | C82: oooc:=[.$P$4] -> Budget YTD | F82: oooc:=[.$O$4] -> Total YTD | G82: oooc:=[.$P$4] -> Budget YTD
A83: oooc:=[.$A6] -> General income | B83: oooc:=[.$O$6] -> 83401 | C83: oooc:=[.$P$6] -> 90000 | E83: oooc:=[.$A$8] -> Building | F83: oooc:=[.$O$15] -> 24290 | G83: oooc:=[.$P$15] -> 25640
A84: oooc:=[.$A8] -> Building | B84: oooc:=[.$O$15] -> 24290 | C84: oooc:=[.$P$15] -> 25640 | E84: oooc:=[.$A$17] -> Business Expenses | F84: oooc:=[.$O$21] -> 1871 | G84: oooc:=[.$P$21] -> 2400
A85: oooc:=[.$A17] -> Business Expenses | B85: oooc:=[.$O$21] -> 1871 | C85: oooc:=[.$P$21] -> 2400 | E85: oooc:=[.$A$23] -> Ministry | F85: oooc:=[.$O$32] -> 1481 | G85: oooc:=[.$P$32] -> 2880
A86: oooc:=[.$A23] -> Ministry | B86: oooc:=[.$O$32] -> 1481 | C86: oooc:=[.$P$32] -> 2880 | E86: oooc:=[.$A$34] -> Parsonage | F86: oooc:=[.$O$39] -> 13754 | G86: oooc:=[.$P$39] -> 14640
A87: oooc:=[.$A34] -> Parsonage | B87: oooc:=[.$O$39] -> 13754 | C87: oooc:=[.$P$39] -> 14640 | E87: oooc:=[.$A$41] -> Pastor | F87: oooc:=[.$O$44] -> 42400 | G87: oooc:=[.$P$44] -> 41400
A88: oooc:=[.$A41] -> Pastor | B88: oooc:=[.$O$44] -> 42400 | C88: oooc:=[.$P$44] -> 41400