Sheet: Budget
A1: Budget | B1: 2008 | P1: #Months YTD
P2: of:=COUNT([.C6:.N6]) -> 12
C3: Month
A4: CategoryÂ Description | B4: Budget | C4: of:=DATE([.B1];1;1) -> 2008-01-01 | D4: of:=DATE(YEAR([.C4]);MONTH([.C4])+1;1) -> 2008-02-01 | E4: of:=DATE(YEAR([.D4]);MONTH([.D4])+1;1) -> 2008-03-01 | F4: of:=DATE(YEAR([.E4]);MONTH([.E4])+1;1) -> 2008-04-01 | G4: of:=DATE(YEAR([.F4]);MONTH([.F4])+1;1) -> 2008-05-01 | H4: of:=DATE(YEAR([.G4]);MONTH([.G4])+1;1) -> 2008-06-01 | I4: of:=DATE(YEAR([.H4]);MONTH([.H4])+1;1) -> 2008-07-01 | J4: of:=DATE(YEAR([.I4]);MONTH([.I4])+1;1) -> 2008-08-01 | K4: of:=DATE(YEAR([.J4]);MONTH([.J4])+1;1) -> 2008-09-01 | L4: of:=DATE(YEAR([.K4]);MONTH([.K4])+1;1) -> 2008-10-01 | M4: of:=DATE(YEAR([.L4]);MONTH([.L4])+1;1) -> 2008-11-01 | N4: of:=DATE(YEAR([.M4]);MONTH([.M4])+1;1) -> 2008-12-01 | O4: Total YTD | P4: Budget YTD | Q4: Difference | R4: Actual Budget
A6: General income | B6: of:=[.R6]/12 -> 7298.66666666667 | C6: 7364 | D6: 5688 | E6: 8019 | F6: 5809 | G6: 5677 | H6: 6560 | I6: 5273 | J6: 7133 | K6: 5981 | L6: 6488 | M6: 8882 | N6: 5489 | O6: of:=SUM([.C6:.N6]) -> 78363 | P6: of:=[.$P$2]/12*[.R6] -> 87584 | Q6: of:=[.O6]-[.P6] -> -9221 | R6: of:=[.R46] -> 87584
A8: Building
A9: Hazard Insurance | B9: of:=[.R9]/12 -> 170.666666666667 | C9: 512 | G9: 410 | J9: 520 | K9: 20 | M9: 505 | O9: of:=SUM([.C9:.N9]) -> 1967 | P9: of:=[.$P$2]/12*[.R9] -> 2048 | Q9: of:=[.O9]-[.P9] -> -81 | R9: of:=4*512 -> 2048
A10: Maintenance | B10: of:=[.R10]/12 -> 80 | N10: 160 | O10: of:=SUM([.C10:.N10]) -> 160 | P10: of:=[.$P$2]/12*[.R10] -> 960 | Q10: of:=[.O10]-[.P10] -> -800 | R10: 960
A11: Mortgage | B11: of:=[.R11]/12 -> 1138 | C11: 1137 | D11: 1137 | E11: 1137 | F11: 1137 | G11: 1137 | K11: 1137 | L11: 500 | M11: 650 | N11: 1250 | O11: of:=SUM([.C11:.N11]) -> 9222 | P11: of:=[.$P$2]/12*[.R11] -> 13656 | Q11: of:=[.O11]-[.P11] -> -4434 | R11: of:=1138*12 -> 13656
A12: Property Tax | B12: of:=[.R12]/12 -> 50 | E12: 205 | L12: 327 | O12: of:=SUM([.C12:.N12]) -> 532 | P12: of:=[.$P$2]/12*[.R12] -> 600 | Q12: of:=[.O12]-[.P12] -> -68 | R12: 600
A13: Supplies | B13: of:=[.R13]/12 -> 8.33333333333333 | O13: of:=SUM([.C13:.N13]) -> 0 | P13: of:=[.$P$2]/12*[.R13] -> 100 | Q13: of:=[.O13]-[.P13] -> -100 | R13: 100
A14: Utilities | B14: of:=[.R14]/12 -> 650 | C14: 647 | D14: 400 | E14: 436 | F14: 480 | G14: 467 | H14: 550 | I14: 838 | J14: 812 | K14: 692 | L14: 639 | M14: 485 | N14: 352 | O14: of:=SUM([.C14:.N14]) -> 6798 | P14: of:=[.$P$2]/12*[.R14] -> 7800 | Q14: of:=[.O14]-[.P14] -> -1002 | R14: 7800
A15: TOTAL Building | B15: of:=SUM([.B9:.B14]) -> 2097 | C15: of:=SUM([.C9:.C14]) -> 2296 | D15: of:=SUM([.D9:.D14]) -> 1537 | E15: of:=SUM([.E9:.E14]) -> 1778 | F15: of:=SUM([.F9:.F14]) -> 1617 | G15: of:=SUM([.G9:.G14]) -> 2014 | H15: of:=SUM([.H9:.H14]) -> 550 | I15: of:=SUM([.I9:.I14]) -> 838 | J15: of:=SUM([.J9:.J14]) -> 1332 | K15: of:=SUM([.K9:.K14]) -> 1849 | L15: of:=SUM([.L9:.L14]) -> 1466 | M15: of:=SUM([.M9:.M14]) -> 1640 | N15: of:=SUM([.N9:.N14]) -> 1762 | O15: of:=SUM([.C15:.N15]) -> 18679 | P15: of:=[.$P$2]/12*[.R15] -> 25164 | Q15: of:=[.O15]-[.P15] -> -6485 | R15: of:=SUM([.R8:.R14]) -> 25164
A17: Business Expenses
A18: Worker's Comp | B18: of:=[.R18]/12 -> 50 | D18: 527 | O18: of:=SUM([.C18:.N18]) -> 527 | P18: of:=[.$P$2]/12*[.R18] -> 600 | Q18: of:=[.O18]-[.P18] -> -73 | R18: 600
A19: Office | D19: 38 | F19: 44 | H19: 34 | L19: 40 | O19: of:=SUM([.C19:.N19]) -> 156 | P19: of:=[.$P$2]/12*[.R19] -> 200 | Q19: of:=[.O19]-[.P19] -> -44 | R19: 200
A20: Telephone | B20: of:=[.R20]/12 -> 100 | C20: 94 | D20: 100 | E20: 103 | F20: 99 | G20: 100 | H20: 100 | I20: 99 | J20: 101 | K20: 101 | L20: 101 | M20: 98 | N20: 107 | O20: of:=SUM([.C20:.N20]) -> 1203 | P20: of:=[.$P$2]/12*[.R20] -> 1200 | Q20: of:=[.O20]-[.P20] -> 3 | R20: 1200
A21: TOTAL Business Expenses | B21: of:=SUM([.B18:.B20]) -> 150 | C21: of:=SUM([.C18:.C20]) -> 94 | D21: of:=SUM([.D18:.D20]) -> 665 | E21: of:=SUM([.E18:.E20]) -> 103 | F21: of:=SUM([.F18:.F20]) -> 143 | G21: of:=SUM([.G18:.G20]) -> 100 | H21: of:=SUM([.H18:.H20]) -> 134 | I21: of:=SUM([.I18:.I20]) -> 99 | J21: of:=SUM([.J18:.J20]) -> 101 | K21: of:=SUM([.K18:.K20]) -> 101 | L21: of:=SUM([.L18:.L20]) -> 141 | M21: of:=SUM([.M18:.M20]) -> 98 | N21: of:=SUM([.N18:.N20]) -> 107 | O21: of:=SUM([.C21:.N21]) -> 1886 | P21: of:=[.$P$2]/12*[.R21] -> 2000 | Q21: of:=[.O21]-[.P21] -> -114 | R21: of:=SUM([.R17:.R20]) -> 2000
A23: Ministry
A24: Adult | B24: of:=[.R24]/12 -> 10 | O24: of:=SUM([.C24:.N24]) -> 0 | P24: of:=[.$P$2]/12*[.R24] -> 120 | Q24: of:=[.O24]-[.P24] -> -120 | R24: 120
A25: Children | B25: of:=[.R25]/12 -> 10 | O25: of:=SUM([.C25:.N25]) -> 0 | P25: of:=[.$P$2]/12*[.R25] -> 120 | Q25: of:=[.O25]-[.P25] -> -120 | R25: 120
A26: Fellowship | B26: of:=[.R26]/12 -> 30 | O26: of:=SUM([.C26:.N26]) -> 0 | P26: of:=[.$P$2]/12*[.R26] -> 360 | Q26: of:=[.O26]-[.P26] -> -360 | R26: 360
A27: Missions | B27: of:=[.R27]/12 -> 80 | C27: 72 | D27: 74 | E27: 60 | F27: 80 | G27: 60 | H27: 60 | K27: 192 | L27: 60 | M27: 66 | N27: 90 | O27: of:=SUM([.C27:.N27]) -> 814 | P27: of:=[.$P$2]/12*[.R27] -> 960 | Q27: of:=[.O27]-[.P27] -> -146 | R27: 960
A28: Outreach | B28: of:=[.R28]/12 -> 50 | C28: 17 | D28: 17 | E28: 17 | F28: 17 | G28: 17 | H28: 17 | I28: 17 | K28: 34 | L28: 17 | M28: 17 | N28: 17 | O28: of:=SUM([.C28:.N28]) -> 204 | P28: of:=[.$P$2]/12*[.R28] -> 600 | Q28: of:=[.O28]-[.P28] -> -396 | R28: 600
A29: Christian Education | B29: of:=[.R29]/12 -> 25 | O29: of:=SUM([.C29:.N29]) -> 0 | P29: of:=[.$P$2]/12*[.R29] -> 300 | Q29: of:=[.O29]-[.P29] -> -300 | R29: 300
A30: Worship | B30: of:=[.R30]/12 -> 30 | E30: 101 | O30: of:=SUM([.C30:.N30]) -> 101 | P30: of:=[.$P$2]/12*[.R30] -> 360 | Q30: of:=[.O30]-[.P30] -> -259 | R30: 360
A31: Youth | B31: of:=[.R31]/12 -> 10 | O31: of:=SUM([.C31:.N31]) -> 0 | P31: of:=[.$P$2]/12*[.R31] -> 120 | Q31: of:=[.O31]-[.P31] -> -120 | R31: 120
A32: TOTAL Ministry | B32: of:=SUM([.B24:.B31]) -> 245 | C32: of:=SUM([.C24:.C31]) -> 89 | D32: of:=SUM([.D24:.D31]) -> 91 | E32: of:=SUM([.E24:.E31]) -> 178 | F32: of:=SUM([.F24:.F31]) -> 97 | G32: of:=SUM([.G24:.G31]) -> 77 | H32: of:=SUM([.H24:.H31]) -> 77 | I32: of:=SUM([.I24:.I31]) -> 17 | J32: of:=SUM([.J24:.J31]) -> 0 | K32: of:=SUM([.K24:.K31]) -> 226 | L32: of:=SUM([.L24:.L31]) -> 77 | M32: of:=SUM([.M24:.M31]) -> 83 | N32: of:=SUM([.N24:.N31]) -> 107 | O32: of:=SUM([.C32:.N32]) -> 1119 | P32: of:=[.$P$2]/12*[.R32] -> 2940 | Q32: of:=[.O32]-[.P32] -> -1821 | R32: of:=SUM([.R23:.R31]) -> 2940
A34: Parsonage
A35: Maintenance | B35: of:=[.R35]/12 -> 100 | O35: of:=SUM([.C35:.N35]) -> 0 | P35: of:=[.$P$2]/12*[.R35] -> 1200 | Q35: of:=[.O35]-[.P35] -> -1200 | R35: 1200
A36: Mortgage | B36: of:=[.R36]/12 -> 565 | C36: 565 | D36: 565 | E36: 565 | F36: 565 | G36: 565 | H36: 565 | I36: 565 | J36: 565 | K36: 565 | L36: 565 | M36: 565 | N36: 565 | O36: of:=SUM([.C36:.N36]) -> 6780 | P36: of:=[.$P$2]/12*[.R36] -> 6780 | Q36: of:=[.O36]-[.P36] -> 0 | R36: of:=12*565 -> 6780
A37: Property Tax | B37: of:=[.R37]/12 -> 183.333333333333 | E37: 1106 | L37: 1166 | O37: of:=SUM([.C37:.N37]) -> 2272 | P37: of:=[.$P$2]/12*[.R37] -> 2200 | Q37: of:=[.O37]-[.P37] -> 72 | R37: 2200
A38: Utilities | B38: of:=[.R38]/12 -> 408.333333333333 | C38: 330 | D38: 306 | E38: 393 | F38: 187 | G38: 212 | H38: 225 | I38: 308 | J38: 300 | K38: 521 | L38: 293 | M38: 233 | N38: 283 | O38: of:=SUM([.C38:.N38]) -> 3591 | P38: of:=[.$P$2]/12*[.R38] -> 4900 | Q38: of:=[.O38]-[.P38] -> -1309 | R38: 4900
A39: TOTAL Parsonage | B39: of:=SUM([.B35:.B38]) -> 1256.66666666667 | C39: of:=SUM([.C35:.C38]) -> 895 | D39: of:=SUM([.D35:.D38]) -> 871 | E39: of:=SUM([.E35:.E38]) -> 2064 | F39: of:=SUM([.F35:.F38]) -> 752 | G39: of:=SUM([.G35:.G38]) -> 777 | H39: of:=SUM([.H35:.H38]) -> 790 | I39: of:=SUM([.I35:.I38]) -> 873 | J39: of:=SUM([.J35:.J38]) -> 865 | K39: of:=SUM([.K35:.K38]) -> 1086 | L39: of:=SUM([.L35:.L38]) -> 2024 | M39: of:=SUM([.M35:.M38]) -> 798 | N39: of:=SUM([.N35:.N38]) -> 848 | O39: of:=SUM([.C39:.N39]) -> 12643 | P39: of:=[.$P$2]/12*[.R39] -> 15080 | Q39: of:=[.O39]-[.P39] -> -2437 | R39: of:=SUM([.R34:.R38]) -> 15080
A41: Pastor
A42: Business Expenses | B42: of:=[.R42]/12 -> 500 | C42: 500 | D42: 500 | E42: 500 | F42: 500 | G42: 500 | H42: 500 | I42: 500 | J42: 500 | K42: 500 | L42: 500 | M42: 500 | N42: 500 | O42: of:=SUM([.C42:.N42]) -> 6000 | P42: of:=[.$P$2]/12*[.R42] -> 6000 | Q42: of:=[.O42]-[.P42] -> 0 | R42: 6000
A43: Honorarium | B43: of:=[.R43]/12 -> 3033.33333333333 | C43: 2800 | D43: 2800 | E43: 3500 | F43: 2800 | G43: 2800 | H43: 3500 | I43: 2800 | J43: 3500 | K43: 2800 | L43: 2800 | M43: 3500 | N43: 2800 | O43: of:=SUM([.C43:.N43]) -> 36400 | P43: of:=[.$P$2]/12*[.R43] -> 36400 | Q43: of:=[.O43]-[.P43] -> 0 | R43: of:=52*700 -> 36400
A44: TOTAL Pastor | B44: of:=SUM([.B42:.B43]) -> 3533.33333333333 | C44: of:=SUM([.C42:.C43]) -> 3300 | D44: of:=SUM([.D42:.D43]) -> 3300 | E44: of:=SUM([.E42:.E43]) -> 4000 | F44: of:=SUM([.F42:.F43]) -> 3300 | G44: of:=SUM([.G42:.G43]) -> 3300 | H44: of:=SUM([.H42:.H43]) -> 4000 | I44: of:=SUM([.I42:.I43]) -> 3300 | J44: of:=SUM([.J42:.J43]) -> 4000 | K44: of:=SUM([.K42:.K43]) -> 3300 | L44: of:=SUM([.L42:.L43]) -> 3300 | M44: of:=SUM([.M42:.M43]) -> 4000 | N44: of:=SUM([.N42:.N43]) -> 3300 | O44: of:=SUM([.C44:.N44]) -> 42400 | P44: of:=[.$P$2]/12*[.R44] -> 42400 | Q44: of:=[.O44]-[.P44] -> 0 | R44: of:=SUM([.R41:.R43]) -> 42400
A46: TOTAL EXPENSES | B46: of:=[.B15]+[.B21]+[.B32]+[.B39]+[.B44] -> 7282 | C46: of:=[.C15]+[.C21]+[.C32]+[.C39]+[.C44] -> 6674 | D46: of:=[.D15]+[.D21]+[.D32]+[.D39]+[.D44] -> 6464 | E46: of:=[.E15]+[.E21]+[.E32]+[.E39]+[.E44] -> 8123 | F46: of:=[.F15]+[.F21]+[.F32]+[.F39]+[.F44] -> 5909 | G46: of:=[.G15]+[.G21]+[.G32]+[.G39]+[.G44] -> 6268 | H46: of:=[.H15]+[.H21]+[.H32]+[.H39]+[.H44] -> 5551 | I46: of:=[.I15]+[.I21]+[.I32]+[.I39]+[.I44] -> 5127 | J46: of:=[.J15]+[.J21]+[.J32]+[.J39]+[.J44] -> 6298 | K46: of:=[.K15]+[.K21]+[.K32]+[.K39]+[.K44] -> 6562 | L46: of:=[.L15]+[.L21]+[.L32]+[.L39]+[.L44] -> 7008 | M46: of:=[.M15]+[.M21]+[.M32]+[.M39]+[.M44] -> 6619 | N46: of:=[.N15]+[.N21]+[.N32]+[.N39]+[.N44] -> 6124 | O46: of:=[.O15]+[.O21]+[.O32]+[.O39]+[.O44] -> 76727 | P46: of:=[.$P$2]/12*[.R46] -> 87584 | Q46: of:=[.O46]-[.P46] -> -10857 | R46: of:=[.R15]+[.R21]+[.R32]+[.R39]+[.R44] -> 87584
A48: OVERALL TOTAL | B48: of:=[.B6]+[.B46] -> 14580.6666666667 | C48: of:=[.C6]-[.C46] -> 690 | D48: of:=[.D6]-[.D46] -> -776 | E48: of:=[.E6]-[.E46] -> -104 | F48: of:=[.F6]-[.F46] -> -100 | G48: of:=[.G6]-[.G46] -> -591 | H48: of:=[.H6]-[.H46] -> 1009 | I48: of:=[.I6]-[.I46] -> 146 | J48: of:=[.J6]-[.J46] -> 835 | K48: of:=[.K6]-[.K46] -> -581 | L48: of:=[.L6]-[.L46] -> -520 | M48: of:=[.M6]-[.M46] -> 2263 | N48: of:=[.N6]-[.N46] -> -635 | O48: of:=[.O6]-[.O46] -> 1636 | P48: of:=[.$P$2]/12*[.R48] -> 0 | Q48: of:=[.O48]-[.P48] -> 1636 | R48: of:=[.R6]-[.R46] -> 0
B82: of:=[.$O$4] -> Total YTD | C82: of:=[.$P$4] -> Budget YTD
A83: of:=[.$A$8] -> Building | B83: of:=[.O$15] -> 18679 | C83: of:=[.P$15] -> 25164
A84: of:=[.$A$17] -> Business Expenses | B84: of:=[.O$21] -> 1886 | C84: of:=[.P$21] -> 2000
A85: of:=[.$A$23] -> Ministry | B85: of:=[.O$32] -> 1119 | C85: of:=[.P$32] -> 2940
A86: of:=[.$A$34] -> Parsonage | B86: of:=[.O$39] -> 12643 | C86: of:=[.P$39] -> 15080
A87: of:=[.$A$41] -> Pastor | B87: of:=[.O$44] -> 42400 | C87: of:=[.P$44] -> 42400

Sheet: Holding Account
A1: Category | B1: Amount
A2: Building Property Tax | B2: of:=[Budget.B12] -> 50
A3: Parsonage Property Tax | B3: of:=[Budget.B37] -> 183.333333333333
A4: Hazard Insurance | B4: of:=[Budget.B9] -> 170.666666666667
A5: Workers' Comp | B5: of:=[Budget.B18] -> 50
A6: Building Maintenance
A7: Parsonage Maintenance