Sheet: Balances
A1: QHCC Balances 2008
A2: Date | B2: QHCC Account | C2: General | D2: Parsonage | E2: Deacon | F2: Holding | G2: Youth | H2: DSL | I2: Temporary | J2: Total | K2: Diff | L2: Total Other | M2: General by Diff | N2: Diff | O2: QHCC Acct Rpt | P2: Diff | Q2: General from Rpt | R2: General by Diff | S2: Diff
A3: 2007-12-31 | B3: 3256 | C3: 451 | D3: 2861 | E3: 704.42 | F3: 0 | G3: 75 | H3: -835.470000000001 | I3: 0 | J3: of:=SUM([.C3:.I3]) -> 3255.95 | K3: of:=[.J3]-[.B3] -> -0.0500000000010914 | L3: of:=SUM([.D3:.I3]) -> 2804.95 | M3: of:=IF([.$B3]<>"";[.B3]-[.L3];"") -> 451.050000000001 | N3: of:=IF([.$B4]<>"";[.M3]-[.C3];"") -> 0.0500000000010914 | P3: of:=[.O3]-[.B3] -> -3256 | R3: of:=[.B3]-SUM([.D3:.I3]) -> 451.050000000001 | S3: of:=[.R3]-[.C3] -> 0.0500000000010914
A4: 2008-01-31 | B4: of:=IF([$Income.$B4]>0;[.B3]+[$Income.B4]-[$Expense.B4];"") -> 4007 | C4: of:=IF([$Income.$B4]>0;[.C3]+[$Income.C4]-[$Expense.C4];"") -> 1140 | D4: of:=IF([$Income.$B4]>0;[.D3]+[$Income.D4]-[$Expense.D4];"") -> 2861 | E4: of:=IF([$Income.$B4]>0;[.E3]+[$Income.E4]-[$Expense.E4];"") -> 704.42 | F4: of:=IF([$Income.$B4]>0;[.F3]+[$Income.F4]-[$Expense.F4];"") -> 0 | G4: of:=IF([$Income.$B4]>0;[.G3]+[$Income.G4]-[$Expense.G4];"") -> 75 | H4: of:=IF([$Income.$B4]>0;[.H3]+[$Income.H4]-[$Expense.H4];"") -> -775.470000000001 | I4: of:=IF([$Income.$B4]>0;[.I3]+[$Income.I4]-[$Expense.I4];"") -> 2 | J4: of:=IF([$Income.$B4]>0;SUM([.C4:.I4]);"") -> 4006.95 | K4: of:=IF([$Income.$B4]>0;[.J4]-[.B4];"") -> -0.0500000000010914 | L4: of:=IF([$Income.$B4]>0;SUM([.D4:.I4]);"") -> 2866.95 | M4: of:=IF([.$B4]<>"";[.B4]-[.L4];"") -> 1140.05 | N4: of:=IF([.$B5]<>"";[.M4]-[.C4];"") -> 0.0500000000010914 | P4: of:=IF([$Income.$B4]>0;[.O4]-[.B4];"") -> -4007 | R4: of:=IF([$Income.$B4]>0;[.B4]-SUM([.D4:.I4]);"") -> 1140.05 | S4: of:=IF([$Income.$B4]>0;[.R4]-[.C4];"") -> 0.0500000000010914
A5: 2008-02-28 | B5: of:=IF([$Income.$B5]>0;[.B4]+[$Income.B5]-[$Expense.B5];"") -> 2994 | C5: of:=IF([$Income.$B5]>0;[.C4]+[$Income.C5]-[$Expense.C5];"") -> 364 | D5: of:=IF([$Income.$B5]>0;[.D4]+[$Income.D5]-[$Expense.D5];"") -> 2861 | E5: of:=IF([$Income.$B5]>0;[.E4]+[$Income.E5]-[$Expense.E5];"") -> 374.42 | F5: of:=IF([$Income.$B5]>0;[.F4]+[$Income.F5]-[$Expense.F5];"") -> 0 | G5: of:=IF([$Income.$B5]>0;[.G4]+[$Income.G5]-[$Expense.G5];"") -> 110 | H5: of:=IF([$Income.$B5]>0;[.H4]+[$Income.H5]-[$Expense.H5];"") -> -715.470000000001 | I5: of:=IF([$Income.$B5]>0;[.I4]+[$Income.I5]-[$Expense.I5];"") -> 0 | J5: of:=IF([$Income.$B5]>0;SUM([.C5:.I5]);"") -> 2993.95 | K5: of:=IF([$Income.$B5]>0;[.J5]-[.B5];"") -> -0.0500000000010914 | L5: of:=IF([$Income.$B5]>0;SUM([.D5:.I5]);"") -> 2629.95 | M5: of:=IF([.$B5]<>"";[.B5]-[.L5];"") -> 364.050000000001 | N5: of:=IF([.$B6]<>"";[.M5]-[.C5];"") -> 0.0500000000010914 | P5: of:=IF([$Income.$B5]>0;[.O5]-[.B5];"") -> -2994 | R5: of:=IF([$Income.$B5]>0;[.B5]-SUM([.D5:.I5]);"") -> 364.050000000001 | S5: of:=IF([$Income.$B5]>0;[.R5]-[.C5];"") -> 0.0500000000010914
A6: 2008-03-31 | B6: of:=IF([$Income.$B6]>0;[.B5]+[$Income.B6]-[$Expense.B6];"") -> 2978 | C6: of:=IF([$Income.$B6]>0;[.C5]+[$Income.C6]-[$Expense.C6];"") -> 261 | D6: of:=IF([$Income.$B6]>0;[.D5]+[$Income.D6]-[$Expense.D6];"") -> 2861 | E6: of:=IF([$Income.$B6]>0;[.E5]+[$Income.E6]-[$Expense.E6];"") -> 437.42 | F6: of:=IF([$Income.$B6]>0;[.F5]+[$Income.F6]-[$Expense.F6];"") -> 0 | G6: of:=IF([$Income.$B6]>0;[.G5]+[$Income.G6]-[$Expense.G6];"") -> 74 | H6: of:=IF([$Income.$B6]>0;[.H5]+[$Income.H6]-[$Expense.H6];"") -> -655.470000000001 | I6: of:=IF([$Income.$B6]>0;[.I5]+[$Income.I6]-[$Expense.I6];"") -> 0 | J6: of:=IF([$Income.$B6]>0;SUM([.C6:.I6]);"") -> 2977.95 | K6: of:=IF([$Income.$B6]>0;[.J6]-[.B6];"") -> -0.0500000000010914 | L6: of:=IF([$Income.$B6]>0;SUM([.D6:.I6]);"") -> 2716.95 | M6: of:=IF([.$B6]<>"";[.B6]-[.L6];"") -> 261.050000000001 | N6: of:=IF([.$B7]<>"";[.M6]-[.C6];"") -> 0.0500000000010914 | P6: of:=IF([$Income.$B6]>0;[.O6]-[.B6];"") -> -2978 | R6: of:=IF([$Income.$B6]>0;[.B6]-SUM([.D6:.I6]);"") -> 261.050000000001 | S6: of:=IF([$Income.$B6]>0;[.R6]-[.C6];"") -> 0.0500000000010914
A7: 2008-04-30 | B7: of:=IF([$Income.$B7]>0;[.B6]+[$Income.B7]-[$Expense.B7];"") -> 2916 | C7: of:=IF([$Income.$B7]>0;[.C6]+[$Income.C7]-[$Expense.C7];"") -> 160 | D7: of:=IF([$Income.$B7]>0;[.D6]+[$Income.D7]-[$Expense.D7];"") -> 2861 | E7: of:=IF([$Income.$B7]>0;[.E6]+[$Income.E7]-[$Expense.E7];"") -> 437.42 | F7: of:=IF([$Income.$B7]>0;[.F6]+[$Income.F7]-[$Expense.F7];"") -> 0 | G7: of:=IF([$Income.$B7]>0;[.G6]+[$Income.G7]-[$Expense.G7];"") -> 74 | H7: of:=IF([$Income.$B7]>0;[.H6]+[$Income.H7]-[$Expense.H7];"") -> -615.470000000001 | I7: of:=IF([$Income.$B7]>0;[.I6]+[$Income.I7]-[$Expense.I7];"") -> 0 | J7: of:=IF([$Income.$B7]>0;SUM([.C7:.I7]);"") -> 2916.95 | K7: of:=IF([$Income.$B7]>0;[.J7]-[.B7];"") -> 0.949999999998909 | L7: of:=IF([$Income.$B7]>0;SUM([.D7:.I7]);"") -> 2756.95 | M7: of:=IF([.$B7]<>"";[.B7]-[.L7];"") -> 159.050000000001 | N7: of:=IF([.$B8]<>"";[.M7]-[.C7];"") -> -0.949999999998909 | P7: of:=IF([$Income.$B7]>0;[.O7]-[.B7];"") -> -2916 | R7: of:=IF([$Income.$B7]>0;[.B7]-SUM([.D7:.I7]);"") -> 159.050000000001 | S7: of:=IF([$Income.$B7]>0;[.R7]-[.C7];"") -> -0.949999999998909
A8: 2008-05-31 | B8: of:=IF([$Income.$B8]>0;[.B7]+[$Income.B8]-[$Expense.B8];"") -> 2391 | C8: of:=IF([$Income.$B8]>0;[.C7]+[$Income.C8]-[$Expense.C8];"") -> -432 | D8: of:=IF([$Income.$B8]>0;[.D7]+[$Income.D8]-[$Expense.D8];"") -> 2861 | E8: of:=IF([$Income.$B8]>0;[.E7]+[$Income.E8]-[$Expense.E8];"") -> 468.42 | F8: of:=IF([$Income.$B8]>0;[.F7]+[$Income.F8]-[$Expense.F8];"") -> 0 | G8: of:=IF([$Income.$B8]>0;[.G7]+[$Income.G8]-[$Expense.G8];"") -> 29.94 | H8: of:=IF([$Income.$B8]>0;[.H7]+[$Income.H8]-[$Expense.H8];"") -> -535.470000000001 | I8: of:=IF([$Income.$B8]>0;[.I7]+[$Income.I8]-[$Expense.I8];"") -> 0 | J8: of:=IF([$Income.$B8]>0;SUM([.C8:.I8]);"") -> 2391.89 | K8: of:=IF([$Income.$B8]>0;[.J8]-[.B8];"") -> 0.889999999998963 | L8: of:=IF([$Income.$B8]>0;SUM([.D8:.I8]);"") -> 2823.89 | M8: of:=IF([.$B8]<>"";[.B8]-[.L8];"") -> -432.889999999999 | N8: of:=IF([.$B9]<>"";[.M8]-[.C8];"") -> -0.889999999998963 | P8: of:=IF([$Income.$B8]>0;[.O8]-[.B8];"") -> -2391 | R8: of:=IF([$Income.$B8]>0;[.B8]-SUM([.D8:.I8]);"") -> -432.889999999999 | S8: of:=IF([$Income.$B8]>0;[.R8]-[.C8];"") -> -0.889999999998963
A9: 2008-06-30 | B9: of:=IF([$Income.$B9]>0;[.B8]+[$Income.B9]-[$Expense.B9];"") -> 3927 | C9: of:=IF([$Income.$B9]>0;[.C8]+[$Income.C9]-[$Expense.C9];"") -> 577 | D9: of:=IF([$Income.$B9]>0;[.D8]+[$Income.D9]-[$Expense.D9];"") -> 3161 | E9: of:=IF([$Income.$B9]>0;[.E8]+[$Income.E9]-[$Expense.E9];"") -> 505.42 | F9: of:=IF([$Income.$B9]>0;[.F8]+[$Income.F9]-[$Expense.F9];"") -> 0 | G9: of:=IF([$Income.$B9]>0;[.G8]+[$Income.G9]-[$Expense.G9];"") -> 29.94 | H9: of:=IF([$Income.$B9]>0;[.H8]+[$Income.H9]-[$Expense.H9];"") -> -345.470000000001 | I9: of:=IF([$Income.$B9]>0;[.I8]+[$Income.I9]-[$Expense.I9];"") -> 0 | J9: of:=IF([$Income.$B9]>0;SUM([.C9:.I9]);"") -> 3927.89 | K9: of:=IF([$Income.$B9]>0;[.J9]-[.B9];"") -> 0.889999999998963 | L9: of:=IF([$Income.$B9]>0;SUM([.D9:.I9]);"") -> 3350.89 | M9: of:=IF([.$B9]<>"";[.B9]-[.L9];"") -> 576.110000000001 | N9: of:=IF([.$B10]<>"";[.M9]-[.C9];"") -> -0.889999999998963 | P9: of:=IF([$Income.$B9]>0;[.O9]-[.B9];"") -> -3927 | R9: of:=IF([$Income.$B9]>0;[.B9]-SUM([.D9:.I9]);"") -> 576.110000000001 | S9: of:=IF([$Income.$B9]>0;[.R9]-[.C9];"") -> -0.889999999998963
A10: 2008-07-31 | B10: of:=IF([$Income.$B10]>0;[.B9]+[$Income.B10]-[$Expense.B10];"") -> 4254 | C10: of:=IF([$Income.$B10]>0;[.C9]+[$Income.C10]-[$Expense.C10];"") -> 722 | D10: of:=IF([$Income.$B10]>0;[.D9]+[$Income.D10]-[$Expense.D10];"") -> 3161 | E10: of:=IF([$Income.$B10]>0;[.E9]+[$Income.E10]-[$Expense.E10];"") -> 629.42 | F10: of:=IF([$Income.$B10]>0;[.F9]+[$Income.F10]-[$Expense.F10];"") -> 0 | G10: of:=IF([$Income.$B10]>0;[.G9]+[$Income.G10]-[$Expense.G10];"") -> 146.94 | H10: of:=IF([$Income.$B10]>0;[.H9]+[$Income.H10]-[$Expense.H10];"") -> -405.470000000001 | I10: of:=IF([$Income.$B10]>0;[.I9]+[$Income.I10]-[$Expense.I10];"") -> 0 | J10: of:=IF([$Income.$B10]>0;SUM([.C10:.I10]);"") -> 4253.89 | K10: of:=IF([$Income.$B10]>0;[.J10]-[.B10];"") -> -0.110000000000582 | L10: of:=IF([$Income.$B10]>0;SUM([.D10:.I10]);"") -> 3531.89 | M10: of:=IF([.$B10]<>"";[.B10]-[.L10];"") -> 722.110000000001 | N10: of:=IF([.$B11]<>"";[.M10]-[.C10];"") -> 0.110000000001037 | P10: of:=IF([$Income.$B10]>0;[.O10]-[.B10];"") -> -4254 | R10: of:=IF([$Income.$B10]>0;[.B10]-SUM([.D10:.I10]);"") -> 722.110000000001 | S10: of:=IF([$Income.$B10]>0;[.R10]-[.C10];"") -> 0.110000000001037
A11: 2008-08-31 | B11: of:=IF([$Income.$B11]>0;[.B10]+[$Income.B11]-[$Expense.B11];"") -> 5129 | C11: of:=IF([$Income.$B11]>0;[.C10]+[$Income.C11]-[$Expense.C11];"") -> 1557 | D11: of:=IF([$Income.$B11]>0;[.D10]+[$Income.D11]-[$Expense.D11];"") -> 3161 | E11: of:=IF([$Income.$B11]>0;[.E10]+[$Income.E11]-[$Expense.E11];"") -> 629.42 | F11: of:=IF([$Income.$B11]>0;[.F10]+[$Income.F11]-[$Expense.F11];"") -> 0 | G11: of:=IF([$Income.$B11]>0;[.G10]+[$Income.G11]-[$Expense.G11];"") -> 246.94 | H11: of:=IF([$Income.$B11]>0;[.H10]+[$Income.H11]-[$Expense.H11];"") -> -465.470000000001 | I11: of:=IF([$Income.$B11]>0;[.I10]+[$Income.I11]-[$Expense.I11];"") -> 0 | J11: of:=IF([$Income.$B11]>0;SUM([.C11:.I11]);"") -> 5128.89 | K11: of:=IF([$Income.$B11]>0;[.J11]-[.B11];"") -> -0.110000000000582 | L11: of:=IF([$Income.$B11]>0;SUM([.D11:.I11]);"") -> 3571.89 | M11: of:=IF([.$B11]<>"";[.B11]-[.L11];"") -> 1557.11 | N11: of:=IF([.$B12]<>"";[.M11]-[.C11];"") -> 0.110000000001037 | P11: of:=IF([$Income.$B11]>0;[.O11]-[.B11];"") -> -5129 | R11: of:=IF([$Income.$B11]>0;[.B11]-SUM([.D11:.I11]);"") -> 1557.11 | S11: of:=IF([$Income.$B11]>0;[.R11]-[.C11];"") -> 0.110000000001037
A12: 2008-09-30 | B12: of:=IF([$Income.$B12]>0;[.B11]+[$Income.B12]-[$Expense.B12];"") -> 4726 | C12: of:=IF([$Income.$B12]>0;[.C11]+[$Income.C12]-[$Expense.C12];"") -> 974 | D12: of:=IF([$Income.$B12]>0;[.D11]+[$Income.D12]-[$Expense.D12];"") -> 3161 | E12: of:=IF([$Income.$B12]>0;[.E11]+[$Income.E12]-[$Expense.E12];"") -> 629.42 | F12: of:=IF([$Income.$B12]>0;[.F11]+[$Income.F12]-[$Expense.F12];"") -> 0 | G12: of:=IF([$Income.$B12]>0;[.G11]+[$Income.G12]-[$Expense.G12];"") -> 256.94 | H12: of:=IF([$Income.$B12]>0;[.H11]+[$Income.H12]-[$Expense.H12];"") -> -295.470000000001 | I12: of:=IF([$Income.$B12]>0;[.I11]+[$Income.I12]-[$Expense.I12];"") -> 0 | J12: of:=IF([$Income.$B12]>0;SUM([.C12:.I12]);"") -> 4725.89 | K12: of:=IF([$Income.$B12]>0;[.J12]-[.B12];"") -> -0.110000000000582 | L12: of:=IF([$Income.$B12]>0;SUM([.D12:.I12]);"") -> 3751.89 | M12: of:=IF([.$B12]<>"";[.B12]-[.L12];"") -> 974.110000000001 | N12: of:=IF([.$B13]<>"";[.M12]-[.C12];"") -> 0.110000000001037 | P12: of:=IF([$Income.$B12]>0;[.O12]-[.B12];"") -> -4726 | R12: of:=IF([$Income.$B12]>0;[.B12]-SUM([.D12:.I12]);"") -> 974.110000000001 | S12: of:=IF([$Income.$B12]>0;[.R12]-[.C12];"") -> 0.110000000001037
A13: 2008-10-31 | B13: of:=IF([$Income.$B13]>0;[.B12]+[$Income.B13]-[$Expense.B13];"") -> 3471 | C13: of:=IF([$Income.$B13]>0;[.C12]+[$Income.C13]-[$Expense.C13];"") -> 454 | D13: of:=IF([$Income.$B13]>0;[.D12]+[$Income.D13]-[$Expense.D13];"") -> 2461 | E13: of:=IF([$Income.$B13]>0;[.E12]+[$Income.E13]-[$Expense.E13];"") -> 655.42 | F13: of:=IF([$Income.$B13]>0;[.F12]+[$Income.F13]-[$Expense.F13];"") -> 0 | G13: of:=IF([$Income.$B13]>0;[.G12]+[$Income.G13]-[$Expense.G13];"") -> 256.94 | H13: of:=IF([$Income.$B13]>0;[.H12]+[$Income.H13]-[$Expense.H13];"") -> -355.470000000001 | I13: of:=IF([$Income.$B13]>0;[.I12]+[$Income.I13]-[$Expense.I13];"") -> 0 | J13: of:=IF([$Income.$B13]>0;SUM([.C13:.I13]);"") -> 3471.89 | K13: of:=IF([$Income.$B13]>0;[.J13]-[.B13];"") -> 0.889999999998963 | L13: of:=IF([$Income.$B13]>0;SUM([.D13:.I13]);"") -> 3017.89 | M13: of:=IF([.$B13]<>"";[.B13]-[.L13];"") -> 453.110000000001 | N13: of:=IF([.$B14]<>"";[.M13]-[.C13];"") -> -0.889999999998963 | P13: of:=IF([$Income.$B13]>0;[.O13]-[.B13];"") -> -3471 | R13: of:=IF([$Income.$B13]>0;[.B13]-SUM([.D13:.I13]);"") -> 453.110000000001 | S13: of:=IF([$Income.$B13]>0;[.R13]-[.C13];"") -> -0.889999999998963
A14: 2008-11-30 | B14: of:=IF([$Income.$B14]>0;[.B13]+[$Income.B14]-[$Expense.B14];"") -> 6264 | C14: of:=IF([$Income.$B14]>0;[.C13]+[$Income.C14]-[$Expense.C14];"") -> 2717 | D14: of:=IF([$Income.$B14]>0;[.D13]+[$Income.D14]-[$Expense.D14];"") -> 2461 | E14: of:=IF([$Income.$B14]>0;[.E13]+[$Income.E14]-[$Expense.E14];"") -> 710.42 | F14: of:=IF([$Income.$B14]>0;[.F13]+[$Income.F14]-[$Expense.F14];"") -> 0 | G14: of:=IF([$Income.$B14]>0;[.G13]+[$Income.G14]-[$Expense.G14];"") -> 551.94 | H14: of:=IF([$Income.$B14]>0;[.H13]+[$Income.H14]-[$Expense.H14];"") -> -175.470000000001 | I14: of:=IF([$Income.$B14]>0;[.I13]+[$Income.I14]-[$Expense.I14];"") -> 0 | J14: of:=IF([$Income.$B14]>0;SUM([.C14:.I14]);"") -> 6264.89 | K14: of:=IF([$Income.$B14]>0;[.J14]-[.B14];"") -> 0.889999999999418 | L14: of:=IF([$Income.$B14]>0;SUM([.D14:.I14]);"") -> 3547.89 | M14: of:=IF([.$B14]<>"";[.B14]-[.L14];"") -> 2716.11 | N14: of:=IF([.$B15]<>"";[.M14]-[.C14];"") -> -0.889999999998963 | P14: of:=IF([$Income.$B14]>0;[.O14]-[.B14];"") -> -6264 | R14: of:=IF([$Income.$B14]>0;[.B14]-SUM([.D14:.I14]);"") -> 2716.11 | S14: of:=IF([$Income.$B14]>0;[.R14]-[.C14];"") -> -0.889999999998963
A15: 2008-12-31 | B15: of:=IF([$Income.$B15]>0;[.B14]+[$Income.B15]-[$Expense.B15];"") -> 5532 | C15: of:=IF([$Income.$B15]>0;[.C14]+[$Income.C15]-[$Expense.C15];"") -> 2082 | D15: of:=IF([$Income.$B15]>0;[.D14]+[$Income.D15]-[$Expense.D15];"") -> 2461 | E15: of:=IF([$Income.$B15]>0;[.E14]+[$Income.E15]-[$Expense.E15];"") -> 710.42 | F15: of:=IF([$Income.$B15]>0;[.F14]+[$Income.F15]-[$Expense.F15];"") -> 0 | G15: of:=IF([$Income.$B15]>0;[.G14]+[$Income.G15]-[$Expense.G15];"") -> 513.94 | H15: of:=IF([$Income.$B15]>0;[.H14]+[$Income.H15]-[$Expense.H15];"") -> -235.470000000001 | I15: of:=IF([$Income.$B15]>0;[.I14]+[$Income.I15]-[$Expense.I15];"") -> 0 | J15: of:=IF([$Income.$B15]>0;SUM([.C15:.I15]);"") -> 5531.89 | K15: of:=IF([$Income.$B15]>0;[.J15]-[.B15];"") -> -0.110000000000582 | L15: of:=IF([$Income.$B15]>0;SUM([.D15:.I15]);"") -> 3449.89 | M15: of:=IF([.$B15]<>"";[.B15]-[.L15];"") -> 2082.11 | N15: of:=IF([.$B16]<>"";[.M15]-[.C15];"") ->  | P15: of:=IF([$Income.$B15]>0;[.O15]-[.B15];"") -> -5532 | R15: of:=IF([$Income.$B15]>0;[.B15]-SUM([.D15:.I15]);"") -> 2082.11 | S15: of:=IF([$Income.$B15]>0;[.R15]-[.C15];"") -> 0.110000000001037
N34: Total
N35: QHCC
N36: Diff
B38: Month | C38: Income | D38: Expense | E38: General Fund | F38: Actual Balance | G38: Unpaid Bills | I38: General
B39: of:=[Income.A4] -> 2008-01-31 | C39: of:=IF([$Income.$C4] > 0;[$Income.$C4];"") -> 7364 | D39: of:=IF([$Expense.$C4] > 0;[$Expense.$C4];"") -> 6675 | E39: of:=IF([.G39]>0;[.F39]-[.G39];[.F39]) -> 1140 | F39: of:=[.$C4] -> 1140 | I39: of:=[.$C4] -> 1140
B40: of:=[Income.A5] -> 2008-02-28 | C40: of:=IF([$Income.$C5] > 0;[$Income.$C5];"") -> 5688 | D40: of:=IF([$Expense.$C5] > 0;[$Expense.$C5];"") -> 6464 | E40: of:=IF([.G40]>0;[.F40]-[.G40];[.F40]) -> 364 | F40: of:=[.$C5] -> 364 | I40: of:=[.$C5] -> 364
B41: of:=[Income.A6] -> 2008-03-31 | C41: of:=IF([$Income.$C6] > 0;[$Income.$C6];"") -> 8019 | D41: of:=IF([$Expense.$C6] > 0;[$Expense.$C6];"") -> 8122 | E41: of:=IF([.G41]>0;[.F41]-[.G41];[.F41]) -> 261 | F41: of:=[.$C6] -> 261 | I41: of:=[.$C6] -> 261
B42: of:=[Income.A7] -> 2008-04-30 | C42: of:=IF([$Income.$C7] > 0;[$Income.$C7];"") -> 5809 | D42: of:=IF([$Expense.$C7] > 0;[$Expense.$C7];"") -> 5910 | E42: of:=IF([.G42]>0;[.F42]-[.G42];[.F42]) -> -352 | F42: of:=[.$C7] -> 160 | G42: 512 | I42: of:=[.$C7] -> 160
B43: of:=[Income.A8] -> 2008-05-31 | C43: of:=IF([$Income.$C8] > 0;[$Income.$C8];"") -> 5677 | D43: of:=IF([$Expense.$C8] > 0;[$Expense.$C8];"") -> 6269 | E43: of:=IF([.G43]>0;[.F43]-[.G43];[.F43]) -> -432 | F43: of:=[.$C8] -> -432 | I43: of:=[.$C8] -> -432
B44: of:=[Income.A9] -> 2008-06-30 | C44: of:=IF([$Income.$C9] > 0;[$Income.$C9];"") -> 6560 | D44: of:=IF([$Expense.$C9] > 0;[$Expense.$C9];"") -> 5551 | E44: of:=IF([.G44]>0;[.F44]-[.G44];[.F44]) -> -560 | F44: of:=[.$C9] -> 577 | G44: 1137 | I44: of:=[.$C9] -> 577
B45: of:=[Income.A10] -> 2008-07-31 | C45: of:=IF([$Income.$C10] > 0;[$Income.$C10];"") -> 5273 | D45: of:=IF([$Expense.$C10] > 0;[$Expense.$C10];"") -> 5128 | E45: of:=IF([.G45]>0;[.F45]-[.G45];[.F45]) -> -2398 | F45: of:=[.$C10] -> 722 | G45: 3120 | I45: of:=[.$C10] -> 722
B46: of:=[Income.A11] -> 2008-08-31 | C46: of:=IF([$Income.$C11] > 0;[$Income.$C11];"") -> 7133 | D46: of:=IF([$Expense.$C11] > 0;[$Expense.$C11];"") -> 6298 | E46: of:=IF([.G46]>0;[.F46]-[.G46];[.F46]) -> -2341 | F46: of:=[.$C11] -> 1557 | G46: 3898 | I46: of:=[.$C11] -> 1557
B47: of:=[Income.A12] -> 2008-09-30 | C47: of:=IF([$Income.$C12] > 0;[$Income.$C12];"") -> 5981 | D47: of:=IF([$Expense.$C12] > 0;[$Expense.$C12];"") -> 6564 | E47: of:=IF([.G47]>0;[.F47]-[.G47];[.F47]) -> -2787 | F47: of:=[.$C12] -> 974 | G47: 3761 | I47: of:=[.$C12] -> 974
B48: of:=[Income.A13] -> 2008-10-31 | C48: of:=IF([$Income.$C13] > 0;[$Income.$C13];"") -> 6488 | D48: of:=IF([$Expense.$C13] > 0;[$Expense.$C13];"") -> 7008 | E48: of:=IF([.G48]>0;[.F48]-[.G48];[.F48]) -> -3828 | F48: of:=[.$C13] -> 454 | G48: 4282 | I48: of:=[.$C13] -> 454
B49: of:=[Income.A14] -> 2008-11-30 | C49: of:=IF([$Income.$C14] > 0;[$Income.$C14];"") -> 8882 | D49: of:=IF([$Expense.$C14] > 0;[$Expense.$C14];"") -> 6619 | E49: of:=IF([.G49]>0;[.F49]-[.G49];[.F49]) -> -895 | F49: of:=[.$C14] -> 2717 | G49: 3612 | I49: of:=[.$C14] -> 2717
B50: of:=[Income.A15] -> 2008-12-31 | C50: of:=IF([$Income.$C15] > 0;[$Income.$C15];"") -> 5489 | D50: of:=IF([$Expense.$C15] > 0;[$Expense.$C15];"") -> 6124 | E50: of:=IF([.G50]>0;[.F50]-[.G50];[.F50]) -> 207 | F50: of:=[.$C15] -> 2082 | G50: 1875 | I50: of:=[.$C15] -> 2082

Sheet: Income
A1: QHCC Income 2008
A2: Date | B2: QHCC Account | C2: General | D2: Parsonage | E2: Deacon | F2: Holding | G2: Youth | H2: DSL | I2: Temporary | J2: Total | K2: Diff
A4: 2008-01-31 | B4: 7488 | C4: 7364 | H4: 120 | I4: 2 | J4: of:=SUM([.C4:.I4]) -> 7486 | K4: of:=[.J4]-[.B4] -> -2 | N4: 7364
A5: 2008-02-28 | B5: 5910 | C5: 5688 | G5: 35 | H5: 120 | I5: 66 | J5: of:=SUM([.C5:.I5]) -> 5909 | K5: of:=[.J5]-[.B5] -> -1 | N5: 5688
A6: 2008-03-31 | B6: 8240 | C6: 8019 | E6: 63 | G6: 34 | H6: 120 | J6: of:=SUM([.C6:.I6]) -> 8236 | K6: of:=[.J6]-[.B6] -> -4 | N6: 8019
A7: 2008-04-30 | B7: 5913 | C7: 5809 | H7: 100 | J7: of:=SUM([.C7:.I7]) -> 5909 | K7: of:=[.J7]-[.B7] -> -4 | N7: 5809
A8: 2008-05-31 | B8: 5852 | C8: 5677 | E8: 31 | H8: 140 | J8: of:=SUM([.C8:.I8]) -> 5848 | K8: of:=[.J8]-[.B8] -> -4 | N8: 5677
A9: 2008-06-30 | B9: 7159 | C9: 6560 | D9: 300 | E9: 37 | H9: 250 | J9: of:=SUM([.C9:.I9]) -> 7147 | K9: of:=[.J9]-[.B9] -> -12 | N9: 6560
A10: 2008-07-31 | B10: 5523 | C10: 5273 | E10: 124 | G10: 117 | J10: of:=SUM([.C10:.I10]) -> 5514 | K10: of:=[.J10]-[.B10] -> -9 | N10: 5273
A11: 2008-08-31 | B11: 7235 | C11: 7133 | G11: 100 | J11: of:=SUM([.C11:.I11]) -> 7233 | K11: of:=[.J11]-[.B11] -> -2 | N11: 7133
A12: 2008-09-30 | B12: 6227 | C12: 5981 | G12: 10 | H12: 230 | J12: of:=SUM([.C12:.I12]) -> 6221 | K12: of:=[.J12]-[.B12] -> -6 | N12: of:=SUM([.N4:.N11]) -> 51523
A13: 2008-10-31 | B13: 6567 | C13: 6488 | E13: 26 | J13: of:=SUM([.C13:.I13]) -> 6514 | K13: of:=[.J13]-[.B13] -> -53 | N13: of:=[.N12]/8 -> 6440.375
A14: 2008-11-30 | B14: 9474 | C14: 8882 | E14: 55 | G14: 295 | H14: 240 | J14: of:=SUM([.C14:.I14]) -> 9472 | K14: of:=[.J14]-[.B14] -> -2
A15: 2008-12-31 | B15: 5497 | C15: 5489 | J15: of:=SUM([.C15:.I15]) -> 5489 | K15: of:=[.J15]-[.B15] -> -8
A16: Total for Year | B16: of:=SUM([.B4:.B15]) -> 81085 | C16: of:=SUM([.C4:.C15]) -> 78363 | D16: of:=SUM([.D4:.D15]) -> 300 | E16: of:=SUM([.E4:.E15]) -> 336 | F16: of:=SUM([.F4:.F15]) -> 0 | G16: of:=SUM([.G4:.G15]) -> 591 | H16: of:=SUM([.H4:.H15]) -> 1320 | I16: of:=SUM([.I4:.I15]) -> 68 | J16: of:=SUM([.J4:.J15]) -> 80978 | K16: of:=SUM([.K4:.K15]) -> -107
A17: Monthly Average | B17: of:=[.B16]/[.$B$23] -> 2205.84429473251 | C17: of:=[.C16]/[.$B$23] -> 2131.79473969444 | D17: of:=[.D16]/[.$B$23] -> 8.16122943108778 | E17: of:=[.E16]/[.$B$23] -> 9.14057696281832 | F17: of:=[.F16]/[.$B$23] -> 0 | G17: of:=[.G16]/[.$B$23] -> 16.0776219792429 | H17: of:=[.H16]/[.$B$23] -> 35.9094094967862 | I17: of:=[.I16]/[.$B$23] -> 1.84987867104656 | J17: of:=[.J16]/[.$B$23] -> 2202.93345623542 | K17: of:=[.K16]/[.$B$23] -> -2.91083849708798
A18: Weekly Average | B18: of:=[.B16]/[.$B$22] -> 507.298893244437 | C18: of:=[.C16]/[.$B$22] -> 490.269016110426 | D18: of:=[.D16]/[.$B$22] -> 1.87691518743703 | E18: of:=[.E16]/[.$B$22] -> 2.10214500992947 | F18: of:=[.F16]/[.$B$22] -> 0 | G18: of:=[.G16]/[.$B$22] -> 3.69752291925094 | H18: of:=[.H16]/[.$B$22] -> 8.25842682472291 | I18: of:=[.I16]/[.$B$22] -> 0.425434109152393 | J18: of:=[.J16]/[.$B$22] -> 506.629460160918 | K18: of:=[.K16]/[.$B$22] -> -0.669433083519206
A20: Today | B20: of:=NOW() -> 2009-01-22T20:34:18.8
A21: Day | B21: of:=[.B20]-DATE(2005;12;31) -> 1118.85716203703
A22: Week | B22: of:=[.B21]/7 -> 159.836737433862
A23: Month | B23: of:=[.B21]/365.25*12 -> 36.7591675412578

Sheet: Expense
A1: QHCC Expenses 2008
A2: Date | B2: QHCC Account | C2: General | D2: Parsonage | E2: Deacon | F2: Holding | G2: Youth | H2: DSL | I2: Temporary | J2: Total | K2: Diff
A4: 2008-01-31 | B4: 6737 | C4: 6675 | H4: 60 | J4: of:=SUM([.C4:.I4]) -> 6735 | K4: of:=[.J4]-[.B4] -> -2
A5: 2008-02-28 | B5: 6923 | C5: 6464 | E5: 330 | H5: 60 | I5: 68 | J5: of:=SUM([.C5:.I5]) -> 6922 | K5: of:=[.J5]-[.B5] -> -1
A6: 2008-03-31 | B6: 8256 | C6: 8122 | G6: 70 | H6: 60 | J6: of:=SUM([.C6:.I6]) -> 8252 | K6: of:=[.J6]-[.B6] -> -4
A7: 2008-04-30 | B7: 5975 | C7: 5910 | H7: 60 | J7: of:=SUM([.C7:.I7]) -> 5970 | K7: of:=[.J7]-[.B7] -> -5
A8: 2008-05-31 | B8: 6377 | C8: 6269 | G8: 44.06 | H8: 60 | J8: of:=SUM([.C8:.I8]) -> 6373.06 | K8: of:=[.J8]-[.B8] -> -3.9399999999996
A9: 2008-06-30 | B9: 5623 | C9: 5551 | H9: 60 | J9: of:=SUM([.C9:.I9]) -> 5611 | K9: of:=[.J9]-[.B9] -> -12
A10: 2008-07-31 | B10: 5196 | C10: 5128 | H10: 60 | J10: of:=SUM([.C10:.I10]) -> 5188 | K10: of:=[.J10]-[.B10] -> -8
A11: 2008-08-31 | B11: 6360 | C11: 6298 | H11: 60 | J11: of:=SUM([.C11:.I11]) -> 6358 | K11: of:=[.J11]-[.B11] -> -2
A12: 2008-09-30 | B12: 6630 | C12: 6564 | H12: 60 | J12: of:=SUM([.C12:.I12]) -> 6624 | K12: of:=[.J12]-[.B12] -> -6
A13: 2008-10-31 | B13: 7822 | C13: 7008 | D13: 700 | H13: 60 | J13: of:=SUM([.C13:.I13]) -> 7768 | K13: of:=[.J13]-[.B13] -> -54
A14: 2008-11-30 | B14: 6681 | C14: 6619 | H14: 60 | J14: of:=SUM([.C14:.I14]) -> 6679 | K14: of:=[.J14]-[.B14] -> -2
A15: 2008-12-31 | B15: 6229 | C15: 6124 | G15: 38 | H15: 60 | J15: of:=SUM([.C15:.I15]) -> 6222 | K15: of:=[.J15]-[.B15] -> -7
A16: Total for Year | B16: of:=SUM([.B4:.B15]) -> 78809 | C16: of:=SUM([.C4:.C15]) -> 76732 | D16: of:=SUM([.D4:.D15]) -> 700 | E16: of:=SUM([.E4:.E15]) -> 330 | F16: of:=SUM([.F4:.F15]) -> 0 | G16: of:=SUM([.G4:.G15]) -> 152.06 | H16: of:=SUM([.H4:.H15]) -> 720 | I16: of:=SUM([.I4:.I15]) -> 68 | J16: of:=SUM([.J4:.J15]) -> 78702.06 | K16: of:=SUM([.K4:.K15]) -> -106.94
A17: Monthly Average | B17: of:=[.B16]/[$Income.$B$23] -> 2143.92776744866 | C17: of:=[.C16]/[$Income.$B$23] -> 2087.42485568743 | D17: of:=[.D16]/[$Income.$B$23] -> 19.0428686725382 | E17: of:=[.E16]/[$Income.$B$23] -> 8.97735237419656 | F17: of:=[.F16]/[$Income.$B$23] -> 0 | G17: of:=[.G16]/[$Income.$B$23] -> 4.13665515763736 | H17: of:=[.H16]/[$Income.$B$23] -> 19.5869506346107 | I17: of:=[.I16]/[$Income.$B$23] -> 1.84987867104656 | J17: of:=[.J16]/[$Income.$B$23] -> 2141.01856119745 | K17: of:=[.K16]/[$Income.$B$23] -> -2.90920625120175
A18: Weekly Average | B18: of:=[.B16]/[$Income.$B$22] -> 493.059363355749 | C18: of:=[.C16]/[$Income.$B$22] -> 480.064853874726 | D18: of:=[.D16]/[$Income.$B$22] -> 4.37946877068639 | E18: of:=[.E16]/[$Income.$B$22] -> 2.06460670618073 | F18: of:=[.F16]/[$Income.$B$22] -> 0 | G18: of:=[.G16]/[$Income.$B$22] -> 0.951345744672247 | H18: of:=[.H16]/[$Income.$B$22] -> 4.50459644984886 | I18: of:=[.I16]/[$Income.$B$22] -> 0.425434109152393 | J18: of:=[.J16]/[$Income.$B$22] -> 492.390305655267 | K18: of:=[.K16]/[$Income.$B$22] -> -0.669057700481716