Sheet: Budget
A1: Budget | B1: 2009 | P1: #Months YTD
P2: of:=COUNT([.C6:.N6]) -> 12
C3: Month
A4: CategoryÂ Description | B4: Budget | C4: of:=DATE([.B1];1;1) -> 2009-01-01 | D4: of:=DATE(YEAR([.C4]);MONTH([.C4])+1;1) -> 2009-02-01 | E4: of:=DATE(YEAR([.D4]);MONTH([.D4])+1;1) -> 2009-03-01 | F4: of:=DATE(YEAR([.E4]);MONTH([.E4])+1;1) -> 2009-04-01 | G4: of:=DATE(YEAR([.F4]);MONTH([.F4])+1;1) -> 2009-05-01 | H4: of:=DATE(YEAR([.G4]);MONTH([.G4])+1;1) -> 2009-06-01 | I4: of:=DATE(YEAR([.H4]);MONTH([.H4])+1;1) -> 2009-07-01 | J4: of:=DATE(YEAR([.I4]);MONTH([.I4])+1;1) -> 2009-08-01 | K4: of:=DATE(YEAR([.J4]);MONTH([.J4])+1;1) -> 2009-09-01 | L4: of:=DATE(YEAR([.K4]);MONTH([.K4])+1;1) -> 2009-10-01 | M4: of:=DATE(YEAR([.L4]);MONTH([.L4])+1;1) -> 2009-11-01 | N4: of:=DATE(YEAR([.M4]);MONTH([.M4])+1;1) -> 2009-12-01 | O4: Total YTD | P4: Budget YTD | Q4: Difference | R4: Actual Budget
A6: General income | B6: of:=[.R6]/12 -> 7298.66666666667 | C6: 6207 | D6: 6800 | E6: 9392 | F6: 8304 | G6: 6680 | H6: 5205 | I6: 7409 | J6: 7031 | K6: 5675 | L6: 8219 | M6: 13753 | N6: 5121 | O6: of:=SUM([.C6:.N6]) -> 89796 | P6: of:=[.$P$2]/12*[.R6] -> 87584 | Q6: of:=[.O6]-[.P6] -> 2212 | R6: of:=[.R47] -> 87584
A8: Building
A9: Hazard Insurance | B9: of:=[.R9]/12 -> 170.666666666667 | D9: 515 | F9: 505 | I9: 501 | L9: 501 | O9: of:=SUM([.C9:.N9]) -> 2022 | P9: of:=[.$P$2]/12*[.R9] -> 2048 | Q9: of:=[.O9]-[.P9] -> -26 | R9: of:=4*512 -> 2048
A10: Maintenance | B10: of:=[.R10]/12 -> 80 | C10: 225 | G10: 130 | I10: 275 | O10: of:=SUM([.C10:.N10]) -> 630 | P10: of:=[.$P$2]/12*[.R10] -> 960 | Q10: of:=[.O10]-[.P10] -> -330 | R10: 960
A11: Mortgage | B11: of:=[.R11]/12 -> 1138 | C11: 500 | D11: 500 | E11: 3000 | F11: 1200 | G11: 1200 | H11: 1200 | I11: 1124 | J11: 1124 | K11: 1124 | L11: 1124 | M11: 1124 | N11: 1124 | O11: of:=SUM([.C11:.N11]) -> 14344 | P11: of:=[.$P$2]/12*[.R11] -> 13656 | Q11: of:=[.O11]-[.P11] -> 688 | R11: of:=1138*12 -> 13656
A12: Property Tax | B12: of:=[.R12]/12 -> 50 | C12: 327 | L12: 668 | O12: of:=SUM([.C12:.N12]) -> 995 | P12: of:=[.$P$2]/12*[.R12] -> 600 | Q12: of:=[.O12]-[.P12] -> 395 | R12: 600
A13: Supplies | B13: of:=[.R13]/12 -> 8.33333333333333 | O13: of:=SUM([.C13:.N13]) -> 0 | P13: of:=[.$P$2]/12*[.R13] -> 100 | Q13: of:=[.O13]-[.P13] -> -100 | R13: 100
A14: Utilities | B14: of:=[.R14]/12 -> 650 | C14: 705 | D14: 628 | E14: 481 | F14: 691 | G14: 492 | H14: 278 | I14: 657 | J14: 777 | K14: 674 | L14: 859 | M14: 395 | N14: 296 | O14: of:=SUM([.C14:.N14]) -> 6933 | P14: of:=[.$P$2]/12*[.R14] -> 7800 | Q14: of:=[.O14]-[.P14] -> -867 | R14: 7800
A15: TOTAL Building | B15: of:=SUM([.B9:.B14]) -> 2097 | C15: of:=SUM([.C9:.C14]) -> 1757 | D15: of:=SUM([.D9:.D14]) -> 1643 | E15: of:=SUM([.E9:.E14]) -> 3481 | F15: of:=SUM([.F9:.F14]) -> 2396 | G15: of:=SUM([.G9:.G14]) -> 1822 | H15: of:=SUM([.H9:.H14]) -> 1478 | I15: of:=SUM([.I9:.I14]) -> 2557 | J15: of:=SUM([.J9:.J14]) -> 1901 | K15: of:=SUM([.K9:.K14]) -> 1798 | L15: of:=SUM([.L9:.L14]) -> 3152 | M15: of:=SUM([.M9:.M14]) -> 1519 | N15: of:=SUM([.N9:.N14]) -> 1420 | O15: of:=SUM([.C15:.N15]) -> 24924 | P15: of:=[.$P$2]/12*[.R15] -> 25164 | Q15: of:=[.O15]-[.P15] -> -240 | R15: of:=SUM([.R8:.R14]) -> 25164
A17: Business Expenses
A18: Worker's Comp | B18: of:=[.R18]/12 -> 50 | D18: 524 | O18: of:=SUM([.C18:.N18]) -> 524 | P18: of:=[.$P$2]/12*[.R18] -> 600 | Q18: of:=[.O18]-[.P18] -> -76 | R18: 600
A19: Office | F19: 60 | J19: 7 | L19: 40 | M19: 100 | N19: 729 | O19: of:=SUM([.C19:.N19]) -> 936 | P19: of:=[.$P$2]/12*[.R19] -> 200 | Q19: of:=[.O19]-[.P19] -> 736 | R19: 200
A20: Telephone | B20: of:=[.R20]/12 -> 100 | C20: 100 | D20: 90 | E20: 112 | F20: 100 | G20: 103 | H20: 101 | I20: 102 | J20: 105 | K20: 105 | L20: 106 | M20: 103 | N20: 105 | O20: of:=SUM([.C20:.N20]) -> 1232 | P20: of:=[.$P$2]/12*[.R20] -> 1200 | Q20: of:=[.O20]-[.P20] -> 32 | R20: 1200
A21: TOTAL Business Expenses | B21: of:=SUM([.B18:.B20]) -> 150 | C21: of:=SUM([.C18:.C20]) -> 100 | D21: of:=SUM([.D18:.D20]) -> 614 | E21: of:=SUM([.E18:.E20]) -> 112 | F21: of:=SUM([.F18:.F20]) -> 160 | G21: of:=SUM([.G18:.G20]) -> 103 | H21: of:=SUM([.H18:.H20]) -> 101 | I21: of:=SUM([.I18:.I20]) -> 102 | J21: of:=SUM([.J18:.J20]) -> 112 | K21: of:=SUM([.K18:.K20]) -> 105 | L21: of:=SUM([.L18:.L20]) -> 146 | M21: of:=SUM([.M18:.M20]) -> 203 | N21: of:=SUM([.N18:.N20]) -> 834 | O21: of:=SUM([.C21:.N21]) -> 2692 | P21: of:=[.$P$2]/12*[.R21] -> 2000 | Q21: of:=[.O21]-[.P21] -> 692 | R21: of:=SUM([.R17:.R20]) -> 2000
A23: Ministry
A24: Adult | B24: of:=[.R24]/12 -> 10 | L24: 120 | O24: of:=SUM([.C24:.N24]) -> 120 | P24: of:=[.$P$2]/12*[.R24] -> 120 | Q24: of:=[.O24]-[.P24] -> 0 | R24: 120
A25: Children | B25: of:=[.R25]/12 -> 10 | O25: of:=SUM([.C25:.N25]) -> 0 | P25: of:=[.$P$2]/12*[.R25] -> 120 | Q25: of:=[.O25]-[.P25] -> -120 | R25: 120
A26: Fellowship | B26: of:=[.R26]/12 -> 30 | O26: of:=SUM([.C26:.N26]) -> 0 | P26: of:=[.$P$2]/12*[.R26] -> 360 | Q26: of:=[.O26]-[.P26] -> -360 | R26: 360
A27: Missions | B27: of:=[.R27]/12 -> 80 | C27: 56 | D27: 62 | E27: 68 | F27: 100 | G27: 84 | H27: 68 | I27: 52 | J27: 74 | K27: 70 | L27: 60 | M27: 82 | N27: 140 | O27: of:=SUM([.C27:.N27]) -> 916 | P27: of:=[.$P$2]/12*[.R27] -> 960 | Q27: of:=[.O27]-[.P27] -> -44 | R27: 960
A28: Outreach | B28: of:=[.R28]/12 -> 50 | C28: 17 | D28: 17 | E28: 17 | F28: 17 | G28: 17 | H28: 17 | I28: 16 | J28: 17 | K28: 17 | L28: 17 | M28: 17 | N28: 17 | O28: of:=SUM([.C28:.N28]) -> 203 | P28: of:=[.$P$2]/12*[.R28] -> 600 | Q28: of:=[.O28]-[.P28] -> -397 | R28: 600
A29: Christian Education | B29: of:=[.R29]/12 -> 25 | O29: of:=SUM([.C29:.N29]) -> 0 | P29: of:=[.$P$2]/12*[.R29] -> 300 | Q29: of:=[.O29]-[.P29] -> -300 | R29: 300
A30: Worship | B30: of:=[.R30]/12 -> 30 | E30: 104 | O30: of:=SUM([.C30:.N30]) -> 104 | P30: of:=[.$P$2]/12*[.R30] -> 360 | Q30: of:=[.O30]-[.P30] -> -256 | R30: 360
A31: Youth | B31: of:=[.R31]/12 -> 10 | O31: of:=SUM([.C31:.N31]) -> 0 | P31: of:=[.$P$2]/12*[.R31] -> 120 | Q31: of:=[.O31]-[.P31] -> -120 | R31: 120
A32: TOTAL Ministry | B32: of:=SUM([.B24:.B31]) -> 245 | C32: of:=SUM([.C24:.C31]) -> 73 | D32: of:=SUM([.D24:.D31]) -> 79 | E32: of:=SUM([.E24:.E31]) -> 189 | F32: of:=SUM([.F24:.F31]) -> 117 | G32: of:=SUM([.G24:.G31]) -> 101 | H32: of:=SUM([.H24:.H31]) -> 85 | I32: of:=SUM([.I24:.I31]) -> 68 | J32: of:=SUM([.J24:.J31]) -> 91 | K32: of:=SUM([.K24:.K31]) -> 87 | L32: of:=SUM([.L24:.L31]) -> 197 | M32: of:=SUM([.M24:.M31]) -> 99 | N32: of:=SUM([.N24:.N31]) -> 157 | O32: of:=SUM([.C32:.N32]) -> 1343 | P32: of:=[.$P$2]/12*[.R32] -> 2940 | Q32: of:=[.O32]-[.P32] -> -1597 | R32: of:=SUM([.R23:.R31]) -> 2940
A34: Parsonage
A35: Maintenance | B35: of:=[.R35]/12 -> 100 | I35: 300 | O35: of:=SUM([.C35:.N35]) -> 300 | P35: of:=[.$P$2]/12*[.R35] -> 1200 | Q35: of:=[.O35]-[.P35] -> -900 | R35: 1200
A36: Mortgage | B36: of:=[.R36]/12 -> 565 | C36: 565 | D36: 565 | E36: 565 | F36: 565 | G36: 565 | H36: 565 | I36: 565 | J36: 565 | K36: 565 | L36: 565 | M36: 565 | N36: 565 | O36: of:=SUM([.C36:.N36]) -> 6780 | P36: of:=[.$P$2]/12*[.R36] -> 6780 | Q36: of:=[.O36]-[.P36] -> 0 | R36: of:=12*565 -> 6780
A37: Property Tax | B37: of:=[.R37]/12 -> 183.333333333333 | C37: 1166 | L37: 2476 | O37: of:=SUM([.C37:.N37]) -> 3642 | P37: of:=[.$P$2]/12*[.R37] -> 2200 | Q37: of:=[.O37]-[.P37] -> 1442 | R37: 2200
A38: Utilities | B38: of:=[.R38]/12 -> 408.333333333333 | C38: 335 | D38: 241 | E38: 279 | F38: 177 | G38: 399 | H38: 290 | I38: 231 | J38: 584 | K38: 664 | L38: 364 | M38: 347 | N38: 233 | O38: of:=SUM([.C38:.N38]) -> 4144 | P38: of:=[.$P$2]/12*[.R38] -> 4900 | Q38: of:=[.O38]-[.P38] -> -756 | R38: 4900
A39: TOTAL Parsonage | B39: of:=SUM([.B35:.B38]) -> 1256.66666666667 | C39: of:=SUM([.C35:.C38]) -> 2066 | D39: of:=SUM([.D35:.D38]) -> 806 | E39: of:=SUM([.E35:.E38]) -> 844 | F39: of:=SUM([.F35:.F38]) -> 742 | G39: of:=SUM([.G35:.G38]) -> 964 | H39: of:=SUM([.H35:.H38]) -> 855 | I39: of:=SUM([.I35:.I38]) -> 1096 | J39: of:=SUM([.J35:.J38]) -> 1149 | K39: of:=SUM([.K35:.K38]) -> 1229 | L39: of:=SUM([.L35:.L38]) -> 3405 | M39: of:=SUM([.M35:.M38]) -> 912 | N39: of:=SUM([.N35:.N38]) -> 798 | O39: of:=SUM([.C39:.N39]) -> 14866 | P39: of:=[.$P$2]/12*[.R39] -> 15080 | Q39: of:=[.O39]-[.P39] -> -214 | R39: of:=SUM([.R34:.R38]) -> 15080
A41: Pastor
A42: Business Expenses | B42: of:=[.R42]/12 -> 500 | C42: 500 | D42: 500 | E42: 500 | F42: 500 | G42: 500 | H42: 500 | I42: 500 | J42: 500 | K42: 500 | L42: 500 | M42: 500 | N42: 500 | O42: of:=SUM([.C42:.N42]) -> 6000 | P42: of:=[.$P$2]/12*[.R42] -> 6000 | Q42: of:=[.O42]-[.P42] -> 0 | R42: 6000
A43: Honorarium | B43: of:=[.R43]/12 -> 3033.33333333333 | C43: 3000 | D43: 2800 | E43: 3500 | F43: 2800 | G43: 3500 | H43: 2800 | I43: 2800 | J43: 3500 | K43: 2800 | L43: 2800 | M43: 3500 | N43: 2800 | O43: of:=SUM([.C43:.N43]) -> 36600 | P43: of:=[.$P$2]/12*[.R43] -> 36400 | Q43: of:=[.O43]-[.P43] -> 200 | R43: of:=52*700 -> 36400
A44: Other | B44: of:=[.R44]/12 -> 0 | J44: 40 | O44: of:=SUM([.C44:.N44]) -> 40 | P44: of:=[.$P$2]/12*[.R44] -> 0 | Q44: of:=[.O44]-[.P44] -> 40 | R44: 0
A45: TOTAL Pastor | B45: of:=SUM([.B42:.B43]) -> 3533.33333333333 | C45: of:=SUM([.C42:.C43]) -> 3500 | D45: of:=SUM([.D42:.D43]) -> 3300 | E45: of:=SUM([.E42:.E43]) -> 4000 | F45: of:=SUM([.F42:.F43]) -> 3300 | G45: of:=SUM([.G42:.G43]) -> 4000 | H45: of:=SUM([.H42:.H43]) -> 3300 | I45: of:=SUM([.I42:.I43]) -> 3300 | J45: of:=SUM([.J42:.J44]) -> 4040 | K45: of:=SUM([.K42:.K43]) -> 3300 | L45: of:=SUM([.L42:.L43]) -> 3300 | M45: of:=SUM([.M42:.M43]) -> 4000 | N45: of:=SUM([.N42:.N43]) -> 3300 | O45: of:=SUM([.C45:.N45]) -> 42640 | P45: of:=[.$P$2]/12*[.R45] -> 42400 | Q45: of:=[.O45]-[.P45] -> 240 | R45: of:=SUM([.R41:.R43]) -> 42400
A47: TOTAL EXPENSES | B47: of:=[.B15]+[.B21]+[.B32]+[.B39]+[.B45] -> 7282 | C47: of:=[.C15]+[.C21]+[.C32]+[.C39]+[.C45] -> 7496 | D47: of:=[.D15]+[.D21]+[.D32]+[.D39]+[.D45] -> 6442 | E47: of:=[.E15]+[.E21]+[.E32]+[.E39]+[.E45] -> 8626 | F47: of:=[.F15]+[.F21]+[.F32]+[.F39]+[.F45] -> 6715 | G47: of:=[.G15]+[.G21]+[.G32]+[.G39]+[.G45] -> 6990 | H47: of:=[.H15]+[.H21]+[.H32]+[.H39]+[.H45] -> 5819 | I47: of:=[.I15]+[.I21]+[.I32]+[.I39]+[.I45] -> 7123 | J47: of:=[.J15]+[.J21]+[.J32]+[.J39]+[.J45] -> 7293 | K47: of:=[.K15]+[.K21]+[.K32]+[.K39]+[.K45] -> 6519 | L47: of:=[.L15]+[.L21]+[.L32]+[.L39]+[.L45] -> 10200 | M47: of:=[.M15]+[.M21]+[.M32]+[.M39]+[.M45] -> 6733 | N47: of:=[.N15]+[.N21]+[.N32]+[.N39]+[.N45] -> 6509 | O47: of:=[.O15]+[.O21]+[.O32]+[.O39]+[.O45] -> 86465 | P47: of:=[.$P$2]/12*[.R47] -> 87584 | Q47: of:=[.O47]-[.P47] -> -1119 | R47: of:=[.R15]+[.R21]+[.R32]+[.R39]+[.R45] -> 87584
A49: OVERALL TOTAL | B49: of:=[.B6]+[.B47] -> 14580.6666666667 | C49: of:=[.C6]-[.C47] -> -1289 | D49: of:=[.D6]-[.D47] -> 358 | E49: of:=[.E6]-[.E47] -> 766 | F49: of:=[.F6]-[.F47] -> 1589 | G49: of:=[.G6]-[.G47] -> -310 | H49: of:=[.H6]-[.H47] -> -614 | I49: of:=[.I6]-[.I47] -> 286 | J49: of:=[.J6]-[.J47] -> -262 | K49: of:=[.K6]-[.K47] -> -844 | L49: of:=[.L6]-[.L47] -> -1981 | M49: of:=[.M6]-[.M47] -> 7020 | N49: of:=[.N6]-[.N47] -> -1388 | O49: of:=[.O6]-[.O47] -> 3331 | P49: of:=[.$P$2]/12*[.R49] -> 0 | Q49: of:=[.O49]-[.P49] -> 3331 | R49: of:=[.R6]-[.R47] -> 0
B83: of:=[.$O$4] -> Total YTD | C83: of:=[.$P$4] -> Budget YTD
A84: of:=[.$A$8] -> Building | B84: of:=[.O$15] -> 24924 | C84: of:=[.P$15] -> 25164
A85: of:=[.$A$17] -> Business Expenses | B85: of:=[.O$21] -> 2692 | C85: of:=[.P$21] -> 2000
A86: of:=[.$A$23] -> Ministry | B86: of:=[.O$32] -> 1343 | C86: of:=[.P$32] -> 2940
A87: of:=[.$A$34] -> Parsonage | B87: of:=[.O$39] -> 14866 | C87: of:=[.P$39] -> 15080
A88: of:=[.$A$41] -> Pastor | B88: of:=[.O$45] -> 42640 | C88: of:=[.P$45] -> 42400

Sheet: Holding Account
A1: Category | B1: Amount
A2: Building Property Tax | B2: of:=[Budget.B12] -> 50
A3: Parsonage Property Tax | B3: of:=[Budget.B37] -> 183.333333333333
A4: Hazard Insurance | B4: of:=[Budget.B9] -> 170.666666666667
A5: Workers' Comp | B5: of:=[Budget.B18] -> 50
A6: Building Maintenance
A7: Parsonage Maintenance
A10: 2009 Differences | B10: Building | C10: Prop Tax | D10: Prop Tax Oct | E10: Gen Expense | F10: Gen Income | G10: Gen Ex Oct | H10: Gen Income Nov
A11: Quicken for year | B11: 24926 | C11: 994 | D11: 668 | E11: 86465 | F11: 89796 | G11: 10199 | H11: 13753
A12: Calc | B12: 24854 | C12: 925 | D12: 598 | E12: 86395 | F12: 89896 | G12: 10130 | H12: 13853
A13: Diff | B13: of:=[.B11]-[.B12] -> 72 | C13: of:=[.C11]-[.C12] -> 69 | D13: of:=[.D11]-[.D12] -> 70 | E13: of:=[.E11]-[.E12] -> 70 | F13: of:=[.F11]-[.F12] -> -100 | G13: of:=[.G11]-[.G12] -> 69 | H13: of:=[.H11]-[.H12] -> -100