Sheet: Balances
A1: QHCC Balances 2009
A2: Date | B2: QHCC Account | C2: General | D2: Gen - Hold | E2: Parsonage | F2: Deacon | G2: Holding | H2: Youth | I2: DSL | J2: Temporary | K2: Total | L2: Diff | M2: Total Other | N2: General by Diff | O2: Diff | P2: QHCC Acct Rpt | Q2: Diff | R2: General from Rpt | S2: General by Diff | T2: Diff
A3: 2008-12-31 | B3: 5532 | C3: 2082 | D3: 2082 | E3: 2461 | F3: 710.42 | G3: 0 | H3: 513.94 | I3: -235.470000000001 | J3: 0 | K3: of:=SUM([.C3:.J3]) -> 7613.89 | L3: of:=[.K3]-[.B3] -> 2081.89 | M3: of:=SUM([.E3:.J3]) -> 3449.89 | N3: of:=IF([.$B3]<>"";[.B3]-[.M3];"") -> 2082.11 | O3: of:=IF([.$B3]<>"";[.N3]-[.C3];"") -> 0.110000000000582 | Q3: of:=[.P3]-[.B3] -> -5532 | S3: of:=[.B3]-SUM([.E3:.J3]) -> 2082.11 | T3: of:=[.S3]-[.C3] -> 0.110000000000582
A4: 2009-01-31 | B4: of:=IF([$Income.$B4]>0;[.B3]+[$Income.B4]-[$Expense.B4];"") -> 4209 | C4: of:=IF([$Income.$B4]>0;[.C3]+[$Income.C4]-[$Expense.C4];"") -> 794 | D4: of:=IF([$Income.$B4]>0;[.D3]+[$Income.D4]-[$Expense.D4];"") -> 794 | E4: of:=IF([$Income.$B4]>0;[.E3]+[$Income.E4]-[$Expense.E4];"") -> 2461 | F4: of:=IF([$Income.$B4]>0;[.F3]+[$Income.F4]-[$Expense.F4];"") -> 710.42 | G4: of:=IF([$Income.$B4]>0;[.G3]+[$Income.G4]-[$Expense.G4];"") -> 0 | H4: of:=IF([$Income.$B4]>0;[.H3]+[$Income.H4]-[$Expense.H4];"") -> 388.94 | I4: of:=IF([$Income.$B4]>0;[.I3]+[$Income.I4]-[$Expense.I4];"") -> -115.470000000001 | J4: of:=IF([$Income.$B4]>0;[.J3]+[$Income.J4]-[$Expense.J4];"") -> 0 | K4: of:=IF([$Income.$B4]>0;SUM([.C4:.J4]);"") -> 5032.89 | L4: of:=IF([$Income.$B4]>0;[.K4]-[.B4];"") -> 823.889999999999 | M4: of:=IF([$Income.$B4]>0;SUM([.E4:.J4]);"") -> 3444.89 | N4: of:=IF([.$B4]<>"";[.B4]-[.M4];"") -> 764.110000000001 | O4: of:=IF([.$B4]<>"";[.N4]-[.C4];"") -> -29.8899999999994 | Q4: of:=IF([$Income.$B4]>0;[.P4]-[.B4];"") -> -4209 | S4: of:=IF([$Income.$B4]>0;[.B4]-SUM([.E4:.J4]);"") -> 764.110000000001 | T4: of:=IF([$Income.$B4]>0;[.S4]-[.C4];"") -> -29.8899999999994
A5: 2009-02-28 | B5: of:=IF([$Income.$B5]>0;[.B4]+[$Income.B5]-[$Expense.B5];"") -> 4542 | C5: of:=IF([$Income.$B5]>0;[.C4]+[$Income.C5]-[$Expense.C5];"") -> 1152 | D5: of:=IF([$Income.$B5]>0;[.D4]+[$Income.D5]-[$Expense.D5];"") -> 1152 | E5: of:=IF([$Income.$B5]>0;[.E4]+[$Income.E5]-[$Expense.E5];"") -> 2461 | F5: of:=IF([$Income.$B5]>0;[.F4]+[$Income.F5]-[$Expense.F5];"") -> 710.42 | G5: of:=IF([$Income.$B5]>0;[.G4]+[$Income.G5]-[$Expense.G5];"") -> 0 | H5: of:=IF([$Income.$B5]>0;[.H4]+[$Income.H5]-[$Expense.H5];"") -> 303.94 | I5: of:=IF([$Income.$B5]>0;[.I4]+[$Income.I5]-[$Expense.I5];"") -> -55.470000000001 | J5: of:=IF([$Income.$B5]>0;[.J4]+[$Income.J5]-[$Expense.J5];"") -> 0 | K5: of:=IF([$Income.$B5]>0;SUM([.C5:.J5]);"") -> 5723.89 | L5: of:=IF([$Income.$B5]>0;[.K5]-[.B5];"") -> 1181.89 | M5: of:=IF([$Income.$B5]>0;SUM([.E5:.J5]);"") -> 3419.89 | N5: of:=IF([.$B5]<>"";[.B5]-[.M5];"") -> 1122.11 | O5: of:=IF([.$B5]<>"";[.N5]-[.C5];"") -> -29.889999999999 | Q5: of:=IF([$Income.$B5]>0;[.P5]-[.B5];"") -> -4542 | S5: of:=IF([$Income.$B5]>0;[.B5]-SUM([.E5:.J5]);"") -> 1122.11 | T5: of:=IF([$Income.$B5]>0;[.S5]-[.C5];"") -> -29.889999999999
A6: 2009-03-31 | B6: of:=IF([$Income.$B6]>0;[.B5]+[$Income.B6]-[$Expense.B6];"") -> 5280 | C6: of:=IF([$Income.$B6]>0;[.C5]+[$Income.C6]-[$Expense.C6];"") -> 1919 | D6: of:=IF([$Income.$B6]>0;[.D5]+[$Income.D6]-[$Expense.D6];"") -> 1919 | E6: of:=IF([$Income.$B6]>0;[.E5]+[$Income.E6]-[$Expense.E6];"") -> 2461 | F6: of:=IF([$Income.$B6]>0;[.F5]+[$Income.F6]-[$Expense.F6];"") -> 796.42 | G6: of:=IF([$Income.$B6]>0;[.G5]+[$Income.G6]-[$Expense.G6];"") -> 0 | H6: of:=IF([$Income.$B6]>0;[.H5]+[$Income.H6]-[$Expense.H6];"") -> 248.94 | I6: of:=IF([$Income.$B6]>0;[.I5]+[$Income.I6]-[$Expense.I6];"") -> -115.470000000001 | J6: of:=IF([$Income.$B6]>0;[.J5]+[$Income.J6]-[$Expense.J6];"") -> 0 | K6: of:=IF([$Income.$B6]>0;SUM([.C6:.J6]);"") -> 7228.89 | L6: of:=IF([$Income.$B6]>0;[.K6]-[.B6];"") -> 1948.89 | M6: of:=IF([$Income.$B6]>0;SUM([.E6:.J6]);"") -> 3390.89 | N6: of:=IF([.$B6]<>"";[.B6]-[.M6];"") -> 1889.11 | O6: of:=IF([.$B6]<>"";[.N6]-[.C6];"") -> -29.8899999999994 | Q6: of:=IF([$Income.$B6]>0;[.P6]-[.B6];"") -> -5280 | S6: of:=IF([$Income.$B6]>0;[.B6]-SUM([.E6:.J6]);"") -> 1889.11 | T6: of:=IF([$Income.$B6]>0;[.S6]-[.C6];"") -> -29.8899999999994
A7: 2009-04-30 | B7: of:=IF([$Income.$B7]>0;[.B6]+[$Income.B7]-[$Expense.B7];"") -> 7169 | C7: of:=IF([$Income.$B7]>0;[.C6]+[$Income.C7]-[$Expense.C7];"") -> 3508 | D7: of:=IF([$Income.$B7]>0;[.D6]+[$Income.D7]-[$Expense.D7];"") -> 2008 | E7: of:=IF([$Income.$B7]>0;[.E6]+[$Income.E7]-[$Expense.E7];"") -> 2461 | F7: of:=IF([$Income.$B7]>0;[.F6]+[$Income.F7]-[$Expense.F7];"") -> 796.42 | G7: of:=IF([$Income.$B7]>0;[.G6]+[$Income.G7]-[$Expense.G7];"") -> 1500 | H7: of:=IF([$Income.$B7]>0;[.H6]+[$Income.H7]-[$Expense.H7];"") -> 248.94 | I7: of:=IF([$Income.$B7]>0;[.I6]+[$Income.I7]-[$Expense.I7];"") -> -175.470000000001 | J7: of:=IF([$Income.$B7]>0;[.J6]+[$Income.J7]-[$Expense.J7];"") -> 360 | K7: of:=IF([$Income.$B7]>0;SUM([.C7:.J7]);"") -> 10706.89 | L7: of:=IF([$Income.$B7]>0;[.K7]-[.B7];"") -> 3537.89 | M7: of:=IF([$Income.$B7]>0;SUM([.E7:.J7]);"") -> 5190.89 | N7: of:=IF([.$B7]<>"";[.B7]-[.M7];"") -> 1978.11 | O7: of:=IF([.$B7]<>"";[.N7]-[.C7];"") -> -1529.89 | Q7: of:=IF([$Income.$B7]>0;[.P7]-[.B7];"") -> -7169 | S7: of:=IF([$Income.$B7]>0;[.B7]-SUM([.E7:.J7]);"") -> 1978.11 | T7: of:=IF([$Income.$B7]>0;[.S7]-[.C7];"") -> -1529.89
A8: 2009-05-31 | B8: of:=IF([$Income.$B8]>0;[.B7]+[$Income.B8]-[$Expense.B8];"") -> 8320 | C8: of:=IF([$Income.$B8]>0;[.C7]+[$Income.C8]-[$Expense.C8];"") -> 3198 | D8: of:=IF([$Income.$B8]>0;[.D7]+[$Income.D8]-[$Expense.D8];"") -> 1698 | E8: of:=IF([$Income.$B8]>0;[.E7]+[$Income.E8]-[$Expense.E8];"") -> 2461 | F8: of:=IF([$Income.$B8]>0;[.F7]+[$Income.F8]-[$Expense.F8];"") -> 880.42 | G8: of:=IF([$Income.$B8]>0;[.G7]+[$Income.G8]-[$Expense.G8];"") -> 1500 | H8: of:=IF([$Income.$B8]>0;[.H7]+[$Income.H8]-[$Expense.H8];"") -> 248.94 | I8: of:=IF([$Income.$B8]>0;[.I7]+[$Income.I8]-[$Expense.I8];"") -> -0.470000000000994 | J8: of:=IF([$Income.$B8]>0;[.J7]+[$Income.J8]-[$Expense.J8];"") -> 1562 | K8: of:=IF([$Income.$B8]>0;SUM([.C8:.J8]);"") -> 11547.89 | L8: of:=IF([$Income.$B8]>0;[.K8]-[.B8];"") -> 3227.89 | M8: of:=IF([$Income.$B8]>0;SUM([.E8:.J8]);"") -> 6651.89 | N8: of:=IF([.$B8]<>"";[.B8]-[.M8];"") -> 1668.11 | O8: of:=IF([.$B8]<>"";[.N8]-[.C8];"") -> -1529.89 | Q8: of:=IF([$Income.$B8]>0;[.P8]-[.B8];"") -> -8320 | S8: of:=IF([$Income.$B8]>0;[.B8]-SUM([.E8:.J8]);"") -> 1668.11 | T8: of:=IF([$Income.$B8]>0;[.S8]-[.C8];"") -> -1529.89
A9: 2009-06-30 | B9: of:=IF([$Income.$B9]>0;[.B8]+[$Income.B9]-[$Expense.B9];"") -> 6211 | C9: of:=IF([$Income.$B9]>0;[.C8]+[$Income.C9]-[$Expense.C9];"") -> 2583 | D9: of:=IF([$Income.$B9]>0;[.D8]+[$Income.D9]-[$Expense.D9];"") -> 1083 | E9: of:=IF([$Income.$B9]>0;[.E8]+[$Income.E9]-[$Expense.E9];"") -> 2461 | F9: of:=IF([$Income.$B9]>0;[.F8]+[$Income.F9]-[$Expense.F9];"") -> 880.42 | G9: of:=IF([$Income.$B9]>0;[.G8]+[$Income.G9]-[$Expense.G9];"") -> 1500 | H9: of:=IF([$Income.$B9]>0;[.H8]+[$Income.H9]-[$Expense.H9];"") -> 306.94 | I9: of:=IF([$Income.$B9]>0;[.I8]+[$Income.I9]-[$Expense.I9];"") -> -0.470000000000994 | J9: of:=IF([$Income.$B9]>0;[.J8]+[$Income.J9]-[$Expense.J9];"") -> 10 | K9: of:=IF([$Income.$B9]>0;SUM([.C9:.J9]);"") -> 8823.89 | L9: of:=IF([$Income.$B9]>0;[.K9]-[.B9];"") -> 2612.89 | M9: of:=IF([$Income.$B9]>0;SUM([.E9:.J9]);"") -> 5157.89 | N9: of:=IF([.$B9]<>"";[.B9]-[.M9];"") -> 1053.11 | O9: of:=IF([.$B9]<>"";[.N9]-[.C9];"") -> -1529.89 | Q9: of:=IF([$Income.$B9]>0;[.P9]-[.B9];"") -> -6211 | S9: of:=IF([$Income.$B9]>0;[.B9]-SUM([.E9:.J9]);"") -> 1053.11 | T9: of:=IF([$Income.$B9]>0;[.S9]-[.C9];"") -> -1529.89
A10: 2009-07-31 | B10: of:=IF([$Income.$B10]>0;[.B9]+[$Income.B10]-[$Expense.B10];"") -> 6496 | C10: of:=IF([$Income.$B10]>0;[.C9]+[$Income.C10]-[$Expense.C10];"") -> 2868 | D10: of:=IF([$Income.$B10]>0;[.D9]+[$Income.D10]-[$Expense.D10];"") -> 1368 | E10: of:=IF([$Income.$B10]>0;[.E9]+[$Income.E10]-[$Expense.E10];"") -> 2461 | F10: of:=IF([$Income.$B10]>0;[.F9]+[$Income.F10]-[$Expense.F10];"") -> 880.42 | G10: of:=IF([$Income.$B10]>0;[.G9]+[$Income.G10]-[$Expense.G10];"") -> 1500 | H10: of:=IF([$Income.$B10]>0;[.H9]+[$Income.H10]-[$Expense.H10];"") -> 306.94 | I10: of:=IF([$Income.$B10]>0;[.I9]+[$Income.I10]-[$Expense.I10];"") -> -0.470000000000994 | J10: of:=IF([$Income.$B10]>0;[.J9]+[$Income.J10]-[$Expense.J10];"") -> 10 | K10: of:=IF([$Income.$B10]>0;SUM([.C10:.J10]);"") -> 9393.89 | L10: of:=IF([$Income.$B10]>0;[.K10]-[.B10];"") -> 2897.89 | M10: of:=IF([$Income.$B10]>0;SUM([.E10:.J10]);"") -> 5157.89 | N10: of:=IF([.$B10]<>"";[.B10]-[.M10];"") -> 1338.11 | O10: of:=IF([.$B10]<>"";[.N10]-[.C10];"") -> -1529.89 | Q10: of:=IF([$Income.$B10]>0;[.P10]-[.B10];"") -> -6496 | S10: of:=IF([$Income.$B10]>0;[.B10]-SUM([.E10:.J10]);"") -> 1338.11 | T10: of:=IF([$Income.$B10]>0;[.S10]-[.C10];"") -> -1529.89
A11: 2009-08-31 | B11: of:=IF([$Income.$B11]>0;[.B10]+[$Income.B11]-[$Expense.B11];"") -> 6234 | C11: of:=IF([$Income.$B11]>0;[.C10]+[$Income.C11]-[$Expense.C11];"") -> 2606 | D11: of:=IF([$Income.$B11]>0;[.D10]+[$Income.D11]-[$Expense.D11];"") -> 1106 | E11: of:=IF([$Income.$B11]>0;[.E10]+[$Income.E11]-[$Expense.E11];"") -> 2461 | F11: of:=IF([$Income.$B11]>0;[.F10]+[$Income.F11]-[$Expense.F11];"") -> 880.42 | G11: of:=IF([$Income.$B11]>0;[.G10]+[$Income.G11]-[$Expense.G11];"") -> 1500 | H11: of:=IF([$Income.$B11]>0;[.H10]+[$Income.H11]-[$Expense.H11];"") -> 306.94 | I11: of:=IF([$Income.$B11]>0;[.I10]+[$Income.I11]-[$Expense.I11];"") -> -0.470000000000994 | J11: of:=IF([$Income.$B11]>0;[.J10]+[$Income.J11]-[$Expense.J11];"") -> 10 | K11: of:=IF([$Income.$B11]>0;SUM([.C11:.J11]);"") -> 8869.89 | L11: of:=IF([$Income.$B11]>0;[.K11]-[.B11];"") -> 2635.89 | M11: of:=IF([$Income.$B11]>0;SUM([.E11:.J11]);"") -> 5157.89 | N11: of:=IF([.$B11]<>"";[.B11]-[.M11];"") -> 1076.11 | O11: of:=IF([.$B11]<>"";[.N11]-[.C11];"") -> -1529.89 | Q11: of:=IF([$Income.$B11]>0;[.P11]-[.B11];"") -> -6234 | S11: of:=IF([$Income.$B11]>0;[.B11]-SUM([.E11:.J11]);"") -> 1076.11 | T11: of:=IF([$Income.$B11]>0;[.S11]-[.C11];"") -> -1529.89
A12: 2009-09-30 | B12: of:=IF([$Income.$B12]>0;[.B11]+[$Income.B12]-[$Expense.B12];"") -> 5467 | C12: of:=IF([$Income.$B12]>0;[.C11]+[$Income.C12]-[$Expense.C12];"") -> 1757 | D12: of:=IF([$Income.$B12]>0;[.D11]+[$Income.D12]-[$Expense.D12];"") -> 257 | E12: of:=IF([$Income.$B12]>0;[.E11]+[$Income.E12]-[$Expense.E12];"") -> 2461 | F12: of:=IF([$Income.$B12]>0;[.F11]+[$Income.F12]-[$Expense.F12];"") -> 949.42 | G12: of:=IF([$Income.$B12]>0;[.G11]+[$Income.G12]-[$Expense.G12];"") -> 1500 | H12: of:=IF([$Income.$B12]>0;[.H11]+[$Income.H12]-[$Expense.H12];"") -> 319.94 | I12: of:=IF([$Income.$B12]>0;[.I11]+[$Income.I12]-[$Expense.I12];"") -> -0.470000000000994 | J12: of:=IF([$Income.$B12]>0;[.J11]+[$Income.J12]-[$Expense.J12];"") -> 10 | K12: of:=IF([$Income.$B12]>0;SUM([.C12:.J12]);"") -> 7253.89 | L12: of:=IF([$Income.$B12]>0;[.K12]-[.B12];"") -> 1786.89 | M12: of:=IF([$Income.$B12]>0;SUM([.E12:.J12]);"") -> 5239.89 | N12: of:=IF([.$B12]<>"";[.B12]-[.M12];"") -> 227.110000000001 | O12: of:=IF([.$B12]<>"";[.N12]-[.C12];"") -> -1529.89 | Q12: of:=IF([$Income.$B12]>0;[.P12]-[.B12];"") -> -5467 | S12: of:=IF([$Income.$B12]>0;[.B12]-SUM([.E12:.J12]);"") -> 227.110000000001 | T12: of:=IF([$Income.$B12]>0;[.S12]-[.C12];"") -> -1529.89
A13: 2009-10-31 | B13: of:=IF([$Income.$B13]>0;[.B12]+[$Income.B13]-[$Expense.B13];"") -> 3385 | C13: of:=IF([$Income.$B13]>0;[.C12]+[$Income.C13]-[$Expense.C13];"") -> -153 | D13: of:=IF([$Income.$B13]>0;[.D12]+[$Income.D13]-[$Expense.D13];"") -> -153 | E13: of:=IF([$Income.$B13]>0;[.E12]+[$Income.E13]-[$Expense.E13];"") -> 2461 | F13: of:=IF([$Income.$B13]>0;[.F12]+[$Income.F13]-[$Expense.F13];"") -> 777.42 | G13: of:=IF([$Income.$B13]>0;[.G12]+[$Income.G13]-[$Expense.G13];"") -> 0 | H13: of:=IF([$Income.$B13]>0;[.H12]+[$Income.H13]-[$Expense.H13];"") -> 319.94 | I13: of:=IF([$Income.$B13]>0;[.I12]+[$Income.I13]-[$Expense.I13];"") -> -0.470000000000994 | J13: of:=IF([$Income.$B13]>0;[.J12]+[$Income.J13]-[$Expense.J13];"") -> 10 | K13: of:=IF([$Income.$B13]>0;SUM([.C13:.J13]);"") -> 3261.89 | L13: of:=IF([$Income.$B13]>0;[.K13]-[.B13];"") -> -123.110000000001 | M13: of:=IF([$Income.$B13]>0;SUM([.E13:.J13]);"") -> 3567.89 | N13: of:=IF([.$B13]<>"";[.B13]-[.M13];"") -> -182.889999999999 | O13: of:=IF([.$B13]<>"";[.N13]-[.C13];"") -> -29.8899999999994 | Q13: of:=IF([$Income.$B13]>0;[.P13]-[.B13];"") -> -3385 | S13: of:=IF([$Income.$B13]>0;[.B13]-SUM([.E13:.J13]);"") -> -182.889999999999 | T13: of:=IF([$Income.$B13]>0;[.S13]-[.C13];"") -> -29.8899999999994
A14: 2009-11-30 | B14: of:=IF([$Income.$B14]>0;[.B13]+[$Income.B14]-[$Expense.B14];"") -> 10505 | C14: of:=IF([$Income.$B14]>0;[.C13]+[$Income.C14]-[$Expense.C14];"") -> 6867 | D14: of:=IF([$Income.$B14]>0;[.D13]+[$Income.D14]-[$Expense.D14];"") -> 1867 | E14: of:=IF([$Income.$B14]>0;[.E13]+[$Income.E14]-[$Expense.E14];"") -> 2461 | F14: of:=IF([$Income.$B14]>0;[.F13]+[$Income.F14]-[$Expense.F14];"") -> 777.42 | G14: of:=IF([$Income.$B14]>0;[.G13]+[$Income.G14]-[$Expense.G14];"") -> 5000 | H14: of:=IF([$Income.$B14]>0;[.H13]+[$Income.H14]-[$Expense.H14];"") -> 319.94 | I14: of:=IF([$Income.$B14]>0;[.I13]+[$Income.I14]-[$Expense.I14];"") -> -0.470000000000994 | J14: of:=IF([$Income.$B14]>0;[.J13]+[$Income.J14]-[$Expense.J14];"") -> 110 | K14: of:=IF([$Income.$B14]>0;SUM([.C14:.J14]);"") -> 17401.89 | L14: of:=IF([$Income.$B14]>0;[.K14]-[.B14];"") -> 6896.89 | M14: of:=IF([$Income.$B14]>0;SUM([.E14:.J14]);"") -> 8667.89 | N14: of:=IF([.$B14]<>"";[.B14]-[.M14];"") -> 1837.11 | O14: of:=IF([.$B14]<>"";[.N14]-[.C14];"") -> -5029.89 | Q14: of:=IF([$Income.$B14]>0;[.P14]-[.B14];"") -> -10505 | S14: of:=IF([$Income.$B14]>0;[.B14]-SUM([.E14:.J14]);"") -> 1837.11 | T14: of:=IF([$Income.$B14]>0;[.S14]-[.C14];"") -> -5029.89
A15: 2009-12-31 | B15: of:=IF([$Income.$B15]>0;[.B14]+[$Income.B15]-[$Expense.B15];"") -> 7550 | C15: of:=IF([$Income.$B15]>0;[.C14]+[$Income.C15]-[$Expense.C15];"") -> 5480 | D15: of:=IF([$Income.$B15]>0;[.D14]+[$Income.D15]-[$Expense.D15];"") -> 1180 | E15: of:=IF([$Income.$B15]>0;[.E14]+[$Income.E15]-[$Expense.E15];"") -> 936 | F15: of:=IF([$Income.$B15]>0;[.F14]+[$Income.F15]-[$Expense.F15];"") -> 835.42 | G15: of:=IF([$Income.$B15]>0;[.G14]+[$Income.G15]-[$Expense.G15];"") -> 4300 | H15: of:=IF([$Income.$B15]>0;[.H14]+[$Income.H15]-[$Expense.H15];"") -> 319.94 | I15: of:=IF([$Income.$B15]>0;[.I14]+[$Income.I15]-[$Expense.I15];"") -> -0.470000000000994 | J15: of:=IF([$Income.$B15]>0;[.J14]+[$Income.J15]-[$Expense.J15];"") -> 10 | K15: of:=IF([$Income.$B15]>0;SUM([.C15:.J15]);"") -> 13060.89 | L15: of:=IF([$Income.$B15]>0;[.K15]-[.B15];"") -> 5510.89 | M15: of:=IF([$Income.$B15]>0;SUM([.E15:.J15]);"") -> 6400.89 | N15: of:=IF([.$B15]<>"";[.B15]-[.M15];"") -> 1149.11 | O15: of:=IF([.$B15]<>"";[.N15]-[.C15];"") -> -4330.89 | Q15: of:=IF([$Income.$B15]>0;[.P15]-[.B15];"") -> -7550 | S15: of:=IF([$Income.$B15]>0;[.B15]-SUM([.E15:.J15]);"") -> 1149.11 | T15: of:=IF([$Income.$B15]>0;[.S15]-[.C15];"") -> -4330.89
O34: Total
O35: QHCC
O36: Diff
B38: Month | C38: Income | D38: Expense | E38: General Fund | F38: Actual Balance | G38: Unpaid Bills | I38: General
B39: of:=[Income.A4] -> 2008-01-31 | C39: of:=IF([$Income.$C4] > 0;[$Income.$C4];"") -> 6207 | D39: of:=IF([$Expense.$C4] > 0;[$Expense.$C4];"") -> 7495 | E39: of:=IF([.G39]<>0;[.F39]-[.G39];[.F39]) -> -1601 | F39: of:=[.$C4] -> 794 | G39: 2395 | I39: of:=[.$C4] -> 794
B40: of:=[Income.A5] -> 2008-02-28 | C40: of:=IF([$Income.$C5] > 0;[$Income.$C5];"") -> 6800 | D40: of:=IF([$Expense.$C5] > 0;[$Expense.$C5];"") -> 6442 | E40: of:=IF([.G40]<>0;[.F40]-[.G40];[.F40]) -> -723 | F40: of:=[.$C5] -> 1152 | G40: 1875 | I40: of:=[.$C5] -> 1152
B41: of:=[Income.A6] -> 2008-03-31 | C41: of:=IF([$Income.$C6] > 0;[$Income.$C6];"") -> 9392 | D41: of:=IF([$Expense.$C6] > 0;[$Expense.$C6];"") -> 8625 | E41: of:=IF([.G41]<>0;[.F41]-[.G41];[.F41]) -> 1919 | F41: of:=[.$C6] -> 1919 | G41: 0 | I41: of:=[.$C6] -> 1919
B42: of:=[Income.A7] -> 2008-04-30 | C42: of:=IF([$Income.$C7] > 0;[$Income.$C7];"") -> 8304 | D42: of:=IF([$Expense.$C7] > 0;[$Expense.$C7];"") -> 6715 | E42: of:=IF([.G42]<>0;[.F42]-[.G42];[.F42]) -> 3508 | F42: of:=[.$C7] -> 3508 | G42: 0 | I42: of:=[.$C7] -> 3508
B43: of:=[Income.A8] -> 2008-05-31 | C43: of:=IF([$Income.$C8] > 0;[$Income.$C8];"") -> 6680 | D43: of:=IF([$Expense.$C8] > 0;[$Expense.$C8];"") -> 6990 | E43: of:=IF([.G43]<>0;[.F43]-[.G43];[.F43]) -> 3198 | F43: of:=[.$C8] -> 3198 | G43: 0 | I43: of:=[.$C8] -> 3198
B44: of:=[Income.A9] -> 2008-06-30 | C44: of:=IF([$Income.$C9] > 0;[$Income.$C9];"") -> 5205 | D44: of:=IF([$Expense.$C9] > 0;[$Expense.$C9];"") -> 5820 | E44: of:=IF([.G44]<>0;[.F44]-[.G44];[.F44]) -> 2583 | F44: of:=[.$C9] -> 2583 | G44: 0 | I44: of:=[.$C9] -> 2583
B45: of:=[Income.A10] -> 2008-07-31 | C45: of:=IF([$Income.$C10] > 0;[$Income.$C10];"") -> 7409 | D45: of:=IF([$Expense.$C10] > 0;[$Expense.$C10];"") -> 7124 | E45: of:=IF([.G45]<>0;[.F45]-[.G45];[.F45]) -> 2868 | F45: of:=[.$C10] -> 2868 | G45: 0 | I45: of:=[.$C10] -> 2868
B46: of:=[Income.A11] -> 2008-08-31 | C46: of:=IF([$Income.$C11] > 0;[$Income.$C11];"") -> 7031 | D46: of:=IF([$Expense.$C11] > 0;[$Expense.$C11];"") -> 7293 | E46: of:=IF([.G46]<>0;[.F46]-[.G46];[.F46]) -> 2606 | F46: of:=[.$C11] -> 2606 | G46: 0 | I46: of:=[.$C11] -> 2606
B47: of:=[Income.A12] -> 2008-09-30 | C47: of:=IF([$Income.$C12] > 0;[$Income.$C12];"") -> 5670 | D47: of:=IF([$Expense.$C12] > 0;[$Expense.$C12];"") -> 6519 | E47: of:=IF([.G47]<>0;[.F47]-[.G47];[.F47]) -> 1757 | F47: of:=[.$C12] -> 1757 | G47: 0 | I47: of:=[.$C12] -> 1757
B48: of:=[Income.A13] -> 2008-10-31 | C48: of:=IF([$Income.$C13] > 0;[$Income.$C13];"") -> 8219 | D48: of:=IF([$Expense.$C13] > 0;[$Expense.$C13];"") -> 10129 | E48: of:=IF([.G48]<>0;[.F48]-[.G48];[.F48]) -> -153 | F48: of:=[.$C13] -> -153 | I48: of:=[.$C13] -> -153
B49: of:=[Income.A14] -> 2008-11-30 | C49: of:=IF([$Income.$C14] > 0;[$Income.$C14];"") -> 13753 | D49: of:=IF([$Expense.$C14] > 0;[$Expense.$C14];"") -> 6733 | E49: of:=IF([.G49]<>0;[.F49]-[.G49];[.F49]) -> 6867 | F49: of:=[.$C14] -> 6867 | I49: of:=[.$C14] -> 6867
B50: of:=[Income.A15] -> 2008-12-31 | C50: of:=IF([$Income.$C15] > 0;[$Income.$C15];"") -> 5121 | D50: of:=IF([$Expense.$C15] > 0;[$Expense.$C15];"") -> 6508 | E50: of:=IF([.G50]<>0;[.F50]-[.G50];[.F50]) -> 5480 | F50: of:=[.$C15] -> 5480 | I50: of:=[.$C15] -> 5480

Sheet: Income
A1: QHCC Income 2009
A2: Date | B2: QHCC Account | C2: General | D2: Gen – Hold | E2: Parsonage | F2: Deacon | G2: Holding | H2: Youth | I2: DSL | J2: Temporary | K2: Total | L2: Diff
A4: 2008-01-31 | B4: 6391 | C4: 6207 | D4: of:=[.C4]-[.G4] -> 6207 | I4: 180 | J4: 30 | K4: of:=[.C4]+SUM([.E4:.J4]) -> 6417 | L4: of:=[.K4]-[.B4] -> 26 | O4: 7364
A5: 2008-02-28 | B5: 6920 | C5: 6800 | D5: of:=[.C5]-[.G5] -> 6800 | I5: 120 | K5: of:=[.C5]+SUM([.E5:.J5]) -> 6920 | L5: of:=[.K5]-[.B5] -> 0 | O5: 5688
A6: 2008-03-31 | B6: 9479 | C6: 9392 | D6: of:=[.C6]-[.G6] -> 9392 | F6: 86 | K6: of:=[.C6]+SUM([.E6:.J6]) -> 9478 | L6: of:=[.K6]-[.B6] -> -1 | O6: 8019
A7: 2008-04-30 | B7: 8665 | C7: 8304 | D7: of:=[.C7]-[.G7] -> 6804 | G7: 1500 | J7: 360 | K7: of:=[.C7]+SUM([.E7:.J7]) -> 10164 | L7: of:=[.K7]-[.B7] -> 1499 | O7: 5809
A8: 2008-05-31 | B8: 8204 | C8: 6680 | D8: of:=[.C8]-[.G8] -> 6680 | F8: 84 | I8: 235 | J8: 1202 | K8: of:=[.C8]+SUM([.E8:.J8]) -> 8201 | L8: of:=[.K8]-[.B8] -> -3 | O8: 5677
A9: 2008-06-30 | B9: 5325 | C9: 5205 | D9: of:=[.C9]-[.G9] -> 5205 | H9: 58 | I9: 60 | K9: of:=[.C9]+SUM([.E9:.J9]) -> 5323 | L9: of:=[.K9]-[.B9] -> -2 | O9: 6560
A10: 2008-07-31 | B10: 7470 | C10: 7409 | D10: of:=[.C10]-[.G10] -> 7409 | I10: 60 | K10: of:=[.C10]+SUM([.E10:.J10]) -> 7469 | L10: of:=[.K10]-[.B10] -> -1 | O10: 5273
A11: 2008-08-31 | B11: 7294 | C11: 7031 | D11: of:=[.C11]-[.G11] -> 7031 | I11: 60 | K11: of:=[.C11]+SUM([.E11:.J11]) -> 7091 | L11: of:=[.K11]-[.B11] -> -203 | O11: 7133
A12: 2008-09-30 | B12: 5814 | C12: 5670 | D12: of:=[.C12]-[.G12] -> 5670 | F12: 69 | H12: 13 | I12: 60 | K12: of:=[.C12]+SUM([.E12:.J12]) -> 5812 | L12: of:=[.K12]-[.B12] -> -2 | O12: of:=SUM([.O4:.O11]) -> 51523
A13: 2008-10-31 | B13: 8333 | C13: 8219 | D13: of:=[.C13]-[.G13] -> 8219 | F13: 43 | I13: 60 | K13: of:=[.C13]+SUM([.E13:.J13]) -> 8322 | L13: of:=[.K13]-[.B13] -> -11 | O13: of:=[.O12]/8 -> 6440.375
A14: 2008-11-30 | B14: 13916 | C14: 13753 | D14: of:=[.C14]-[.G14] -> 8753 | G14: 5000 | I14: 60 | J14: 100 | K14: of:=[.C14]+SUM([.E14:.J14]) -> 18913 | L14: of:=[.K14]-[.B14] -> 4997
A15: 2008-12-31 | B15: 5361 | C15: 5121 | D15: of:=[.C15]-[.G15] -> 5121 | F15: 58 | I15: 60 | J15: 95 | K15: of:=[.C15]+SUM([.E15:.J15]) -> 5334 | L15: of:=[.K15]-[.B15] -> -27
A16: Total for Year | B16: of:=SUM([.B4:.B15]) -> 93172 | C16: of:=SUM([.C4:.C15]) -> 89791 | E16: of:=SUM([.E4:.E15]) -> 0 | F16: of:=SUM([.F4:.F15]) -> 340 | G16: of:=SUM([.G4:.G15]) -> 6500 | H16: of:=SUM([.H4:.H15]) -> 71 | I16: of:=SUM([.I4:.I15]) -> 955 | J16: of:=SUM([.J4:.J15]) -> 1787 | K16: of:=SUM([.K4:.K15]) -> 99444 | L16: of:=SUM([.L4:.L15]) -> 6272
A17: Monthly Average | B17: of:=[.B16]/[.$B$23] -> 1927.00541448822 | C17: of:=[.C16]/[.$B$23] -> 1857.07877014888 | E17: of:=[.E16]/[.$B$23] -> 0 | F17: of:=[.F16]/[.$B$23] -> 7.0319606848194 | G17: of:=[.G16]/[.$B$23] -> 134.4345425039 | H17: of:=[.H16]/[.$B$23] -> 1.46843884888876 | I17: of:=[.I16]/[.$B$23] -> 19.7515366294192 | J17: of:=[.J16]/[.$B$23] -> 36.9591580699184 | K17: of:=[.K16]/[.$B$23] -> 2056.72440688582 | L17: of:=[.L16]/[.$B$23] -> 129.71899239761
A18: Weekly Average | B18: of:=[.B16]/[.$B$22] -> 443.171676432608 | C18: of:=[.C16]/[.$B$22] -> 427.089984099948 | E18: of:=[.E16]/[.$B$22] -> 0 | F18: of:=[.F16]/[.$B$22] -> 1.61720656406524 | G18: of:=[.G16]/[.$B$22] -> 30.917184313012 | H18: of:=[.H16]/[.$B$22] -> 0.337710782495977 | I18: of:=[.I16]/[.$B$22] -> 4.54244784906561 | J18: of:=[.J16]/[.$B$22] -> 8.49984744113114 | K18: of:=[.K16]/[.$B$22] -> 473.004381049717 | L18: of:=[.L16]/[.$B$22] -> 29.8327046171094
A20: Today | B20: of:=NOW() -> 2010-01-10T16:09:48.03
A21: Day | B21: of:=[.B20]-DATE(2005;12;31) -> 1471.67347256945
A22: Week | B22: of:=[.B21]/7 -> 210.239067509921
A23: Month | B23: of:=[.B21]/365.25*12 -> 48.3506685033083

Sheet: Expense
A1: QHCC Expenses 2009
A2: Date | B2: QHCC Account | C2: General | D2: Gen – Hold | E2: Parsonage | F2: Deacon | G2: Holding | H2: Youth | I2: DSL | J2: Temporary | K2: Total | L2: Diff
A4: 2008-01-31 | B4: 7714 | C4: 7495 | D4: of:=[.C4]-[.G4] -> 7495 | H4: 125 | I4: 60 | J4: 30 | K4: of:=[.C4]+SUM([.E4:.J4]) -> 7710 | L4: of:=[.K4]-[.B4] -> -4
A5: 2008-02-28 | B5: 6587 | C5: 6442 | D5: of:=[.C5]-[.G5] -> 6442 | H5: 85 | I5: 60 | K5: of:=[.C5]+SUM([.E5:.J5]) -> 6587 | L5: of:=[.K5]-[.B5] -> 0
A6: 2008-03-31 | B6: 8741 | C6: 8625 | D6: of:=[.C6]-[.G6] -> 8625 | H6: 55 | I6: 60 | K6: of:=[.C6]+SUM([.E6:.J6]) -> 8740 | L6: of:=[.K6]-[.B6] -> -1
A7: 2008-04-30 | B7: 6776 | C7: 6715 | D7: of:=[.C7]-[.G7] -> 6715 | I7: 60 | K7: of:=[.C7]+SUM([.E7:.J7]) -> 6775 | L7: of:=[.K7]-[.B7] -> -1
A8: 2008-05-31 | B8: 7053 | C8: 6990 | D8: of:=[.C8]-[.G8] -> 6990 | I8: 60 | K8: of:=[.C8]+SUM([.E8:.J8]) -> 7050 | L8: of:=[.K8]-[.B8] -> -3
A9: 2008-06-30 | B9: 7434 | C9: 5820 | D9: of:=[.C9]-[.G9] -> 5820 | I9: 60 | J9: 1552 | K9: of:=[.C9]+SUM([.E9:.J9]) -> 7432 | L9: of:=[.K9]-[.B9] -> -2
A10: 2008-07-31 | B10: 7185 | C10: 7124 | D10: of:=[.C10]-[.G10] -> 7124 | I10: 60 | K10: of:=[.C10]+SUM([.E10:.J10]) -> 7184 | L10: of:=[.K10]-[.B10] -> -1
A11: 2008-08-31 | B11: 7556 | C11: 7293 | D11: of:=[.C11]-[.G11] -> 7293 | I11: 60 | K11: of:=[.C11]+SUM([.E11:.J11]) -> 7353 | L11: of:=[.K11]-[.B11] -> -203
A12: 2008-09-30 | B12: 6581 | C12: 6519 | D12: of:=[.C12]-[.G12] -> 6519 | I12: 60 | K12: of:=[.C12]+SUM([.E12:.J12]) -> 6579 | L12: of:=[.K12]-[.B12] -> -2
A13: 2008-10-31 | B13: 10415 | C13: 10129 | D13: of:=[.C13]-[.G13] -> 8629 | F13: 215 | G13: 1500 | I13: 60 | K13: of:=[.C13]+SUM([.E13:.J13]) -> 11904 | L13: of:=[.K13]-[.B13] -> 1489
A14: 2008-11-30 | B14: 6796 | C14: 6733 | D14: of:=[.C14]-[.G14] -> 6733 | I14: 60 | K14: of:=[.C14]+SUM([.E14:.J14]) -> 6793 | L14: of:=[.K14]-[.B14] -> -3
A15: 2008-12-31 | B15: 8316 | C15: 6508 | D15: of:=[.C15]-[.G15] -> 5808 | E15: 1525 | G15: 700 | I15: 60 | J15: 195 | K15: of:=[.C15]+SUM([.E15:.J15]) -> 8988 | L15: of:=[.K15]-[.B15] -> 672
A16: Total for Year | B16: of:=SUM([.B4:.B15]) -> 91154 | C16: of:=SUM([.C4:.C15]) -> 86393 | E16: of:=SUM([.E4:.E15]) -> 1525 | F16: of:=SUM([.F4:.F15]) -> 215 | G16: of:=SUM([.G4:.G15]) -> 2200 | H16: of:=SUM([.H4:.H15]) -> 265 | I16: of:=SUM([.I4:.I15]) -> 720 | J16: of:=SUM([.J4:.J15]) -> 1777 | K16: of:=SUM([.K4:.K15]) -> 93095 | L16: of:=SUM([.L4:.L15]) -> 1941
A17: Monthly Average | B17: of:=[.B16]/[$Income.$B$23] -> 1885.26865960008 | C17: of:=[.C16]/[$Income.$B$23] -> 1786.8005277753 | E17: of:=[.E16]/[$Income.$B$23] -> 31.5404118951458 | F17: of:=[.F16]/[$Income.$B$23] -> 4.44668102128286 | G17: of:=[.G16]/[$Income.$B$23] -> 45.5009220782432 | H17: of:=[.H16]/[$Income.$B$23] -> 5.48079288669747 | I17: of:=[.I16]/[$Income.$B$23] -> 14.8912108619705 | J17: of:=[.J16]/[$Income.$B$23] -> 36.7523356968355 | K17: of:=[.K16]/[$Income.$B$23] -> 1925.41288221548 | L17: of:=[.L16]/[$Income.$B$23] -> 40.1442226153955
A18: Weekly Average | B18: of:=[.B16]/[$Income.$B$22] -> 433.573079825891 | C18: of:=[.C16]/[$Income.$B$22] -> 410.927431439084 | E18: of:=[.E16]/[$Income.$B$22] -> 7.25364708882204 | F18: of:=[.F16]/[$Income.$B$22] -> 1.02264532727655 | G18: of:=[.G16]/[$Income.$B$22] -> 10.464277767481 | H18: of:=[.H16]/[$Income.$B$22] -> 1.26046982199203 | I18: of:=[.I16]/[$Income.$B$22] -> 3.42467272390287 | J18: of:=[.J16]/[$Income.$B$22] -> 8.45228254218804 | K18: of:=[.K16]/[$Income.$B$22] -> 442.805426710746 | L18: of:=[.L16]/[$Income.$B$22] -> 9.23234688485481