Sheet: Balances
A1: QHCC Balances 2010
A2: Date | B2: QHCC Account | C2: General | D2: Gen - Hold | E2: Parsonage | F2: Deacon | G2: Holding | H2: Youth | I2: DSL | J2: Temporary | K2: Total | L2: Diff | M2: Total Other | N2: General by Diff | O2: Diff | P2: QHCC Acct Rpt | Q2: Diff | R2: General from Rpt | S2: General by Diff | T2: Diff
A3: 2009-12-31 | B3: 7550 | C3: 5480 | D3: 1180 | E3: 936 | F3: 835.42 | G3: 4300 | H3: 319.94 | I3: -0.470000000000994 | J3: 10 | K3: of:=SUM([.C3:.J3]) -> 13060.89 | L3: of:=[.K3]-[.B3] -> 5510.89 | M3: of:=SUM([.E3:.J3]) -> 6400.89 | N3: of:=IF([.$B3]<>"";[.B3]-[.M3];"") -> 1149.11 | O3: of:=IF([.$B3]<>"";[.N3]-[.C3];"") -> -4330.89 | Q3: of:=[.P3]-[.B3] -> -7550 | S3: of:=[.B3]-SUM([.E3:.J3]) -> 1149.11 | T3: of:=[.S3]-[.C3] -> -4330.89
A4: 2010-01-31 | B4: of:=IF([$Income.$B4]>0;[.B3]+[$Income.B4]-[$Expense.B4];"") -> 6157 | C4: of:=IF([$Income.$B4]>0;[.C3]+[$Income.C4]-[$Expense.C4];"") -> 3828 | D4: of:=IF([$Income.$B4]>0;[.D3]+[$Income.D4]-[$Expense.D4];"") -> 228 | E4: of:=IF([$Income.$B4]>0;[.E3]+[$Income.E4]-[$Expense.E4];"") -> 936 | F4: of:=IF([$Income.$B4]>0;[.F3]+[$Income.F4]-[$Expense.F4];"") -> 894.42 | G4: of:=IF([$Income.$B4]>0;[.G3]+[$Income.G4]-[$Expense.G4];"") -> 3600 | H4: of:=IF([$Income.$B4]>0;[.H3]+[$Income.H4]-[$Expense.H4];"") -> 319.94 | I4: of:=IF([$Income.$B4]>0;[.I3]+[$Income.I4]-[$Expense.I4];"") -> -0.470000000000994 | J4: of:=IF([$Income.$B4]>0;[.J3]+[$Income.J4]-[$Expense.J4];"") -> 210 | K4: of:=IF([$Income.$B4]>0;SUM([.C4:.J4]);"") -> 10015.89 | L4: of:=IF([$Income.$B4]>0;[.K4]-[.B4];"") -> 3858.89 | M4: of:=IF([$Income.$B4]>0;SUM([.E4:.J4]);"") -> 5959.89 | N4: of:=IF([.$B4]<>"";[.B4]-[.M4];"") -> 197.110000000002 | O4: of:=IF([.$B4]<>"";[.N4]-[.C4];"") -> -3630.89 | Q4: of:=IF([$Income.$B4]>0;[.P4]-[.B4];"") -> -6157 | S4: of:=IF([$Income.$B4]>0;[.B4]-SUM([.E4:.J4]);"") -> 197.110000000002 | T4: of:=IF([$Income.$B4]>0;[.S4]-[.C4];"") -> -3630.89
A5: 2010-02-28 | B5: of:=IF([$Income.$B5]>0;[.B4]+[$Income.B5]-[$Expense.B5];"") -> 5532 | C5: of:=IF([$Income.$B5]>0;[.C4]+[$Income.C5]-[$Expense.C5];"") -> 3177 | D5: of:=IF([$Income.$B5]>0;[.D4]+[$Income.D5]-[$Expense.D5];"") -> 277 | E5: of:=IF([$Income.$B5]>0;[.E4]+[$Income.E5]-[$Expense.E5];"") -> 936 | F5: of:=IF([$Income.$B5]>0;[.F4]+[$Income.F5]-[$Expense.F5];"") -> 940.42 | G5: of:=IF([$Income.$B5]>0;[.G4]+[$Income.G5]-[$Expense.G5];"") -> 2900 | H5: of:=IF([$Income.$B5]>0;[.H4]+[$Income.H5]-[$Expense.H5];"") -> 319.94 | I5: of:=IF([$Income.$B5]>0;[.I4]+[$Income.I5]-[$Expense.I5];"") -> -0.470000000000994 | J5: of:=IF([$Income.$B5]>0;[.J4]+[$Income.J5]-[$Expense.J5];"") -> 190 | K5: of:=IF([$Income.$B5]>0;SUM([.C5:.J5]);"") -> 8739.89 | L5: of:=IF([$Income.$B5]>0;[.K5]-[.B5];"") -> 3207.89 | M5: of:=IF([$Income.$B5]>0;SUM([.E5:.J5]);"") -> 5285.89 | N5: of:=IF([.$B5]<>"";[.B5]-[.M5];"") -> 246.110000000001 | O5: of:=IF([.$B5]<>"";[.N5]-[.C5];"") -> -2930.89 | Q5: of:=IF([$Income.$B5]>0;[.P5]-[.B5];"") -> -5532 | S5: of:=IF([$Income.$B5]>0;[.B5]-SUM([.E5:.J5]);"") -> 246.110000000001 | T5: of:=IF([$Income.$B5]>0;[.S5]-[.C5];"") -> -2930.89
A6: 2010-03-31 | B6: of:=IF([$Income.$B6]>0;[.B5]+[$Income.B6]-[$Expense.B6];"") -> 4348.11 | C6: of:=IF([$Income.$B6]>0;[.C5]+[$Income.C6]-[$Expense.C6];"")+['Gnu Switch'.L50] -> 1914.65 | D6: of:=IF([$Income.$B6]>0;[.D5]+[$Income.D6]-[$Expense.D6];"")+['Gnu Switch'.L50] -> 14.6500000000004 | E6: of:=IF([$Income.$B6]>0;[.E5]+[$Income.E6]-[$Expense.E6];"") -> 936 | F6: of:=IF([$Income.$B6]>0;[.F5]+[$Income.F6]-[$Expense.F6];"") -> 1003.42 | G6: of:=IF([$Income.$B6]>0;[.G5]+[$Income.G6]-[$Expense.G6];"") -> 1900 | H6: of:=IF([$Income.$B6]>0;[.H5]+[$Income.H6]-[$Expense.H6];"") -> 259.94 | I6: of:=IF([$Income.$B6]>0;[.I5]+[$Income.I6]-[$Expense.I6];"") -> -0.470000000000994 | J6: of:=IF([$Income.$B6]>0;[.J5]+[$Income.J6]-[$Expense.J6];"") -> 220 | K6: of:=IF([$Income.$B6]>0;SUM([.C6:.J6]);"") -> 6248.19 | L6: of:=IF([$Income.$B6]>0;[.K6]-[.B6];"") -> 1900.08 | M6: of:=IF([$Income.$B6]>0;SUM([.E6:.J6]);"") -> 4318.89 | N6: of:=IF([.$B6]<>"";[.B6]-[.M6];"") -> 29.2200000000003 | O6: of:=IF([.$B6]<>"";[.N6]-[.C6];"") -> -1885.43 | Q6: of:=IF([$Income.$B6]>0;[.P6]-[.B6];"") -> -4348.11 | S6: of:=IF([$Income.$B6]>0;[.B6]-SUM([.E6:.J6]);"") -> 29.2200000000003 | T6: of:=IF([$Income.$B6]>0;[.S6]-[.C6];"") -> -1885.43
A7: 2010-04-30 | B7: of:=IF([$Income.$B7]>0;[.B6]+[$Income.B7]-[$Expense.B7];"") -> 3031.28 | C7: of:=IF([$Income.$B7]>0;[.C6]+[$Income.C7]-[$Expense.C7];"") -> 951.820000000001 | D7: of:=IF([$Income.$B7]>0;[.D6]+[$Income.D7]-[$Expense.D7];"") -> 51.8200000000006 | E7: of:=IF([$Income.$B7]>0;[.E6]+[$Income.E7]-[$Expense.E7];"") -> 936 | F7: of:=IF([$Income.$B7]>0;[.F6]+[$Income.F7]-[$Expense.F7];"") -> 868.42 | G7: of:=IF([$Income.$B7]>0;[.G6]+[$Income.G7]-[$Expense.G7];"") -> 900 | H7: of:=IF([$Income.$B7]>0;[.H6]+[$Income.H7]-[$Expense.H7];"") -> 259.94 | I7: of:=IF([$Income.$B7]>0;[.I6]+[$Income.I7]-[$Expense.I7];"") -> -0.470000000000994 | J7: of:=IF([$Income.$B7]>0;[.J6]+[$Income.J7]-[$Expense.J7];"") -> 0 | K7: of:=IF([$Income.$B7]>0;SUM([.C7:.J7]);"") -> 3967.53 | L7: of:=IF([$Income.$B7]>0;[.K7]-[.B7];"") -> 936.25 | M7: of:=IF([$Income.$B7]>0;SUM([.E7:.J7]);"") -> 2963.89 | N7: of:=IF([.$B7]<>"";[.B7]-[.M7];"") -> 67.3900000000003 | O7: of:=IF([.$B7]<>"";[.N7]-[.C7];"") -> -884.43 | Q7: of:=IF([$Income.$B7]>0;[.P7]-[.B7];"") -> -3031.28 | S7: of:=IF([$Income.$B7]>0;[.B7]-SUM([.E7:.J7]);"") -> 67.3900000000003 | T7: of:=IF([$Income.$B7]>0;[.S7]-[.C7];"") -> -884.43
A8: 2010-05-31 | B8: of:=IF([$Income.$B8]>0;[.B7]+[$Income.B8]-[$Expense.B8];"") -> 2739.48 | C8: of:=IF([$Income.$B8]>0;[.C7]+[$Income.C8]-[$Expense.C8];"") -> 690.02 | D8: of:=IF([$Income.$B8]>0;[.D7]+[$Income.D8]-[$Expense.D8];"") -> 690.02 | E8: of:=IF([$Income.$B8]>0;[.E7]+[$Income.E8]-[$Expense.E8];"") -> 936 | F8: of:=IF([$Income.$B8]>0;[.F7]+[$Income.F8]-[$Expense.F8];"") -> 838.42 | G8: of:=IF([$Income.$B8]>0;[.G7]+[$Income.G8]-[$Expense.G8];"") -> 0 | H8: of:=IF([$Income.$B8]>0;[.H7]+[$Income.H8]-[$Expense.H8];"") -> 259.94 | I8: of:=IF([$Income.$B8]>0;[.I7]+[$Income.I8]-[$Expense.I8];"") -> -0.470000000000994 | J8: of:=IF([$Income.$B8]>0;[.J7]+[$Income.J8]-[$Expense.J8];"") -> 0 | K8: of:=IF([$Income.$B8]>0;SUM([.C8:.J8]);"") -> 3413.93 | L8: of:=IF([$Income.$B8]>0;[.K8]-[.B8];"") -> 674.45 | M8: of:=IF([$Income.$B8]>0;SUM([.E8:.J8]);"") -> 2033.89 | N8: of:=IF([.$B8]<>"";[.B8]-[.M8];"") -> 705.59 | O8: of:=IF([.$B8]<>"";[.N8]-[.C8];"") -> 15.5699999999999 | Q8: of:=IF([$Income.$B8]>0;[.P8]-[.B8];"") -> -2739.48 | S8: of:=IF([$Income.$B8]>0;[.B8]-SUM([.E8:.J8]);"") -> 705.59 | T8: of:=IF([$Income.$B8]>0;[.S8]-[.C8];"") -> 15.5699999999999
A9: 2010-06-30 | B9: of:=IF([$Income.$B9]>0;[.B8]+[$Income.B9]-[$Expense.B9];"") -> 2802.87 | C9: of:=IF([$Income.$B9]>0;[.C8]+[$Income.C9]-[$Expense.C9];"") -> 687.41 | D9: of:=IF([$Income.$B9]>0;[.D8]+[$Income.D9]-[$Expense.D9];"") -> 687.41 | E9: of:=IF([$Income.$B9]>0;[.E8]+[$Income.E9]-[$Expense.E9];"") -> 936 | F9: of:=IF([$Income.$B9]>0;[.F8]+[$Income.F9]-[$Expense.F9];"") -> 904.42 | G9: of:=IF([$Income.$B9]>0;[.G8]+[$Income.G9]-[$Expense.G9];"") -> 0 | H9: of:=IF([$Income.$B9]>0;[.H8]+[$Income.H9]-[$Expense.H9];"") -> 259.94 | I9: of:=IF([$Income.$B9]>0;[.I8]+[$Income.I9]-[$Expense.I9];"") -> -0.470000000000994 | J9: of:=IF([$Income.$B9]>0;[.J8]+[$Income.J9]-[$Expense.J9];"") -> 0 | K9: of:=IF([$Income.$B9]>0;SUM([.C9:.J9]);"") -> 3474.71 | L9: of:=IF([$Income.$B9]>0;[.K9]-[.B9];"") -> 671.84 | M9: of:=IF([$Income.$B9]>0;SUM([.E9:.J9]);"") -> 2099.89 | N9: of:=IF([.$B9]<>"";[.B9]-[.M9];"") -> 702.98 | O9: of:=IF([.$B9]<>"";[.N9]-[.C9];"") -> 15.5699999999997 | Q9: of:=IF([$Income.$B9]>0;[.P9]-[.B9];"") -> -2802.87 | S9: of:=IF([$Income.$B9]>0;[.B9]-SUM([.E9:.J9]);"") -> 702.98 | T9: of:=IF([$Income.$B9]>0;[.S9]-[.C9];"") -> 15.5699999999997
A10: 2010-07-31 | B10: of:=IF([$Income.$B10]>0;[.B9]+[$Income.B10]-[$Expense.B10];"") -> 2093.89 | C10: of:=IF([$Income.$B10]>0;[.C9]+[$Income.C10]-[$Expense.C10];"") -> 478.41 | D10: of:=IF([$Income.$B10]>0;[.D9]+[$Income.D10]-[$Expense.D10];"") -> 478.41 | E10: of:=IF([$Income.$B10]>0;[.E9]+[$Income.E10]-[$Expense.E10];"") -> 936 | F10: of:=IF([$Income.$B10]>0;[.F9]+[$Income.F10]-[$Expense.F10];"") -> 404.42 | G10: of:=IF([$Income.$B10]>0;[.G9]+[$Income.G10]-[$Expense.G10];"") -> 0 | H10: of:=IF([$Income.$B10]>0;[.H9]+[$Income.H10]-[$Expense.H10];"") -> 259.94 | I10: of:=IF([$Income.$B10]>0;[.I9]+[$Income.I10]-[$Expense.I10];"") -> -0.00000000000099475983006414 | J10: of:=IF([$Income.$B10]>0;[.J9]+[$Income.J10]-[$Expense.J10];"") -> 0 | K10: of:=IF([$Income.$B10]>0;SUM([.C10:.J10]);"") -> 2557.18 | L10: of:=IF([$Income.$B10]>0;[.K10]-[.B10];"") -> 463.29 | M10: of:=IF([$Income.$B10]>0;SUM([.E10:.J10]);"") -> 1600.36 | N10: of:=IF([.$B10]<>"";[.B10]-[.M10];"") -> 493.53 | O10: of:=IF([.$B10]<>"";[.N10]-[.C10];"") -> 15.1200000000003 | Q10: of:=IF([$Income.$B10]>0;[.P10]-[.B10];"") -> -2093.89 | S10: of:=IF([$Income.$B10]>0;[.B10]-SUM([.E10:.J10]);"") -> 493.53 | T10: of:=IF([$Income.$B10]>0;[.S10]-[.C10];"") -> 15.1200000000003
A11: 2010-08-31 | B11: of:=IF([$Income.$B11]>0;[.B10]+[$Income.B11]-[$Expense.B11];"") -> 2250.7 | C11: of:=IF([$Income.$B11]>0;[.C10]+[$Income.C11]-[$Expense.C11];"") -> 622.19 | D11: of:=IF([$Income.$B11]>0;[.D10]+[$Income.D11]-[$Expense.D11];"") -> 622.19 | E11: of:=IF([$Income.$B11]>0;[.E10]+[$Income.E11]-[$Expense.E11];"") -> 936 | F11: of:=IF([$Income.$B11]>0;[.F10]+[$Income.F11]-[$Expense.F11];"") -> 477.42 | G11: of:=IF([$Income.$B11]>0;[.G10]+[$Income.G11]-[$Expense.G11];"") -> 0 | H11: of:=IF([$Income.$B11]>0;[.H10]+[$Income.H11]-[$Expense.H11];"") -> 259.94 | I11: of:=IF([$Income.$B11]>0;[.I10]+[$Income.I11]-[$Expense.I11];"") -> -59.950000000001 | J11: of:=IF([$Income.$B11]>0;[.J10]+[$Income.J11]-[$Expense.J11];"") -> 0 | K11: of:=IF([$Income.$B11]>0;SUM([.C11:.J11]);"") -> 2857.79 | L11: of:=IF([$Income.$B11]>0;[.K11]-[.B11];"") -> 607.089999999999 | M11: of:=IF([$Income.$B11]>0;SUM([.E11:.J11]);"") -> 1613.41 | N11: of:=IF([.$B11]<>"";[.B11]-[.M11];"") -> 637.29 | O11: of:=IF([.$B11]<>"";[.N11]-[.C11];"") -> 15.1000000000001 | Q11: of:=IF([$Income.$B11]>0;[.P11]-[.B11];"") -> -2250.7 | S11: of:=IF([$Income.$B11]>0;[.B11]-SUM([.E11:.J11]);"") -> 637.29 | T11: of:=IF([$Income.$B11]>0;[.S11]-[.C11];"") -> 15.1000000000001
A12: 2010-09-30 | B12: of:=IF([$Income.$B12]>0;[.B11]+[$Income.B12]-[$Expense.B12];"") -> 1673.19 | C12: of:=IF([$Income.$B12]>0;[.C11]+[$Income.C12]-[$Expense.C12];"") -> -15.2700000000004 | D12: of:=IF([$Income.$B12]>0;[.D11]+[$Income.D12]-[$Expense.D12];"") -> -15.2700000000004 | E12: of:=IF([$Income.$B12]>0;[.E11]+[$Income.E12]-[$Expense.E12];"") -> 936 | F12: of:=IF([$Income.$B12]>0;[.F11]+[$Income.F12]-[$Expense.F12];"") -> 477.42 | G12: of:=IF([$Income.$B12]>0;[.G11]+[$Income.G12]-[$Expense.G12];"") -> 0 | H12: of:=IF([$Income.$B12]>0;[.H11]+[$Income.H12]-[$Expense.H12];"") -> 259.94 | I12: of:=IF([$Income.$B12]>0;[.I11]+[$Income.I12]-[$Expense.I12];"") -> -0.00000000000099475983006414 | J12: of:=IF([$Income.$B12]>0;[.J11]+[$Income.J12]-[$Expense.J12];"") -> 0 | K12: of:=IF([$Income.$B12]>0;SUM([.C12:.J12]);"") -> 1642.82 | L12: of:=IF([$Income.$B12]>0;[.K12]-[.B12];"") -> -30.3700000000003 | M12: of:=IF([$Income.$B12]>0;SUM([.E12:.J12]);"") -> 1673.36 | N12: of:=IF([.$B12]<>"";[.B12]-[.M12];"") -> -0.170000000000528 | O12: of:=IF([.$B12]<>"";[.N12]-[.C12];"") -> 15.0999999999999 | Q12: of:=IF([$Income.$B12]>0;[.P12]-[.B12];"") -> -1673.19 | S12: of:=IF([$Income.$B12]>0;[.B12]-SUM([.E12:.J12]);"") -> -0.170000000000528 | T12: of:=IF([$Income.$B12]>0;[.S12]-[.C12];"") -> 15.0999999999999
A13: 2010-10-31 | B13: of:=IF([$Income.$B13]>0;[.B12]+[$Income.B13]-[$Expense.B13];"") -> 3918.56 | C13: of:=IF([$Income.$B13]>0;[.C12]+[$Income.C13]-[$Expense.C13];"") -> 2230.1 | D13: of:=IF([$Income.$B13]>0;[.D12]+[$Income.D13]-[$Expense.D13];"") -> 2230.1 | E13: of:=IF([$Income.$B13]>0;[.E12]+[$Income.E13]-[$Expense.E13];"") -> 936 | F13: of:=IF([$Income.$B13]>0;[.F12]+[$Income.F13]-[$Expense.F13];"") -> 477.42 | G13: of:=IF([$Income.$B13]>0;[.G12]+[$Income.G13]-[$Expense.G13];"") -> 0 | H13: of:=IF([$Income.$B13]>0;[.H12]+[$Income.H13]-[$Expense.H13];"") -> 259.94 | I13: of:=IF([$Income.$B13]>0;[.I12]+[$Income.I13]-[$Expense.I13];"") -> -0.00000000000099475983006414 | J13: of:=IF([$Income.$B13]>0;[.J12]+[$Income.J13]-[$Expense.J13];"") -> 0 | K13: of:=IF([$Income.$B13]>0;SUM([.C13:.J13]);"") -> 6133.56 | L13: of:=IF([$Income.$B13]>0;[.K13]-[.B13];"") -> 2215 | M13: of:=IF([$Income.$B13]>0;SUM([.E13:.J13]);"") -> 1673.36 | N13: of:=IF([.$B13]<>"";[.B13]-[.M13];"") -> 2245.2 | O13: of:=IF([.$B13]<>"";[.N13]-[.C13];"") -> 15.1000000000008 | Q13: of:=IF([$Income.$B13]>0;[.P13]-[.B13];"") -> -3918.56 | S13: of:=IF([$Income.$B13]>0;[.B13]-SUM([.E13:.J13]);"") -> 2245.2 | T13: of:=IF([$Income.$B13]>0;[.S13]-[.C13];"") -> 15.1000000000008
A14: 2010-11-30 | B14: of:=IF([$Income.$B14]>0;[.B13]+[$Income.B14]-[$Expense.B14];"") -> 1695.29 | C14: of:=IF([$Income.$B14]>0;[.C13]+[$Income.C14]-[$Expense.C14];"") -> -57.1700000000001 | D14: of:=IF([$Income.$B14]>0;[.D13]+[$Income.D14]-[$Expense.D14];"") -> -57.1700000000001 | E14: of:=IF([$Income.$B14]>0;[.E13]+[$Income.E14]-[$Expense.E14];"") -> 936 | F14: of:=IF([$Income.$B14]>0;[.F13]+[$Income.F14]-[$Expense.F14];"") -> 541.42 | G14: of:=IF([$Income.$B14]>0;[.G13]+[$Income.G14]-[$Expense.G14];"") -> 0 | H14: of:=IF([$Income.$B14]>0;[.H13]+[$Income.H14]-[$Expense.H14];"") -> 259.94 | I14: of:=IF([$Income.$B14]>0;[.I13]+[$Income.I14]-[$Expense.I14];"") -> -0.00000000000099475983006414 | J14: of:=IF([$Income.$B14]>0;[.J13]+[$Income.J14]-[$Expense.J14];"") -> 0 | K14: of:=IF([$Income.$B14]>0;SUM([.C14:.J14]);"") -> 1623.02 | L14: of:=IF([$Income.$B14]>0;[.K14]-[.B14];"") -> -72.2699999999991 | M14: of:=IF([$Income.$B14]>0;SUM([.E14:.J14]);"") -> 1737.36 | N14: of:=IF([.$B14]<>"";[.B14]-[.M14];"") -> -42.0700000000011 | O14: of:=IF([.$B14]<>"";[.N14]-[.C14];"") -> 15.099999999999 | Q14: of:=IF([$Income.$B14]>0;[.P14]-[.B14];"") -> -1695.29 | S14: of:=IF([$Income.$B14]>0;[.B14]-SUM([.E14:.J14]);"") -> -42.0700000000011 | T14: of:=IF([$Income.$B14]>0;[.S14]-[.C14];"") -> 15.099999999999
A15: 2010-12-31 | B15: of:=IF([$Income.$B15]>0;[.B14]+[$Income.B15]-[$Expense.B15];"") -> 1760.44 | C15: of:=IF([$Income.$B15]>0;[.C14]+[$Income.C15]-[$Expense.C15];"") -> -82.0199999999995 | D15: of:=IF([$Income.$B15]>0;[.D14]+[$Income.D15]-[$Expense.D15];"") -> -82.0199999999995 | E15: of:=IF([$Income.$B15]>0;[.E14]+[$Income.E15]-[$Expense.E15];"") -> 936 | F15: of:=IF([$Income.$B15]>0;[.F14]+[$Income.F15]-[$Expense.F15];"") -> 581.42 | G15: of:=IF([$Income.$B15]>0;[.G14]+[$Income.G15]-[$Expense.G15];"") -> 0 | H15: of:=IF([$Income.$B15]>0;[.H14]+[$Income.H15]-[$Expense.H15];"") -> 259.94 | I15: of:=IF([$Income.$B15]>0;[.I14]+[$Income.I15]-[$Expense.I15];"") -> -0.00000000000099475983006414 | J15: of:=IF([$Income.$B15]>0;[.J14]+[$Income.J15]-[$Expense.J15];"") -> 50 | K15: of:=IF([$Income.$B15]>0;SUM([.C15:.J15]);"") -> 1663.32 | L15: of:=IF([$Income.$B15]>0;[.K15]-[.B15];"") -> -97.1199999999976 | M15: of:=IF([$Income.$B15]>0;SUM([.E15:.J15]);"") -> 1827.36 | N15: of:=IF([.$B15]<>"";[.B15]-[.M15];"") -> -66.9200000000014 | O15: of:=IF([.$B15]<>"";[.N15]-[.C15];"") -> 15.0999999999981 | Q15: of:=IF([$Income.$B15]>0;[.P15]-[.B15];"") -> -1760.44 | S15: of:=IF([$Income.$B15]>0;[.B15]-SUM([.E15:.J15]);"") -> -66.9200000000014 | T15: of:=IF([$Income.$B15]>0;[.S15]-[.C15];"") -> 15.0999999999981
O34: Total
O35: QHCC
O36: Diff
B38: Month | C38: Income | D38: Expense | E38: General Fund | F38: Actual Balance | G38: Unpaid Bills | I38: General
B39: of:=[Income.A4] -> 2010-01-31 | C39: of:=IF([$Income.$C4] > 0;[$Income.$C4];"") -> 6163 | D39: of:=IF([$Expense.$C4] > 0;[$Expense.$C4];"") -> 7815 | E39: of:=IF([.G39]<>0;[.F39]-[.G39];[.F39]) -> 3828 | F39: of:=[.$C4] -> 3828 | G39: 0 | I39: of:=[.$C4] -> 3828
B40: of:=[Income.A5] -> 2010-02-28 | C40: of:=IF([$Income.$C5] > 0;[$Income.$C5];"") -> 6021 | D40: of:=IF([$Expense.$C5] > 0;[$Expense.$C5];"") -> 6672 | E40: of:=IF([.G40]<>0;[.F40]-[.G40];[.F40]) -> 3177 | F40: of:=[.$C5] -> 3177 | G40: 0 | I40: of:=[.$C5] -> 3177
B41: of:=[Income.A6] -> 2010-03-28 | C41: of:=IF([$Income.$C6] > 0;[$Income.$C6];"") -> 5119.67 | D41: of:=IF([$Expense.$C6] > 0;[$Expense.$C6];"") -> 6364.61 | E41: of:=IF([.G41]<>0;[.F41]-[.G41];[.F41]) -> 1914.65 | F41: of:=[.$C6] -> 1914.65 | G41: 0 | I41: of:=[.$C6] -> 1914.65
B42: of:=[Income.A7] -> 2010-04-25 | C42: of:=IF([$Income.$C7] > 0;[$Income.$C7];"") -> 5291.8 | D42: of:=IF([$Expense.$C7] > 0;[$Expense.$C7];"") -> 6254.63 | E42: of:=IF([.G42]<>0;[.F42]-[.G42];[.F42]) -> 951.820000000001 | F42: of:=[.$C7] -> 951.820000000001 | G42: 0 | I42: of:=[.$C7] -> 951.820000000001
B43: of:=[Income.A8] -> 2010-05-23 | C43: of:=IF([$Income.$C8] > 0;[$Income.$C8];"") -> 5316 | D43: of:=IF([$Expense.$C8] > 0;[$Expense.$C8];"") -> 5577.8 | E43: of:=IF([.G43]<>0;[.F43]-[.G43];[.F43]) -> -433.98 | F43: of:=[.$C8] -> 690.02 | G43: 1124 | I43: of:=[.$C8] -> 690.02
B44: of:=[Income.A9] -> 2010-06-20 | C44: of:=IF([$Income.$C9] > 0;[$Income.$C9];"") -> 4031 | D44: of:=IF([$Expense.$C9] > 0;[$Expense.$C9];"") -> 4033.61 | E44: of:=IF([.G44]<>0;[.F44]-[.G44];[.F44]) -> -2060.59 | F44: of:=[.$C9] -> 687.41 | G44: 2748 | I44: of:=[.$C9] -> 687.41
B45: of:=[Income.A10] -> 2010-07-18 | C45: of:=IF([$Income.$C10] > 0;[$Income.$C10];"") -> 6841 | D45: of:=IF([$Expense.$C10] > 0;[$Expense.$C10];"") -> 7050 | E45: of:=IF([.G45]<>0;[.F45]-[.G45];[.F45]) -> -1769.59 | F45: of:=[.$C10] -> 478.41 | G45: 2248 | I45: of:=[.$C10] -> 478.41
B46: of:=[Income.A11] -> 2010-08-15 | C46: of:=IF([$Income.$C11] > 0;[$Income.$C11];"") -> 6231 | D46: of:=IF([$Expense.$C11] > 0;[$Expense.$C11];"") -> 6087.22 | E46: of:=IF([.G46]<>0;[.F46]-[.G46];[.F46]) -> -2749.81 | F46: of:=[.$C11] -> 622.19 | G46: 3372 | I46: of:=[.$C11] -> 622.19
B47: of:=[Income.A12] -> 2010-09-12 | C47: of:=IF([$Income.$C12] > 0;[$Income.$C12];"") -> 5684 | D47: of:=IF([$Expense.$C12] > 0;[$Expense.$C12];"") -> 6321.46 | E47: of:=IF([.G47]<>0;[.F47]-[.G47];[.F47]) -> -3949.27 | F47: of:=[.$C12] -> -15.2700000000004 | G47: 3934 | I47: of:=[.$C12] -> -15.2700000000004
B48: of:=[Income.A13] -> 2010-10-10 | C48: of:=IF([$Income.$C13] > 0;[$Income.$C13];"") -> 7842 | D48: of:=IF([$Expense.$C13] > 0;[$Expense.$C13];"") -> 5596.63 | E48: of:=IF([.G48]<>0;[.F48]-[.G48];[.F48]) -> -4706.9 | F48: of:=[.$C13] -> 2230.1 | G48: 6937 | I48: of:=[.$C13] -> 2230.1
B49: of:=[Income.A14] -> 2010-11-07 | C49: of:=IF([$Income.$C14] > 0;[$Income.$C14];"") -> 5134 | D49: of:=IF([$Expense.$C14] > 0;[$Expense.$C14];"") -> 7421.27 | E49: of:=IF([.G49]<>0;[.F49]-[.G49];[.F49]) -> -5205.17 | F49: of:=[.$C14] -> -57.1700000000001 | G49: 5148 | I49: of:=[.$C14] -> -57.1700000000001
B50: of:=[Income.A15] -> 2010-12-05 | C50: of:=IF([$Income.$C15] > 0;[$Income.$C15];"") -> 5973 | D50: of:=IF([$Expense.$C15] > 0;[$Expense.$C15];"") -> 5997.85 | E50: of:=IF([.G50]<>0;[.F50]-[.G50];[.F50]) -> -4758.02 | F50: of:=[.$C15] -> -82.0199999999995 | G50: 4676 | I50: of:=[.$C15] -> -82.0199999999995

Sheet: Income
A1: QHCC Income 2010
A2: Date | B2: QHCC Account | C2: General | D2: Gen – Hold | E2: Parsonage | F2: Deacon | G2: Holding | H2: Youth | I2: DSL | J2: Temporary | K2: Total | L2: Diff
A4: 2010-01-31 | B4: 6483 | C4: 6163 | D4: of:=[.C4]-[.G4] -> 6163 | F4: 59 | I4: 60 | J4: 200 | K4: of:=[.D4]+SUM([.E4:.J4]) -> 6482 | L4: of:=[.K4]-[.B4] -> -1 | O4: 7364
A5: 2010-02-28 | B5: 6223 | C5: 6021 | D5: of:=[.C5]-[.G5] -> 6021 | F5: 46 | I5: 60 | J5: 95 | K5: of:=[.D5]+SUM([.E5:.J5]) -> 6222 | L5: of:=[.K5]-[.B5] -> -1 | O5: 5688
A6: 2010-03-28 | B6: 5240.67 | C6: 5119.67 | D6: of:=[.C6]-[.G6] -> 5119.67 | F6: 63 | I6: 58 | J6: 30 | K6: of:=[.D6]+SUM([.E6:.J6]) -> 5270.67 | L6: of:=[.K6]-[.B6] -> 30 | O6: 8019
A7: 2010-04-25 | B7: 5592.64 | C7: 5291.8 | D7: of:=[.C7]-[.G7] -> 5291.8 | F7: 65 | I7: 59.95 | J7: 104 | K7: of:=[.D7]+SUM([.E7:.J7]) -> 5520.75 | L7: of:=[.K7]-[.B7] -> -71.8900000000003 | O7: 5809
A8: 2010-05-23 | B8: 5417.3 | C8: 5316 | D8: of:=[.C8]-[.G8] -> 5316 | F8: 40 | I8: 59.95 | K8: of:=[.D8]+SUM([.E8:.J8]) -> 5415.95 | L8: of:=[.K8]-[.B8] -> -1.35000000000036 | O8: 5677
A9: 2010-06-20 | B9: 4156.95 | C9: 4031 | D9: of:=[.C9]-[.G9] -> 4031 | F9: 66 | I9: 59.95 | K9: of:=[.D9]+SUM([.E9:.J9]) -> 4156.95 | L9: of:=[.K9]-[.B9] -> 0 | O9: 6560
A10: 2010-07-18 | B10: 6407.85 | C10: 6841 | D10: of:=[.C10]-[.G10] -> 6841 | I10: 60.42 | K10: of:=[.D10]+SUM([.E10:.J10]) -> 6901.42 | L10: of:=[.K10]-[.B10] -> 493.57 | O10: 5273
A11: 2010-08-15 | B11: 6305.48 | C11: 6231 | D11: of:=[.C11]-[.G11] -> 6231 | F11: 73 | K11: of:=[.D11]+SUM([.E11:.J11]) -> 6304 | L11: of:=[.K11]-[.B11] -> -1.47999999999956 | O11: 7133
A12: 2010-09-12 | B12: 5803.9 | C12: 5684 | D12: of:=[.C12]-[.G12] -> 5684 | I12: 119.9 | K12: of:=[.D12]+SUM([.E12:.J12]) -> 5803.9 | L12: of:=[.K12]-[.B12] -> 0 | O12: of:=SUM([.O4:.O11]) -> 51523
A13: 2010-10-10 | B13: 7901.95 | C13: 7842 | D13: of:=[.C13]-[.G13] -> 7842 | I13: 59.95 | K13: of:=[.D13]+SUM([.E13:.J13]) -> 7901.95 | L13: of:=[.K13]-[.B13] -> 0 | O13: of:=[.O12]/8 -> 6440.375
A14: 2010-11-07 | B14: 5257.95 | C14: 5134 | D14: of:=[.C14]-[.G14] -> 5134 | F14: 64 | I14: 59.95 | K14: of:=[.D14]+SUM([.E14:.J14]) -> 5257.95 | L14: of:=[.K14]-[.B14] -> 0
A15: 2010-12-05 | B15: 6122.95 | C15: 5973 | D15: of:=[.C15]-[.G15] -> 5973 | F15: 40 | I15: 59.95 | J15: 50 | K15: of:=[.D15]+SUM([.E15:.J15]) -> 6122.95 | L15: of:=[.K15]-[.B15] -> 0
A16: Total for Year | B16: of:=SUM([.B4:.B15]) -> 70913.64 | C16: of:=SUM([.C4:.C15]) -> 69647.47 | E16: of:=SUM([.E4:.E15]) -> 0 | F16: of:=SUM([.F4:.F15]) -> 516 | G16: of:=SUM([.G4:.G15]) -> 0 | H16: of:=SUM([.H4:.H15]) -> 0 | I16: of:=SUM([.I4:.I15]) -> 718.02 | J16: of:=SUM([.J4:.J15]) -> 479 | K16: of:=SUM([.K4:.K15]) -> 71360.49 | L16: of:=SUM([.L4:.L15]) -> 446.849999999999
A17: Monthly Average | B17: of:=[.B16]/[.$B$23] -> 1181.64479784608 | C17: of:=[.C16]/[.$B$23] -> 1160.54641404165 | E17: of:=[.E16]/[.$B$23] -> 0 | F17: of:=[.F16]/[.$B$23] -> 8.59818669142601 | G17: of:=[.G16]/[.$B$23] -> 0 | H17: of:=[.H16]/[.$B$23] -> 0 | I17: of:=[.I16]/[.$B$23] -> 11.9644767600343 | J17: of:=[.J16]/[.$B$23] -> 7.98165004882375 | K17: of:=[.K16]/[.$B$23] -> 1189.09072754194 | L17: of:=[.L16]/[.$B$23] -> 7.4459296958599
A18: Weekly Average | B18: of:=[.B16]/[.$B$22] -> 271.754039751048 | C18: of:=[.C16]/[.$B$22] -> 266.901844707731 | E18: of:=[.E16]/[.$B$22] -> 0 | F18: of:=[.F16]/[.$B$22] -> 1.97740638488647 | G18: of:=[.G16]/[.$B$22] -> 0 | H18: of:=[.H16]/[.$B$22] -> 0 | I18: of:=[.I16]/[.$B$22] -> 2.75158397766703 | J18: of:=[.J16]/[.$B$22] -> 1.83561561697795 | K18: of:=[.K16]/[.$B$22] -> 273.466450687262 | L18: of:=[.L16]/[.$B$22] -> 1.71241093621419
A20: Today | B20: of:=NOW() -> 2010-12-31T15:14:36.59
A21: Day | B21: of:=[.B20]-DATE(2005;12;31) -> 1826.63514571759
A22: Week | B22: of:=[.B21]/7 -> 260.947877959656
A23: Month | B23: of:=[.B21]/365.25*12 -> 60.0126536580728

Sheet: Expense
A1: QHCC Expenses 2010
A2: Date | B2: QHCC Account | C2: General | D2: Gen – Hold | E2: Parsonage | F2: Deacon | G2: Holding | H2: Youth | I2: DSL | J2: Temporary | K2: Total | L2: Diff | M2: Gnu General | N2: Mortgage
A4: 2010-01-31 | B4: 7876 | C4: of:=[.M4]+[.N4] -> 7815 | D4: of:=[.C4]-[.G4] -> 7115 | G4: 700 | I4: 60 | K4: of:=[.D4]+SUM([.E4:.J4]) -> 7875 | L4: of:=[.K4]-[.B4] -> -1 | M4: 7815
A5: 2010-02-28 | B5: 6848 | C5: of:=[.M5]+[.N5] -> 6672 | D5: of:=[.C5]-[.G5] -> 5972 | G5: 700 | I5: 60 | J5: 115 | K5: of:=[.D5]+SUM([.E5:.J5]) -> 6847 | L5: of:=[.K5]-[.B5] -> -1 | M5: 6672
A6: 2010-03-28 | B6: of:=5275.02+1149.54 -> 6424.56 | C6: of:=[.M6]+[.N6] -> 6364.61 | D6: of:=[.C6]-[.G6] -> 5364.61 | G6: 1000 | H6: 60 | I6: 58 | K6: of:=[.D6]+SUM([.E6:.J6]) -> 6482.61 | L6: of:=[.K6]-[.B6] -> 58.0499999999993 | M6: 5215.07 | N6: 1149.54
A7: 2010-04-25 | B7: 6909.47 | C7: of:=[.M7]+[.N7] -> 6254.63 | D7: of:=[.C7]-[.G7] -> 5254.63 | F7: 200 | G7: 1000 | I7: 59.95 | J7: 324 | K7: of:=[.D7]+SUM([.E7:.J7]) -> 6838.58 | L7: of:=[.K7]-[.B7] -> -70.8900000000003 | M7: 6254.63
A8: 2010-05-23 | B8: 5709.1 | C8: of:=[.M8]+[.N8] -> 5577.8 | D8: of:=[.C8]-[.G8] -> 4677.8 | F8: 70 | G8: 900 | I8: 59.95 | K8: of:=[.D8]+SUM([.E8:.J8]) -> 5707.75 | L8: of:=[.K8]-[.B8] -> -1.35000000000036 | M8: 5326.99 | N8: 250.81
A9: 2010-06-20 | B9: 4093.56 | C9: of:=[.M9]+[.N9] -> 4033.61 | D9: of:=[.C9]-[.G9] -> 4033.61 | I9: 59.95 | K9: of:=[.D9]+SUM([.E9:.J9]) -> 4093.56 | L9: of:=[.K9]-[.B9] -> 0 | M9: 4033.61
A10: 2010-07-18 | B10: 7116.83 | C10: of:=[.M10]+[.N10] -> 7050 | D10: of:=[.C10]-[.G10] -> 7050 | F10: 500 | I10: 59.95 | K10: of:=[.D10]+SUM([.E10:.J10]) -> 7609.95 | L10: of:=[.K10]-[.B10] -> 493.12 | M10: 7050
A11: 2010-08-15 | B11: 6148.67 | C11: of:=[.M11]+[.N11] -> 6087.22 | D11: of:=[.C11]-[.G11] -> 6087.22 | I11: 59.95 | K11: of:=[.D11]+SUM([.E11:.J11]) -> 6147.17 | L11: of:=[.K11]-[.B11] -> -1.5 | M11: 6087.22
A12: 2010-09-12 | B12: of:=6381.41 -> 6381.41 | C12: of:=[.M12]+[.N12] -> 6321.46 | D12: of:=[.C12]-[.G12] -> 6321.46 | I12: 59.95 | K12: of:=[.D12]+SUM([.E12:.J12]) -> 6381.41 | L12: of:=[.K12]-[.B12] -> 0 | M12: 5188.45 | N12: 1133.01
A13: 2010-10-10 | B13: 5656.58 | C13: of:=[.M13]+[.N13] -> 5596.63 | D13: of:=[.C13]-[.G13] -> 5596.63 | I13: 59.95 | K13: of:=[.D13]+SUM([.E13:.J13]) -> 5656.58 | L13: of:=[.K13]-[.B13] -> 0 | M13: 5596.63
A14: 2010-11-07 | B14: of:=7480.22+1 -> 7481.22 | C14: of:=[.M14]+[.N14]+1 -> 7421.27 | D14: of:=[.C14]-[.G14] -> 7421.27 | I14: 59.95 | K14: of:=[.D14]+SUM([.E14:.J14]) -> 7481.22 | L14: of:=[.K14]-[.B14] -> 0 | M14: 6692.4 | N14: 727.87
A15: 2010-12-05 | B15: 6057.8 | C15: of:=[.M15]+[.N15] -> 5997.85 | D15: of:=[.C15]-[.G15] -> 5997.85 | I15: 59.95 | K15: of:=[.D15]+SUM([.E15:.J15]) -> 6057.8 | L15: of:=[.K15]-[.B15] -> 0 | M15: 4849.98 | N15: of:=247.87+900 -> 1147.87
A16: Total for Year | B16: of:=SUM([.B4:.B15]) -> 76703.2 | C16: of:=SUM([.C4:.C15]) -> 75192.08 | E16: of:=SUM([.E4:.E15]) -> 0 | F16: of:=SUM([.F4:.F15]) -> 770 | G16: of:=SUM([.G4:.G15]) -> 4300 | H16: of:=SUM([.H4:.H15]) -> 60 | I16: of:=SUM([.I4:.I15]) -> 717.55 | J16: of:=SUM([.J4:.J15]) -> 439 | K16: of:=SUM([.K4:.K15]) -> 77178.63 | L16: of:=SUM([.L4:.L15]) -> 475.429999999998
A17: Monthly Average | B17: of:=[.B16]/[$Income.$B$23] -> 1278.11711904998 | C17: of:=[.C16]/[$Income.$B$23] -> 1252.93709604 | E17: of:=[.E16]/[$Income.$B$23] -> 0 | F17: of:=[.F16]/[$Income.$B$23] -> 12.830627427128 | G17: of:=[.G16]/[$Income.$B$23] -> 71.6515557618834 | H17: of:=[.H16]/[$Income.$B$23] -> 0.999789150165815 | I17: of:=[.I16]/[$Income.$B$23] -> 11.956645078358 | J17: of:=[.J16]/[$Income.$B$23] -> 7.31512394871321 | K17: of:=[.K16]/[$Income.$B$23] -> 1286.03928164436 | L17: of:=[.L16]/[$Income.$B$23] -> 7.92216259438886
A18: Weekly Average | B18: of:=[.B16]/[$Income.$B$22] -> 293.940692676791 | C18: of:=[.C16]/[$Income.$B$22] -> 288.14980442809 | E18: of:=[.E16]/[$Income.$B$22] -> 0 | F18: of:=[.F16]/[$Income.$B$22] -> 2.95078084566392 | G18: of:=[.G16]/[$Income.$B$22] -> 16.4783865407206 | H18: of:=[.H16]/[$Income.$B$22] -> 0.229930974986799 | I18: of:=[.I16]/[$Income.$B$22] -> 2.7497828516963 | J18: of:=[.J16]/[$Income.$B$22] -> 1.68232830032008 | K18: of:=[.K16]/[$Income.$B$22] -> 295.762627400757 | L18: of:=[.L16]/[$Income.$B$22] -> 1.82193472396623

Sheet: Gnu Switch
A1: Gnu Switch 3/10/10
A2: Gnu Balances
B3: Date | C3: Ods | D3: Gnu | E3: Diff
A4: Deacon | B4: Now | C4: 940 | D4: 521.55 | E4: of:=[.C4]-[.D4] -> 418.45 | F4: 940 | G4: 893.33 | H4: of:=[.F4]-[.G4] -> 46.67
B5: 2005-12-31 | C5: 429 | D5: 57.22 | E5: of:=[.C5]-[.D5] -> 371.78
B6: 2006-12-31 | C6: 136 | D6: -235.7 | E6: of:=[.C6]-[.D6] -> 371.7
B7: 2007-12-31 | C7: 704 | D7: 332.3 | E7: of:=[.C7]-[.D7] -> 371.7
B8: 2008-12-31 | C8: 710 | D8: 337.8 | E8: of:=[.C8]-[.D8] -> 372.2
B9: 2009-12-31 | C9: 835 | D9: 462.55 | E9: of:=[.C9]-[.D9] -> 372.45
A11: Youth | B11: Now | C11: 320 | D11: 117.76 | E11: of:=[.C11]-[.D11] -> 202.24
B12: 2008-12-31 | C12: 514 | D12: 311.81 | E12: of:=[.C12]-[.D12] -> 202.19
B13: 2007-12-31 | C13: 75 | D13: -126.76 | E13: of:=[.C13]-[.D13] -> 201.76
F14: After 2165.42 adj
A15: Temp | B15: Now | C15: 190 | D15: 2278.23 | E15: of:=[.C15]-[.D15] -> -2088.23 | F15: 112.81 | G15: of:=[.C15]-[.F15] -> 77.19
B16: 2005-12-31 | C16: -633 | D16: 1532.42 | E16: of:=[.C16]-[.D16] -> -2165.42 | F16: -633 | G16: of:=[.C16]-[.F16] -> 0
B17: 2006-12-31 | C17: 139 | D17: 2304.42 | E17: of:=[.C17]-[.D17] -> -2165.42 | F17: 139 | G17: of:=[.C17]-[.F17] -> 0
B18: 2007-12-31 | C18: 0 | D18: 2087.93 | E18: of:=[.C18]-[.D18] -> -2087.93 | F18: -77.49 | G18: of:=[.C18]-[.F18] -> 77.49 | H18: Apr 07 off by $152 which later got put into youth fund.
B19: 2008-12-31 | C19: 0 | D19: 2087.93 | E19: of:=[.C19]-[.D19] -> -2087.93 | F19: -77.49 | G19: of:=[.C19]-[.F19] -> 77.49
B20: 2009-12-31 | C20: 10 | D20: 2098.23 | E20: of:=[.C20]-[.D20] -> -2088.23 | F20: -67.19 | G20: of:=[.C20]-[.F20] -> 77.19
A22: QHCC Balances
A23: Checking | B23: Date | C23: Old | D23: Gnu | E23: Diff | I23: 2004-11-30 | J23: 2004-12-31 | K23: Diff
B24: 2001-12-31 | C24: 12011.84 | D24: 12011.84 | E24: of:=[.C24]-[.D24] -> 0 | H24: Deacon's | I24: 84.93 | J24: 149.78 | K24: of:=[.J24]-[.I24] -> 64.85
B25: 2002-12-31 | C25: 17811.12 | D25: 17238.42 | E25: of:=[.C25]-[.D25] -> 572.700000000001 | H25: Gen | I25: 15083.4 | J25: 17836.97 | K25: of:=[.J25]-[.I25] -> 2753.57
B26: 2002-06-30 | C26: 15218.68 | D26: 15218.68 | E26: of:=[.C26]-[.D26] -> 0 | H26: Par | I26: 9664.22 | J26: 9664.22 | K26: of:=[.J26]-[.I26] -> 0
B27: 2002-09-30 | C27: 15317.02 | D27: 14744.32 | E27: of:=[.C27]-[.D27] -> 572.700000000001 | H27: Restore | I27: 741.92 | J27: 741.92 | K27: of:=[.J27]-[.I27] -> 0
B28: 2002-07-31 | C28: 13875.4 | D28: 13302.7 | E28: of:=[.C28]-[.D28] -> 572.699999999999 | H28: Temp | I28: 426.5 | J28: 426.5 | K28: of:=[.J28]-[.I28] -> 0
B29: 2003-12-31 | C29: 15786.81 | D29: 15786.81 | E29: of:=[.C29]-[.D29] -> 0 | H29: Youth | I29: 423.2 | J29: 187.2 | K29: of:=[.J29]-[.I29] -> -236
B30: 2004-12-31 | C30: 28898.59 | D30: 28898.59 | E30: of:=[.C30]-[.D30] -> 0 | H30: Total | I30: of:=SUM([.I24:.I29]) -> 26424.17 | J30: of:=SUM([.J24:.J29]) -> 29006.59 | K30: of:=[.J30]-[.I30] -> 2582.42
B31: 2004-06-30 | C31: 29192.2 | D31: 29192.2 | E31: of:=[.C31]-[.D31] -> 0
B32: 2004-09-30 | C32: 25244.15 | D32: 25244.15 | E32: of:=[.C32]-[.D32] -> 0
B33: 2004-10-31 | C33: 28831.72 | D33: 28831.72 | E33: of:=[.C33]-[.D33] -> 0
B34: 2004-11-30 | C34: 26424.17 | D34: 26424.17 | E34: of:=[.C34]-[.D34] -> 0
B35: 2005-12-31 | C35: 24505.31 | D35: 24505.31 | E35: of:=[.C35]-[.D35] -> 0
B36: 2006-12-31 | C36: 8685.37 | D36: 8685.37 | E36: of:=[.C36]-[.D36] -> 0
B37: 2007-12-31 | C37: 3236.88 | D37: 3236.88 | E37: of:=[.C37]-[.D37] -> 0
B38: 2007-12-31 | C38: 5542.37 | D38: 5542.37 | E38: of:=[.C38]-[.D38] -> 0
B39: 2009-12-31 | C39: 7494.35 | D39: 7494.35 | E39: of:=[.C39]-[.D39] -> 0
B40: 2010-03-11 | C40: 3578.81 | D40: 3578.81 | E40: of:=[.C40]-[.D40] -> 0
H41: Gnu Gen Fund | I41: Bal | K41: Gnu Gen Fund | L41: Bal | M41: Change | N41: Income | O41: Expense | P41: Mort | Q41: Net | R41: Diff
A42: General | B42: Date | C42: Old | D42: Gnu | E42: Diff | H42: 2010-02-28 | I42: 1142.91 | K42: 2010-03-07 | L42: 1092.63 | M42: of:=[.L42]-[.$I$42] -> -50.28 | N42: 1155 | O42: 1735.87 | P42: 269.41 | Q42: of:=[.N42]-[.O42]-[.P42] -> -850.28 | R42: of:=[.M42]-[.Q42] -> 800
B43: 2009-12-31 | C43: 1180 | D43: 2046.27 | E43: of:=[.C43]-[.D43] -> -866.27 | H43: 2010-03-31 | I43: -285.35 | K43: 2010-03-10 | L43: 209.31 | M43: of:=[.L43]-[.$I$42] -> -933.6 | N43: 1155 | O43: 1735.87 | P43: 269.41 | Q43: of:=[.N43]-[.O43]-[.P43] -> -850.28 | R43: of:=[.M43]-[.Q43] -> -83.3200000000002
B44: 2010-03-31 | C44: -268 | D44: -285.35 | E44: of:=[.C44]-[.D44] -> 17.35 | H44: Diff | I44: of:=[.I43]-[.I42] -> -1428.26 | J44: of:=[.I44]-[.I51] -> -183.320000000001 | K44: 2010-03-01 | L44: 1842.91 | M44: of:=[.L44]-[.$I$42] -> 700 | N44: 0 | O44: 0 | P44: 0 | Q44: of:=[.N44]-[.O44]-[.P44] -> 0 | R44: of:=[.M44]-[.Q44] -> 700
B45: 2010-02-28 | C45: 277 | D45: 1142.91 | E45: of:=[.C45]-[.D45] -> -865.91 | K45: 2010-03-02 | L45: 537.63 | M45: of:=[.L45]-[.$I$42] -> -605.28 | N45: 0 | O45: 1035.87 | P45: 269.41 | Q45: of:=[.N45]-[.O45]-[.P45] -> -1305.28 | R45: of:=[.M45]-[.Q45] -> 700
B46: 2008-12-31 | C46: 2082 | D46: 3005.19 | E46: of:=[.C46]-[.D46] -> -923.19 | H46: Monthly
B47: 2007-12-31 | C47: 451 | D47: 1374.37 | E47: of:=[.C47]-[.D47] -> -923.37 | H47: Income | I47: 5119.67 | K47: March Corrections
B48: 2006-12-31 | C48: 3401 | D48: 5270.13 | E48: of:=[.C48]-[.D48] -> -1869.13 | H48: Expense | I48: 5215.07 | K48: 2010-03-10 | L48: -883.32 | M48: Gen to temp
E49: of:=[.C49]-[.D49] -> 0 | H49: Net | I49: of:=[.I47]-[.I48] -> -95.3999999999996 | K49: 2010-02-28 | L49: of:=1142.91-277 -> 865.91 | M49: Diff between spreadsheet and Gnu Gen account
E50: of:=[.C50]-[.D50] -> 0 | H50: Mort | I50: 1149.54 | K50: Tot Gen Corr | L50: of:=SUM([.L48:.L49]) -> -17.41 | M50: Added correction to March Gen & Gen – hold balances due to Gnu switch changes
E51: of:=[.C51]-[.D51] -> 0 | H51: Net | I51: of:=[.I49]-[.I50] -> -1244.94
E52: of:=[.C52]-[.D52] -> 0
E53: of:=[.C53]-[.D53] -> 0
E54: of:=[.C54]-[.D54] -> 0
E55: of:=[.C55]-[.D55] -> 0
E56: of:=[.C56]-[.D56] -> 0
E57: of:=[.C57]-[.D57] -> 0
E58: of:=[.C58]-[.D58] -> 0
E59: of:=[.C59]-[.D59] -> 0