Sheet: Budget
A1: Budget | B1: 2010 | P1: #Months YTD
P2: of:=COUNT([.C6:.N6]) -> 12
C3: Month
A4: CategoryÂ Description | B4: Budget | C4: of:=DATE([.B1];1;1) -> 2010-01-01 | D4: of:=DATE(YEAR([.C4]);MONTH([.C4])+1;1) -> 2010-02-01 | E4: of:=DATE(YEAR([.D4]);MONTH([.D4])+1;1) -> 2010-03-01 | F4: of:=DATE(YEAR([.E4]);MONTH([.E4])+1;1) -> 2010-04-01 | G4: of:=DATE(YEAR([.F4]);MONTH([.F4])+1;1) -> 2010-05-01 | H4: of:=DATE(YEAR([.G4]);MONTH([.G4])+1;1) -> 2010-06-01 | I4: of:=DATE(YEAR([.H4]);MONTH([.H4])+1;1) -> 2010-07-01 | J4: of:=DATE(YEAR([.I4]);MONTH([.I4])+1;1) -> 2010-08-01 | K4: of:=DATE(YEAR([.J4]);MONTH([.J4])+1;1) -> 2010-09-01 | L4: of:=DATE(YEAR([.K4]);MONTH([.K4])+1;1) -> 2010-10-01 | M4: of:=DATE(YEAR([.L4]);MONTH([.L4])+1;1) -> 2010-11-01 | N4: of:=DATE(YEAR([.M4]);MONTH([.M4])+1;1) -> 2010-12-01 | O4: Total YTD | P4: Budget YTD | Q4: Difference | R4: Actual Budget
A6: General income | B6: of:=[.R6]/12 -> 7298.66666666667 | C6: 6163 | D6: 6021 | E6: 5119.67 | F6: 5292.8 | G6: 5316 | H6: 4031 | I6: 6341 | J6: 6231 | K6: 5684 | L6: 7842 | M6: 5109 | N6: 5973 | O6: of:=SUM([.C6:.N6]) -> 69123.47 | P6: of:=[.$P$2]/12*[.R6] -> 87584 | Q6: of:=[.O6]-[.P6] -> -18460.53 | R6: of:=[.R47] -> 87584
A8: Building
A9: Hazard Insurance | B9: of:=[.R9]/12 -> 170.666666666667 | C9: 501 | F9: 501.25 | I9: 567.5 | M9: 567.5 | O9: of:=SUM([.C9:.N9]) -> 2137.25 | P9: of:=[.$P$2]/12*[.R9] -> 2048 | Q9: of:=[.O9]-[.P9] -> 89.25 | R9: of:=4*512 -> 2048
A10: Maintenance | B10: of:=[.R10]/12 -> 80 | C10: 200 | J10: 300 | O10: of:=SUM([.C10:.N10]) -> 500 | P10: of:=[.$P$2]/12*[.R10] -> 960 | Q10: of:=[.O10]-[.P10] -> -460 | R10: 960
A11: Mortgage | B11: of:=[.R11]/12 -> 1138 | C11: 1124 | D11: 1124 | E11: of:=243.87+880.13 -> 1124 | F11: 1124 | I11: 1124 | K11: 1124 | M11: 600 | N11: 1124 | O11: of:=SUM([.C11:.N11]) -> 8468 | P11: of:=[.$P$2]/12*[.R11] -> 13656 | Q11: of:=[.O11]-[.P11] -> -5188 | R11: of:=1138*12 -> 13656
A12: Property Tax | B12: of:=[.R12]/12 -> 50 | M12: 516.09 | O12: of:=SUM([.C12:.N12]) -> 516.09 | P12: of:=[.$P$2]/12*[.R12] -> 600 | Q12: of:=[.O12]-[.P12] -> -83.91 | R12: 600
A13: Supplies | B13: of:=[.R13]/12 -> 8.33333333333333 | J13: 50 | O13: of:=SUM([.C13:.N13]) -> 50 | P13: of:=[.$P$2]/12*[.R13] -> 100 | Q13: of:=[.O13]-[.P13] -> -50 | R13: 100
A14: Utilities | B14: of:=[.R14]/12 -> 650 | C14: 850 | D14: 544 | E14: 409.54 | F14: 379.35 | G14: 473.65 | H14: 270.22 | I14: 448.01 | J14: 358 | K14: 1058.99 | L14: 952.04 | M14: 597.36 | N14: 430.47 | O14: of:=SUM([.C14:.N14]) -> 6771.63 | P14: of:=[.$P$2]/12*[.R14] -> 7800 | Q14: of:=[.O14]-[.P14] -> -1028.37 | R14: 7800
A15: TOTAL Building | B15: of:=SUM([.B9:.B14]) -> 2097 | C15: of:=SUM([.C9:.C14]) -> 2675 | D15: of:=SUM([.D9:.D14]) -> 1668 | E15: of:=SUM([.E9:.E14]) -> 1533.54 | F15: of:=SUM([.F9:.F14]) -> 2004.6 | G15: of:=SUM([.G9:.G14]) -> 473.65 | H15: of:=SUM([.H9:.H14]) -> 270.22 | I15: of:=SUM([.I9:.I14]) -> 2139.51 | J15: of:=SUM([.J9:.J14]) -> 708 | K15: of:=SUM([.K9:.K14]) -> 2182.99 | L15: of:=SUM([.L9:.L14]) -> 952.04 | M15: of:=SUM([.M9:.M14]) -> 2280.95 | N15: of:=SUM([.N9:.N14]) -> 1554.47 | O15: of:=SUM([.C15:.N15]) -> 18442.97 | P15: of:=[.$P$2]/12*[.R15] -> 25164 | Q15: of:=[.O15]-[.P15] -> -6721.03 | R15: of:=SUM([.R8:.R14]) -> 25164
A17: Business Expenses
A18: Worker's Comp | B18: of:=[.R18]/12 -> 50 | D18: 578 | F18: -61.46 | O18: of:=SUM([.C18:.N18]) -> 516.54 | P18: of:=[.$P$2]/12*[.R18] -> 600 | Q18: of:=[.O18]-[.P18] -> -83.46 | R18: 600
A19: Office | E19: 1.03 | H19: 4 | J19: 4 | K19: 38 | L19: 40.59 | O19: of:=SUM([.C19:.N19]) -> 87.62 | P19: of:=[.$P$2]/12*[.R19] -> 200 | Q19: of:=[.O19]-[.P19] -> -112.38 | R19: 200
A20: Telephone | B20: of:=[.R20]/12 -> 100 | C20: 103 | D20: 103 | E20: 108.75 | F20: 104.71 | G20: 108.86 | H20: 107.43 | I20: 106.3 | J20: 112.5 | K20: 109.91 | L20: 109.52 | M20: 110.91 | N20: 112.65 | O20: of:=SUM([.C20:.N20]) -> 1297.54 | P20: of:=[.$P$2]/12*[.R20] -> 1200 | Q20: of:=[.O20]-[.P20] -> 97.54 | R20: 1200
A21: TOTAL Business Expenses | B21: of:=SUM([.B18:.B20]) -> 150 | C21: of:=SUM([.C18:.C20]) -> 103 | D21: of:=SUM([.D18:.D20]) -> 681 | E21: of:=SUM([.E18:.E20]) -> 109.78 | F21: of:=SUM([.F18:.F20]) -> 43.25 | G21: of:=SUM([.G18:.G20]) -> 108.86 | H21: of:=SUM([.H18:.H20]) -> 111.43 | I21: of:=SUM([.I18:.I20]) -> 106.3 | J21: of:=SUM([.J18:.J20]) -> 116.5 | K21: of:=SUM([.K18:.K20]) -> 147.91 | L21: of:=SUM([.L18:.L20]) -> 150.11 | M21: of:=SUM([.M18:.M20]) -> 110.91 | N21: of:=SUM([.N18:.N20]) -> 112.65 | O21: of:=SUM([.C21:.N21]) -> 1901.7 | P21: of:=[.$P$2]/12*[.R21] -> 2000 | Q21: of:=[.O21]-[.P21] -> -98.3 | R21: of:=SUM([.R17:.R20]) -> 2000
A23: Ministry
A24: Adult | B24: of:=[.R24]/12 -> 10 | O24: of:=SUM([.C24:.N24]) -> 0 | P24: of:=[.$P$2]/12*[.R24] -> 120 | Q24: of:=[.O24]-[.P24] -> -120 | R24: 120
A25: Children | B25: of:=[.R25]/12 -> 10 | O25: of:=SUM([.C25:.N25]) -> 0 | P25: of:=[.$P$2]/12*[.R25] -> 120 | Q25: of:=[.O25]-[.P25] -> -120 | R25: 120
A26: Fellowship | B26: of:=[.R26]/12 -> 30 | O26: of:=SUM([.C26:.N26]) -> 0 | P26: of:=[.$P$2]/12*[.R26] -> 360 | Q26: of:=[.O26]-[.P26] -> -360 | R26: 360
A27: Missions | B27: of:=[.R27]/12 -> 80 | C27: 52 | D27: 62 | E27: 60 | F27: 52 | G27: 54 | H27: 54 | I27: 40 | J27: 64 | O27: of:=SUM([.C27:.N27]) -> 438 | P27: of:=[.$P$2]/12*[.R27] -> 960 | Q27: of:=[.O27]-[.P27] -> -522 | R27: 960
A28: Outreach | B28: of:=[.R28]/12 -> 50 | C28: 17 | D28: 17 | E28: 115.47 | F28: 16.5 | G28: 16.5 | H28: 16.5 | I28: 16.5 | J28: 15.18 | K28: 15.18 | L28: 15.18 | M28: 15.18 | N28: 115.18 | O28: of:=SUM([.C28:.N28]) -> 391.37 | P28: of:=[.$P$2]/12*[.R28] -> 600 | Q28: of:=[.O28]-[.P28] -> -208.63 | R28: 600
A29: Christian Education | B29: of:=[.R29]/12 -> 25 | O29: of:=SUM([.C29:.N29]) -> 0 | P29: of:=[.$P$2]/12*[.R29] -> 300 | Q29: of:=[.O29]-[.P29] -> -300 | R29: 300
A30: Worship | B30: of:=[.R30]/12 -> 30 | E30: 109 | O30: of:=SUM([.C30:.N30]) -> 109 | P30: of:=[.$P$2]/12*[.R30] -> 360 | Q30: of:=[.O30]-[.P30] -> -251 | R30: 360
A31: Youth | B31: of:=[.R31]/12 -> 10 | O31: of:=SUM([.C31:.N31]) -> 0 | P31: of:=[.$P$2]/12*[.R31] -> 120 | Q31: of:=[.O31]-[.P31] -> -120 | R31: 120
A32: TOTAL Ministry | B32: of:=SUM([.B24:.B31]) -> 245 | C32: of:=SUM([.C24:.C31]) -> 69 | D32: of:=SUM([.D24:.D31]) -> 79 | E32: of:=SUM([.E24:.E31]) -> 284.47 | F32: of:=SUM([.F24:.F31]) -> 68.5 | G32: of:=SUM([.G24:.G31]) -> 70.5 | H32: of:=SUM([.H24:.H31]) -> 70.5 | I32: of:=SUM([.I24:.I31]) -> 56.5 | J32: of:=SUM([.J24:.J31]) -> 79.18 | K32: of:=SUM([.K24:.K31]) -> 15.18 | L32: of:=SUM([.L24:.L31]) -> 15.18 | M32: of:=SUM([.M24:.M31]) -> 15.18 | N32: of:=SUM([.N24:.N31]) -> 115.18 | O32: of:=SUM([.C32:.N32]) -> 938.37 | P32: of:=[.$P$2]/12*[.R32] -> 2940 | Q32: of:=[.O32]-[.P32] -> -2001.63 | R32: of:=SUM([.R23:.R31]) -> 2940
A34: Parsonage
A35: Maintenance | B35: of:=[.R35]/12 -> 100 | E35: 250 | O35: of:=SUM([.C35:.N35]) -> 250 | P35: of:=[.$P$2]/12*[.R35] -> 1200 | Q35: of:=[.O35]-[.P35] -> -950 | R35: 1200
A36: Mortgage | B36: of:=[.R36]/12 -> 565 | C36: 565 | D36: 565 | E36: of:=295.59+269.41 -> 565 | F36: 565 | G36: 565 | H36: 565 | I36: 565 | J36: 565 | K36: 565 | L36: 565 | M36: 565 | N36: 565 | O36: of:=SUM([.C36:.N36]) -> 6780 | P36: of:=[.$P$2]/12*[.R36] -> 6780 | Q36: of:=[.O36]-[.P36] -> 0 | R36: of:=12*565 -> 6780
A37: Property Tax | B37: of:=[.R37]/12 -> 183.333333333333 | M37: 1285.65 | O37: of:=SUM([.C37:.N37]) -> 1285.65 | P37: of:=[.$P$2]/12*[.R37] -> 2200 | Q37: of:=[.O37]-[.P37] -> -914.35 | R37: 2200
A38: Utilities | B38: of:=[.R38]/12 -> 408.333333333333 | C38: 403 | D38: 380 | E38: 321.82 | F38: 273.28 | G38: 359.79 | H38: 216.46 | I38: 383.14 | J38: 618.56 | K38: 610.38 | L38: 414.3 | M38: 362.58 | N38: 350.55 | O38: of:=SUM([.C38:.N38]) -> 4693.86 | P38: of:=[.$P$2]/12*[.R38] -> 4900 | Q38: of:=[.O38]-[.P38] -> -206.14 | R38: 4900
A39: TOTAL Parsonage | B39: of:=SUM([.B35:.B38]) -> 1256.66666666667 | C39: of:=SUM([.C35:.C38]) -> 968 | D39: of:=SUM([.D35:.D38]) -> 945 | E39: of:=SUM([.E35:.E38]) -> 1136.82 | F39: of:=SUM([.F35:.F38]) -> 838.28 | G39: of:=SUM([.G35:.G38]) -> 924.79 | H39: of:=SUM([.H35:.H38]) -> 781.46 | I39: of:=SUM([.I35:.I38]) -> 948.14 | J39: of:=SUM([.J35:.J38]) -> 1183.56 | K39: of:=SUM([.K35:.K38]) -> 1175.38 | L39: of:=SUM([.L35:.L38]) -> 979.3 | M39: of:=SUM([.M35:.M38]) -> 2213.23 | N39: of:=SUM([.N35:.N38]) -> 915.55 | O39: of:=SUM([.C39:.N39]) -> 13009.51 | P39: of:=[.$P$2]/12*[.R39] -> 15080 | Q39: of:=[.O39]-[.P39] -> -2070.49 | R39: of:=SUM([.R34:.R38]) -> 15080
A41: Pastor
A42: Business Expenses | B42: of:=[.R42]/12 -> 500 | C42: 500 | D42: 500 | E42: 500 | F42: 500 | G42: 500 | I42: 1000 | J42: 500 | N42: 500 | P42: of:=[.$P$2]/12*[.R42] -> 6000 | Q42: of:=[.O42]-[.P42] -> -6000 | R42: 6000
A43: Honorarium | B43: of:=[.R43]/12 -> 3033.33333333333 | C43: 3500 | D43: 2800 | E43: 2800 | F43: 2800 | G43: 3500 | H43: 2800 | I43: 2800 | J43: 3500 | K43: 2800 | L43: 3500 | M43: 2800 | N43: 2800 | P43: of:=[.$P$2]/12*[.R43] -> 36400 | Q43: of:=[.O43]-[.P43] -> -36400 | R43: of:=52*700 -> 36400
A44: Other | B44: of:=[.R44]/12 -> 0 | P44: of:=[.$P$2]/12*[.R44] -> 0 | Q44: of:=[.O44]-[.P44] -> 0 | R44: 0
A45: TOTAL Pastor | B45: of:=SUM([.B42:.B43]) -> 3533.33333333333 | C45: of:=SUM([.C42:.C43]) -> 4000 | D45: of:=SUM([.D42:.D43]) -> 3300 | E45: of:=SUM([.E42:.E43]) -> 3300 | F45: of:=SUM([.F42:.F43]) -> 3300 | G45: of:=SUM([.G42:.G43]) -> 4000 | H45: of:=SUM([.H42:.H43]) -> 2800 | I45: of:=SUM([.I42:.I43]) -> 3800 | J45: of:=SUM([.J42:.J44]) -> 4000 | K45: of:=SUM([.K42:.K43]) -> 2800 | L45: of:=SUM([.L42:.L43]) -> 3500 | M45: of:=SUM([.M42:.M43]) -> 2800 | N45: of:=SUM([.N42:.N43]) -> 3300 | O45: of:=SUM([.C45:.N45]) -> 40900 | P45: of:=[.$P$2]/12*[.R45] -> 42400 | Q45: of:=[.O45]-[.P45] -> -1500 | R45: of:=SUM([.R41:.R43]) -> 42400
A47: TOTAL EXPENSES | B47: of:=[.B15]+[.B21]+[.B32]+[.B39]+[.B45] -> 7282 | C47: of:=[.C15]+[.C21]+[.C32]+[.C39]+[.C45] -> 7815 | D47: of:=[.D15]+[.D21]+[.D32]+[.D39]+[.D45] -> 6673 | E47: of:=[.E15]+[.E21]+[.E32]+[.E39]+[.E45] -> 6364.61 | F47: of:=[.F15]+[.F21]+[.F32]+[.F39]+[.F45] -> 6254.63 | G47: of:=[.G15]+[.G21]+[.G32]+[.G39]+[.G45] -> 5577.8 | H47: of:=[.H15]+[.H21]+[.H32]+[.H39]+[.H45] -> 4033.61 | I47: of:=[.I15]+[.I21]+[.I32]+[.I39]+[.I45] -> 7050.45 | J47: of:=[.J15]+[.J21]+[.J32]+[.J39]+[.J45] -> 6087.24 | K47: of:=[.K15]+[.K21]+[.K32]+[.K39]+[.K45] -> 6321.46 | L47: of:=[.L15]+[.L21]+[.L32]+[.L39]+[.L45] -> 5596.63 | M47: of:=[.M15]+[.M21]+[.M32]+[.M39]+[.M45] -> 7420.27 | N47: of:=[.N15]+[.N21]+[.N32]+[.N39]+[.N45] -> 5997.85 | O47: of:=[.O15]+[.O21]+[.O32]+[.O39]+[.O45] -> 75192.55 | P47: of:=[.$P$2]/12*[.R47] -> 87584 | Q47: of:=[.O47]-[.P47] -> -12391.45 | R47: of:=[.R15]+[.R21]+[.R32]+[.R39]+[.R45] -> 87584
A49: OVERALL TOTAL | B49: of:=[.B6]+[.B47] -> 14580.6666666667 | C49: of:=[.C6]-[.C47] -> -1652 | D49: of:=[.D6]-[.D47] -> -652 | E49: of:=[.E6]-[.E47] -> -1244.94 | F49: of:=[.F6]-[.F47] -> -961.83 | G49: of:=[.G6]-[.G47] -> -261.8 | H49: of:=[.H6]-[.H47] -> -2.61000000000013 | I49: of:=[.I6]-[.I47] -> -709.450000000001 | J49: of:=[.J6]-[.J47] -> 143.76 | K49: of:=[.K6]-[.K47] -> -637.459999999999 | L49: of:=[.L6]-[.L47] -> 2245.37 | M49: of:=[.M6]-[.M47] -> -2311.27 | N49: of:=[.N6]-[.N47] -> -24.8500000000004 | O49: of:=[.O6]-[.O47] -> -6069.08 | P49: of:=[.$P$2]/12*[.R49] -> 0 | Q49: of:=[.O49]-[.P49] -> -6069.08 | R49: of:=[.R6]-[.R47] -> 0
B83: of:=[.$O$4] -> Total YTD | C83: of:=[.$P$4] -> Budget YTD
A84: of:=[.$A$8] -> Building | B84: of:=[.O$15] -> 18442.97 | C84: of:=[.P$15] -> 25164
A85: of:=[.$A$17] -> Business Expenses | B85: of:=[.O$21] -> 1901.7 | C85: of:=[.P$21] -> 2000
A86: of:=[.$A$23] -> Ministry | B86: of:=[.O$32] -> 938.37 | C86: of:=[.P$32] -> 2940
A87: of:=[.$A$34] -> Parsonage | B87: of:=[.O$39] -> 13009.51 | C87: of:=[.P$39] -> 15080
A88: of:=[.$A$41] -> Pastor | B88: of:=[.O$45] -> 40900 | C88: of:=[.P$45] -> 42400

Sheet: Holding Account
A1: Category | B1: Amount
A2: Building Property Tax | B2: of:=[Budget.B12] -> 50
A3: Parsonage Property Tax | B3: of:=[Budget.B37] -> 183.333333333333
A4: Hazard Insurance | B4: of:=[Budget.B9] -> 170.666666666667
A5: Workers' Comp | B5: of:=[Budget.B18] -> 50
A6: Building Maintenance
A7: Parsonage Maintenance