Sheet: Budget
A1: Budget | B1: 2011 | P1: #Months YTD
P2: of:=COUNT([.C6:.N6]) -> 12
C3: Month
A4: CategoryÂ Description | B4: Budget | C4: of:=DATE([.B1];1;1) -> 2011-01-01 | D4: of:=DATE(YEAR([.C4]);MONTH([.C4])+1;1) -> 2011-02-01 | E4: of:=DATE(YEAR([.D4]);MONTH([.D4])+1;1) -> 2011-03-01 | F4: of:=DATE(YEAR([.E4]);MONTH([.E4])+1;1) -> 2011-04-01 | G4: of:=DATE(YEAR([.F4]);MONTH([.F4])+1;1) -> 2011-05-01 | H4: of:=DATE(YEAR([.G4]);MONTH([.G4])+1;1) -> 2011-06-01 | I4: of:=DATE(YEAR([.H4]);MONTH([.H4])+1;1) -> 2011-07-01 | J4: of:=DATE(YEAR([.I4]);MONTH([.I4])+1;1) -> 2011-08-01 | K4: of:=DATE(YEAR([.J4]);MONTH([.J4])+1;1) -> 2011-09-01 | L4: of:=DATE(YEAR([.K4]);MONTH([.K4])+1;1) -> 2011-10-01 | M4: of:=DATE(YEAR([.L4]);MONTH([.L4])+1;1) -> 2011-11-01 | N4: of:=DATE(YEAR([.M4]);MONTH([.M4])+1;1) -> 2011-12-01 | O4: Total YTD | P4: Budget YTD | Q4: Difference | R4: Actual Budget
A6: General income | B6: of:=[.R6]/12 -> 7298.66666666667 | C6: 5397 | D6: 7279 | E6: 6654 | F6: 7045 | G6: 8063 | H6: 6033 | I6: 6863 | J6: 5418.62 | K6: 5334 | L6: 8939.96 | M6: 5355.15 | N6: 6624 | O6: of:=SUM([.C6:.N6]) -> 79005.73 | P6: of:=[.$P$2]/12*[.R6] -> 87584 | Q6: of:=[.O6]-[.P6] -> -8578.27 | R6: of:=[.R47] -> 87584
A8: Building
A9: Hazard Insurance | B9: of:=[.R9]/12 -> 170.666666666667 | D9: 602.5 | G9: 602.5 | J9: 631.5 | L9: 666.5 | O9: of:=SUM([.C9:.N9]) -> 2503 | P9: of:=[.$P$2]/12*[.R9] -> 2048 | Q9: of:=[.O9]-[.P9] -> 455 | R9: of:=4*512 -> 2048
A10: Maintenance | B10: of:=[.R10]/12 -> 80 | I10: 380 | O10: of:=SUM([.C10:.N10]) -> 380 | P10: of:=[.$P$2]/12*[.R10] -> 960 | Q10: of:=[.O10]-[.P10] -> -580 | R10: 960
A11: Mortgage | B11: of:=[.R11]/12 -> 1138 | D11: 1724 | E11: 600 | F11: 1800 | G11: 600 | H11: 600 | I11: 600 | J11: 600 | K11: 600 | L11: 1000 | M11: 727 | N11: 743 | O11: of:=SUM([.C11:.N11]) -> 9594 | P11: of:=[.$P$2]/12*[.R11] -> 13656 | Q11: of:=[.O11]-[.P11] -> -4062 | R11: of:=1138*12 -> 13656
A12: Property Tax | B12: of:=[.R12]/12 -> 50 | E12: 516.08 | H12: 42.58 | M12: 343.96 | O12: of:=SUM([.C12:.N12]) -> 902.62 | P12: of:=[.$P$2]/12*[.R12] -> 600 | Q12: of:=[.O12]-[.P12] -> 302.62 | R12: 600
A13: Supplies | B13: of:=[.R13]/12 -> 8.33333333333333 | O13: of:=SUM([.C13:.N13]) -> 0 | P13: of:=[.$P$2]/12*[.R13] -> 100 | Q13: of:=[.O13]-[.P13] -> -100 | R13: 100
A14: Utilities | B14: of:=[.R14]/12 -> 650 | C14: 509.66 | D14: 334.85 | E14: 380.58 | F14: 529.02 | G14: 523.42 | H14: 468.44 | I14: 770.1 | J14: 887.24 | K14: 896.4 | L14: 775.83 | M14: 601.03 | N14: 625.1 | O14: of:=SUM([.C14:.N14]) -> 7301.67 | P14: of:=[.$P$2]/12*[.R14] -> 7800 | Q14: of:=[.O14]-[.P14] -> -498.330000000001 | R14: 7800
A15: TOTAL Building | B15: of:=SUM([.B9:.B14]) -> 2097 | C15: of:=SUM([.C9:.C14]) -> 509.66 | D15: of:=SUM([.D9:.D14]) -> 2661.35 | E15: of:=SUM([.E9:.E14]) -> 1496.66 | F15: of:=SUM([.F9:.F14]) -> 2329.02 | G15: of:=SUM([.G9:.G14]) -> 1725.92 | H15: of:=SUM([.H9:.H14]) -> 1111.02 | I15: of:=SUM([.I9:.I14]) -> 1750.1 | J15: of:=SUM([.J9:.J14]) -> 2118.74 | K15: of:=SUM([.K9:.K14]) -> 1496.4 | L15: of:=SUM([.L9:.L14]) -> 2442.33 | M15: of:=SUM([.M9:.M14]) -> 1671.99 | N15: of:=SUM([.N9:.N14]) -> 1368.1 | O15: of:=SUM([.C15:.N15]) -> 20681.29 | P15: of:=[.$P$2]/12*[.R15] -> 25164 | Q15: of:=[.O15]-[.P15] -> -4482.71 | R15: of:=SUM([.R8:.R14]) -> 25164
A17: Business Expenses
A18: Worker's Comp | B18: of:=[.R18]/12 -> 50 | E18: 617.36 | G18: -220.1 | O18: of:=SUM([.C18:.N18]) -> 397.26 | P18: of:=[.$P$2]/12*[.R18] -> 600 | Q18: of:=[.O18]-[.P18] -> -202.74 | R18: 600
A19: Office | C19: 4 | D19: 4 | F19: 7 | K19: 4 | L19: 60 | M19: -10.1 | O19: of:=SUM([.C19:.N19]) -> 68.9 | P19: of:=[.$P$2]/12*[.R19] -> 200 | Q19: of:=[.O19]-[.P19] -> -131.1 | R19: 200
A20: Telephone | B20: of:=[.R20]/12 -> 100 | C20: 114.71 | D20: 112.41 | E20: 113.5 | F20: 111.16 | G20: 118.97 | H20: 118.35 | I20: 101.82 | J20: 18.23 | K20: 20.85 | L20: 52.1 | N20: 31.25 | O20: of:=SUM([.C20:.N20]) -> 913.35 | P20: of:=[.$P$2]/12*[.R20] -> 1200 | Q20: of:=[.O20]-[.P20] -> -286.65 | R20: 1200
A21: TOTAL Business Expenses | B21: of:=SUM([.B18:.B20]) -> 150 | C21: of:=SUM([.C18:.C20]) -> 118.71 | D21: of:=SUM([.D18:.D20]) -> 116.41 | E21: of:=SUM([.E18:.E20]) -> 730.86 | F21: of:=SUM([.F18:.F20]) -> 118.16 | G21: of:=SUM([.G18:.G20]) -> -101.13 | H21: of:=SUM([.H18:.H20]) -> 118.35 | I21: of:=SUM([.I18:.I20]) -> 101.82 | J21: of:=SUM([.J18:.J20]) -> 18.23 | K21: of:=SUM([.K18:.K20]) -> 24.85 | L21: of:=SUM([.L18:.L20]) -> 112.1 | M21: of:=SUM([.M18:.M20]) -> -10.1 | N21: of:=SUM([.N18:.N20]) -> 31.25 | O21: of:=SUM([.C21:.N21]) -> 1379.51 | P21: of:=[.$P$2]/12*[.R21] -> 2000 | Q21: of:=[.O21]-[.P21] -> -620.49 | R21: of:=SUM([.R17:.R20]) -> 2000
A23: Ministry
A24: Adult | B24: of:=[.R24]/12 -> 10 | O24: of:=SUM([.C24:.N24]) -> 0 | P24: of:=[.$P$2]/12*[.R24] -> 120 | Q24: of:=[.O24]-[.P24] -> -120 | R24: 120
A25: Children | B25: of:=[.R25]/12 -> 10 | O25: of:=SUM([.C25:.N25]) -> 0 | P25: of:=[.$P$2]/12*[.R25] -> 120 | Q25: of:=[.O25]-[.P25] -> -120 | R25: 120
A26: Fellowship | B26: of:=[.R26]/12 -> 30 | O26: of:=SUM([.C26:.N26]) -> 0 | P26: of:=[.$P$2]/12*[.R26] -> 360 | Q26: of:=[.O26]-[.P26] -> -360 | R26: 360
A27: Missions | B27: of:=[.R27]/12 -> 80 | G27: 510 | H27: 80 | I27: 60 | J27: 70 | K27: 54 | L27: 54 | M27: 90 | N27: 62 | O27: of:=SUM([.C27:.N27]) -> 980 | P27: of:=[.$P$2]/12*[.R27] -> 960 | Q27: of:=[.O27]-[.P27] -> 20 | R27: 960
A28: Outreach | B28: of:=[.R28]/12 -> 50 | C28: 15.18 | D28: 15.18 | E28: 15 | F28: 15.18 | G28: 15.18 | H28: 15.18 | I28: 15.18 | J28: 15.18 | K28: 15.18 | L28: 15.18 | M28: 15.18 | N28: 15.18 | O28: of:=SUM([.C28:.N28]) -> 181.98 | P28: of:=[.$P$2]/12*[.R28] -> 600 | Q28: of:=[.O28]-[.P28] -> -418.02 | R28: 600
A29: Christian Education | B29: of:=[.R29]/12 -> 25 | O29: of:=SUM([.C29:.N29]) -> 0 | P29: of:=[.$P$2]/12*[.R29] -> 300 | Q29: of:=[.O29]-[.P29] -> -300 | R29: 300
A30: Worship | B30: of:=[.R30]/12 -> 30 | E30: 109 | J30: 100 | O30: of:=SUM([.C30:.N30]) -> 209 | P30: of:=[.$P$2]/12*[.R30] -> 360 | Q30: of:=[.O30]-[.P30] -> -151 | R30: 360
A31: Youth | B31: of:=[.R31]/12 -> 10 | O31: of:=SUM([.C31:.N31]) -> 0 | P31: of:=[.$P$2]/12*[.R31] -> 120 | Q31: of:=[.O31]-[.P31] -> -120 | R31: 120
A32: TOTAL Ministry | B32: of:=SUM([.B24:.B31]) -> 245 | C32: of:=SUM([.C24:.C31]) -> 15.18 | D32: of:=SUM([.D24:.D31]) -> 15.18 | E32: of:=SUM([.E24:.E31]) -> 124 | F32: of:=SUM([.F24:.F31]) -> 15.18 | G32: of:=SUM([.G24:.G31]) -> 525.18 | H32: of:=SUM([.H24:.H31]) -> 95.18 | I32: of:=SUM([.I24:.I31]) -> 75.18 | J32: of:=SUM([.J24:.J31]) -> 185.18 | K32: of:=SUM([.K24:.K31]) -> 69.18 | L32: of:=SUM([.L24:.L31]) -> 69.18 | M32: of:=SUM([.M24:.M31]) -> 105.18 | N32: of:=SUM([.N24:.N31]) -> 77.18 | O32: of:=SUM([.C32:.N32]) -> 1370.98 | P32: of:=[.$P$2]/12*[.R32] -> 2940 | Q32: of:=[.O32]-[.P32] -> -1569.02 | R32: of:=SUM([.R23:.R31]) -> 2940
A34: Parsonage
A35: Maintenance | B35: of:=[.R35]/12 -> 100 | F35: 151.46 | O35: of:=SUM([.C35:.N35]) -> 151.46 | P35: of:=[.$P$2]/12*[.R35] -> 1200 | Q35: of:=[.O35]-[.P35] -> -1048.54 | R35: 1200
A36: Mortgage | B36: of:=[.R36]/12 -> 565 | C36: 565 | D36: 565 | E36: 565 | F36: 565 | G36: 565 | H36: 565 | I36: 565 | J36: 565 | K36: 565 | L36: 565 | M36: 565 | N36: 565 | O36: of:=SUM([.C36:.N36]) -> 6780 | P36: of:=[.$P$2]/12*[.R36] -> 6780 | Q36: of:=[.O36]-[.P36] -> 0 | R36: of:=12*565 -> 6780
A37: Property Tax | B37: of:=[.R37]/12 -> 183.333333333333 | E37: 1285.64 | N37: 1421.03 | O37: of:=SUM([.C37:.N37]) -> 2706.67 | P37: of:=[.$P$2]/12*[.R37] -> 2200 | Q37: of:=[.O37]-[.P37] -> 506.67 | R37: 2200
A38: Utilities | B38: of:=[.R38]/12 -> 408.333333333333 | C38: 360.1 | D38: 246.69 | E38: 389.29 | F38: 201.63 | G38: 202.4 | H38: 284.23 | I38: 337.07 | J38: 312.6 | K38: 572.08 | L38: 515.78 | M38: 355.69 | N38: 307.66 | O38: of:=SUM([.C38:.N38]) -> 4085.22 | P38: of:=[.$P$2]/12*[.R38] -> 4900 | Q38: of:=[.O38]-[.P38] -> -814.780000000001 | R38: 4900
A39: TOTAL Parsonage | B39: of:=SUM([.B35:.B38]) -> 1256.66666666667 | C39: of:=SUM([.C35:.C38]) -> 925.1 | D39: of:=SUM([.D35:.D38]) -> 811.69 | E39: of:=SUM([.E35:.E38]) -> 2239.93 | F39: of:=SUM([.F35:.F38]) -> 918.09 | G39: of:=SUM([.G35:.G38]) -> 767.4 | H39: of:=SUM([.H35:.H38]) -> 849.23 | I39: of:=SUM([.I35:.I38]) -> 902.07 | J39: of:=SUM([.J35:.J38]) -> 877.6 | K39: of:=SUM([.K35:.K38]) -> 1137.08 | L39: of:=SUM([.L35:.L38]) -> 1080.78 | M39: of:=SUM([.M35:.M38]) -> 920.69 | N39: of:=SUM([.N35:.N38]) -> 2293.69 | O39: of:=SUM([.C39:.N39]) -> 13723.35 | P39: of:=[.$P$2]/12*[.R39] -> 15080 | Q39: of:=[.O39]-[.P39] -> -1356.65 | R39: of:=SUM([.R34:.R38]) -> 15080
A41: Pastor
A42: Business Expenses | B42: of:=[.R42]/12 -> 500 | G42: 1000 | H42: 1000 | I42: 1000 | J42: 500 | K42: 500 | L42: 500 | M42: 500 | N42: 500 | P42: of:=[.$P$2]/12*[.R42] -> 6000 | Q42: of:=[.O42]-[.P42] -> -6000 | R42: 6000
A43: Honorarium | B43: of:=[.R43]/12 -> 3033.33333333333 | C43: 3500 | D43: 2800 | E43: 2800 | F43: 2900 | G43: 3500 | H43: 2800 | I43: 3500 | J43: 2800 | K43: 2800 | L43: 3500 | M43: 2800 | N43: 2800 | P43: of:=[.$P$2]/12*[.R43] -> 36400 | Q43: of:=[.O43]-[.P43] -> -36400 | R43: of:=52*700 -> 36400
A44: Other | B44: of:=[.R44]/12 -> 0 | P44: of:=[.$P$2]/12*[.R44] -> 0 | Q44: of:=[.O44]-[.P44] -> 0 | R44: 0
A45: TOTAL Pastor | B45: of:=SUM([.B42:.B43]) -> 3533.33333333333 | C45: of:=SUM([.C42:.C43]) -> 3500 | D45: of:=SUM([.D42:.D43]) -> 2800 | E45: of:=SUM([.E42:.E43]) -> 2800 | F45: of:=SUM([.F42:.F43]) -> 2900 | G45: of:=SUM([.G42:.G43]) -> 4500 | H45: of:=SUM([.H42:.H43]) -> 3800 | I45: of:=SUM([.I42:.I43]) -> 4500 | J45: of:=SUM([.J42:.J44]) -> 3300 | K45: of:=SUM([.K42:.K43]) -> 3300 | L45: of:=SUM([.L42:.L43]) -> 4000 | M45: of:=SUM([.M42:.M43]) -> 3300 | N45: of:=SUM([.N42:.N43]) -> 3300 | O45: of:=SUM([.C45:.N45]) -> 42000 | P45: of:=[.$P$2]/12*[.R45] -> 42400 | Q45: of:=[.O45]-[.P45] -> -400 | R45: of:=SUM([.R41:.R43]) -> 42400
A47: TOTAL EXPENSES | B47: of:=[.B15]+[.B21]+[.B32]+[.B39]+[.B45] -> 7282 | C47: of:=[.C15]+[.C21]+[.C32]+[.C39]+[.C45] -> 5068.65 | D47: of:=[.D15]+[.D21]+[.D32]+[.D39]+[.D45] -> 6404.63 | E47: of:=[.E15]+[.E21]+[.E32]+[.E39]+[.E45] -> 7391.45 | F47: of:=[.F15]+[.F21]+[.F32]+[.F39]+[.F45] -> 6280.45 | G47: of:=[.G15]+[.G21]+[.G32]+[.G39]+[.G45] -> 7417.37 | H47: of:=[.H15]+[.H21]+[.H32]+[.H39]+[.H45] -> 5973.78 | I47: of:=[.I15]+[.I21]+[.I32]+[.I39]+[.I45] -> 7329.17 | J47: of:=[.J15]+[.J21]+[.J32]+[.J39]+[.J45] -> 6499.75 | K47: of:=[.K15]+[.K21]+[.K32]+[.K39]+[.K45] -> 6027.51 | L47: of:=[.L15]+[.L21]+[.L32]+[.L39]+[.L45] -> 7704.39 | M47: of:=[.M15]+[.M21]+[.M32]+[.M39]+[.M45] -> 5987.76 | N47: of:=[.N15]+[.N21]+[.N32]+[.N39]+[.N45] -> 7070.22 | O47: of:=[.O15]+[.O21]+[.O32]+[.O39]+[.O45] -> 79155.13 | P47: of:=[.$P$2]/12*[.R47] -> 87584 | Q47: of:=[.O47]-[.P47] -> -8428.86999999999 | R47: of:=[.R15]+[.R21]+[.R32]+[.R39]+[.R45] -> 87584
A49: OVERALL TOTAL | B49: of:=[.B6]+[.B47] -> 14580.6666666667 | C49: of:=[.C6]-[.C47] -> 328.35 | D49: of:=[.D6]-[.D47] -> 874.370000000001 | E49: of:=[.E6]-[.E47] -> -737.450000000001 | F49: of:=[.F6]-[.F47] -> 764.55 | G49: of:=[.G6]-[.G47] -> 645.63 | H49: of:=[.H6]-[.H47] -> 59.2200000000003 | I49: of:=[.I6]-[.I47] -> -466.17 | J49: of:=[.J6]-[.J47] -> -1081.13 | K49: of:=[.K6]-[.K47] -> -693.51 | L49: of:=[.L6]-[.L47] -> 1235.57 | M49: of:=[.M6]-[.M47] -> -632.610000000001 | N49: of:=[.N6]-[.N47] -> -446.22 | O49: of:=[.O6]-[.O47] -> -149.400000000009 | P49: of:=[.$P$2]/12*[.R49] -> 0 | Q49: of:=[.O49]-[.P49] -> -149.400000000009 | R49: of:=[.R6]-[.R47] -> 0
B83: of:=[.$O$4] -> Total YTD | C83: of:=[.$P$4] -> Budget YTD
A84: of:=[.$A$8] -> Building | B84: of:=[.O$15] -> 20681.29 | C84: of:=[.P$15] -> 25164
A85: of:=[.$A$17] -> Business Expenses | B85: of:=[.O$21] -> 1379.51 | C85: of:=[.P$21] -> 2000
A86: of:=[.$A$23] -> Ministry | B86: of:=[.O$32] -> 1370.98 | C86: of:=[.P$32] -> 2940
A87: of:=[.$A$34] -> Parsonage | B87: of:=[.O$39] -> 13723.35 | C87: of:=[.P$39] -> 15080
A88: of:=[.$A$41] -> Pastor | B88: of:=[.O$45] -> 42000 | C88: of:=[.P$45] -> 42400

Sheet: Holding Account
A1: Category | B1: Amount
A2: Building Property Tax | B2: of:=[Budget.B12] -> 50
A3: Parsonage Property Tax | B3: of:=[Budget.B37] -> 183.333333333333
A4: Hazard Insurance | B4: of:=[Budget.B9] -> 170.666666666667
A5: Workers' Comp | B5: of:=[Budget.B18] -> 50
A6: Building Maintenance
A7: Parsonage Maintenance