Sheet: Budget
A1: Budget | B1: 2012 | P1: #Months YTD
P2: of:=COUNT([.C6:.N6]) -> 12
C3: Month
A4: CategoryÂ Description | B4: Budget | C4: of:=EOMONTH(DATE([.$B$1];1;1);0) -> 2012-01-31 | D4: of:=EOMONTH([.C4];1) -> 2012-02-29 | E4: of:=EOMONTH([.D4];1) -> 2012-03-31 | F4: of:=EOMONTH([.E4];1) -> 2012-04-30 | G4: of:=EOMONTH([.F4];1) -> 2012-05-31 | H4: of:=EOMONTH([.G4];1) -> 2012-06-30 | I4: of:=EOMONTH([.H4];1) -> 2012-07-31 | J4: of:=EOMONTH([.I4];1) -> 2012-08-31 | K4: of:=EOMONTH([.J4];1) -> 2012-09-30 | L4: of:=EOMONTH([.K4];1) -> 2012-10-31 | M4: of:=EOMONTH([.L4];1) -> 2012-11-30 | N4: of:=EOMONTH([.M4];1) -> 2012-12-31 | O4: Total YTD | P4: Budget YTD | Q4: Difference | R4: Actual Budget
A6: General income | B6: of:=[.R6]/12 -> 7298.66666666667 | C6: 6279 | D6: 7605 | E6: 5981 | F6: 7400 | G6: 5686 | H6: 4892 | I6: 7018.5 | J6: 6037 | K6: 7583 | L6: 6810 | M6: 6618 | N6: 7154 | O6: of:=SUM([.C6:.N6]) -> 79063.5 | P6: of:=[.$P$2]/12*[.R6] -> 87584 | Q6: of:=[.O6]-[.P6] -> -8520.5 | R6: of:=[.R47] -> 87584
A8: Building
A9: Hazard Insurance | B9: of:=[.R9]/12 -> 170.666666666667 | D9: 631.5 | F9: 666.5 | I9: 676.75 | L9: 676.75 | O9: of:=SUM([.C9:.N9]) -> 2651.5 | P9: of:=[.$P$2]/12*[.R9] -> 2048 | Q9: of:=[.O9]-[.P9] -> 603.5 | R9: of:=4*512 -> 2048
A10: Maintenance | B10: of:=[.R10]/12 -> 80 | F10: 220 | G10: 143.1 | O10: of:=SUM([.C10:.N10]) -> 363.1 | P10: of:=[.$P$2]/12*[.R10] -> 960 | Q10: of:=[.O10]-[.P10] -> -596.9 | R10: 960
A11: Mortgage | B11: of:=[.R11]/12 -> 1138 | C11: 735 | D11: 735 | E11: 735 | F11: 735 | G11: 735 | H11: 735 | I11: 735 | J11: 735 | K11: 735 | M11: 735 | N11: 735 | O11: of:=SUM([.C11:.N11]) -> 8085 | P11: of:=[.$P$2]/12*[.R11] -> 13656 | Q11: of:=[.O11]-[.P11] -> -5571 | R11: of:=1138*12 -> 13656
A12: Property Tax | B12: of:=[.R12]/12 -> 50 | L12: 401.74 | N12: 416.29 | O12: of:=SUM([.C12:.N12]) -> 818.03 | P12: of:=[.$P$2]/12*[.R12] -> 600 | Q12: of:=[.O12]-[.P12] -> 218.03 | R12: 600
A13: Supplies | B13: of:=[.R13]/12 -> 8.33333333333333 | O13: of:=SUM([.C13:.N13]) -> 0 | P13: of:=[.$P$2]/12*[.R13] -> 100 | Q13: of:=[.O13]-[.P13] -> -100 | R13: 100
A14: Utilities | B14: of:=[.R14]/12 -> 650 | C14: 553.92 | D14: 353.32 | E14: 696.49 | F14: 509.93 | G14: 534.1 | H14: 672.68 | I14: 929.94 | J14: 1072.88 | K14: 960.49 | L14: 861.45 | M14: 503.76 | O14: of:=SUM([.C14:.N14]) -> 7648.96 | P14: of:=[.$P$2]/12*[.R14] -> 7800 | Q14: of:=[.O14]-[.P14] -> -151.04 | R14: 7800
A15: TOTAL Building | B15: of:=SUM([.B9:.B14]) -> 2097 | C15: of:=SUM([.C9:.C14]) -> 1288.92 | D15: of:=SUM([.D9:.D14]) -> 1719.82 | E15: of:=SUM([.E9:.E14]) -> 1431.49 | F15: of:=SUM([.F9:.F14]) -> 2131.43 | G15: of:=SUM([.G9:.G14]) -> 1412.2 | H15: of:=SUM([.H9:.H14]) -> 1407.68 | I15: of:=SUM([.I9:.I14]) -> 2341.69 | J15: of:=SUM([.J9:.J14]) -> 1807.88 | K15: of:=SUM([.K9:.K14]) -> 1695.49 | L15: of:=SUM([.L9:.L14]) -> 1939.94 | M15: of:=SUM([.M9:.M14]) -> 1238.76 | N15: of:=SUM([.N9:.N14]) -> 1151.29 | O15: of:=SUM([.C15:.N15]) -> 19566.59 | P15: of:=[.$P$2]/12*[.R15] -> 25164 | Q15: of:=[.O15]-[.P15] -> -5597.41 | R15: of:=SUM([.R8:.R14]) -> 25164
A17: Business Expenses
A18: Worker's Comp | B18: of:=[.R18]/12 -> 50 | D18: 518.13 | F18: -106.58 | O18: of:=SUM([.C18:.N18]) -> 411.55 | P18: of:=[.$P$2]/12*[.R18] -> 600 | Q18: of:=[.O18]-[.P18] -> -188.45 | R18: 600
A19: Office | D19: 3.2 | K19: 97 | M19: 40 | O19: of:=SUM([.C19:.N19]) -> 140.2 | P19: of:=[.$P$2]/12*[.R19] -> 200 | Q19: of:=[.O19]-[.P19] -> -59.8 | R19: 200
A20: Telephone | B20: of:=[.R20]/12 -> 100 | C20: 32.52 | D20: 32.52 | E20: 32.52 | F20: 32.52 | G20: 32.52 | H20: 32.57 | I20: 32.19 | J20: 32.19 | K20: 32.19 | L20: 33.69 | M20: 33.69 | N20: 33.75 | O20: of:=SUM([.C20:.N20]) -> 392.87 | P20: of:=[.$P$2]/12*[.R20] -> 1200 | Q20: of:=[.O20]-[.P20] -> -807.13 | R20: 1200
A21: TOTAL Business Expenses | B21: of:=SUM([.B18:.B20]) -> 150 | C21: of:=SUM([.C18:.C20]) -> 32.52 | D21: of:=SUM([.D18:.D20]) -> 553.85 | E21: of:=SUM([.E18:.E20]) -> 32.52 | F21: of:=SUM([.F18:.F20]) -> -74.06 | G21: of:=SUM([.G18:.G20]) -> 32.52 | H21: of:=SUM([.H18:.H20]) -> 32.57 | I21: of:=SUM([.I18:.I20]) -> 32.19 | J21: of:=SUM([.J18:.J20]) -> 32.19 | K21: of:=SUM([.K18:.K20]) -> 129.19 | L21: of:=SUM([.L18:.L20]) -> 33.69 | M21: of:=SUM([.M18:.M20]) -> 73.69 | N21: of:=SUM([.N18:.N20]) -> 33.75 | O21: of:=SUM([.C21:.N21]) -> 944.62 | P21: of:=[.$P$2]/12*[.R21] -> 2000 | Q21: of:=[.O21]-[.P21] -> -1055.38 | R21: of:=SUM([.R17:.R20]) -> 2000
A23: Ministry
A24: Adult | B24: of:=[.R24]/12 -> 10 | O24: of:=SUM([.C24:.N24]) -> 0 | P24: of:=[.$P$2]/12*[.R24] -> 120 | Q24: of:=[.O24]-[.P24] -> -120 | R24: 120
A25: Children | B25: of:=[.R25]/12 -> 10 | O25: of:=SUM([.C25:.N25]) -> 0 | P25: of:=[.$P$2]/12*[.R25] -> 120 | Q25: of:=[.O25]-[.P25] -> -120 | R25: 120
A26: Fellowship | B26: of:=[.R26]/12 -> 30 | O26: of:=SUM([.C26:.N26]) -> 0 | P26: of:=[.$P$2]/12*[.R26] -> 360 | Q26: of:=[.O26]-[.P26] -> -360 | R26: 360
A27: Missions | B27: of:=[.R27]/12 -> 80 | C27: 68 | D27: 62 | E27: 76 | F27: 60 | G27: 74 | H27: 56 | I27: 50 | J27: 70 | K27: 60 | L27: 76 | M27: 68 | N27: 66 | O27: of:=SUM([.C27:.N27]) -> 786 | P27: of:=[.$P$2]/12*[.R27] -> 960 | Q27: of:=[.O27]-[.P27] -> -174 | R27: 960
A28: Outreach | B28: of:=[.R28]/12 -> 50 | C28: 15.18 | D28: 15.18 | E28: 15.18 | F28: 15.18 | G28: 15.18 | H28: 15.18 | I28: 15 | J28: 15.18 | K28: 15.18 | L28: 15.18 | M28: 15.18 | N28: 15.18 | O28: of:=SUM([.C28:.N28]) -> 181.98 | P28: of:=[.$P$2]/12*[.R28] -> 600 | Q28: of:=[.O28]-[.P28] -> -418.02 | R28: 600
A29: Christian Education | B29: of:=[.R29]/12 -> 25 | G29: -69.38 | O29: of:=SUM([.C29:.N29]) -> -69.38 | P29: of:=[.$P$2]/12*[.R29] -> 300 | Q29: of:=[.O29]-[.P29] -> -369.38 | R29: 300
A30: Worship | B30: of:=[.R30]/12 -> 30 | E30: 109 | O30: of:=SUM([.C30:.N30]) -> 109 | P30: of:=[.$P$2]/12*[.R30] -> 360 | Q30: of:=[.O30]-[.P30] -> -251 | R30: 360
A31: Youth | B31: of:=[.R31]/12 -> 10 | O31: of:=SUM([.C31:.N31]) -> 0 | P31: of:=[.$P$2]/12*[.R31] -> 120 | Q31: of:=[.O31]-[.P31] -> -120 | R31: 120
A32: TOTAL Ministry | B32: of:=SUM([.B24:.B31]) -> 245 | C32: of:=SUM([.C24:.C31]) -> 83.18 | D32: of:=SUM([.D24:.D31]) -> 77.18 | E32: of:=SUM([.E24:.E31]) -> 200.18 | F32: of:=SUM([.F24:.F31]) -> 75.18 | G32: of:=SUM([.G24:.G31]) -> 19.8 | H32: of:=SUM([.H24:.H31]) -> 71.18 | I32: of:=SUM([.I24:.I31]) -> 65 | J32: of:=SUM([.J24:.J31]) -> 85.18 | K32: of:=SUM([.K24:.K31]) -> 75.18 | L32: of:=SUM([.L24:.L31]) -> 91.18 | M32: of:=SUM([.M24:.M31]) -> 83.18 | N32: of:=SUM([.N24:.N31]) -> 81.18 | O32: of:=SUM([.C32:.N32]) -> 1007.6 | P32: of:=[.$P$2]/12*[.R32] -> 2940 | Q32: of:=[.O32]-[.P32] -> -1932.4 | R32: of:=SUM([.R23:.R31]) -> 2940
A34: Parsonage
A35: Maintenance | B35: of:=[.R35]/12 -> 100 | O35: of:=SUM([.C35:.N35]) -> 0 | P35: of:=[.$P$2]/12*[.R35] -> 1200 | Q35: of:=[.O35]-[.P35] -> -1200 | R35: 1200
A36: Mortgage | B36: of:=[.R36]/12 -> 565 | C36: 565 | D36: 565 | E36: 565 | F36: 565 | G36: 565 | H36: 565 | I36: 565 | J36: 565 | K36: 565 | L36: 565 | M36: 565 | N36: 565 | O36: of:=SUM([.C36:.N36]) -> 6780 | P36: of:=[.$P$2]/12*[.R36] -> 6780 | Q36: of:=[.O36]-[.P36] -> 0 | R36: of:=12*565 -> 6780
A37: Property Tax | B37: of:=[.R37]/12 -> 183.333333333333 | M37: 1368.17 | O37: of:=SUM([.C37:.N37]) -> 1368.17 | P37: of:=[.$P$2]/12*[.R37] -> 2200 | Q37: of:=[.O37]-[.P37] -> -831.83 | R37: 2200
A38: Utilities | B38: of:=[.R38]/12 -> 408.333333333333 | C38: 345.85 | D38: 217.44 | E38: 346.74 | F38: 200.77 | G38: 269.18 | H38: 384.05 | I38: 510.54 | J38: 473.94 | K38: 715.44 | L38: 378.49 | M38: 362.08 | N38: 309.07 | O38: of:=SUM([.C38:.N38]) -> 4513.59 | P38: of:=[.$P$2]/12*[.R38] -> 4900 | Q38: of:=[.O38]-[.P38] -> -386.41 | R38: 4900
A39: TOTAL Parsonage | B39: of:=SUM([.B35:.B38]) -> 1256.66666666667 | C39: of:=SUM([.C35:.C38]) -> 910.85 | D39: of:=SUM([.D35:.D38]) -> 782.44 | E39: of:=SUM([.E35:.E38]) -> 911.74 | F39: of:=SUM([.F35:.F38]) -> 765.77 | G39: of:=SUM([.G35:.G38]) -> 834.18 | H39: of:=SUM([.H35:.H38]) -> 949.05 | I39: of:=SUM([.I35:.I38]) -> 1075.54 | J39: of:=SUM([.J35:.J38]) -> 1038.94 | K39: of:=SUM([.K35:.K38]) -> 1280.44 | L39: of:=SUM([.L35:.L38]) -> 943.49 | M39: of:=SUM([.M35:.M38]) -> 2295.25 | N39: of:=SUM([.N35:.N38]) -> 874.07 | O39: of:=SUM([.C39:.N39]) -> 12661.76 | P39: of:=[.$P$2]/12*[.R39] -> 15080 | Q39: of:=[.O39]-[.P39] -> -2418.24 | R39: of:=SUM([.R34:.R38]) -> 15080
A41: Pastor
A42: Business Expenses | B42: of:=[.R42]/12 -> 500 | D42: 1000 | E42: 500 | F42: 500 | G42: 500 | H42: 500 | J42: 1000 | K42: 500 | L42: 500 | M42: 500 | N42: 500 | O42: of:=SUM([.C42:.N42]) -> 6000 | P42: of:=[.$P$2]/12*[.R42] -> 6000 | Q42: of:=[.O42]-[.P42] -> 0 | R42: 6000
A43: Honorarium | B43: of:=[.R43]/12 -> 3033.33333333333 | C43: 3500 | D43: 2800 | E43: 2800 | F43: 3500 | G43: 2800 | H43: 2800 | I43: 3500 | J43: 2800 | K43: 3500 | L43: 2800 | M43: 2800 | N43: 3500 | O43: of:=SUM([.C43:.N43]) -> 37100 | P43: of:=[.$P$2]/12*[.R43] -> 36400 | Q43: of:=[.O43]-[.P43] -> 700 | R43: of:=52*700 -> 36400
A44: Other | B44: of:=[.R44]/12 -> 0 | O44: of:=SUM([.C44:.N44]) -> 0 | P44: of:=[.$P$2]/12*[.R44] -> 0 | Q44: of:=[.O44]-[.P44] -> 0 | R44: 0
A45: TOTAL Pastor | B45: of:=SUM([.B42:.B43]) -> 3533.33333333333 | C45: of:=SUM([.C42:.C43]) -> 3500 | D45: of:=SUM([.D42:.D43]) -> 3800 | E45: of:=SUM([.E42:.E43]) -> 3300 | F45: of:=SUM([.F42:.F43]) -> 4000 | G45: of:=SUM([.G42:.G43]) -> 3300 | H45: of:=SUM([.H42:.H43]) -> 3300 | I45: of:=SUM([.I42:.I43]) -> 3500 | J45: of:=SUM([.J42:.J44]) -> 3800 | K45: of:=SUM([.K42:.K43]) -> 4000 | L45: of:=SUM([.L42:.L43]) -> 3300 | M45: of:=SUM([.M42:.M43]) -> 3300 | N45: of:=SUM([.N42:.N43]) -> 4000 | O45: of:=SUM([.C45:.N45]) -> 43100 | P45: of:=[.$P$2]/12*[.R45] -> 42400 | Q45: of:=[.O45]-[.P45] -> 700 | R45: of:=SUM([.R41:.R43]) -> 42400
A47: TOTAL EXPENSES | B47: of:=[.B15]+[.B21]+[.B32]+[.B39]+[.B45] -> 7282 | C47: of:=[.C15]+[.C21]+[.C32]+[.C39]+[.C45] -> 5815.47 | D47: of:=[.D15]+[.D21]+[.D32]+[.D39]+[.D45] -> 6933.29 | E47: of:=[.E15]+[.E21]+[.E32]+[.E39]+[.E45] -> 5875.93 | F47: of:=[.F15]+[.F21]+[.F32]+[.F39]+[.F45] -> 6898.32 | G47: of:=[.G15]+[.G21]+[.G32]+[.G39]+[.G45] -> 5598.7 | H47: of:=[.H15]+[.H21]+[.H32]+[.H39]+[.H45] -> 5760.48 | I47: of:=[.I15]+[.I21]+[.I32]+[.I39]+[.I45] -> 7014.42 | J47: of:=[.J15]+[.J21]+[.J32]+[.J39]+[.J45] -> 6764.19 | K47: of:=[.K15]+[.K21]+[.K32]+[.K39]+[.K45] -> 7180.3 | L47: of:=[.L15]+[.L21]+[.L32]+[.L39]+[.L45] -> 6308.3 | M47: of:=[.M15]+[.M21]+[.M32]+[.M39]+[.M45] -> 6990.88 | N47: of:=[.N15]+[.N21]+[.N32]+[.N39]+[.N45] -> 6140.29 | O47: of:=[.O15]+[.O21]+[.O32]+[.O39]+[.O45] -> 77280.57 | P47: of:=[.$P$2]/12*[.R47] -> 87584 | Q47: of:=[.O47]-[.P47] -> -10303.43 | R47: of:=[.R15]+[.R21]+[.R32]+[.R39]+[.R45] -> 87584
A49: OVERALL TOTAL | B49: of:=[.B6]+[.B47] -> 14580.6666666667 | C49: of:=[.C6]-[.C47] -> 463.53 | D49: of:=[.D6]-[.D47] -> 671.71 | E49: of:=[.E6]-[.E47] -> 105.07 | F49: of:=[.F6]-[.F47] -> 501.68 | G49: of:=[.G6]-[.G47] -> 87.3000000000002 | H49: of:=[.H6]-[.H47] -> -868.48 | I49: of:=[.I6]-[.I47] -> 4.07999999999993 | J49: of:=[.J6]-[.J47] -> -727.190000000001 | K49: of:=[.K6]-[.K47] -> 402.7 | L49: of:=[.L6]-[.L47] -> 501.7 | M49: of:=[.M6]-[.M47] -> -372.88 | N49: of:=[.N6]-[.N47] -> 1013.71 | O49: of:=[.O6]-[.O47] -> 1782.92999999999 | P49: of:=[.$P$2]/12*[.R49] -> 0 | Q49: of:=[.O49]-[.P49] -> 1782.92999999999 | R49: of:=[.R6]-[.R47] -> 0
B83: of:=[.$O$4] -> Total YTD | C83: of:=[.$P$4] -> Budget YTD
A84: of:=[.$A$8] -> Building | B84: of:=[.O$15] -> 19566.59 | C84: of:=[.P$15] -> 25164
A85: of:=[.$A$17] -> Business Expenses | B85: of:=[.O$21] -> 944.62 | C85: of:=[.P$21] -> 2000
A86: of:=[.$A$23] -> Ministry | B86: of:=[.O$32] -> 1007.6 | C86: of:=[.P$32] -> 2940
A87: of:=[.$A$34] -> Parsonage | B87: of:=[.O$39] -> 12661.76 | C87: of:=[.P$39] -> 15080
A88: of:=[.$A$41] -> Pastor | B88: of:=[.O$45] -> 43100 | C88: of:=[.P$45] -> 42400

Sheet: Holding Account
A1: Category | B1: Amount
A2: Building Property Tax | B2: of:=[Budget.B12] -> 50
A3: Parsonage Property Tax | B3: of:=[Budget.B37] -> 183.333333333333
A4: Hazard Insurance | B4: of:=[Budget.B9] -> 170.666666666667
A5: Workers' Comp | B5: of:=[Budget.B18] -> 50
A6: Building Maintenance
A7: Parsonage Maintenance