Sheet: Budget
A1: Budget | B1: 2013 | P1: #Months YTD
P2: of:=COUNT([.C6:.N6]) -> 8
C3: Month
A4: CategoryÂ Description | B4: Budget | C4: of:=EOMONTH(DATE([.$B$1];1;1);0) -> 2013-01-31 | D4: of:=EOMONTH([.C4];1) -> 2013-02-28 | E4: of:=EOMONTH([.D4];1) -> 2013-03-31 | F4: of:=EOMONTH([.E4];1) -> 2013-04-30 | G4: of:=EOMONTH([.F4];1) -> 2013-05-31 | H4: of:=EOMONTH([.G4];1) -> 2013-06-30 | I4: of:=EOMONTH([.H4];1) -> 2013-07-31 | J4: of:=EOMONTH([.I4];1) -> 2013-08-31 | K4: of:=EOMONTH([.J4];1) -> 2013-09-30 | L4: of:=EOMONTH([.K4];1) -> 2013-10-31 | M4: of:=EOMONTH([.L4];1) -> 2013-11-30 | N4: of:=EOMONTH([.M4];1) -> 2013-12-31 | O4: Total YTD | P4: Budget YTD | Q4: Difference | R4: Actual Budget
A6: General income | B6: of:=[.R6]/12 -> 7298.66666666667 | C6: 4769 | D6: 11679 | E6: 9375 | F6: 6072 | G6: 7563.85 | H6: 6828 | I6: 7560 | J6: 8547 | O6: of:=SUM([.C6:.N6]) -> 62393.85 | P6: of:=[.$P$2]/12*[.R6] -> 58389.3333333333 | Q6: of:=[.O6]-[.P6] -> 4004.51666666667 | R6: of:=[.R47] -> 87584
A8: Building
A9: Hazard Insurance | B9: of:=[.R9]/12 -> 170.666666666667 | D9: 724.3 | G9: 766 | J9: 780.5 | O9: of:=SUM([.C9:.N9]) -> 2270.8 | P9: of:=[.$P$2]/12*[.R9] -> 1365.33333333333 | Q9: of:=[.O9]-[.P9] -> 905.466666666667 | R9: of:=4*512 -> 2048
A10: Maintenance | B10: of:=[.R10]/12 -> 80 | E10: 4000 | J10: 98.21 | O10: of:=SUM([.C10:.N10]) -> 4098.21 | P10: of:=[.$P$2]/12*[.R10] -> 640 | Q10: of:=[.O10]-[.P10] -> 3458.21 | R10: 960
A11: Mortgage | B11: of:=[.R11]/12 -> 1138 | C11: 735 | D11: 735 | E11: 735 | F11: 735 | G11: 735 | H11: 735 | I11: 735 | J11: 735 | O11: of:=SUM([.C11:.N11]) -> 5880 | P11: of:=[.$P$2]/12*[.R11] -> 9104 | Q11: of:=[.O11]-[.P11] -> -3224 | R11: of:=1138*12 -> 13656
A12: Property Tax | B12: of:=[.R12]/12 -> 50 | E12: 352.32 | O12: of:=SUM([.C12:.N12]) -> 352.32 | P12: of:=[.$P$2]/12*[.R12] -> 400 | Q12: of:=[.O12]-[.P12] -> -47.68 | R12: 600
A13: Supplies | B13: of:=[.R13]/12 -> 8.33333333333333 | O13: of:=SUM([.C13:.N13]) -> 0 | P13: of:=[.$P$2]/12*[.R13] -> 66.6666666666667 | Q13: of:=[.O13]-[.P13] -> -66.6666666666667 | R13: 100
A14: Utilities | B14: of:=[.R14]/12 -> 650 | C14: 590.49 | D14: 580.51 | E14: 544.56 | F14: 453.02 | G14: 641.45 | H14: 590.05 | I14: 855 | J14: 972.04 | O14: of:=SUM([.C14:.N14]) -> 5227.12 | P14: of:=[.$P$2]/12*[.R14] -> 5200 | Q14: of:=[.O14]-[.P14] -> 27.1199999999999 | R14: 7800
A15: TOTAL Building | B15: of:=SUM([.B9:.B14]) -> 2097 | C15: of:=SUM([.C9:.C14]) -> 1325.49 | D15: of:=SUM([.D9:.D14]) -> 2039.81 | E15: of:=SUM([.E9:.E14]) -> 5631.88 | F15: of:=SUM([.F9:.F14]) -> 1188.02 | G15: of:=SUM([.G9:.G14]) -> 2142.45 | H15: of:=SUM([.H9:.H14]) -> 1325.05 | I15: of:=SUM([.I9:.I14]) -> 1590 | J15: of:=SUM([.J9:.J14]) -> 2585.75 | K15: of:=SUM([.K9:.K14]) -> 0 | L15: of:=SUM([.L9:.L14]) -> 0 | M15: of:=SUM([.M9:.M14]) -> 0 | N15: of:=SUM([.N9:.N14]) -> 0 | O15: of:=SUM([.C15:.N15]) -> 17828.45 | P15: of:=[.$P$2]/12*[.R15] -> 16776 | Q15: of:=[.O15]-[.P15] -> 1052.45 | R15: of:=SUM([.R8:.R14]) -> 25164
A17: Business Expenses
A18: Worker's Comp | B18: of:=[.R18]/12 -> 50 | D18: 519.26 | O18: of:=SUM([.C18:.N18]) -> 519.26 | P18: of:=[.$P$2]/12*[.R18] -> 400 | Q18: of:=[.O18]-[.P18] -> 119.26 | R18: 600
A19: Office | C19: 7 | E19: 60.98 | J19: 4 | O19: of:=SUM([.C19:.N19]) -> 71.98 | P19: of:=[.$P$2]/12*[.R19] -> 133.333333333333 | Q19: of:=[.O19]-[.P19] -> -61.3533333333333 | R19: 200
A20: Telephone | B20: of:=[.R20]/12 -> 100 | C20: 34.77 | D20: 34.74 | E20: 34.74 | F20: 35.05 | G20: 35.05 | H20: 35.04 | I20: 35.2 | J20: 35.35 | O20: of:=SUM([.C20:.N20]) -> 279.94 | P20: of:=[.$P$2]/12*[.R20] -> 800 | Q20: of:=[.O20]-[.P20] -> -520.06 | R20: 1200
A21: TOTAL Business Expenses | B21: of:=SUM([.B18:.B20]) -> 150 | C21: of:=SUM([.C18:.C20]) -> 41.77 | D21: of:=SUM([.D18:.D20]) -> 554 | E21: of:=SUM([.E18:.E20]) -> 95.72 | F21: of:=SUM([.F18:.F20]) -> 35.05 | G21: of:=SUM([.G18:.G20]) -> 35.05 | H21: of:=SUM([.H18:.H20]) -> 35.04 | I21: of:=SUM([.I18:.I20]) -> 35.2 | J21: of:=SUM([.J18:.J20]) -> 39.35 | K21: of:=SUM([.K18:.K20]) -> 0 | L21: of:=SUM([.L18:.L20]) -> 0 | M21: of:=SUM([.M18:.M20]) -> 0 | N21: of:=SUM([.N18:.N20]) -> 0 | O21: of:=SUM([.C21:.N21]) -> 871.18 | P21: of:=[.$P$2]/12*[.R21] -> 1333.33333333333 | Q21: of:=[.O21]-[.P21] -> -462.153333333333 | R21: of:=SUM([.R17:.R20]) -> 2000
A23: Ministry
A24: Adult | B24: of:=[.R24]/12 -> 10 | O24: of:=SUM([.C24:.N24]) -> 0 | P24: of:=[.$P$2]/12*[.R24] -> 80 | Q24: of:=[.O24]-[.P24] -> -80 | R24: 120
A25: Children | B25: of:=[.R25]/12 -> 10 | O25: of:=SUM([.C25:.N25]) -> 0 | P25: of:=[.$P$2]/12*[.R25] -> 80 | Q25: of:=[.O25]-[.P25] -> -80 | R25: 120
A26: Fellowship | B26: of:=[.R26]/12 -> 30 | O26: of:=SUM([.C26:.N26]) -> 0 | P26: of:=[.$P$2]/12*[.R26] -> 240 | Q26: of:=[.O26]-[.P26] -> -240 | R26: 360
A27: Missions | B27: of:=[.R27]/12 -> 80 | C27: 74 | D27: 48 | E27: 120 | F27: 94 | G27: 60 | H27: 76 | I27: 68 | J27: 76 | O27: of:=SUM([.C27:.N27]) -> 616 | P27: of:=[.$P$2]/12*[.R27] -> 640 | Q27: of:=[.O27]-[.P27] -> -24 | R27: 960
A28: Outreach | B28: of:=[.R28]/12 -> 50 | C28: 15.18 | D28: 15.18 | E28: 15.18 | F28: 15.18 | G28: 15.18 | H28: 15.18 | I28: 15.18 | J28: 15.18 | O28: of:=SUM([.C28:.N28]) -> 121.44 | P28: of:=[.$P$2]/12*[.R28] -> 400 | Q28: of:=[.O28]-[.P28] -> -278.56 | R28: 600
A29: Christian Education | B29: of:=[.R29]/12 -> 25 | O29: of:=SUM([.C29:.N29]) -> 0 | P29: of:=[.$P$2]/12*[.R29] -> 200 | Q29: of:=[.O29]-[.P29] -> -200 | R29: 300
A30: Worship | B30: of:=[.R30]/12 -> 30 | E30: 116 | I30: 200 | O30: of:=SUM([.C30:.N30]) -> 316 | P30: of:=[.$P$2]/12*[.R30] -> 240 | Q30: of:=[.O30]-[.P30] -> 76 | R30: 360
A31: Youth | B31: of:=[.R31]/12 -> 10 | O31: of:=SUM([.C31:.N31]) -> 0 | P31: of:=[.$P$2]/12*[.R31] -> 80 | Q31: of:=[.O31]-[.P31] -> -80 | R31: 120
A32: TOTAL Ministry | B32: of:=SUM([.B24:.B31]) -> 245 | C32: of:=SUM([.C24:.C31]) -> 89.18 | D32: of:=SUM([.D24:.D31]) -> 63.18 | E32: of:=SUM([.E24:.E31]) -> 251.18 | F32: of:=SUM([.F24:.F31]) -> 109.18 | G32: of:=SUM([.G24:.G31]) -> 75.18 | H32: of:=SUM([.H24:.H31]) -> 91.18 | I32: of:=SUM([.I24:.I31]) -> 283.18 | J32: of:=SUM([.J24:.J31]) -> 91.18 | K32: of:=SUM([.K24:.K31]) -> 0 | L32: of:=SUM([.L24:.L31]) -> 0 | M32: of:=SUM([.M24:.M31]) -> 0 | N32: of:=SUM([.N24:.N31]) -> 0 | O32: of:=SUM([.C32:.N32]) -> 1053.44 | P32: of:=[.$P$2]/12*[.R32] -> 1960 | Q32: of:=[.O32]-[.P32] -> -906.56 | R32: of:=SUM([.R23:.R31]) -> 2940
A34: Parsonage
A35: Maintenance | B35: of:=[.R35]/12 -> 100 | C35: 75 | P35: of:=[.$P$2]/12*[.R35] -> 800 | Q35: of:=[.O35]-[.P35] -> -800 | R35: 1200
A36: Mortgage | B36: of:=[.R36]/12 -> 565 | C36: 565 | D36: 565 | E36: 565 | F36: 1065 | G36: 1579.24 | H36: 600 | I36: 600 | J36: 600 | P36: of:=[.$P$2]/12*[.R36] -> 4520 | Q36: of:=[.O36]-[.P36] -> -4520 | R36: of:=12*565 -> 6780
A37: Property Tax | B37: of:=[.R37]/12 -> 183.333333333333 | F37: 1396.77 | P37: of:=[.$P$2]/12*[.R37] -> 1466.66666666667 | Q37: of:=[.O37]-[.P37] -> -1466.66666666667 | R37: 2200
A38: Utilities | B38: of:=[.R38]/12 -> 408.333333333333 | C38: 290.68 | D38: 290.49 | E38: 490.57 | F38: 186.84 | G38: 152.38 | H38: 351.79 | I38: 547.44 | J38: 550.15 | P38: of:=[.$P$2]/12*[.R38] -> 3266.66666666667 | Q38: of:=[.O38]-[.P38] -> -3266.66666666667 | R38: 4900
A39: TOTAL Parsonage | B39: of:=SUM([.B35:.B38]) -> 1256.66666666667 | C39: of:=SUM([.C35:.C38]) -> 930.68 | D39: of:=SUM([.D35:.D38]) -> 855.49 | E39: of:=SUM([.E35:.E38]) -> 1055.57 | F39: of:=SUM([.F35:.F38]) -> 2648.61 | G39: of:=SUM([.G35:.G38]) -> 1731.62 | H39: of:=SUM([.H35:.H38]) -> 951.79 | I39: of:=SUM([.I35:.I38]) -> 1147.44 | J39: of:=SUM([.J35:.J38]) -> 1150.15 | K39: of:=SUM([.K35:.K38]) -> 0 | L39: of:=SUM([.L35:.L38]) -> 0 | M39: of:=SUM([.M35:.M38]) -> 0 | N39: of:=SUM([.N35:.N38]) -> 0 | O39: of:=SUM([.C39:.N39]) -> 10471.35 | P39: of:=[.$P$2]/12*[.R39] -> 10053.3333333333 | Q39: of:=[.O39]-[.P39] -> 418.016666666668 | R39: of:=SUM([.R34:.R38]) -> 15080
A41: Pastor
A42: Business Expenses | B42: of:=[.R42]/12 -> 500 | C42: 500 | D42: 500 | E42: 500 | F42: 500 | G42: 500 | H42: 500 | I42: 500 | J42: 500 | P42: of:=[.$P$2]/12*[.R42] -> 4000 | Q42: of:=[.O42]-[.P42] -> -4000 | R42: 6000
A43: Honorarium | B43: of:=[.R43]/12 -> 3033.33333333333 | C43: 2800 | D43: 2800 | E43: 4500 | F43: 2800 | G43: 2800 | H43: 3500 | I43: 2800 | J43: 3500 | P43: of:=[.$P$2]/12*[.R43] -> 24266.6666666667 | Q43: of:=[.O43]-[.P43] -> -24266.6666666667 | R43: of:=52*700 -> 36400
A44: Other | B44: of:=[.R44]/12 -> 0 | P44: of:=[.$P$2]/12*[.R44] -> 0 | Q44: of:=[.O44]-[.P44] -> 0 | R44: 0
A45: TOTAL Pastor | B45: of:=SUM([.B42:.B43]) -> 3533.33333333333 | C45: of:=SUM([.C42:.C43]) -> 3300 | D45: of:=SUM([.D42:.D43]) -> 3300 | E45: of:=SUM([.E42:.E43]) -> 5000 | F45: of:=SUM([.F42:.F43]) -> 3300 | G45: of:=SUM([.G42:.G43]) -> 3300 | H45: of:=SUM([.H42:.H43]) -> 4000 | I45: of:=SUM([.I42:.I43]) -> 3300 | J45: of:=SUM([.J42:.J44]) -> 4000 | K45: of:=SUM([.K42:.K43]) -> 0 | L45: of:=SUM([.L42:.L43]) -> 0 | M45: of:=SUM([.M42:.M43]) -> 0 | N45: of:=SUM([.N42:.N43]) -> 0 | O45: of:=SUM([.C45:.N45]) -> 29500 | P45: of:=[.$P$2]/12*[.R45] -> 28266.6666666667 | Q45: of:=[.O45]-[.P45] -> 1233.33333333334 | R45: of:=SUM([.R41:.R43]) -> 42400
A47: TOTAL EXPENSES | B47: of:=[.B15]+[.B21]+[.B32]+[.B39]+[.B45] -> 7282 | C47: of:=[.C15]+[.C21]+[.C32]+[.C39]+[.C45] -> 5687.12 | D47: of:=[.D15]+[.D21]+[.D32]+[.D39]+[.D45] -> 6812.48 | E47: of:=[.E15]+[.E21]+[.E32]+[.E39]+[.E45] -> 12034.35 | F47: of:=[.F15]+[.F21]+[.F32]+[.F39]+[.F45] -> 7280.86 | G47: of:=[.G15]+[.G21]+[.G32]+[.G39]+[.G45] -> 7284.3 | H47: of:=[.H15]+[.H21]+[.H32]+[.H39]+[.H45] -> 6403.06 | I47: of:=[.I15]+[.I21]+[.I32]+[.I39]+[.I45] -> 6355.82 | J47: of:=[.J15]+[.J21]+[.J32]+[.J39]+[.J45] -> 7866.43 | K47: of:=[.K15]+[.K21]+[.K32]+[.K39]+[.K45] -> 0 | L47: of:=[.L15]+[.L21]+[.L32]+[.L39]+[.L45] -> 0 | M47: of:=[.M15]+[.M21]+[.M32]+[.M39]+[.M45] -> 0 | N47: of:=[.N15]+[.N21]+[.N32]+[.N39]+[.N45] -> 0 | O47: of:=[.O15]+[.O21]+[.O32]+[.O39]+[.O45] -> 59724.42 | P47: of:=[.$P$2]/12*[.R47] -> 58389.3333333333 | Q47: of:=[.O47]-[.P47] -> 1335.08666666667 | R47: of:=[.R15]+[.R21]+[.R32]+[.R39]+[.R45] -> 87584
A49: OVERALL TOTAL | B49: of:=[.B6]+[.B47] -> 14580.6666666667 | C49: of:=[.C6]-[.C47] -> -918.12 | D49: of:=[.D6]-[.D47] -> 4866.52 | E49: of:=[.E6]-[.E47] -> -2659.35 | F49: of:=[.F6]-[.F47] -> -1208.86 | G49: of:=[.G6]-[.G47] -> 279.550000000001 | H49: of:=[.H6]-[.H47] -> 424.940000000001 | I49: of:=[.I6]-[.I47] -> 1204.18 | J49: of:=[.J6]-[.J47] -> 680.57 | K49: of:=[.K6]-[.K47] -> 0 | L49: of:=[.L6]-[.L47] -> 0 | M49: of:=[.M6]-[.M47] -> 0 | N49: of:=[.N6]-[.N47] -> 0 | O49: of:=[.O6]-[.O47] -> 2669.43 | P49: of:=[.$P$2]/12*[.R49] -> 0 | Q49: of:=[.O49]-[.P49] -> 2669.43 | R49: of:=[.R6]-[.R47] -> 0
B83: of:=[.$O$4] -> Total YTD | C83: of:=[.$P$4] -> Budget YTD
A84: of:=[.$A$8] -> Building | B84: of:=[.O$15] -> 17828.45 | C84: of:=[.P$15] -> 16776
A85: of:=[.$A$17] -> Business Expenses | B85: of:=[.O$21] -> 871.18 | C85: of:=[.P$21] -> 1333.33333333333
A86: of:=[.$A$23] -> Ministry | B86: of:=[.O$32] -> 1053.44 | C86: of:=[.P$32] -> 1960
A87: of:=[.$A$34] -> Parsonage | B87: of:=[.O$39] -> 10471.35 | C87: of:=[.P$39] -> 10053.3333333333
A88: of:=[.$A$41] -> Pastor | B88: of:=[.O$45] -> 29500 | C88: of:=[.P$45] -> 28266.6666666667

Sheet: Holding Account
A1: Category | B1: Amount
A2: Building Property Tax | B2: of:=[Budget.B12] -> 50
A3: Parsonage Property Tax | B3: of:=[Budget.B37] -> 183.333333333333
A4: Hazard Insurance | B4: of:=[Budget.B9] -> 170.666666666667 | F4: of:=6356-383.21-615.31 -> 5357.48
A5: Workers' Comp | B5: of:=[Budget.B18] -> 50 | H5: From bal | I5: 6414
A6: Building Maintenance | H6: From budget | I6: 6356
A7: Parsonage Maintenance | I7: of:=[.I5]-[.I6] -> 58