Sheet: Balances
A1: of:=CONCATENATE("QHCC Balances ";[.A39]) -> QHCC Balances 2015
A2: Date | B2: QHCC Account | C2: General | D2: Gen - Hold | E2: Parsonage | F2: Deacon | G2: Holding | H2: Youth | I2: Internet | J2: Temporary | K2: Total | L2: Diff | M2: Total Other | N2: General by Diff | O2: Diff | P2: QHCC Acct Rpt | Q2: Diff | R2: General from Rpt | S2: General by Diff | T2: Diff
A3: of:=EOMONTH(DATE([.A39]-1;12;1);0) -> 2014-12-31 | B3: 7748.74 | C3: 1057.78 | D3: 1057.38 | E3: 385.42 | F3: 865.08 | G3: 0 | H3: 259.52 | I3: -0.0599999999999952 | J3: 5181.33 | K3: of:=[.C3]+SUM([.E3:.J3]) -> 7749.07 | L3: of:=[.K3]-[.B3] -> 0.329999999999927 | M3: of:=SUM([.E3:.J3]) -> 6691.29 | N3: of:=IF([.$B3]<>"";[.B3]-[.M3];"") -> 1057.45 | O3: of:=IF([.$B3]<>"";[.N3]-[.C3];"") -> -0.330000000000155 | Q3: of:=[.P3]-[.B3] -> -7748.74 | S3: of:=[.B3]-SUM([.E3:.J3]) -> 1057.45 | T3: of:=[.S3]-[.C3] -> -0.330000000000155
A4: of:=EOMONTH([.A3];1) -> 2015-01-31 | B4: of:=IF([$Income.$B4]>0;[.B3]+[$Income.B4]-[$Expense.B4];"") -> 7188.32 | C4: of:=IF([$Income.$B4]>0;[.C3]+[$Income.C4]-[$Expense.C4];"") -> 197.36 | D4: of:=IF([$Income.$B4]>0;[.D3]+[$Income.D4]-[$Expense.D4];"") -> 196.96 | E4: of:=IF([$Income.$B4]>0;[.E3]+[$Income.E4]-[$Expense.E4];"") -> 385.42 | F4: of:=IF([$Income.$B4]>0;[.F3]+[$Income.F4]-[$Expense.F4];"") -> 865.08 | G4: of:=IF([$Income.$B4]>0;[.G3]+[$Income.G4]-[$Expense.G4];"") -> 0 | H4: of:=IF([$Income.$B4]>0;[.H3]+[$Income.H4]-[$Expense.H4];"") -> 259.52 | I4: of:=IF([$Income.$B4]>0;[.I3]+[$Income.I4]-[$Expense.I4];"") -> -0.0599999999999952 | J4: of:=IF([$Income.$B4]>0;[.J3]+[$Income.J4]-[$Expense.J4];"") -> 5481.33 | K4: of:=IF([$Income.$B4]>0;[.C4]+SUM([.E4:.J4]);"") -> 7188.65 | L4: of:=IF([$Income.$B4]>0;[.K4]-[.B4];"") -> 0.329999999999927 | M4: of:=IF([$Income.$B4]>0;SUM([.E4:.J4]);"") -> 6991.29 | N4: of:=IF([.$B4]<>"";[.B4]-[.M4];"") -> 197.03 | O4: of:=IF([.$B4]<>"";[.N4]-[.C4];"") -> -0.329999999999927 | Q4: of:=IF([$Income.$B4]>0;[.P4]-[.B4];"") -> -7188.32 | S4: of:=IF([$Income.$B4]>0;[.B4]-SUM([.E4:.J4]);"") -> 197.03 | T4: of:=IF([$Income.$B4]>0;[.S4]-[.C4];"") -> -0.329999999999927
A5: of:=EOMONTH([.A4];1) -> 2015-02-28 | B5: of:=IF([$Income.$B5]>0;[.B4]+[$Income.B5]-[$Expense.B5];"") -> 7150.58 | C5: of:=IF([$Income.$B5]>0;[.C4]+[$Income.C5]-[$Expense.C5];"") -> -42.3800000000001 | D5: of:=IF([$Income.$B5]>0;[.D4]+[$Income.D5]-[$Expense.D5];"") -> -42.7799999999998 | E5: of:=IF([$Income.$B5]>0;[.E4]+[$Income.E5]-[$Expense.E5];"") -> 385.42 | F5: of:=IF([$Income.$B5]>0;[.F4]+[$Income.F5]-[$Expense.F5];"") -> 917.08 | G5: of:=IF([$Income.$B5]>0;[.G4]+[$Income.G5]-[$Expense.G5];"") -> 0 | H5: of:=IF([$Income.$B5]>0;[.H4]+[$Income.H5]-[$Expense.H5];"") -> 259.52 | I5: of:=IF([$Income.$B5]>0;[.I4]+[$Income.I5]-[$Expense.I5];"") -> -0.0599999999999952 | J5: of:=IF([$Income.$B5]>0;[.J4]+[$Income.J5]-[$Expense.J5];"") -> 5631.33 | K5: of:=IF([$Income.$B5]>0;[.C5]+SUM([.E5:.J5]);"") -> 7150.91 | L5: of:=IF([$Income.$B5]>0;[.K5]-[.B5];"") -> 0.329999999999927 | M5: of:=IF([$Income.$B5]>0;SUM([.E5:.J5]);"") -> 7193.29 | N5: of:=IF([.$B5]<>"";[.B5]-[.M5];"") -> -42.71 | O5: of:=IF([.$B5]<>"";[.N5]-[.C5];"") -> -0.329999999999927 | Q5: of:=IF([$Income.$B5]>0;[.P5]-[.B5];"") -> -7150.58 | S5: of:=IF([$Income.$B5]>0;[.B5]-SUM([.E5:.J5]);"") -> -42.71 | T5: of:=IF([$Income.$B5]>0;[.S5]-[.C5];"") -> -0.329999999999927
A6: of:=EOMONTH([.A5];1) -> 2015-03-31 | B6: of:=IF([$Income.$B6]>0;[.B5]+[$Income.B6]-[$Expense.B6];"") -> 10751.58 | C6: of:=IF([$Income.$B6]>0;[.C5]+[$Income.C6]-[$Expense.C6];"") -> 2598.62 | D6: of:=IF([$Income.$B6]>0;[.D5]+[$Income.D6]-[$Expense.D6];"") -> 2598.22 | E6: of:=IF([$Income.$B6]>0;[.E5]+[$Income.E6]-[$Expense.E6];"") -> 385.42 | F6: of:=IF([$Income.$B6]>0;[.F5]+[$Income.F6]-[$Expense.F6];"") -> 917.08 | G6: of:=IF([$Income.$B6]>0;[.G5]+[$Income.G6]-[$Expense.G6];"") -> 0 | H6: of:=IF([$Income.$B6]>0;[.H5]+[$Income.H6]-[$Expense.H6];"") -> 259.52 | I6: of:=IF([$Income.$B6]>0;[.I5]+[$Income.I6]-[$Expense.I6];"") -> -0.0599999999999952 | J6: of:=IF([$Income.$B6]>0;[.J5]+[$Income.J6]-[$Expense.J6];"") -> 6591.33 | K6: of:=IF([$Income.$B6]>0;[.C6]+SUM([.E6:.J6]);"") -> 10751.91 | L6: of:=IF([$Income.$B6]>0;[.K6]-[.B6];"") -> 0.329999999998108 | M6: of:=IF([$Income.$B6]>0;SUM([.E6:.J6]);"") -> 8153.29 | N6: of:=IF([.$B6]<>"";[.B6]-[.M6];"") -> 2598.29 | O6: of:=IF([.$B6]<>"";[.N6]-[.C6];"") -> -0.329999999997199 | Q6: of:=IF([$Income.$B6]>0;[.P6]-[.B6];"") -> -10751.58 | S6: of:=IF([$Income.$B6]>0;[.B6]-SUM([.E6:.J6]);"") -> 2598.29 | T6: of:=IF([$Income.$B6]>0;[.S6]-[.C6];"") -> -0.329999999997199
A7: of:=EOMONTH([.A6];1) -> 2015-04-30 | B7: of:=IF([$Income.$B7]>0;[.B6]+[$Income.B7]-[$Expense.B7];"") -> 7897.93 | C7: of:=IF([$Income.$B7]>0;[.C6]+[$Income.C7]-[$Expense.C7];"") -> 4679.91 | D7: of:=IF([$Income.$B7]>0;[.D6]+[$Income.D7]-[$Expense.D7];"") -> 4679.51 | E7: of:=IF([$Income.$B7]>0;[.E6]+[$Income.E7]-[$Expense.E7];"") -> 385.42 | F7: of:=IF([$Income.$B7]>0;[.F6]+[$Income.F7]-[$Expense.F7];"") -> 917.08 | G7: of:=IF([$Income.$B7]>0;[.G6]+[$Income.G7]-[$Expense.G7];"") -> 0 | H7: of:=IF([$Income.$B7]>0;[.H6]+[$Income.H7]-[$Expense.H7];"") -> 259.52 | I7: of:=IF([$Income.$B7]>0;[.I6]+[$Income.I7]-[$Expense.I7];"") -> -0.0599999999999952 | J7: of:=IF([$Income.$B7]>0;[.J6]+[$Income.J7]-[$Expense.J7];"") -> 1656.39 | K7: of:=IF([$Income.$B7]>0;[.C7]+SUM([.E7:.J7]);"") -> 7898.26 | L7: of:=IF([$Income.$B7]>0;[.K7]-[.B7];"") -> 0.329999999997199 | M7: of:=IF([$Income.$B7]>0;SUM([.E7:.J7]);"") -> 3218.35 | N7: of:=IF([.$B7]<>"";[.B7]-[.M7];"") -> 4679.58 | O7: of:=IF([.$B7]<>"";[.N7]-[.C7];"") -> -0.329999999997199 | Q7: of:=IF([$Income.$B7]>0;[.P7]-[.B7];"") -> -7897.93 | S7: of:=IF([$Income.$B7]>0;[.B7]-SUM([.E7:.J7]);"") -> 4679.58 | T7: of:=IF([$Income.$B7]>0;[.S7]-[.C7];"") -> -0.329999999997199
A8: of:=EOMONTH([.A7];1) -> 2015-05-31 | B8: of:=IF([$Income.$B8]>0;[.B7]+[$Income.B8]-[$Expense.B8];"") -> 9011.73 | C8: of:=IF([$Income.$B8]>0;[.C7]+[$Income.C8]-[$Expense.C8];"") -> 5352.71 | D8: of:=IF([$Income.$B8]>0;[.D7]+[$Income.D8]-[$Expense.D8];"") -> 5352.31 | E8: of:=IF([$Income.$B8]>0;[.E7]+[$Income.E8]-[$Expense.E8];"") -> 385.42 | F8: of:=IF([$Income.$B8]>0;[.F7]+[$Income.F8]-[$Expense.F8];"") -> 358.08 | G8: of:=IF([$Income.$B8]>0;[.G7]+[$Income.G8]-[$Expense.G8];"") -> 0 | H8: of:=IF([$Income.$B8]>0;[.H7]+[$Income.H8]-[$Expense.H8];"") -> 259.52 | I8: of:=IF([$Income.$B8]>0;[.I7]+[$Income.I8]-[$Expense.I8];"") -> -0.0599999999999952 | J8: of:=IF([$Income.$B8]>0;[.J7]+[$Income.J8]-[$Expense.J8];"") -> 2656.39 | K8: of:=IF([$Income.$B8]>0;[.C8]+SUM([.E8:.J8]);"") -> 9012.06 | L8: of:=IF([$Income.$B8]>0;[.K8]-[.B8];"") -> 0.32999999999447 | M8: of:=IF([$Income.$B8]>0;SUM([.E8:.J8]);"") -> 3659.35 | N8: of:=IF([.$B8]<>"";[.B8]-[.M8];"") -> 5352.38 | O8: of:=IF([.$B8]<>"";[.N8]-[.C8];"") -> -0.32999999999538 | Q8: of:=IF([$Income.$B8]>0;[.P8]-[.B8];"") -> -9011.73 | S8: of:=IF([$Income.$B8]>0;[.B8]-SUM([.E8:.J8]);"") -> 5352.38 | T8: of:=IF([$Income.$B8]>0;[.S8]-[.C8];"") -> -0.32999999999538
A9: of:=EOMONTH([.A8];1) -> 2015-06-30 | B9: of:=IF([$Income.$B9]>0;[.B8]+[$Income.B9]-[$Expense.B9];"") -> 9456.54 | C9: of:=IF([$Income.$B9]>0;[.C8]+[$Income.C9]-[$Expense.C9];"") -> 6015.72 | D9: of:=IF([$Income.$B9]>0;[.D8]+[$Income.D9]-[$Expense.D9];"") -> 6015.32 | E9: of:=IF([$Income.$B9]>0;[.E8]+[$Income.E9]-[$Expense.E9];"") -> 385.42 | F9: of:=IF([$Income.$B9]>0;[.F8]+[$Income.F9]-[$Expense.F9];"") -> -60.1200000000001 | G9: of:=IF([$Income.$B9]>0;[.G8]+[$Income.G9]-[$Expense.G9];"") -> 0 | H9: of:=IF([$Income.$B9]>0;[.H8]+[$Income.H9]-[$Expense.H9];"") -> 259.52 | I9: of:=IF([$Income.$B9]>0;[.I8]+[$Income.I9]-[$Expense.I9];"") -> -0.0599999999999952 | J9: of:=IF([$Income.$B9]>0;[.J8]+[$Income.J9]-[$Expense.J9];"") -> 2856.39 | K9: of:=IF([$Income.$B9]>0;[.C9]+SUM([.E9:.J9]);"") -> 9456.87 | L9: of:=IF([$Income.$B9]>0;[.K9]-[.B9];"") -> 0.32999999999447 | M9: of:=IF([$Income.$B9]>0;SUM([.E9:.J9]);"") -> 3441.15 | N9: of:=IF([.$B9]<>"";[.B9]-[.M9];"") -> 6015.39 | O9: of:=IF([.$B9]<>"";[.N9]-[.C9];"") -> -0.32999999999538 | Q9: of:=IF([$Income.$B9]>0;[.P9]-[.B9];"") -> -9456.54 | S9: of:=IF([$Income.$B9]>0;[.B9]-SUM([.E9:.J9]);"") -> 6015.39 | T9: of:=IF([$Income.$B9]>0;[.S9]-[.C9];"") -> -0.32999999999538
A10: of:=EOMONTH([.A9];1) -> 2015-07-31 | B10: of:=IF([$Income.$B10]>0;[.B9]+[$Income.B10]-[$Expense.B10];"") -> 9928.51000000001 | C10: of:=IF([$Income.$B10]>0;[.C9]+[$Income.C10]-[$Expense.C10];"") -> 6427.69 | D10: of:=IF([$Income.$B10]>0;[.D9]+[$Income.D10]-[$Expense.D10];"") -> 6427.29 | E10: of:=IF([$Income.$B10]>0;[.E9]+[$Income.E10]-[$Expense.E10];"") -> 385.42 | F10: of:=IF([$Income.$B10]>0;[.F9]+[$Income.F10]-[$Expense.F10];"") -> -0.120000000000061 | G10: of:=IF([$Income.$B10]>0;[.G9]+[$Income.G10]-[$Expense.G10];"") -> 0 | H10: of:=IF([$Income.$B10]>0;[.H9]+[$Income.H10]-[$Expense.H10];"") -> 259.52 | I10: of:=IF([$Income.$B10]>0;[.I9]+[$Income.I10]-[$Expense.I10];"") -> -0.0599999999999952 | J10: of:=IF([$Income.$B10]>0;[.J9]+[$Income.J10]-[$Expense.J10];"") -> 2856.39 | K10: of:=IF([$Income.$B10]>0;[.C10]+SUM([.E10:.J10]);"") -> 9928.84 | L10: of:=IF([$Income.$B10]>0;[.K10]-[.B10];"") -> 0.32999999999447 | M10: of:=IF([$Income.$B10]>0;SUM([.E10:.J10]);"") -> 3501.15 | N10: of:=IF([.$B10]<>"";[.B10]-[.M10];"") -> 6427.36000000001 | O10: of:=IF([.$B10]<>"";[.N10]-[.C10];"") -> -0.329999999993561 | Q10: of:=IF([$Income.$B10]>0;[.P10]-[.B10];"") -> -9928.51000000001 | S10: of:=IF([$Income.$B10]>0;[.B10]-SUM([.E10:.J10]);"") -> 6427.36000000001 | T10: of:=IF([$Income.$B10]>0;[.S10]-[.C10];"") -> -0.329999999993561
A11: of:=EOMONTH([.A10];1) -> 2015-08-31 | B11: of:=IF([$Income.$B11]>0;[.B10]+[$Income.B11]-[$Expense.B11];"") -> 12031.59 | C11: of:=IF([$Income.$B11]>0;[.C10]+[$Income.C11]-[$Expense.C11];"") -> 8376.77 | D11: of:=IF([$Income.$B11]>0;[.D10]+[$Income.D11]-[$Expense.D11];"") -> 8376.37 | E11: of:=IF([$Income.$B11]>0;[.E10]+[$Income.E11]-[$Expense.E11];"") -> 385.42 | F11: of:=IF([$Income.$B11]>0;[.F10]+[$Income.F11]-[$Expense.F11];"") -> 3.87999999999994 | G11: of:=IF([$Income.$B11]>0;[.G10]+[$Income.G11]-[$Expense.G11];"") -> 0 | H11: of:=IF([$Income.$B11]>0;[.H10]+[$Income.H11]-[$Expense.H11];"") -> 259.52 | I11: of:=IF([$Income.$B11]>0;[.I10]+[$Income.I11]-[$Expense.I11];"") -> -0.0599999999999952 | J11: of:=IF([$Income.$B11]>0;[.J10]+[$Income.J11]-[$Expense.J11];"") -> 3006.39 | K11: of:=IF([$Income.$B11]>0;[.C11]+SUM([.E11:.J11]);"") -> 12031.92 | L11: of:=IF([$Income.$B11]>0;[.K11]-[.B11];"") -> 0.329999999990832 | M11: of:=IF([$Income.$B11]>0;SUM([.E11:.J11]);"") -> 3655.15 | N11: of:=IF([.$B11]<>"";[.B11]-[.M11];"") -> 8376.44000000001 | O11: of:=IF([.$B11]<>"";[.N11]-[.C11];"") -> -0.329999999992651 | Q11: of:=IF([$Income.$B11]>0;[.P11]-[.B11];"") -> -12031.59 | S11: of:=IF([$Income.$B11]>0;[.B11]-SUM([.E11:.J11]);"") -> 8376.44000000001 | T11: of:=IF([$Income.$B11]>0;[.S11]-[.C11];"") -> -0.329999999992651
A12: of:=EOMONTH([.A11];1) -> 2015-09-30 | B12: of:=IF([$Income.$B12]>0;[.B11]+[$Income.B12]-[$Expense.B12];"") -> 12435.59 | C12: of:=IF([$Income.$B12]>0;[.C11]+[$Income.C12]-[$Expense.C12];"") -> 5965.29 | D12: of:=IF([$Income.$B12]>0;[.D11]+[$Income.D12]-[$Expense.D12];"") -> 4264.89 | E12: of:=IF([$Income.$B12]>0;[.E11]+[$Income.E12]-[$Expense.E12];"") -> 385.42 | F12: of:=IF([$Income.$B12]>0;[.F11]+[$Income.F12]-[$Expense.F12];"") -> 68.8799999999999 | G12: of:=IF([$Income.$B12]>0;[.G11]+[$Income.G12]-[$Expense.G12];"") -> 1700 | H12: of:=IF([$Income.$B12]>0;[.H11]+[$Income.H12]-[$Expense.H12];"") -> 259.52 | I12: of:=IF([$Income.$B12]>0;[.I11]+[$Income.I12]-[$Expense.I12];"") -> -0.0599999999999952 | J12: of:=IF([$Income.$B12]>0;[.J11]+[$Income.J12]-[$Expense.J12];"") -> 5756.39 | K12: of:=IF([$Income.$B12]>0;[.C12]+SUM([.E12:.J12]);"") -> 14135.44 | L12: of:=IF([$Income.$B12]>0;[.K12]-[.B12];"") -> 1699.84999999999 | M12: of:=IF([$Income.$B12]>0;SUM([.E12:.J12]);"") -> 8170.15 | N12: of:=IF([.$B12]<>"";[.B12]-[.M12];"") -> 4265.44000000001 | O12: of:=IF([.$B12]<>"";[.N12]-[.C12];"") -> -1699.84999999999 | Q12: of:=IF([$Income.$B12]>0;[.P12]-[.B12];"") -> -12435.59 | S12: of:=IF([$Income.$B12]>0;[.B12]-SUM([.E12:.J12]);"") -> 4265.44000000001 | T12: of:=IF([$Income.$B12]>0;[.S12]-[.C12];"") -> -1699.84999999999
A13: of:=EOMONTH([.A12];1) -> 2015-10-31 | B13: of:=IF([$Income.$B13]>0;[.B12]+[$Income.B13]-[$Expense.B13];"") -> 16327.54 | C13: of:=IF([$Income.$B13]>0;[.C12]+[$Income.C13]-[$Expense.C13];"") -> 9879.24 | D13: of:=IF([$Income.$B13]>0;[.D12]+[$Income.D13]-[$Expense.D13];"") -> 7491.84 | E13: of:=IF([$Income.$B13]>0;[.E12]+[$Income.E13]-[$Expense.E13];"") -> 385.42 | F13: of:=IF([$Income.$B13]>0;[.F12]+[$Income.F13]-[$Expense.F13];"") -> 46.8799999999999 | G13: of:=IF([$Income.$B13]>0;[.G12]+[$Income.G13]-[$Expense.G13];"") -> 2387 | H13: of:=IF([$Income.$B13]>0;[.H12]+[$Income.H13]-[$Expense.H13];"") -> 259.52 | I13: of:=IF([$Income.$B13]>0;[.I12]+[$Income.I13]-[$Expense.I13];"") -> -0.0599999999999952 | J13: of:=IF([$Income.$B13]>0;[.J12]+[$Income.J13]-[$Expense.J13];"") -> 5756.39 | K13: of:=IF([$Income.$B13]>0;[.C13]+SUM([.E13:.J13]);"") -> 18714.39 | L13: of:=IF([$Income.$B13]>0;[.K13]-[.B13];"") -> 2386.84999999999 | M13: of:=IF([$Income.$B13]>0;SUM([.E13:.J13]);"") -> 8835.15 | N13: of:=IF([.$B13]<>"";[.B13]-[.M13];"") -> 7492.39000000001 | O13: of:=IF([.$B13]<>"";[.N13]-[.C13];"") -> -2386.84999999999 | Q13: of:=IF([$Income.$B13]>0;[.P13]-[.B13];"") -> -16327.54 | S13: of:=IF([$Income.$B13]>0;[.B13]-SUM([.E13:.J13]);"") -> 7492.39000000001 | T13: of:=IF([$Income.$B13]>0;[.S13]-[.C13];"") -> -2386.84999999999
A14: of:=EOMONTH([.A13];1) -> 2015-11-30 | B14: of:=IF([$Income.$B14]>0;[.B13]+[$Income.B14]-[$Expense.B14];"") ->  | C14: of:=IF([$Income.$B14]>0;[.C13]+[$Income.C14]-[$Expense.C14];"") ->  | D14: of:=IF([$Income.$B14]>0;[.D13]+[$Income.D14]-[$Expense.D14];"") ->  | E14: of:=IF([$Income.$B14]>0;[.E13]+[$Income.E14]-[$Expense.E14];"") ->  | F14: of:=IF([$Income.$B14]>0;[.F13]+[$Income.F14]-[$Expense.F14];"") ->  | G14: of:=IF([$Income.$B14]>0;[.G13]+[$Income.G14]-[$Expense.G14];"") ->  | H14: of:=IF([$Income.$B14]>0;[.H13]+[$Income.H14]-[$Expense.H14];"") ->  | I14: of:=IF([$Income.$B14]>0;[.I13]+[$Income.I14]-[$Expense.I14];"") ->  | J14: of:=IF([$Income.$B14]>0;[.J13]+[$Income.J14]-[$Expense.J14];"") ->  | K14: of:=IF([$Income.$B14]>0;[.C14]+SUM([.E14:.J14]);"") ->  | L14: of:=IF([$Income.$B14]>0;[.K14]-[.B14];"") ->  | M14: of:=IF([$Income.$B14]>0;SUM([.E14:.J14]);"") ->  | N14: of:=IF([.$B14]<>"";[.B14]-[.M14];"") ->  | O14: of:=IF([.$B14]<>"";[.N14]-[.C14];"") ->  | Q14: of:=IF([$Income.$B14]>0;[.P14]-[.B14];"") ->  | S14: of:=IF([$Income.$B14]>0;[.B14]-SUM([.E14:.J14]);"") ->  | T14: of:=IF([$Income.$B14]>0;[.S14]-[.C14];"") -> 
A15: of:=EOMONTH([.A14];1) -> 2015-12-31 | B15: of:=IF([$Income.$B15]>0;[.B14]+[$Income.B15]-[$Expense.B15];"") ->  | C15: of:=IF([$Income.$B15]>0;[.C14]+[$Income.C15]-[$Expense.C15];"") ->  | D15: of:=IF([$Income.$B15]>0;[.D14]+[$Income.D15]-[$Expense.D15];"") ->  | E15: of:=IF([$Income.$B15]>0;[.E14]+[$Income.E15]-[$Expense.E15];"") ->  | F15: of:=IF([$Income.$B15]>0;[.F14]+[$Income.F15]-[$Expense.F15];"") ->  | G15: of:=IF([$Income.$B15]>0;[.G14]+[$Income.G15]-[$Expense.G15];"") ->  | H15: of:=IF([$Income.$B15]>0;[.H14]+[$Income.H15]-[$Expense.H15];"") ->  | I15: of:=IF([$Income.$B15]>0;[.I14]+[$Income.I15]-[$Expense.I15];"") ->  | J15: of:=IF([$Income.$B15]>0;[.J14]+[$Income.J15]-[$Expense.J15];"") ->  | K15: of:=IF([$Income.$B15]>0;[.C15]+SUM([.E15:.J15]);"") ->  | L15: of:=IF([$Income.$B15]>0;[.K15]-[.B15];"") ->  | M15: of:=IF([$Income.$B15]>0;SUM([.E15:.J15]);"") ->  | N15: of:=IF([.$B15]<>"";[.B15]-[.M15];"") ->  | O15: of:=IF([.$B15]<>"";[.N15]-[.C15];"") ->  | Q15: of:=IF([$Income.$B15]>0;[.P15]-[.B15];"") ->  | S15: of:=IF([$Income.$B15]>0;[.B15]-SUM([.E15:.J15]);"") ->  | T15: of:=IF([$Income.$B15]>0;[.S15]-[.C15];"") -> 
O34: Total
O35: QHCC
O36: Diff
A38: Year | B38: Month | C38: Income | D38: Expense | E38: General Fund | F38: Actual Balance | G38: Unpaid Bills | I38: General
A39: 2015 | B39: of:=[Income.A4] -> 2015-01-31 | C39: of:=IF([$Income.$C4] > 0;[$Income.$C4];"") -> 5229 | D39: of:=IF([$Expense.$C4] > 0;[$Expense.$C4];"") -> 6089.42 | E39: of:=IF([.G39]<>0;[.F39]-[.G39];[.F39]) -> 197.36 | F39: of:=[.$C4] -> 197.36 | I39: of:=[.$C4] -> 197.36
B40: of:=[Income.A5] -> 2015-02-28 | C40: of:=IF([$Income.$C5] > 0;[$Income.$C5];"") -> 6405 | D40: of:=IF([$Expense.$C5] > 0;[$Expense.$C5];"") -> 6644.74 | E40: of:=IF([.G40]<>0;[.F40]-[.G40];[.F40]) -> -42.3800000000001 | F40: of:=[.$C5] -> -42.3800000000001 | I40: of:=[.$C5] -> -42.3800000000001
B41: of:=[Income.A6] -> 2015-03-31 | C41: of:=IF([$Income.$C6] > 0;[$Income.$C6];"") -> 9016 | D41: of:=IF([$Expense.$C6] > 0;[$Expense.$C6];"") -> 6375 | E41: of:=IF([.G41]<>0;[.F41]-[.G41];[.F41]) -> 2598.62 | F41: of:=[.$C6] -> 2598.62 | I41: of:=[.$C6] -> 2598.62
B42: of:=[Income.A7] -> 2015-04-30 | C42: of:=IF([$Income.$C7] > 0;[$Income.$C7];"") -> 8268 | D42: of:=IF([$Expense.$C7] > 0;[$Expense.$C7];"") -> 6186.71 | E42: of:=IF([.G42]<>0;[.F42]-[.G42];[.F42]) -> 4679.91 | F42: of:=[.$C7] -> 4679.91 | I42: of:=[.$C7] -> 4679.91
B43: of:=[Income.A8] -> 2015-05-31 | C43: of:=IF([$Income.$C8] > 0;[$Income.$C8];"") -> 8745.01 | D43: of:=IF([$Expense.$C8] > 0;[$Expense.$C8];"") -> 8072.21 | E43: of:=IF([.G43]<>0;[.F43]-[.G43];[.F43]) -> 5352.71 | F43: of:=[.$C8] -> 5352.71 | I43: of:=[.$C8] -> 5352.71
B44: of:=[Income.A9] -> 2015-06-30 | C44: of:=IF([$Income.$C9] > 0;[$Income.$C9];"") -> 6312 | D44: of:=IF([$Expense.$C9] > 0;[$Expense.$C9];"") -> 5648.99 | E44: of:=IF([.G44]<>0;[.F44]-[.G44];[.F44]) -> 6015.72 | F44: of:=[.$C9] -> 6015.72 | I44: of:=[.$C9] -> 6015.72
B45: of:=[Income.A10] -> 2015-07-31 | C45: of:=IF([$Income.$C10] > 0;[$Income.$C10];"") -> 7223 | D45: of:=IF([$Expense.$C10] > 0;[$Expense.$C10];"") -> 6811.03 | E45: of:=IF([.G45]<>0;[.F45]-[.G45];[.F45]) -> 6427.69 | F45: of:=[.$C10] -> 6427.69 | I45: of:=[.$C10] -> 6427.69
B46: of:=[Income.A11] -> 2015-08-31 | C46: of:=IF([$Income.$C11] > 0;[$Income.$C11];"") -> 9062.99 | D46: of:=IF([$Expense.$C11] > 0;[$Expense.$C11];"") -> 7113.91 | E46: of:=IF([.G46]<>0;[.F46]-[.G46];[.F46]) -> 8376.77 | F46: of:=[.$C11] -> 8376.77 | I46: of:=[.$C11] -> 8376.77
B47: of:=[Income.A12] -> 2015-09-30 | C47: of:=IF([$Income.$C12] > 0;[$Income.$C12];"") -> 4222 | D47: of:=IF([$Expense.$C12] > 0;[$Expense.$C12];"") -> 6633.48 | E47: of:=IF([.G47]<>0;[.F47]-[.G47];[.F47]) -> 5965.29 | F47: of:=[.$C12] -> 5965.29 | I47: of:=[.$C12] -> 5965.29
B48: of:=[Income.A13] -> 2015-10-31 | C48: of:=IF([$Income.$C13] > 0;[$Income.$C13];"") -> 8195 | D48: of:=IF([$Expense.$C13] > 0;[$Expense.$C13];"") -> 4281.05 | E48: of:=IF([.G48]<>0;[.F48]-[.G48];[.F48]) -> 9879.24 | F48: of:=[.$C13] -> 9879.24 | I48: of:=[.$C13] -> 9879.24
B49: of:=[Income.A14] -> 2015-11-30 | C49: of:=IF([$Income.$C14] > 0;[$Income.$C14];"") ->  | D49: of:=IF([$Expense.$C14] > 0;[$Expense.$C14];"") ->  | E49: of:=IF([.G49]<>0;[.F49]-[.G49];[.F49]) ->  | F49: of:=[.$C14] ->  | I49: of:=[.$C14] -> 
B50: of:=[Income.A15] -> 2015-12-31 | C50: of:=IF([$Income.$C15] > 0;[$Income.$C15];"") ->  | D50: of:=IF([$Expense.$C15] > 0;[$Expense.$C15];"") ->  | E50: of:=IF([.G50]<>0;[.F50]-[.G50];[.F50]) ->  | F50: of:=[.$C15] ->  | I50: of:=[.$C15] -> 

Sheet: Income
A1: of:=CONCATENATE("QHCC Income ";[Balances.A39]) -> QHCC Income 2015
A2: Date | B2: QHCC Account | C2: General | D2: Gen – Hold | E2: Parsonage | F2: Deacon | G2: Holding | H2: Youth | I2: Internet | J2: Temporary | K2: Total | L2: Diff
A4: of:=[Balances.A4] -> 2015-01-31 | B4: 5529 | C4: 5229 | D4: of:=[.C4]-[.G4] -> 5229 | J4: 300 | K4: of:=[.D4]+SUM([.E4:.J4]) -> 5529 | L4: of:=[.K4]-[.B4] -> 0
A5: of:=EOMONTH([.A4];1) -> 2015-02-28 | B5: 6607 | C5: 6405 | D5: of:=[.C5]-[.G5] -> 6405 | F5: 52 | J5: 150 | K5: of:=[.D5]+SUM([.E5:.J5]) -> 6607 | L5: of:=[.K5]-[.B5] -> 0
A6: of:=EOMONTH([.A5];1) -> 2015-03-31 | B6: 9976 | C6: 9016 | D6: of:=[.C6]-[.G6] -> 9016 | J6: 960 | K6: of:=[.D6]+SUM([.E6:.J6]) -> 9976 | L6: of:=[.K6]-[.B6] -> 0
A7: of:=EOMONTH([.A6];1) -> 2015-04-30 | B7: 9488 | C7: 8268 | D7: of:=[.C7]-[.G7] -> 8268 | J7: 1220 | K7: of:=[.D7]+SUM([.E7:.J7]) -> 9488 | L7: of:=[.K7]-[.B7] -> 0
A8: of:=EOMONTH([.A7];1) -> 2015-05-31 | B8: 9876.01 | C8: 8745.01 | D8: of:=[.C8]-[.G8] -> 8745.01 | F8: 131 | J8: 1000 | K8: of:=[.D8]+SUM([.E8:.J8]) -> 9876.01 | L8: of:=[.K8]-[.B8] -> 0
A9: of:=EOMONTH([.A8];1) -> 2015-06-30 | B9: 6577 | C9: 6312 | D9: of:=[.C9]-[.G9] -> 6312 | F9: 65 | J9: 200 | K9: of:=[.D9]+SUM([.E9:.J9]) -> 6577 | L9: of:=[.K9]-[.B9] -> 0
A10: of:=EOMONTH([.A9];1) -> 2015-07-31 | B10: 7283 | C10: 7223 | D10: of:=[.C10]-[.G10] -> 7223 | F10: 60 | K10: of:=[.D10]+SUM([.E10:.J10]) -> 7283 | L10: of:=[.K10]-[.B10] -> 0
A11: of:=EOMONTH([.A10];1) -> 2015-08-31 | B11: 9416.99 | C11: 9062.99 | D11: of:=[.C11]-[.G11] -> 9062.99 | F11: 204 | J11: 150 | K11: of:=[.D11]+SUM([.E11:.J11]) -> 9416.99 | L11: of:=[.K11]-[.B11] -> 0
A12: of:=EOMONTH([.A11];1) -> 2015-09-30 | B12: 7037 | C12: 4222 | D12: of:=[.C12]-[.G12] -> 2522 | F12: 65 | G12: 1700 | J12: 2750 | K12: of:=[.D12]+SUM([.E12:.J12]) -> 7037 | L12: of:=[.K12]-[.B12] -> 0
A13: of:=EOMONTH([.A12];1) -> 2015-10-31 | B13: 8258 | C13: 8195 | D13: of:=[.C13]-[.G13] -> 7508 | F13: 63 | G13: 687 | K13: of:=[.D13]+SUM([.E13:.J13]) -> 8258 | L13: of:=[.K13]-[.B13] -> 0
A14: of:=EOMONTH([.A13];1) -> 2015-11-30 | D14: of:=[.C14]-[.G14] -> 0 | K14: of:=[.D14]+SUM([.E14:.J14]) -> 0 | L14: of:=[.K14]-[.B14] -> 0
A15: of:=EOMONTH([.A14];1) -> 2015-12-31 | D15: of:=[.C15]-[.G15] -> 0 | K15: of:=[.D15]+SUM([.E15:.J15]) -> 0 | L15: of:=[.K15]-[.B15] -> 0
A16: Total for Year | B16: of:=SUM([.B4:.B15]) -> 80048 | C16: of:=SUM([.C4:.C15]) -> 72678 | E16: of:=SUM([.E4:.E15]) -> 0 | F16: of:=SUM([.F4:.F15]) -> 640 | G16: of:=SUM([.G4:.G15]) -> 2387 | H16: of:=SUM([.H4:.H15]) -> 0 | I16: of:=SUM([.I4:.I15]) -> 0 | J16: of:=SUM([.J4:.J15]) -> 6730 | K16: of:=SUM([.K4:.K15]) -> 80048 | L16: of:=SUM([.L4:.L15]) -> 0
A17: Monthly Average | B17: of:=[.B16]/[.$B$23] -> 8152.99251912772 | C17: of:=[.C16]/[.$B$23] -> 7402.34846973271 | E17: of:=[.E16]/[.$B$23] -> 0 | F17: of:=[.F16]/[.$B$23] -> 65.1848292554685 | G17: of:=[.G16]/[.$B$23] -> 243.119042863755 | H17: of:=[.H16]/[.$B$23] -> 0 | I17: of:=[.I16]/[.$B$23] -> 0 | J17: of:=[.J16]/[.$B$23] -> 685.459220139535 | K17: of:=[.K16]/[.$B$23] -> 8152.99251912772 | L17: of:=[.L16]/[.$B$23] -> 0
A18: Weekly Average | B18: of:=[.B16]/[.$B$22] -> 1875.02086682198 | C18: of:=[.C16]/[.$B$22] -> 1702.38814909664 | E18: of:=[.E16]/[.$B$22] -> 0 | F18: of:=[.F16]/[.$B$22] -> 14.9911722312371 | G18: of:=[.G16]/[.$B$22] -> 55.9123876811921 | H18: of:=[.H16]/[.$B$22] -> 0 | I18: of:=[.I16]/[.$B$22] -> 0 | J18: of:=[.J16]/[.$B$22] -> 157.641545494103 | K18: of:=[.K16]/[.$B$22] -> 1875.02086682198 | L18: of:=[.L16]/[.$B$22] -> 0
A20: Today | B20: of:=NOW() -> 2015-10-25T20:13:15.53
A21: Day | B21: of:=[.B20]-[Balances.A3] -> 298.84254085648
A22: Week | B22: of:=[.B21]/7 -> 42.6917915509257
A23: Month | B23: of:=[.B21]/365.25*12 -> 9.81823542854965

Sheet: Expense
A1: of:=CONCATENATE("QHCC Expenses ";[Balances.A39]) -> QHCC Expenses 2015
A2: Date | B2: QHCC Account | C2: General | D2: Gen – Hold | E2: Parsonage | F2: Deacon | G2: Holding | H2: Youth | I2: Internet | J2: Temporary | K2: Total | L2: Diff
A4: of:=[Balances.A4] -> 2015-01-31 | B4: 6089.42 | C4: of:=5047.55+391.87+650 -> 6089.42 | D4: of:=[.C4]-[.G4] -> 6089.42 | K4: of:=[.D4]+SUM([.E4:.J4]) -> 6089.42 | L4: of:=[.K4]-[.B4] -> 0
A5: of:=EOMONTH([.A4];1) -> 2015-02-28 | B5: 6644.74 | C5: of:=5602.87+391.87+650 -> 6644.74 | D5: of:=[.C5]-[.G5] -> 6644.74 | K5: of:=[.D5]+SUM([.E5:.J5]) -> 6644.74 | L5: of:=[.K5]-[.B5] -> 0
A6: of:=EOMONTH([.A5];1) -> 2015-03-31 | B6: of:=6443.75-68.75 -> 6375 | C6: of:=5333.13+391.87+650 -> 6375 | D6: of:=[.C6]-[.G6] -> 6375 | K6: of:=[.D6]+SUM([.E6:.J6]) -> 6375 | L6: of:=[.K6]-[.B6] -> 0
A7: of:=EOMONTH([.A6];1) -> 2015-04-30 | B7: 12341.65 | C7: of:=5504.68+682.03 -> 6186.71 | D7: of:=[.C7]-[.G7] -> 6186.71 | J7: 6154.94 | K7: of:=[.D7]+SUM([.E7:.J7]) -> 12341.65 | L7: of:=[.K7]-[.B7] -> 0
A8: of:=EOMONTH([.A7];1) -> 2015-05-31 | B8: 8762.21 | C8: of:=6660.65+726.68+684.88 -> 8072.21 | D8: of:=[.C8]-[.G8] -> 8072.21 | F8: 690 | K8: of:=[.D8]+SUM([.E8:.J8]) -> 8762.21 | L8: of:=[.K8]-[.B8] -> 0
A9: of:=EOMONTH([.A8];1) -> 2015-06-30 | B9: 6132.19 | C9: of:=4556.87+407.24+684.88 -> 5648.99 | D9: of:=[.C9]-[.G9] -> 5648.99 | F9: 483.2 | K9: of:=[.D9]+SUM([.E9:.J9]) -> 6132.19 | L9: of:=[.K9]-[.B9] -> 0
A10: of:=EOMONTH([.A9];1) -> 2015-07-31 | B10: 6811.03 | C10: of:=5721.3+404.85+684.88 -> 6811.03 | D10: of:=[.C10]-[.G10] -> 6811.03 | K10: of:=[.D10]+SUM([.E10:.J10]) -> 6811.03 | L10: of:=[.K10]-[.B10] -> 0
A11: of:=EOMONTH([.A10];1) -> 2015-08-31 | B11: 7313.91 | C11: of:=6021.5+398.94+693.47 -> 7113.91 | D11: of:=[.C11]-[.G11] -> 7113.91 | F11: 200 | K11: of:=[.D11]+SUM([.E11:.J11]) -> 7313.91 | L11: of:=[.K11]-[.B11] -> 0
A12: of:=EOMONTH([.A11];1) -> 2015-09-30 | B12: 6633 | C12: of:=5547.65+400.95+684.88 -> 6633.48 | D12: of:=[.C12]-[.G12] -> 6633.48 | K12: of:=[.D12]+SUM([.E12:.J12]) -> 6633.48 | L12: of:=[.K12]-[.B12] -> 0.479999999999563
A13: of:=EOMONTH([.A12];1) -> 2015-10-31 | B13: 4366.05 | C13: of:=3187.2+408.97+684.88 -> 4281.05 | D13: of:=[.C13]-[.G13] -> 4281.05 | F13: 85 | K13: of:=[.D13]+SUM([.E13:.J13]) -> 4366.05 | L13: of:=[.K13]-[.B13] -> 0
A14: of:=EOMONTH([.A13];1) -> 2015-11-30 | D14: of:=[.C14]-[.G14] -> 0 | K14: of:=[.D14]+SUM([.E14:.J14]) -> 0 | L14: of:=[.K14]-[.B14] -> 0
A15: of:=EOMONTH([.A14];1) -> 2015-12-31 | D15: of:=[.C15]-[.G15] -> 0 | K15: of:=[.D15]+SUM([.E15:.J15]) -> 0 | L15: of:=[.K15]-[.B15] -> 0
A16: Total for Year | B16: of:=SUM([.B4:.B15]) -> 71469.2 | C16: of:=SUM([.C4:.C15]) -> 63856.54 | E16: of:=SUM([.E4:.E15]) -> 0 | F16: of:=SUM([.F4:.F15]) -> 1458.2 | G16: of:=SUM([.G4:.G15]) -> 0 | H16: of:=SUM([.H4:.H15]) -> 0 | I16: of:=SUM([.I4:.I15]) -> 0 | J16: of:=SUM([.J4:.J15]) -> 6154.94 | K16: of:=SUM([.K4:.K15]) -> 71469.68 | L16: of:=SUM([.L4:.L15]) -> 0.479999999999563
A17: Monthly Average | B17: of:=[.B16]/[$Income.$B$23] -> 7279.23062347645 | C17: of:=[.C16]/[$Income.$B$23] -> 6503.87133866405 | E17: of:=[.E16]/[$Income.$B$23] -> 0 | F17: of:=[.F16]/[$Income.$B$23] -> 148.519559406756 | G17: of:=[.G16]/[$Income.$B$23] -> 0 | H17: of:=[.H16]/[$Income.$B$23] -> 0 | I17: of:=[.I16]/[$Income.$B$23] -> 0 | J17: of:=[.J16]/[$Income.$B$23] -> 626.888614027583 | K17: of:=[.K16]/[$Income.$B$23] -> 7279.27951209839 | L17: of:=[.L16]/[$Income.$B$23] -> 0.0488886219415569
A18: Weekly Average | B18: of:=[.B16]/[$Income.$B$22] -> 1674.07357254489 | C18: of:=[.C16]/[$Income.$B$22] -> 1495.75685817325 | E18: of:=[.E16]/[$Income.$B$22] -> 0 | F18: of:=[.F16]/[$Income.$B$22] -> 34.1564489806093 | G18: of:=[.G16]/[$Income.$B$22] -> 0 | H18: of:=[.H16]/[$Income.$B$22] -> 0 | I18: of:=[.I16]/[$Income.$B$22] -> 0 | J18: of:=[.J16]/[$Income.$B$22] -> 144.171508770204 | K18: of:=[.K16]/[$Income.$B$22] -> 1674.08481592406 | L18: of:=[.L16]/[$Income.$B$22] -> 0.0112433791734176