Sheet: Budget
A1: Budget | B1: 2015 | P1: #Months YTD
P2: of:=COUNT([.C6:.N6]) -> 3
C3: Month
A4: CategoryÂ Description | B4: Budget | C4: of:=EOMONTH(DATE([.$B$1];1;1);0) -> 2015-01-31 | D4: of:=EOMONTH([.C4];1) -> 2015-02-28 | E4: of:=EOMONTH([.D4];1) -> 2015-03-31 | F4: of:=EOMONTH([.E4];1) -> 2015-04-30 | G4: of:=EOMONTH([.F4];1) -> 2015-05-31 | H4: of:=EOMONTH([.G4];1) -> 2015-06-30 | I4: of:=EOMONTH([.H4];1) -> 2015-07-31 | J4: of:=EOMONTH([.I4];1) -> 2015-08-31 | K4: of:=EOMONTH([.J4];1) -> 2015-09-30 | L4: of:=EOMONTH([.K4];1) -> 2015-10-31 | M4: of:=EOMONTH([.L4];1) -> 2015-11-30 | N4: of:=EOMONTH([.M4];1) -> 2015-12-31 | O4: Total YTD | P4: Budget YTD | Q4: Difference | R4: Actual Budget
A6: General income | B6: of:=[.R6]/12 -> 7135 | C6: 5229 | D6: 6405 | E6: 9016 | O6: of:=SUM([.C6:.N6]) -> 20650 | P6: of:=[.$P$2]/12*[.R6] -> 21405 | Q6: of:=[.O6]-[.P6] -> -755 | R6: of:=[.R47] -> 85620
A8: Building
A9: Hazard Insurance | B9: of:=[.R9]/12 -> 258.333333333333 | D9: 730.18 | O9: of:=SUM([.C9:.N9]) -> 730.18 | P9: of:=[.$P$2]/12*[.R9] -> 775 | Q9: of:=[.O9]-[.P9] -> -44.82 | R9: 3100
A10: Maintenance | B10: of:=[.R10]/12 -> 100 | O10: of:=SUM([.C10:.N10]) -> 0 | P10: of:=[.$P$2]/12*[.R10] -> 300 | Q10: of:=[.O10]-[.P10] -> -300 | R10: 1200
A11: Mortgage | B11: of:=[.R11]/12 -> 735 | C11: 735 | D11: 735 | E11: 735 | O11: of:=SUM([.C11:.N11]) -> 2205 | P11: of:=[.$P$2]/12*[.R11] -> 2205 | Q11: of:=[.O11]-[.P11] -> 0 | R11: of:=12*735 -> 8820
A12: Property Tax | B12: of:=[.R12]/12 -> 50 | C12: 443.08 | E12: -68.75 | O12: of:=SUM([.C12:.N12]) -> 374.33 | P12: of:=[.$P$2]/12*[.R12] -> 150 | Q12: of:=[.O12]-[.P12] -> 224.33 | R12: 600
A13: Supplies | B13: of:=[.R13]/12 -> 8.33333333333333 | O13: of:=SUM([.C13:.N13]) -> 0 | P13: of:=[.$P$2]/12*[.R13] -> 25 | Q13: of:=[.O13]-[.P13] -> -25 | R13: 100
A14: Utilities | B14: of:=[.R14]/12 -> 750 | C14: 577.81 | D14: 611.22 | E14: 665.14 | O14: of:=SUM([.C14:.N14]) -> 1854.17 | P14: of:=[.$P$2]/12*[.R14] -> 2250 | Q14: of:=[.O14]-[.P14] -> -395.83 | R14: 9000
A15: TOTAL Building | B15: of:=SUM([.B9:.B14]) -> 1901.66666666667 | C15: of:=SUM([.C9:.C14]) -> 1755.89 | D15: of:=SUM([.D9:.D14]) -> 2076.4 | E15: of:=SUM([.E9:.E14]) -> 1331.39 | F15: of:=SUM([.F9:.F14]) -> 0 | G15: of:=SUM([.G9:.G14]) -> 0 | H15: of:=SUM([.H9:.H14]) -> 0 | I15: of:=SUM([.I9:.I14]) -> 0 | J15: of:=SUM([.J9:.J14]) -> 0 | K15: of:=SUM([.K9:.K14]) -> 0 | L15: of:=SUM([.L9:.L14]) -> 0 | M15: of:=SUM([.M9:.M14]) -> 0 | N15: of:=SUM([.N9:.N14]) -> 0 | O15: of:=SUM([.C15:.N15]) -> 5163.68 | P15: of:=[.$P$2]/12*[.R15] -> 5705 | Q15: of:=[.O15]-[.P15] -> -541.32 | R15: of:=SUM([.R8:.R14]) -> 22820
A17: Business Expenses
A18: Worker's Comp | B18: of:=[.R18]/12 -> 50 | D18: 308.22 | O18: of:=SUM([.C18:.N18]) -> 308.22 | P18: of:=[.$P$2]/12*[.R18] -> 150 | Q18: of:=[.O18]-[.P18] -> 158.22 | R18: 600
A19: Office | O19: of:=SUM([.C19:.N19]) -> 0 | P19: of:=[.$P$2]/12*[.R19] -> 50 | Q19: of:=[.O19]-[.P19] -> -50 | R19: 200
A20: Telephone | B20: of:=[.R20]/12 -> 38.3333333333333 | C20: 35.26 | D20: 35.3 | E20: 35.3 | O20: of:=SUM([.C20:.N20]) -> 105.86 | P20: of:=[.$P$2]/12*[.R20] -> 115 | Q20: of:=[.O20]-[.P20] -> -9.14000000000002 | R20: 460
A21: TOTAL Business Expenses | B21: of:=SUM([.B18:.B20]) -> 88.3333333333333 | C21: of:=SUM([.C18:.C20]) -> 35.26 | D21: of:=SUM([.D18:.D20]) -> 343.52 | E21: of:=SUM([.E18:.E20]) -> 35.3 | F21: of:=SUM([.F18:.F20]) -> 0 | G21: of:=SUM([.G18:.G20]) -> 0 | H21: of:=SUM([.H18:.H20]) -> 0 | I21: of:=SUM([.I18:.I20]) -> 0 | J21: of:=SUM([.J18:.J20]) -> 0 | K21: of:=SUM([.K18:.K20]) -> 0 | L21: of:=SUM([.L18:.L20]) -> 0 | M21: of:=SUM([.M18:.M20]) -> 0 | N21: of:=SUM([.N18:.N20]) -> 0 | O21: of:=SUM([.C21:.N21]) -> 414.08 | P21: of:=[.$P$2]/12*[.R21] -> 315 | Q21: of:=[.O21]-[.P21] -> 99.0800000000001 | R21: of:=SUM([.R17:.R20]) -> 1260
A23: Ministry
A24: Adult | B24: of:=[.R24]/12 -> 10 | O24: of:=SUM([.C24:.N24]) -> 0 | P24: of:=[.$P$2]/12*[.R24] -> 30 | Q24: of:=[.O24]-[.P24] -> -30 | R24: 120
A25: Children | B25: of:=[.R25]/12 -> 10 | O25: of:=SUM([.C25:.N25]) -> 0 | P25: of:=[.$P$2]/12*[.R25] -> 30 | Q25: of:=[.O25]-[.P25] -> -30 | R25: 120
A26: Fellowship | B26: of:=[.R26]/12 -> 30 | O26: of:=SUM([.C26:.N26]) -> 0 | P26: of:=[.$P$2]/12*[.R26] -> 90 | Q26: of:=[.O26]-[.P26] -> -90 | R26: 360
A27: Missions | B27: of:=[.R27]/12 -> 80 | C27: 70 | D27: 54 | E27: 64 | O27: of:=SUM([.C27:.N27]) -> 188 | P27: of:=[.$P$2]/12*[.R27] -> 240 | Q27: of:=[.O27]-[.P27] -> -52 | R27: 960
A28: Outreach | B28: of:=[.R28]/12 -> 50 | C28: 15.18 | D28: 15.18 | E28: 15.18 | O28: of:=SUM([.C28:.N28]) -> 45.54 | P28: of:=[.$P$2]/12*[.R28] -> 150 | Q28: of:=[.O28]-[.P28] -> -104.46 | R28: 600
A29: Christian Education | B29: of:=[.R29]/12 -> 25 | O29: of:=SUM([.C29:.N29]) -> 0 | P29: of:=[.$P$2]/12*[.R29] -> 75 | Q29: of:=[.O29]-[.P29] -> -75 | R29: 300
A30: Worship | B30: of:=[.R30]/12 -> 30 | O30: of:=SUM([.C30:.N30]) -> 0 | P30: of:=[.$P$2]/12*[.R30] -> 90 | Q30: of:=[.O30]-[.P30] -> -90 | R30: 360
A31: Youth | B31: of:=[.R31]/12 -> 10 | O31: of:=SUM([.C31:.N31]) -> 0 | P31: of:=[.$P$2]/12*[.R31] -> 30 | Q31: of:=[.O31]-[.P31] -> -30 | R31: 120
A32: TOTAL Ministry | B32: of:=SUM([.B24:.B31]) -> 245 | C32: of:=SUM([.C24:.C31]) -> 85.18 | D32: of:=SUM([.D24:.D31]) -> 69.18 | E32: of:=SUM([.E24:.E31]) -> 79.18 | F32: of:=SUM([.F24:.F31]) -> 0 | G32: of:=SUM([.G24:.G31]) -> 0 | H32: of:=SUM([.H24:.H31]) -> 0 | I32: of:=SUM([.I24:.I31]) -> 0 | J32: of:=SUM([.J24:.J31]) -> 0 | K32: of:=SUM([.K24:.K31]) -> 0 | L32: of:=SUM([.L24:.L31]) -> 0 | M32: of:=SUM([.M24:.M31]) -> 0 | N32: of:=SUM([.N24:.N31]) -> 0 | O32: of:=SUM([.C32:.N32]) -> 233.54 | P32: of:=[.$P$2]/12*[.R32] -> 735 | Q32: of:=[.O32]-[.P32] -> -501.46 | R32: of:=SUM([.R23:.R31]) -> 2940
A34: Parsonage
A35: Maintenance | B35: of:=[.R35]/12 -> 100 | P35: of:=[.$P$2]/12*[.R35] -> 300 | Q35: of:=[.O35]-[.P35] -> -300 | R35: 1200
A36: Mortgage | B36: of:=[.R36]/12 -> 600 | C36: 600 | D36: 600 | E36: 600 | P36: of:=[.$P$2]/12*[.R36] -> 1800 | Q36: of:=[.O36]-[.P36] -> -1800 | R36: 7200
A37: Property Tax | B37: of:=[.R37]/12 -> 250 | P37: of:=[.$P$2]/12*[.R37] -> 750 | Q37: of:=[.O37]-[.P37] -> -750 | R37: 3000
A38: Utilities | B38: of:=[.R38]/12 -> 400 | C38: 313.09 | D38: 255.64 | E38: 329.13 | P38: of:=[.$P$2]/12*[.R38] -> 1200 | Q38: of:=[.O38]-[.P38] -> -1200 | R38: 4800
A39: TOTAL Parsonage | B39: of:=SUM([.B35:.B38]) -> 1350 | C39: of:=SUM([.C35:.C38]) -> 913.09 | D39: of:=SUM([.D35:.D38]) -> 855.64 | E39: of:=SUM([.E35:.E38]) -> 929.13 | F39: of:=SUM([.F35:.F38]) -> 0 | G39: of:=SUM([.G35:.G38]) -> 0 | H39: of:=SUM([.H35:.H38]) -> 0 | I39: of:=SUM([.I35:.I38]) -> 0 | J39: of:=SUM([.J35:.J38]) -> 0 | K39: of:=SUM([.K35:.K38]) -> 0 | L39: of:=SUM([.L35:.L38]) -> 0 | M39: of:=SUM([.M35:.M38]) -> 0 | N39: of:=SUM([.N35:.N38]) -> 0 | O39: of:=SUM([.C39:.N39]) -> 2697.86 | P39: of:=[.$P$2]/12*[.R39] -> 4050 | Q39: of:=[.O39]-[.P39] -> -1352.14 | R39: of:=SUM([.R34:.R38]) -> 16200
A41: Pastor
A42: Business Expenses | B42: of:=[.R42]/12 -> 500 | C42: 500 | D42: 500 | E42: 500 | P42: of:=[.$P$2]/12*[.R42] -> 1500 | Q42: of:=[.O42]-[.P42] -> -1500 | R42: 6000
A43: Honorarium | B43: of:=[.R43]/12 -> 3033.33333333333 | C43: 2800 | D43: 2800 | E43: 3500 | P43: of:=[.$P$2]/12*[.R43] -> 9100 | Q43: of:=[.O43]-[.P43] -> -9100 | R43: of:=52*700 -> 36400
A44: Other | B44: of:=[.R44]/12 -> 0 | P44: of:=[.$P$2]/12*[.R44] -> 0 | Q44: of:=[.O44]-[.P44] -> 0 | R44: 0
A45: TOTAL Pastor | B45: of:=SUM([.B42:.B43]) -> 3533.33333333333 | C45: of:=SUM([.C42:.C43]) -> 3300 | D45: of:=SUM([.D42:.D43]) -> 3300 | E45: of:=SUM([.E42:.E43]) -> 4000 | F45: of:=SUM([.F42:.F43]) -> 0 | G45: of:=SUM([.G42:.G43]) -> 0 | H45: of:=SUM([.H42:.H43]) -> 0 | I45: of:=SUM([.I42:.I43]) -> 0 | J45: of:=SUM([.J42:.J43]) -> 0 | K45: of:=SUM([.K42:.K43]) -> 0 | L45: of:=SUM([.L42:.L43]) -> 0 | M45: of:=SUM([.M42:.M43]) -> 0 | N45: of:=SUM([.N42:.N43]) -> 0 | O45: of:=SUM([.C45:.N45]) -> 10600 | P45: of:=[.$P$2]/12*[.R45] -> 10600 | Q45: of:=[.O45]-[.P45] -> 0 | R45: of:=SUM([.R41:.R43]) -> 42400
A47: TOTAL EXPENSES | B47: of:=[.B15]+[.B21]+[.B32]+[.B39]+[.B45] -> 7118.33333333333 | C47: of:=[.C15]+[.C21]+[.C32]+[.C39]+[.C45] -> 6089.42 | D47: of:=[.D15]+[.D21]+[.D32]+[.D39]+[.D45] -> 6644.74 | E47: of:=[.E15]+[.E21]+[.E32]+[.E39]+[.E45] -> 6375 | F47: of:=[.F15]+[.F21]+[.F32]+[.F39]+[.F45] -> 0 | G47: of:=[.G15]+[.G21]+[.G32]+[.G39]+[.G45] -> 0 | H47: of:=[.H15]+[.H21]+[.H32]+[.H39]+[.H45] -> 0 | I47: of:=[.I15]+[.I21]+[.I32]+[.I39]+[.I45] -> 0 | J47: of:=[.J15]+[.J21]+[.J32]+[.J39]+[.J45] -> 0 | K47: of:=[.K15]+[.K21]+[.K32]+[.K39]+[.K45] -> 0 | L47: of:=[.L15]+[.L21]+[.L32]+[.L39]+[.L45] -> 0 | M47: of:=[.M15]+[.M21]+[.M32]+[.M39]+[.M45] -> 0 | N47: of:=[.N15]+[.N21]+[.N32]+[.N39]+[.N45] -> 0 | O47: of:=[.O15]+[.O21]+[.O32]+[.O39]+[.O45] -> 19109.16 | P47: of:=[.$P$2]/12*[.R47] -> 21405 | Q47: of:=[.O47]-[.P47] -> -2295.84 | R47: of:=[.R15]+[.R21]+[.R32]+[.R39]+[.R45] -> 85620
A49: OVERALL TOTAL | B49: of:=[.B6]-[.B47] -> 16.6666666666661 | C49: of:=[.C6]-[.C47] -> -860.42 | D49: of:=[.D6]-[.D47] -> -239.74 | E49: of:=[.E6]-[.E47] -> 2641 | F49: of:=[.F6]-[.F47] -> 0 | G49: of:=[.G6]-[.G47] -> 0 | H49: of:=[.H6]-[.H47] -> 0 | I49: of:=[.I6]-[.I47] -> 0 | J49: of:=[.J6]-[.J47] -> 0 | K49: of:=[.K6]-[.K47] -> 0 | L49: of:=[.L6]-[.L47] -> 0 | M49: of:=[.M6]-[.M47] -> 0 | N49: of:=[.N6]-[.N47] -> 0 | O49: of:=[.O6]-[.O47] -> 1540.84 | P49: of:=[.$P$2]/12*[.R49] -> 0 | Q49: of:=[.O49]-[.P49] -> 1540.84 | R49: of:=[.R6]-[.R47] -> 0
B83: of:=[.$O$4] -> Total YTD | C83: of:=[.$P$4] -> Budget YTD
A84: of:=[.$A$8] -> Building | B84: of:=[.O$15] -> 5163.68 | C84: of:=[.P$15] -> 5705
A85: of:=[.$A$17] -> Business Expenses | B85: of:=[.O$21] -> 414.08 | C85: of:=[.P$21] -> 315
A86: of:=[.$A$23] -> Ministry | B86: of:=[.O$32] -> 233.54 | C86: of:=[.P$32] -> 735
A87: of:=[.$A$34] -> Parsonage | B87: of:=[.O$39] -> 2697.86 | C87: of:=[.P$39] -> 4050
A88: of:=[.$A$41] -> Pastor | B88: of:=[.O$45] -> 10600 | C88: of:=[.P$45] -> 10600

Sheet: Holding Account
A1: Category | B1: Amount
A2: Building Property Tax | B2: of:=[Budget.B12] -> 50
A3: Parsonage Property Tax | B3: of:=[Budget.B37] -> 250
A4: Hazard Insurance | B4: of:=[Budget.B9] -> 258.333333333333 | F4: of:=6356-383.21-615.31 -> 5357.48
A5: Workers' Comp | B5: of:=[Budget.B18] -> 50 | H5: From bal | I5: 6414
A6: Building Maintenance | H6: From budget | I6: 6356
A7: Parsonage Maintenance | I7: of:=[.I5]-[.I6] -> 58