Sheet: Budget
A1: Budget | B1: 2008 | P1: #Months YTD
P2: oooc:=COUNT([.C6:.N6]) -> 2
C3: Month
A4: CategoryÂ Description | B4: Budget | C4: oooc:=DATE([.B1];1;1) -> 2008-01-01 | D4: oooc:=DATE(YEAR([.C4]);MONTH([.C4])+1;1) -> 2008-02-01 | E4: oooc:=DATE(YEAR([.D4]);MONTH([.D4])+1;1) -> 2008-03-01 | F4: oooc:=DATE(YEAR([.E4]);MONTH([.E4])+1;1) -> 2008-04-01 | G4: oooc:=DATE(YEAR([.F4]);MONTH([.F4])+1;1) -> 2008-05-01 | H4: oooc:=DATE(YEAR([.G4]);MONTH([.G4])+1;1) -> 2008-06-01 | I4: oooc:=DATE(YEAR([.H4]);MONTH([.H4])+1;1) -> 2008-07-01 | J4: oooc:=DATE(YEAR([.I4]);MONTH([.I4])+1;1) -> 2008-08-01 | K4: oooc:=DATE(YEAR([.J4]);MONTH([.J4])+1;1) -> 2008-09-01 | L4: oooc:=DATE(YEAR([.K4]);MONTH([.K4])+1;1) -> 2008-10-01 | M4: oooc:=DATE(YEAR([.L4]);MONTH([.L4])+1;1) -> 2008-11-01 | N4: oooc:=DATE(YEAR([.M4]);MONTH([.M4])+1;1) -> 2008-12-01 | O4: Total YTD | P4: Budget YTD | Q4: Difference | R4: Actual Budget
A6: General income | B6: oooc:=[.R6]/12 -> 7298.66666666667 | C6: 7364 | D6: 5688 | O6: oooc:=SUM([.C6:.N6]) -> 13052 | P6: oooc:=[.$P$2]/12*[.R6] -> 14597.3333333333 | Q6: oooc:=[.O6]-[.P6] -> -1545.33333333333 | R6: oooc:=[.R46] -> 87584
A8: Building
A9: Hazard Insurance | B9: oooc:=[.R9]/12 -> 170.666666666667 | C9: 512 | O9: oooc:=SUM([.C9:.N9]) -> 512 | P9: oooc:=[.$P$2]/12*[.R9] -> 341.333333333333 | Q9: oooc:=[.O9]-[.P9] -> 170.666666666667 | R9: oooc:=4*512 -> 2048
A10: Maintenance | B10: oooc:=[.R10]/12 -> 80 | O10: oooc:=SUM([.C10:.N10]) -> 0 | P10: oooc:=[.$P$2]/12*[.R10] -> 160 | Q10: oooc:=[.O10]-[.P10] -> -160 | R10: 960
A11: Mortgage | B11: oooc:=[.R11]/12 -> 1138 | C11: 1137 | D11: 1137 | O11: oooc:=SUM([.C11:.N11]) -> 2274 | P11: oooc:=[.$P$2]/12*[.R11] -> 2276 | Q11: oooc:=[.O11]-[.P11] -> -2 | R11: oooc:=1138*12 -> 13656
A12: Property Tax | B12: oooc:=[.R12]/12 -> 50 | O12: oooc:=SUM([.C12:.N12]) -> 0 | P12: oooc:=[.$P$2]/12*[.R12] -> 100 | Q12: oooc:=[.O12]-[.P12] -> -100 | R12: 600
A13: Supplies | B13: oooc:=[.R13]/12 -> 8.33333333333333 | O13: oooc:=SUM([.C13:.N13]) -> 0 | P13: oooc:=[.$P$2]/12*[.R13] -> 16.6666666666667 | Q13: oooc:=[.O13]-[.P13] -> -16.6666666666667 | R13: 100
A14: Utilities | B14: oooc:=[.R14]/12 -> 650 | C14: 647 | D14: 400 | O14: oooc:=SUM([.C14:.N14]) -> 1047 | P14: oooc:=[.$P$2]/12*[.R14] -> 1300 | Q14: oooc:=[.O14]-[.P14] -> -253 | R14: 7800
A15: TOTAL Building | B15: oooc:=SUM([.B9:.B14]) -> 2097 | C15: oooc:=SUM([.C9:.C14]) -> 2296 | D15: oooc:=SUM([.D9:.D14]) -> 1537 | E15: oooc:=SUM([.E9:.E14]) -> 0 | F15: oooc:=SUM([.F9:.F14]) -> 0 | G15: oooc:=SUM([.G9:.G14]) -> 0 | H15: oooc:=SUM([.H9:.H14]) -> 0 | I15: oooc:=SUM([.I9:.I14]) -> 0 | J15: oooc:=SUM([.J9:.J14]) -> 0 | K15: oooc:=SUM([.K9:.K14]) -> 0 | L15: oooc:=SUM([.L9:.L14]) -> 0 | M15: oooc:=SUM([.M9:.M14]) -> 0 | N15: oooc:=SUM([.N9:.N14]) -> 0 | O15: oooc:=SUM([.C15:.N15]) -> 3833 | P15: oooc:=[.$P$2]/12*[.R15] -> 4194 | Q15: oooc:=[.O15]-[.P15] -> -361 | R15: oooc:=SUM([.R8:.R14]) -> 25164
A17: Business Expenses
A18: Worker's Comp | B18: oooc:=[.R18]/12 -> 50 | D18: 527 | O18: oooc:=SUM([.C18:.N18]) -> 527 | P18: oooc:=[.$P$2]/12*[.R18] -> 100 | Q18: oooc:=[.O18]-[.P18] -> 427 | R18: 600
A19: Office | D19: 38 | O19: oooc:=SUM([.C19:.N19]) -> 38 | P19: oooc:=[.$P$2]/12*[.R19] -> 33.3333333333333 | Q19: oooc:=[.O19]-[.P19] -> 4.66666666666667 | R19: 200
A20: Telephone | B20: oooc:=[.R20]/12 -> 100 | C20: 94 | D20: 100 | O20: oooc:=SUM([.C20:.N20]) -> 194 | P20: oooc:=[.$P$2]/12*[.R20] -> 200 | Q20: oooc:=[.O20]-[.P20] -> -6 | R20: 1200
A21: TOTAL Business Expenses | B21: oooc:=SUM([.B18:.B20]) -> 150 | C21: oooc:=SUM([.C18:.C20]) -> 94 | D21: oooc:=SUM([.D18:.D20]) -> 665 | E21: oooc:=SUM([.E18:.E20]) -> 0 | F21: oooc:=SUM([.F18:.F20]) -> 0 | G21: oooc:=SUM([.G18:.G20]) -> 0 | H21: oooc:=SUM([.H18:.H20]) -> 0 | I21: oooc:=SUM([.I18:.I20]) -> 0 | J21: oooc:=SUM([.J18:.J20]) -> 0 | K21: oooc:=SUM([.K18:.K20]) -> 0 | L21: oooc:=SUM([.L18:.L20]) -> 0 | M21: oooc:=SUM([.M18:.M20]) -> 0 | N21: oooc:=SUM([.N18:.N20]) -> 0 | O21: oooc:=SUM([.C21:.N21]) -> 759 | P21: oooc:=[.$P$2]/12*[.R21] -> 333.333333333333 | Q21: oooc:=[.O21]-[.P21] -> 425.666666666667 | R21: oooc:=SUM([.R17:.R20]) -> 2000
A23: Ministry
A24: Adult | B24: oooc:=[.R24]/12 -> 10 | O24: oooc:=SUM([.C24:.N24]) -> 0 | P24: oooc:=[.$P$2]/12*[.R24] -> 20 | Q24: oooc:=[.O24]-[.P24] -> -20 | R24: 120
A25: Children | B25: oooc:=[.R25]/12 -> 10 | O25: oooc:=SUM([.C25:.N25]) -> 0 | P25: oooc:=[.$P$2]/12*[.R25] -> 20 | Q25: oooc:=[.O25]-[.P25] -> -20 | R25: 120
A26: Fellowship | B26: oooc:=[.R26]/12 -> 30 | O26: oooc:=SUM([.C26:.N26]) -> 0 | P26: oooc:=[.$P$2]/12*[.R26] -> 60 | Q26: oooc:=[.O26]-[.P26] -> -60 | R26: 360
A27: Missions | B27: oooc:=[.R27]/12 -> 80 | C27: 72 | D27: 68 | O27: oooc:=SUM([.C27:.N27]) -> 140 | P27: oooc:=[.$P$2]/12*[.R27] -> 160 | Q27: oooc:=[.O27]-[.P27] -> -20 | R27: 960
A28: Outreach | B28: oooc:=[.R28]/12 -> 50 | C28: 17 | D28: 17 | O28: oooc:=SUM([.C28:.N28]) -> 34 | P28: oooc:=[.$P$2]/12*[.R28] -> 100 | Q28: oooc:=[.O28]-[.P28] -> -66 | R28: 600
A29: Christian Education | B29: oooc:=[.R29]/12 -> 25 | O29: oooc:=SUM([.C29:.N29]) -> 0 | P29: oooc:=[.$P$2]/12*[.R29] -> 50 | Q29: oooc:=[.O29]-[.P29] -> -50 | R29: 300
A30: Worship | B30: oooc:=[.R30]/12 -> 30 | O30: oooc:=SUM([.C30:.N30]) -> 0 | P30: oooc:=[.$P$2]/12*[.R30] -> 60 | Q30: oooc:=[.O30]-[.P30] -> -60 | R30: 360
A31: Youth | B31: oooc:=[.R31]/12 -> 10 | O31: oooc:=SUM([.C31:.N31]) -> 0 | P31: oooc:=[.$P$2]/12*[.R31] -> 20 | Q31: oooc:=[.O31]-[.P31] -> -20 | R31: 120
A32: TOTAL Ministry | B32: oooc:=SUM([.B24:.B31]) -> 245 | C32: oooc:=SUM([.C24:.C31]) -> 89 | D32: oooc:=SUM([.D24:.D31]) -> 85 | E32: oooc:=SUM([.E24:.E31]) -> 0 | F32: oooc:=SUM([.F24:.F31]) -> 0 | G32: oooc:=SUM([.G24:.G31]) -> 0 | H32: oooc:=SUM([.H24:.H31]) -> 0 | I32: oooc:=SUM([.I24:.I31]) -> 0 | J32: oooc:=SUM([.J24:.J31]) -> 0 | K32: oooc:=SUM([.K24:.K31]) -> 0 | L32: oooc:=SUM([.L24:.L31]) -> 0 | M32: oooc:=SUM([.M24:.M31]) -> 0 | N32: oooc:=SUM([.N24:.N31]) -> 0 | O32: oooc:=SUM([.C32:.N32]) -> 174 | P32: oooc:=[.$P$2]/12*[.R32] -> 490 | Q32: oooc:=[.O32]-[.P32] -> -316 | R32: oooc:=SUM([.R23:.R31]) -> 2940
A34: Parsonage
A35: Maintenance | B35: oooc:=[.R35]/12 -> 100 | O35: oooc:=SUM([.C35:.N35]) -> 0 | P35: oooc:=[.$P$2]/12*[.R35] -> 200 | Q35: oooc:=[.O35]-[.P35] -> -200 | R35: 1200
A36: Mortgage | B36: oooc:=[.R36]/12 -> 565 | C36: 565 | D36: 565 | O36: oooc:=SUM([.C36:.N36]) -> 1130 | P36: oooc:=[.$P$2]/12*[.R36] -> 1130 | Q36: oooc:=[.O36]-[.P36] -> 0 | R36: oooc:=12*565 -> 6780
A37: Property Tax | B37: oooc:=[.R37]/12 -> 183.333333333333 | O37: oooc:=SUM([.C37:.N37]) -> 0 | P37: oooc:=[.$P$2]/12*[.R37] -> 366.666666666667 | Q37: oooc:=[.O37]-[.P37] -> -366.666666666667 | R37: 2200
A38: Utilities | B38: oooc:=[.R38]/12 -> 408.333333333333 | C38: 330 | D38: 306 | O38: oooc:=SUM([.C38:.N38]) -> 636 | P38: oooc:=[.$P$2]/12*[.R38] -> 816.666666666667 | Q38: oooc:=[.O38]-[.P38] -> -180.666666666667 | R38: 4900
A39: TOTAL Parsonage | B39: oooc:=SUM([.B35:.B38]) -> 1256.66666666667 | C39: oooc:=SUM([.C35:.C38]) -> 895 | D39: oooc:=SUM([.D35:.D38]) -> 871 | E39: oooc:=SUM([.E35:.E38]) -> 0 | F39: oooc:=SUM([.F35:.F38]) -> 0 | G39: oooc:=SUM([.G35:.G38]) -> 0 | H39: oooc:=SUM([.H35:.H38]) -> 0 | I39: oooc:=SUM([.I35:.I38]) -> 0 | J39: oooc:=SUM([.J35:.J38]) -> 0 | K39: oooc:=SUM([.K35:.K38]) -> 0 | L39: oooc:=SUM([.L35:.L38]) -> 0 | M39: oooc:=SUM([.M35:.M38]) -> 0 | N39: oooc:=SUM([.N35:.N38]) -> 0 | O39: oooc:=SUM([.C39:.N39]) -> 1766 | P39: oooc:=[.$P$2]/12*[.R39] -> 2513.33333333333 | Q39: oooc:=[.O39]-[.P39] -> -747.333333333333 | R39: oooc:=SUM([.R34:.R38]) -> 15080
A41: Pastor
A42: Business Expenses | B42: oooc:=[.R42]/12 -> 500 | C42: 500 | D42: 500 | O42: oooc:=SUM([.C42:.N42]) -> 1000 | P42: oooc:=[.$P$2]/12*[.R42] -> 1000 | Q42: oooc:=[.O42]-[.P42] -> 0 | R42: 6000
A43: Honorarium | B43: oooc:=[.R43]/12 -> 3033.33333333333 | C43: 2800 | D43: 2800 | O43: oooc:=SUM([.C43:.N43]) -> 5600 | P43: oooc:=[.$P$2]/12*[.R43] -> 6066.66666666667 | Q43: oooc:=[.O43]-[.P43] -> -466.666666666666 | R43: oooc:=52*700 -> 36400
A44: TOTAL Pastor | B44: oooc:=SUM([.B42:.B43]) -> 3533.33333333333 | C44: oooc:=SUM([.C42:.C43]) -> 3300 | D44: oooc:=SUM([.D42:.D43]) -> 3300 | E44: oooc:=SUM([.E42:.E43]) -> 0 | F44: oooc:=SUM([.F42:.F43]) -> 0 | G44: oooc:=SUM([.G42:.G43]) -> 0 | H44: oooc:=SUM([.H42:.H43]) -> 0 | I44: oooc:=SUM([.I42:.I43]) -> 0 | J44: oooc:=SUM([.J42:.J43]) -> 0 | K44: oooc:=SUM([.K42:.K43]) -> 0 | L44: oooc:=SUM([.L42:.L43]) -> 0 | M44: oooc:=SUM([.M42:.M43]) -> 0 | N44: oooc:=SUM([.N42:.N43]) -> 0 | O44: oooc:=SUM([.C44:.N44]) -> 6600 | P44: oooc:=[.$P$2]/12*[.R44] -> 7066.66666666667 | Q44: oooc:=[.O44]-[.P44] -> -466.666666666666 | R44: oooc:=SUM([.R41:.R43]) -> 42400
A46: TOTAL EXPENSES | B46: oooc:=[.B15]+[.B21]+[.B32]+[.B39]+[.B44] -> 7282 | C46: oooc:=[.C15]+[.C21]+[.C32]+[.C39]+[.C44] -> 6674 | D46: oooc:=[.D15]+[.D21]+[.D32]+[.D39]+[.D44] -> 6458 | E46: oooc:=[.E15]+[.E21]+[.E32]+[.E39]+[.E44] -> 0 | F46: oooc:=[.F15]+[.F21]+[.F32]+[.F39]+[.F44] -> 0 | G46: oooc:=[.G15]+[.G21]+[.G32]+[.G39]+[.G44] -> 0 | H46: oooc:=[.H15]+[.H21]+[.H32]+[.H39]+[.H44] -> 0 | I46: oooc:=[.I15]+[.I21]+[.I32]+[.I39]+[.I44] -> 0 | J46: oooc:=[.J15]+[.J21]+[.J32]+[.J39]+[.J44] -> 0 | K46: oooc:=[.K15]+[.K21]+[.K32]+[.K39]+[.K44] -> 0 | L46: oooc:=[.L15]+[.L21]+[.L32]+[.L39]+[.L44] -> 0 | M46: oooc:=[.M15]+[.M21]+[.M32]+[.M39]+[.M44] -> 0 | N46: oooc:=[.N15]+[.N21]+[.N32]+[.N39]+[.N44] -> 0 | O46: oooc:=[.O15]+[.O21]+[.O32]+[.O39]+[.O44] -> 13132 | P46: oooc:=[.$P$2]/12*[.R46] -> 14597.3333333333 | Q46: oooc:=[.O46]-[.P46] -> -1465.33333333333 | R46: oooc:=[.R15]+[.R21]+[.R32]+[.R39]+[.R44] -> 87584
A48: OVERALL TOTAL | B48: oooc:=[.B6]+[.B46] -> 14580.6666666667 | C48: oooc:=[.C6]-[.C46] -> 690 | D48: oooc:=[.D6]-[.D46] -> -770 | E48: oooc:=[.E6]-[.E46] -> 0 | F48: oooc:=[.F6]-[.F46] -> 0 | G48: oooc:=[.G6]-[.G46] -> 0 | H48: oooc:=[.H6]-[.H46] -> 0 | I48: oooc:=[.I6]-[.I46] -> 0 | J48: oooc:=[.J6]-[.J46] -> 0 | K48: oooc:=[.K6]-[.K46] -> 0 | L48: oooc:=[.L6]-[.L46] -> 0 | M48: oooc:=[.M6]-[.M46] -> 0 | N48: oooc:=[.N6]-[.N46] -> 0 | O48: oooc:=[.O6]-[.O46] -> -80 | P48: oooc:=[.$P$2]/12*[.R48] -> 0 | Q48: oooc:=[.O48]-[.P48] -> -80 | R48: oooc:=[.R6]-[.R46] -> 0
B82: oooc:=[.$O$4] -> Total YTD | C82: oooc:=[.$P$4] -> Budget YTD
A83: oooc:=[.$A$8] -> Building | B83: oooc:=[.O$15] -> 3833 | C83: oooc:=[.P$15] -> 4194
A84: oooc:=[.$A$17] -> Business Expenses | B84: oooc:=[.O$21] -> 759 | C84: oooc:=[.P$21] -> 333.333333333333
A85: oooc:=[.$A$23] -> Ministry | B85: oooc:=[.O$32] -> 174 | C85: oooc:=[.P$32] -> 490
A86: oooc:=[.$A$34] -> Parsonage | B86: oooc:=[.O$39] -> 1766 | C86: oooc:=[.P$39] -> 2513.33333333333
A87: oooc:=[.$A$41] -> Pastor | B87: oooc:=[.O$44] -> 6600 | C87: oooc:=[.P$44] -> 7066.66666666667

Sheet: Holding Account
A1: Category | B1: Amount
A2: Building Property Tax | B2: oooc:=[Budget.B12] -> 50
A3: Parsonage Property Tax | B3: oooc:=[Budget.B37] -> 183.333333333333
A4: Hazard Insurance | B4: oooc:=[Budget.B9] -> 170.666666666667
A5: Workers' Comp | B5: oooc:=[Budget.B18] -> 50
A6: Building Maintenance
A7: Parsonage Maintenance