Sheet: Balances
A1: QHCC Balances 2008
A2: Date | B2: QHCC Account | C2: General | D2: Parsonage | E2: Deacon | F2: Holding | G2: Youth | H2: DSL | I2: Temporary | J2: Total | K2: Diff | L2: Total Other | M2: General by Diff | N2: Diff | O2: QHCC Acct Rpt | P2: Diff | Q2: General from Rpt | R2: General by Diff | S2: Diff
A3: 2007-12-31 | B3: 3256 | C3: 451 | D3: 2861 | E3: 704.42 | F3: 0 | G3: 75 | H3: -835.470000000001 | I3: 0 | J3: oooc:=SUM([.C3:.I3]) -> 3255.95 | K3: oooc:=[.J3]-[.B3] -> -0.0500000000010914 | L3: oooc:=SUM([.D3:.I3]) -> 2804.95 | M3: oooc:=IF([.$B3]<>"";[.B3]-[.L3];"") -> 451.050000000001 | N3: oooc:=IF([.$B4]<>"";[.M3]-[.C3];"") -> 0.0500000000010914 | P3: oooc:=[.O3]-[.B3] -> -3256 | R3: oooc:=[.B3]-SUM([.D3:.I3]) -> 451.050000000001 | S3: oooc:=[.R3]-[.C3] -> 0.0500000000010914
A4: 2008-01-31 | B4: oooc:=IF([$Income.$B4]>0;[.B3]+[$Income.B4]-[$Expense.B4];"") -> 4007 | C4: oooc:=IF([$Income.$B4]>0;[.C3]+[$Income.C4]-[$Expense.C4];"") -> 1140 | D4: oooc:=IF([$Income.$B4]>0;[.D3]+[$Income.D4]-[$Expense.D4];"") -> 2861 | E4: oooc:=IF([$Income.$B4]>0;[.E3]+[$Income.E4]-[$Expense.E4];"") -> 704.42 | F4: oooc:=IF([$Income.$B4]>0;[.F3]+[$Income.F4]-[$Expense.F4];"") -> 0 | G4: oooc:=IF([$Income.$B4]>0;[.G3]+[$Income.G4]-[$Expense.G4];"") -> 75 | H4: oooc:=IF([$Income.$B4]>0;[.H3]+[$Income.H4]-[$Expense.H4];"") -> -775.470000000001 | I4: oooc:=IF([$Income.$B4]>0;[.I3]+[$Income.I4]-[$Expense.I4];"") -> 2 | J4: oooc:=IF([$Income.$B4]>0;SUM([.C4:.I4]);"") -> 4006.95 | K4: oooc:=IF([$Income.$B4]>0;[.J4]-[.B4];"") -> -0.0500000000010914 | L4: oooc:=IF([$Income.$B4]>0;SUM([.D4:.I4]);"") -> 2866.95 | M4: oooc:=IF([.$B4]<>"";[.B4]-[.L4];"") -> 1140.05 | N4: oooc:=IF([.$B5]<>"";[.M4]-[.C4];"") -> 0.0500000000010914 | P4: oooc:=IF([$Income.$B4]>0;[.O4]-[.B4];"") -> -4007 | R4: oooc:=IF([$Income.$B4]>0;[.B4]-SUM([.D4:.I4]);"") -> 1140.05 | S4: oooc:=IF([$Income.$B4]>0;[.R4]-[.C4];"") -> 0.0500000000010914
A5: 2008-02-28 | B5: oooc:=IF([$Income.$B5]>0;[.B4]+[$Income.B5]-[$Expense.B5];"") -> 3000 | C5: oooc:=IF([$Income.$B5]>0;[.C4]+[$Income.C5]-[$Expense.C5];"") -> 370 | D5: oooc:=IF([$Income.$B5]>0;[.D4]+[$Income.D5]-[$Expense.D5];"") -> 2861 | E5: oooc:=IF([$Income.$B5]>0;[.E4]+[$Income.E5]-[$Expense.E5];"") -> 374.42 | F5: oooc:=IF([$Income.$B5]>0;[.F4]+[$Income.F5]-[$Expense.F5];"") -> 0 | G5: oooc:=IF([$Income.$B5]>0;[.G4]+[$Income.G5]-[$Expense.G5];"") -> 110 | H5: oooc:=IF([$Income.$B5]>0;[.H4]+[$Income.H5]-[$Expense.H5];"") -> -715.470000000001 | I5: oooc:=IF([$Income.$B5]>0;[.I4]+[$Income.I5]-[$Expense.I5];"") -> 0 | J5: oooc:=IF([$Income.$B5]>0;SUM([.C5:.I5]);"") -> 2999.95 | K5: oooc:=IF([$Income.$B5]>0;[.J5]-[.B5];"") -> -0.0500000000010914 | L5: oooc:=IF([$Income.$B5]>0;SUM([.D5:.I5]);"") -> 2629.95 | M5: oooc:=IF([.$B5]<>"";[.B5]-[.L5];"") -> 370.050000000001 | N5: oooc:=IF([.$B6]<>"";[.M5]-[.C5];"") ->  | P5: oooc:=IF([$Income.$B5]>0;[.O5]-[.B5];"") -> -3000 | R5: oooc:=IF([$Income.$B5]>0;[.B5]-SUM([.D5:.I5]);"") -> 370.050000000001 | S5: oooc:=IF([$Income.$B5]>0;[.R5]-[.C5];"") -> 0.0500000000010914
A6: 2008-03-31 | B6: oooc:=IF([$Income.$B6]>0;[.B5]+[$Income.B6]-[$Expense.B6];"") ->  | C6: oooc:=IF([$Income.$B6]>0;[.C5]+[$Income.C6]-[$Expense.C6];"") ->  | D6: oooc:=IF([$Income.$B6]>0;[.D5]+[$Income.D6]-[$Expense.D6];"") ->  | E6: oooc:=IF([$Income.$B6]>0;[.E5]+[$Income.E6]-[$Expense.E6];"") ->  | F6: oooc:=IF([$Income.$B6]>0;[.F5]+[$Income.F6]-[$Expense.F6];"") ->  | G6: oooc:=IF([$Income.$B6]>0;[.G5]+[$Income.G6]-[$Expense.G6];"") ->  | H6: oooc:=IF([$Income.$B6]>0;[.H5]+[$Income.H6]-[$Expense.H6];"") ->  | I6: oooc:=IF([$Income.$B6]>0;[.I5]+[$Income.I6]-[$Expense.I6];"") ->  | J6: oooc:=IF([$Income.$B6]>0;SUM([.C6:.I6]);"") ->  | K6: oooc:=IF([$Income.$B6]>0;[.J6]-[.B6];"") ->  | L6: oooc:=IF([$Income.$B6]>0;SUM([.D6:.I6]);"") ->  | M6: oooc:=IF([.$B6]<>"";[.B6]-[.L6];"") ->  | N6: oooc:=IF([.$B7]<>"";[.M6]-[.C6];"") ->  | P6: oooc:=IF([$Income.$B6]>0;[.O6]-[.B6];"") ->  | R6: oooc:=IF([$Income.$B6]>0;[.B6]-SUM([.D6:.I6]);"") ->  | S6: oooc:=IF([$Income.$B6]>0;[.R6]-[.C6];"") -> 
A7: 2008-04-30 | B7: oooc:=IF([$Income.$B7]>0;[.B6]+[$Income.B7]-[$Expense.B7];"") ->  | C7: oooc:=IF([$Income.$B7]>0;[.C6]+[$Income.C7]-[$Expense.C7];"") ->  | D7: oooc:=IF([$Income.$B7]>0;[.D6]+[$Income.D7]-[$Expense.D7];"") ->  | E7: oooc:=IF([$Income.$B7]>0;[.E6]+[$Income.E7]-[$Expense.E7];"") ->  | F7: oooc:=IF([$Income.$B7]>0;[.F6]+[$Income.F7]-[$Expense.F7];"") ->  | G7: oooc:=IF([$Income.$B7]>0;[.G6]+[$Income.G7]-[$Expense.G7];"") ->  | H7: oooc:=IF([$Income.$B7]>0;[.H6]+[$Income.H7]-[$Expense.H7];"") ->  | I7: oooc:=IF([$Income.$B7]>0;[.I6]+[$Income.I7]-[$Expense.I7];"") ->  | J7: oooc:=IF([$Income.$B7]>0;SUM([.C7:.I7]);"") ->  | K7: oooc:=IF([$Income.$B7]>0;[.J7]-[.B7];"") ->  | L7: oooc:=IF([$Income.$B7]>0;SUM([.D7:.I7]);"") ->  | M7: oooc:=IF([.$B7]<>"";[.B7]-[.L7];"") ->  | N7: oooc:=IF([.$B8]<>"";[.M7]-[.C7];"") ->  | P7: oooc:=IF([$Income.$B7]>0;[.O7]-[.B7];"") ->  | R7: oooc:=IF([$Income.$B7]>0;[.B7]-SUM([.D7:.I7]);"") ->  | S7: oooc:=IF([$Income.$B7]>0;[.R7]-[.C7];"") -> 
A8: 2008-05-31 | B8: oooc:=IF([$Income.$B8]>0;[.B7]+[$Income.B8]-[$Expense.B8];"") ->  | C8: oooc:=IF([$Income.$B8]>0;[.C7]+[$Income.C8]-[$Expense.C8];"") ->  | D8: oooc:=IF([$Income.$B8]>0;[.D7]+[$Income.D8]-[$Expense.D8];"") ->  | E8: oooc:=IF([$Income.$B8]>0;[.E7]+[$Income.E8]-[$Expense.E8];"") ->  | F8: oooc:=IF([$Income.$B8]>0;[.F7]+[$Income.F8]-[$Expense.F8];"") ->  | G8: oooc:=IF([$Income.$B8]>0;[.G7]+[$Income.G8]-[$Expense.G8];"") ->  | H8: oooc:=IF([$Income.$B8]>0;[.H7]+[$Income.H8]-[$Expense.H8];"") ->  | I8: oooc:=IF([$Income.$B8]>0;[.I7]+[$Income.I8]-[$Expense.I8];"") ->  | J8: oooc:=IF([$Income.$B8]>0;SUM([.C8:.I8]);"") ->  | K8: oooc:=IF([$Income.$B8]>0;[.J8]-[.B8];"") ->  | L8: oooc:=IF([$Income.$B8]>0;SUM([.D8:.I8]);"") ->  | M8: oooc:=IF([.$B8]<>"";[.B8]-[.L8];"") ->  | N8: oooc:=IF([.$B9]<>"";[.M8]-[.C8];"") ->  | P8: oooc:=IF([$Income.$B8]>0;[.O8]-[.B8];"") ->  | R8: oooc:=IF([$Income.$B8]>0;[.B8]-SUM([.D8:.I8]);"") ->  | S8: oooc:=IF([$Income.$B8]>0;[.R8]-[.C8];"") -> 
A9: 2008-06-30 | B9: oooc:=IF([$Income.$B9]>0;[.B8]+[$Income.B9]-[$Expense.B9];"") ->  | C9: oooc:=IF([$Income.$B9]>0;[.C8]+[$Income.C9]-[$Expense.C9];"") ->  | D9: oooc:=IF([$Income.$B9]>0;[.D8]+[$Income.D9]-[$Expense.D9];"") ->  | E9: oooc:=IF([$Income.$B9]>0;[.E8]+[$Income.E9]-[$Expense.E9];"") ->  | F9: oooc:=IF([$Income.$B9]>0;[.F8]+[$Income.F9]-[$Expense.F9];"") ->  | G9: oooc:=IF([$Income.$B9]>0;[.G8]+[$Income.G9]-[$Expense.G9];"") ->  | H9: oooc:=IF([$Income.$B9]>0;[.H8]+[$Income.H9]-[$Expense.H9];"") ->  | I9: oooc:=IF([$Income.$B9]>0;[.I8]+[$Income.I9]-[$Expense.I9];"") ->  | J9: oooc:=IF([$Income.$B9]>0;SUM([.C9:.I9]);"") ->  | K9: oooc:=IF([$Income.$B9]>0;[.J9]-[.B9];"") ->  | L9: oooc:=IF([$Income.$B9]>0;SUM([.D9:.I9]);"") ->  | M9: oooc:=IF([.$B9]<>"";[.B9]-[.L9];"") ->  | N9: oooc:=IF([.$B10]<>"";[.M9]-[.C9];"") ->  | P9: oooc:=IF([$Income.$B9]>0;[.O9]-[.B9];"") ->  | R9: oooc:=IF([$Income.$B9]>0;[.B9]-SUM([.D9:.I9]);"") ->  | S9: oooc:=IF([$Income.$B9]>0;[.R9]-[.C9];"") -> 
A10: 2008-07-31 | B10: oooc:=IF([$Income.$B10]>0;[.B9]+[$Income.B10]-[$Expense.B10];"") ->  | C10: oooc:=IF([$Income.$B10]>0;[.C9]+[$Income.C10]-[$Expense.C10];"") ->  | D10: oooc:=IF([$Income.$B10]>0;[.D9]+[$Income.D10]-[$Expense.D10];"") ->  | E10: oooc:=IF([$Income.$B10]>0;[.E9]+[$Income.E10]-[$Expense.E10];"") ->  | F10: oooc:=IF([$Income.$B10]>0;[.F9]+[$Income.F10]-[$Expense.F10];"") ->  | G10: oooc:=IF([$Income.$B10]>0;[.G9]+[$Income.G10]-[$Expense.G10];"") ->  | H10: oooc:=IF([$Income.$B10]>0;[.H9]+[$Income.H10]-[$Expense.H10];"") ->  | I10: oooc:=IF([$Income.$B10]>0;[.I9]+[$Income.I10]-[$Expense.I10];"") ->  | J10: oooc:=IF([$Income.$B10]>0;SUM([.C10:.I10]);"") ->  | K10: oooc:=IF([$Income.$B10]>0;[.J10]-[.B10];"") ->  | L10: oooc:=IF([$Income.$B10]>0;SUM([.D10:.I10]);"") ->  | M10: oooc:=IF([.$B10]<>"";[.B10]-[.L10];"") ->  | N10: oooc:=IF([.$B11]<>"";[.M10]-[.C10];"") ->  | P10: oooc:=IF([$Income.$B10]>0;[.O10]-[.B10];"") ->  | R10: oooc:=IF([$Income.$B10]>0;[.B10]-SUM([.D10:.I10]);"") ->  | S10: oooc:=IF([$Income.$B10]>0;[.R10]-[.C10];"") -> 
A11: 2008-08-31 | B11: oooc:=IF([$Income.$B11]>0;[.B10]+[$Income.B11]-[$Expense.B11];"") ->  | C11: oooc:=IF([$Income.$B11]>0;[.C10]+[$Income.C11]-[$Expense.C11];"") ->  | D11: oooc:=IF([$Income.$B11]>0;[.D10]+[$Income.D11]-[$Expense.D11];"") ->  | E11: oooc:=IF([$Income.$B11]>0;[.E10]+[$Income.E11]-[$Expense.E11];"") ->  | F11: oooc:=IF([$Income.$B11]>0;[.F10]+[$Income.F11]-[$Expense.F11];"") ->  | G11: oooc:=IF([$Income.$B11]>0;[.G10]+[$Income.G11]-[$Expense.G11];"") ->  | H11: oooc:=IF([$Income.$B11]>0;[.H10]+[$Income.H11]-[$Expense.H11];"") ->  | I11: oooc:=IF([$Income.$B11]>0;[.I10]+[$Income.I11]-[$Expense.I11];"") ->  | J11: oooc:=IF([$Income.$B11]>0;SUM([.C11:.I11]);"") ->  | K11: oooc:=IF([$Income.$B11]>0;[.J11]-[.B11];"") ->  | L11: oooc:=IF([$Income.$B11]>0;SUM([.D11:.I11]);"") ->  | M11: oooc:=IF([.$B11]<>"";[.B11]-[.L11];"") ->  | N11: oooc:=IF([.$B12]<>"";[.M11]-[.C11];"") ->  | P11: oooc:=IF([$Income.$B11]>0;[.O11]-[.B11];"") ->  | R11: oooc:=IF([$Income.$B11]>0;[.B11]-SUM([.D11:.I11]);"") ->  | S11: oooc:=IF([$Income.$B11]>0;[.R11]-[.C11];"") -> 
A12: 2008-09-30 | B12: oooc:=IF([$Income.$B12]>0;[.B11]+[$Income.B12]-[$Expense.B12];"") ->  | C12: oooc:=IF([$Income.$B12]>0;[.C11]+[$Income.C12]-[$Expense.C12];"") ->  | D12: oooc:=IF([$Income.$B12]>0;[.D11]+[$Income.D12]-[$Expense.D12];"") ->  | E12: oooc:=IF([$Income.$B12]>0;[.E11]+[$Income.E12]-[$Expense.E12];"") ->  | F12: oooc:=IF([$Income.$B12]>0;[.F11]+[$Income.F12]-[$Expense.F12];"") ->  | G12: oooc:=IF([$Income.$B12]>0;[.G11]+[$Income.G12]-[$Expense.G12];"") ->  | H12: oooc:=IF([$Income.$B12]>0;[.H11]+[$Income.H12]-[$Expense.H12];"") ->  | I12: oooc:=IF([$Income.$B12]>0;[.I11]+[$Income.I12]-[$Expense.I12];"") ->  | J12: oooc:=IF([$Income.$B12]>0;SUM([.C12:.I12]);"") ->  | K12: oooc:=IF([$Income.$B12]>0;[.J12]-[.B12];"") ->  | L12: oooc:=IF([$Income.$B12]>0;SUM([.D12:.I12]);"") ->  | M12: oooc:=IF([.$B12]<>"";[.B12]-[.L12];"") ->  | N12: oooc:=IF([.$B13]<>"";[.M12]-[.C12];"") ->  | P12: oooc:=IF([$Income.$B12]>0;[.O12]-[.B12];"") ->  | R12: oooc:=IF([$Income.$B12]>0;[.B12]-SUM([.D12:.I12]);"") ->  | S12: oooc:=IF([$Income.$B12]>0;[.R12]-[.C12];"") -> 
A13: 2008-10-31 | B13: oooc:=IF([$Income.$B13]>0;[.B12]+[$Income.B13]-[$Expense.B13];"") ->  | C13: oooc:=IF([$Income.$B13]>0;[.C12]+[$Income.C13]-[$Expense.C13];"") ->  | D13: oooc:=IF([$Income.$B13]>0;[.D12]+[$Income.D13]-[$Expense.D13];"") ->  | E13: oooc:=IF([$Income.$B13]>0;[.E12]+[$Income.E13]-[$Expense.E13];"") ->  | F13: oooc:=IF([$Income.$B13]>0;[.F12]+[$Income.F13]-[$Expense.F13];"") ->  | G13: oooc:=IF([$Income.$B13]>0;[.G12]+[$Income.G13]-[$Expense.G13];"") ->  | H13: oooc:=IF([$Income.$B13]>0;[.H12]+[$Income.H13]-[$Expense.H13];"") ->  | I13: oooc:=IF([$Income.$B13]>0;[.I12]+[$Income.I13]-[$Expense.I13];"") ->  | J13: oooc:=IF([$Income.$B13]>0;SUM([.C13:.I13]);"") ->  | K13: oooc:=IF([$Income.$B13]>0;[.J13]-[.B13];"") ->  | L13: oooc:=IF([$Income.$B13]>0;SUM([.D13:.I13]);"") ->  | M13: oooc:=IF([.$B13]<>"";[.B13]-[.L13];"") ->  | N13: oooc:=IF([.$B14]<>"";[.M13]-[.C13];"") ->  | P13: oooc:=IF([$Income.$B13]>0;[.O13]-[.B13];"") ->  | R13: oooc:=IF([$Income.$B13]>0;[.B13]-SUM([.D13:.I13]);"") ->  | S13: oooc:=IF([$Income.$B13]>0;[.R13]-[.C13];"") -> 
A14: 2008-11-30 | B14: oooc:=IF([$Income.$B14]>0;[.B13]+[$Income.B14]-[$Expense.B14];"") ->  | C14: oooc:=IF([$Income.$B14]>0;[.C13]+[$Income.C14]-[$Expense.C14];"") ->  | D14: oooc:=IF([$Income.$B14]>0;[.D13]+[$Income.D14]-[$Expense.D14];"") ->  | E14: oooc:=IF([$Income.$B14]>0;[.E13]+[$Income.E14]-[$Expense.E14];"") ->  | F14: oooc:=IF([$Income.$B14]>0;[.F13]+[$Income.F14]-[$Expense.F14];"") ->  | G14: oooc:=IF([$Income.$B14]>0;[.G13]+[$Income.G14]-[$Expense.G14];"") ->  | H14: oooc:=IF([$Income.$B14]>0;[.H13]+[$Income.H14]-[$Expense.H14];"") ->  | I14: oooc:=IF([$Income.$B14]>0;[.I13]+[$Income.I14]-[$Expense.I14];"") ->  | J14: oooc:=IF([$Income.$B14]>0;SUM([.C14:.I14]);"") ->  | K14: oooc:=IF([$Income.$B14]>0;[.J14]-[.B14];"") ->  | L14: oooc:=IF([$Income.$B14]>0;SUM([.D14:.I14]);"") ->  | M14: oooc:=IF([.$B14]<>"";[.B14]-[.L14];"") ->  | N14: oooc:=IF([.$B15]<>"";[.M14]-[.C14];"") ->  | P14: oooc:=IF([$Income.$B14]>0;[.O14]-[.B14];"") ->  | R14: oooc:=IF([$Income.$B14]>0;[.B14]-SUM([.D14:.I14]);"") ->  | S14: oooc:=IF([$Income.$B14]>0;[.R14]-[.C14];"") -> 
A15: 2008-12-31 | B15: oooc:=IF([$Income.$B15]>0;[.B14]+[$Income.B15]-[$Expense.B15];"") ->  | C15: oooc:=IF([$Income.$B15]>0;[.C14]+[$Income.C15]-[$Expense.C15];"") ->  | D15: oooc:=IF([$Income.$B15]>0;[.D14]+[$Income.D15]-[$Expense.D15];"") ->  | E15: oooc:=IF([$Income.$B15]>0;[.E14]+[$Income.E15]-[$Expense.E15];"") ->  | F15: oooc:=IF([$Income.$B15]>0;[.F14]+[$Income.F15]-[$Expense.F15];"") ->  | G15: oooc:=IF([$Income.$B15]>0;[.G14]+[$Income.G15]-[$Expense.G15];"") ->  | H15: oooc:=IF([$Income.$B15]>0;[.H14]+[$Income.H15]-[$Expense.H15];"") ->  | I15: oooc:=IF([$Income.$B15]>0;[.I14]+[$Income.I15]-[$Expense.I15];"") ->  | J15: oooc:=IF([$Income.$B15]>0;SUM([.C15:.I15]);"") ->  | K15: oooc:=IF([$Income.$B15]>0;[.J15]-[.B15];"") ->  | L15: oooc:=IF([$Income.$B15]>0;SUM([.D15:.I15]);"") ->  | M15: oooc:=IF([.$B15]<>"";[.B15]-[.L15];"") ->  | N15: oooc:=IF([.$B16]<>"";[.M15]-[.C15];"") ->  | P15: oooc:=IF([$Income.$B15]>0;[.O15]-[.B15];"") ->  | R15: oooc:=IF([$Income.$B15]>0;[.B15]-SUM([.D15:.I15]);"") ->  | S15: oooc:=IF([$Income.$B15]>0;[.R15]-[.C15];"") -> 
N34: Total
N35: QHCC
N36: Diff
B38: Month | C38: Income | D38: Expense | E38: General Fund | F38: Effective Balance | G38: Unpaid Bills | I38: General
B39: oooc:=[Income.A4] -> 2008-01-31 | C39: oooc:=IF([$Income.$C4] > 0;[$Income.$C4];"") -> 7364 | D39: oooc:=IF([$Expense.$C4] > 0;[$Expense.$C4];"") -> 6675 | E39: oooc:=[.$C4] -> 1140 | F39: oooc:=IF([.G39]>0;[.E39]-[.G39];"") ->  | I39: oooc:=[.$C4] -> 1140
B40: oooc:=[Income.A5] -> 2008-02-28 | C40: oooc:=IF([$Income.$C5] > 0;[$Income.$C5];"") -> 5688 | D40: oooc:=IF([$Expense.$C5] > 0;[$Expense.$C5];"") -> 6458 | E40: oooc:=[.$C5] -> 370 | F40: oooc:=IF([.G40]>0;[.E40]-[.G40];"") ->  | I40: oooc:=[.$C5] -> 370
B41: oooc:=[Income.A6] -> 2008-03-31 | C41: oooc:=IF([$Income.$C6] > 0;[$Income.$C6];"") ->  | D41: oooc:=IF([$Expense.$C6] > 0;[$Expense.$C6];"") ->  | E41: oooc:=[.$C6] ->  | F41: oooc:=IF([.G41]>0;[.E41]-[.G41];"") ->  | I41: oooc:=[.$C6] -> 
B42: oooc:=[Income.A7] -> 2008-04-30 | C42: oooc:=IF([$Income.$C7] > 0;[$Income.$C7];"") ->  | D42: oooc:=IF([$Expense.$C7] > 0;[$Expense.$C7];"") ->  | E42: oooc:=[.$C7] ->  | F42: oooc:=IF([.G42]>0;[.E42]-[.G42];"") ->  | I42: oooc:=[.$C7] -> 
B43: oooc:=[Income.A8] -> 2008-05-31 | C43: oooc:=IF([$Income.$C8] > 0;[$Income.$C8];"") ->  | D43: oooc:=IF([$Expense.$C8] > 0;[$Expense.$C8];"") ->  | E43: oooc:=[.$C8] ->  | F43: oooc:=IF([.G43]>0;[.E43]-[.G43];"") ->  | I43: oooc:=[.$C8] -> 
B44: oooc:=[Income.A9] -> 2008-06-30 | C44: oooc:=IF([$Income.$C9] > 0;[$Income.$C9];"") ->  | D44: oooc:=IF([$Expense.$C9] > 0;[$Expense.$C9];"") ->  | E44: oooc:=[.$C9] ->  | F44: oooc:=IF([.G44]>0;[.E44]-[.G44];"") ->  | I44: oooc:=[.$C9] -> 
B45: oooc:=[Income.A10] -> 2008-07-31 | C45: oooc:=IF([$Income.$C10] > 0;[$Income.$C10];"") ->  | D45: oooc:=IF([$Expense.$C10] > 0;[$Expense.$C10];"") ->  | E45: oooc:=[.$C10] ->  | F45: oooc:=IF([.G45]>0;[.E45]-[.G45];"") ->  | I45: oooc:=[.$C10] -> 
B46: oooc:=[Income.A11] -> 2008-08-31 | C46: oooc:=IF([$Income.$C11] > 0;[$Income.$C11];"") ->  | D46: oooc:=IF([$Expense.$C11] > 0;[$Expense.$C11];"") ->  | E46: oooc:=[.$C11] ->  | F46: oooc:=IF([.G46]>0;[.E46]-[.G46];"") ->  | I46: oooc:=[.$C11] -> 
B47: oooc:=[Income.A12] -> 2008-09-30 | C47: oooc:=IF([$Income.$C12] > 0;[$Income.$C12];"") ->  | D47: oooc:=IF([$Expense.$C12] > 0;[$Expense.$C12];"") ->  | E47: oooc:=[.$C12] ->  | F47: oooc:=IF([.G47]>0;[.E47]-[.G47];"") ->  | I47: oooc:=[.$C12] -> 
B48: oooc:=[Income.A13] -> 2008-10-31 | C48: oooc:=IF([$Income.$C13] > 0;[$Income.$C13];"") ->  | D48: oooc:=IF([$Expense.$C13] > 0;[$Expense.$C13];"") ->  | E48: oooc:=[.$C13] ->  | F48: oooc:=IF([.G48]>0;[.E48]-[.G48];"") ->  | I48: oooc:=[.$C13] -> 
B49: oooc:=[Income.A14] -> 2008-11-30 | C49: oooc:=IF([$Income.$C14] > 0;[$Income.$C14];"") ->  | D49: oooc:=IF([$Expense.$C14] > 0;[$Expense.$C14];"") ->  | E49: oooc:=[.$C14] ->  | F49: oooc:=IF([.G49]>0;[.E49]-[.G49];"") ->  | I49: oooc:=[.$C14] -> 
B50: oooc:=[Income.A15] -> 2008-12-31 | C50: oooc:=IF([$Income.$C15] > 0;[$Income.$C15];"") ->  | D50: oooc:=IF([$Expense.$C15] > 0;[$Expense.$C15];"") ->  | E50: oooc:=[.$C15] ->  | F50: oooc:=IF([.G50]>0;[.E50]-[.G50];"") ->  | I50: oooc:=[.$C15] -> 

Sheet: Income
A1: QHCC Income 2008
A2: Date | B2: QHCC Account | C2: General | D2: Parsonage | E2: Deacon | F2: Holding | G2: Youth | H2: DSL | I2: Temporary | J2: Total | K2: Diff
A4: 2008-01-31 | B4: 7488 | C4: 7364 | H4: 120 | I4: 2 | J4: oooc:=SUM([.C4:.I4]) -> 7486 | K4: oooc:=[.J4]-[.B4] -> -2
A5: 2008-02-28 | B5: 5910 | C5: 5688 | G5: 35 | H5: 120 | I5: 66 | J5: oooc:=SUM([.C5:.I5]) -> 5909 | K5: oooc:=[.J5]-[.B5] -> -1
A6: 2008-03-31 | J6: oooc:=SUM([.C6:.I6]) -> 0 | K6: oooc:=[.J6]-[.B6] -> 0
A7: 2008-04-30 | J7: oooc:=SUM([.C7:.I7]) -> 0 | K7: oooc:=[.J7]-[.B7] -> 0
A8: 2008-05-31 | J8: oooc:=SUM([.C8:.I8]) -> 0 | K8: oooc:=[.J8]-[.B8] -> 0
A9: 2008-06-30 | J9: oooc:=SUM([.C9:.I9]) -> 0 | K9: oooc:=[.J9]-[.B9] -> 0
A10: 2008-07-31 | J10: oooc:=SUM([.C10:.I10]) -> 0 | K10: oooc:=[.J10]-[.B10] -> 0
A11: 2008-08-31 | J11: oooc:=SUM([.C11:.I11]) -> 0 | K11: oooc:=[.J11]-[.B11] -> 0
A12: 2008-09-30 | J12: oooc:=SUM([.C12:.I12]) -> 0 | K12: oooc:=[.J12]-[.B12] -> 0
A13: 2008-10-31 | J13: oooc:=SUM([.C13:.I13]) -> 0 | K13: oooc:=[.J13]-[.B13] -> 0
A14: 2008-11-30 | J14: oooc:=SUM([.C14:.I14]) -> 0 | K14: oooc:=[.J14]-[.B14] -> 0
A15: 2008-12-31 | J15: oooc:=SUM([.C15:.I15]) -> 0 | K15: oooc:=[.J15]-[.B15] -> 0
A16: Total for Year | B16: oooc:=SUM([.B4:.B15]) -> 13398 | C16: oooc:=SUM([.C4:.C15]) -> 13052 | D16: oooc:=SUM([.D4:.D15]) -> 0 | E16: oooc:=SUM([.E4:.E15]) -> 0 | F16: oooc:=SUM([.F4:.F15]) -> 0 | G16: oooc:=SUM([.G4:.G15]) -> 35 | H16: oooc:=SUM([.H4:.H15]) -> 240 | I16: oooc:=SUM([.I4:.I15]) -> 68 | J16: oooc:=SUM([.J4:.J15]) -> 13395 | K16: oooc:=SUM([.K4:.K15]) -> -3
A17: Monthly Average | B17: oooc:=[.B16]/[.$B$23] -> 514.465388600231 | C17: oooc:=[.C16]/[.$B$23] -> 501.179448575177 | D17: oooc:=[.D16]/[.$B$23] -> 0 | E17: oooc:=[.E16]/[.$B$23] -> 0 | F17: oooc:=[.F16]/[.$B$23] -> 0 | G17: oooc:=[.G16]/[.$B$23] -> 1.34395347074251 | H17: oooc:=[.H16]/[.$B$23] -> 9.21568094223433 | I17: oooc:=[.I16]/[.$B$23] -> 2.61110960029973 | J17: oooc:=[.J16]/[.$B$23] -> 514.350192588453 | K17: oooc:=[.K16]/[.$B$23] -> -0.115196011777929
A18: Weekly Average | B18: oooc:=[.B16]/[.$B$22] -> 118.316475407035 | C18: oooc:=[.C16]/[.$B$22] -> 115.260982013182 | D18: oooc:=[.D16]/[.$B$22] -> 0 | E18: oooc:=[.E16]/[.$B$22] -> 0 | F18: oooc:=[.F16]/[.$B$22] -> 0 | G18: oooc:=[.G16]/[.$B$22] -> 0.309081701690268 | H18: oooc:=[.H16]/[.$B$22] -> 2.11941738301898 | I18: oooc:=[.I16]/[.$B$22] -> 0.600501591855378 | J18: oooc:=[.J16]/[.$B$22] -> 118.289982689747 | K18: oooc:=[.K16]/[.$B$22] -> -0.0264927172877373
A20: Today | B20: oooc:=NOW() -> 2008-03-02T16:05:46.01
A21: Day | B21: oooc:=[.B20]-DATE(2005;12;31) -> 792.670671412037
A22: Week | B22: oooc:=[.B21]/7 -> 113.238667344577
A23: Month | B23: oooc:=[.B21]/365.25*12 -> 26.0425682599437

Sheet: Expense
A1: QHCC Expenses 2008
A2: Date | B2: QHCC Account | C2: General | D2: Parsonage | E2: Deacon | F2: Holding | G2: Youth | H2: DSL | I2: Temporary | J2: Total | K2: Diff
A4: 2008-01-31 | B4: 6737 | C4: 6675 | H4: 60 | J4: oooc:=SUM([.C4:.I4]) -> 6735 | K4: oooc:=[.J4]-[.B4] -> -2
A5: 2008-02-28 | B5: 6917 | C5: 6458 | E5: 330 | H5: 60 | I5: 68 | J5: oooc:=SUM([.C5:.I5]) -> 6916 | K5: oooc:=[.J5]-[.B5] -> -1
A6: 2008-03-31 | J6: oooc:=SUM([.C6:.I6]) -> 0 | K6: oooc:=[.J6]-[.B6] -> 0
A7: 2008-04-30 | J7: oooc:=SUM([.C7:.I7]) -> 0 | K7: oooc:=[.J7]-[.B7] -> 0
A8: 2008-05-31 | J8: oooc:=SUM([.C8:.I8]) -> 0 | K8: oooc:=[.J8]-[.B8] -> 0
A9: 2008-06-30 | J9: oooc:=SUM([.C9:.I9]) -> 0 | K9: oooc:=[.J9]-[.B9] -> 0
A10: 2008-07-31 | J10: oooc:=SUM([.C10:.I10]) -> 0 | K10: oooc:=[.J10]-[.B10] -> 0
A11: 2008-08-31 | J11: oooc:=SUM([.C11:.I11]) -> 0 | K11: oooc:=[.J11]-[.B11] -> 0
A12: 2008-09-30 | J12: oooc:=SUM([.C12:.I12]) -> 0 | K12: oooc:=[.J12]-[.B12] -> 0
A13: 2008-10-31 | J13: oooc:=SUM([.C13:.I13]) -> 0 | K13: oooc:=[.J13]-[.B13] -> 0
A14: 2008-11-30 | J14: oooc:=SUM([.C14:.I14]) -> 0 | K14: oooc:=[.J14]-[.B14] -> 0
A15: 2008-12-31 | J15: oooc:=SUM([.C15:.I15]) -> 0 | K15: oooc:=[.J15]-[.B15] -> 0
A16: Total for Year | J16: oooc:=SUM([.J4:.J15]) -> 13651 | K16: oooc:=SUM([.K4:.K15]) -> -3
A17: Monthly Average | B17: oooc:=[.B16]/[$Income.$B$23] -> 0 | C17: oooc:=[.C16]/[$Income.$B$23] -> 0 | D17: oooc:=[.D16]/[$Income.$B$23] -> 0 | E17: oooc:=[.E16]/[$Income.$B$23] -> 0 | F17: oooc:=[.F16]/[$Income.$B$23] -> 0 | G17: oooc:=[.G16]/[$Income.$B$23] -> 0 | H17: oooc:=[.H16]/[$Income.$B$23] -> 0 | I17: oooc:=[.I16]/[$Income.$B$23] -> 0 | J17: oooc:=[.J16]/[$Income.$B$23] -> 524.18025226017 | K17: oooc:=[.K16]/[$Income.$B$23] -> -0.115196011777929
A18: Weekly Average | B18: oooc:=[.B16]/[$Income.$B$22] -> 0 | C18: oooc:=[.C16]/[$Income.$B$22] -> 0 | D18: oooc:=[.D16]/[$Income.$B$22] -> 0 | E18: oooc:=[.E16]/[$Income.$B$22] -> 0 | F18: oooc:=[.F16]/[$Income.$B$22] -> 0 | G18: oooc:=[.G16]/[$Income.$B$22] -> 0 | H18: oooc:=[.H16]/[$Income.$B$22] -> 0 | I18: oooc:=[.I16]/[$Income.$B$22] -> 0 | J18: oooc:=[.J16]/[$Income.$B$22] -> 120.550694564967 | K18: oooc:=[.K16]/[$Income.$B$22] -> -0.0264927172877373